Deliverable,EndDate,FirstAddedDate,GeoX,GeoY,HazardousSubstances,Hectares,LastUpdatedDate,MinNetDwellings,NetDwellingsRangeFrom,NetDwellingsRangeTo,Notes,OrganisationLabel,OrganisationURI,OwnershipStatus,PermissionDate,PermissionType,PlanningHistory,PlanningStatus,SiteNameAddress,SiteReference,SiteplanURL,entity,point,brownfield-land
yes,,2016-07-30,,,,6.56,2017-12-18,650,650,650,Proposed for up to 650 dwelling mixed-use as part of larger development scheme for City Deal,Portsmouth City Council,http://opendatacommunities.org/id/unitary-authority/portsmouth,mixed ownership,,,,Not permissioned,TIPNER WEST,1,https://www.portsmouth.gov.uk/Ext/Documents-External/PLN-Brownfield-Land-Site-001.pdf,,,
yes,,2016-07-31,,,,15.46,2017-12-18,600,600,600,Proposed for up to 600 dwelling mixed-use as part of larger development scheme for City Deal,Portsmouth City Council,http://opendatacommunities.org/id/unitary-authority/portsmouth,owned by a public authority,,,,Not permissioned,TIPNER FIRING RANGE,2,https://www.portsmouth.gov.uk/Ext/Documents-External/PLN-Brownfield-Land-Site-002.pdf,,,
yes,,2016-08-01,,,,11.29,2017-12-18,600,600,600,"Outline planning permission granted for up to 600 homes, 615sqm commercial floor space and sea wall. Permission granted for Park & Ride facility.",Portsmouth City Council,http://opendatacommunities.org/id/unitary-authority/portsmouth,owned by a public authority,2012-03-30,outline planning permission,http://publicaccess.portsmouth.gov.uk/online-applications/applicationDetails.do?activeTab=summary&keyVal=L7GM7TMO5G000,permissioned,LAND OFF AND BETWEEN M275 SOUTH OF TIPNER LAKE INCLUDING GREYHOUND STADIUM TWYFORD AVENUE,3,https://www.portsmouth.gov.uk/Ext/Documents-External/PLN-Brownfield-Land-Site-003.pdf,,,
yes,,2016-08-02,,,,25.34,2017-12-18,500,500,500,Allocated in Core Strategy (2011-2027) for approx. 500 homes. Also part of City Deal ,Portsmouth City Council,http://opendatacommunities.org/id/unitary-authority/portsmouth,mixed ownership,,,,Not permissioned,PORT SOLENT HMS EXCELLENT,4,https://www.portsmouth.gov.uk/Ext/Documents-External/PLN-Brownfield-Land-Site-004.pdf,,,
yes,,2016-08-05,,,,0.26,2017-12-18,200,200,200,Change of use from office (Class B1) to halls of residence (Class C1) at levels 6-18 of Europa House and the annex building to form 262 study bedrooms with communal facilities,Portsmouth City Council,http://opendatacommunities.org/id/unitary-authority/portsmouth,,2015-06-18,full planning permission,http://publicaccess.portsmouth.gov.uk/online-applications/applicationDetails.do?activeTab=summary&keyVal=NJCF4FMOI3V00,permissioned,"CITY CENTRE IDENTIFIED PERMISSIONS (EUROPA HOUSE, HAVANT STREET)",12,https://www.portsmouth.gov.uk/Ext/Documents-External/PLN-Brownfield-Land-Site-012.pdf,,,
yes,,2016-08-06,,,,3.23,2017-12-18,160,160,160,Resolution to grant permission for 163 units. Allocated for residential development in Portsmouth City Plan 2001-2011,Portsmouth City Council,http://opendatacommunities.org/id/unitary-authority/portsmouth,not owned by a public authority,,,http://publicaccess.portsmouth.gov.uk/online-applications/applicationDetails.do?activeTab=documents&keyVal=MSUUZTMO5G000,pending decision,TRAFALGAR WHARF,14,https://www.portsmouth.gov.uk/Ext/Documents-External/PLN-Brownfield-Land-Site-014.pdf,,,
yes,,2016-08-07,,,,2.52,2017-12-18,100,100,100,Outline application for the construction of up to 108 dwellings,Portsmouth City Council,http://opendatacommunities.org/id/unitary-authority/portsmouth,owned by a public authority,2017-09-20,Other,http://publicaccess.portsmouth.gov.uk/online-applications/applicationDetails.do?activeTab=documents&keyVal=OL60SKMOJTS00,permissioned,DRAYTON DAIRY,16,https://www.portsmouth.gov.uk/Ext/Documents-External/PLN-Brownfield-Land-Site-016.pdf,,,
yes,,2016-08-14,,,,5.45,2017-12-18,130,130,130,Previous planning application withdrawn for 131 residential dwellings. Recent refused planning application for access road to accommodate residential development,Portsmouth City Council,http://opendatacommunities.org/id/unitary-authority/portsmouth,not owned by a public authority,,,,Not permissioned,QINETIQ - FRASER BATTERY,27,https://www.portsmouth.gov.uk/Ext/Documents-External/PLN-Brownfield-Land-Site-027.pdf,,,
yes,,2016-08-17,,,,0.11,2017-12-18,60,60,60,Construction of 4-storey building to form 66 unit student halls of residence (within Class C1) and three commercial units to ground floor for purposes within Use Class B1 after demolition of existing building,Portsmouth City Council,http://opendatacommunities.org/id/unitary-authority/portsmouth,not owned by a public authority,2015-02-10,full planning permission,http://publicaccess.portsmouth.gov.uk/online-applications/applicationDetails.do?activeTab=documents&keyVal=MXWFV2MOGHQ00,permissioned,42-56 GKN AUTOPARTS LTD MIDDLE STREET,32,https://www.portsmouth.gov.uk/Ext/Documents-External/PLN-Brownfield-Land-Site-032.pdf,,,
yes,,2016-08-19,,,,0.84,2017-12-18,30,30,30,Construction of eight-storey building comprising 38 apartments above extended landscapes podium level and associated car parking facilities,Portsmouth City Council,http://opendatacommunities.org/id/unitary-authority/portsmouth,not owned by a public authority,2012-03-15,full planning permission,http://publicaccess.portsmouth.gov.uk/online-applications/applicationDetails.do?activeTab=documents&keyVal=LDTP2UMO02T00,permissioned,QUEENS HOTEL,34,https://www.portsmouth.gov.uk/Ext/Documents-External/PLN-Brownfield-Land-Site-034.pdf,,,
yes,,2016-08-26,,,,0.11,2017-12-18,40,40,40,Conversion of east wing to form 9 maisonettes and 31 flats including construction of mansard roof to form additional floor and external alterations,Portsmouth City Council,http://opendatacommunities.org/id/unitary-authority/portsmouth,,2013-07-18,full planning permission,http://publicaccess.portsmouth.gov.uk/online-applications/applicationDetails.do?activeTab=documents&keyVal=KYYKV6MO04R00,permissioned,THE ROYAL BEACH HOTEL (EAST WING) ST HELENS PARADE,45,https://www.portsmouth.gov.uk/Ext/Documents-External/PLN-Brownfield-Land-Site-045.pdf,,,
yes,,2016-09-19,,,,0.07,2017-12-18,10,10,10,Part demolition of former bingo hall and conversion to form retail unit (Class A1/A2) and 10 dwellinghouse; conversion/extension of outbuilding to form dwellinghouse; provision of associated refuse/ bicycle stores and car parking,Portsmouth City Council,http://opendatacommunities.org/id/unitary-authority/portsmouth,not owned by a public authority,,,http://publicaccess.portsmouth.gov.uk/online-applications/applicationDetails.do?activeTab=documents&keyVal=OTLPCOMOG6Y00,pending decision,140-142 KINGSTON ROAD (BINGO HALL),77,https://www.portsmouth.gov.uk/Ext/Documents-External/PLN-Brownfield-Land-Site-077.pdf,,,
yes,,2016-09-26,,,,0.11,2017-12-18,5,5,5,Potential for residential development following demolition of existing garages,Portsmouth City Council,http://opendatacommunities.org/id/unitary-authority/portsmouth,not owned by a public authority,,,,Not permissioned,GARAGES AT EXMOUTH ROAD,86,https://www.portsmouth.gov.uk/Ext/Documents-External/PLN-Brownfield-Land-Site-086.pdf,,,
yes,,2016-09-27,,,,0.25,2017-12-18,7,7,7,Construction of four 3-storey houses and three 2-storey houses with associated access road and car parking after demolition of existing buildings,Portsmouth City Council,http://opendatacommunities.org/id/unitary-authority/portsmouth,not owned by a public authority,2015-09-11,full planning permission,http://publicaccess.portsmouth.gov.uk/online-applications/applicationDetails.do?activeTab=documents&keyVal=NR2RVQMOLKU00,permissioned,"FORMER AQUATICS CENTRE, 201 HIGHLAND ROAD AND 197 AND LAND AT REAR",87,https://www.portsmouth.gov.uk/Ext/Documents-External/PLN-Brownfield-Land-Site-087.pdf,,,
yes,,2016-09-28,,,,0.19,2017-12-18,15,15,15,"Site adjacent to existing marina, previously promoted for residential development.",Portsmouth City Council,http://opendatacommunities.org/id/unitary-authority/portsmouth,not owned by a public authority,,,,Not permissioned,LAND SOUTH OF MARINA KEEP,88,https://www.portsmouth.gov.uk/Ext/Documents-External/PLN-Brownfield-Land-Site-088.pdf,,,
yes,,2016-09-29,,,,0.17,2017-12-18,10,10,10,"Vacant retail unit, being promoted for residential development",Portsmouth City Council,http://opendatacommunities.org/id/unitary-authority/portsmouth,not owned by a public authority,,,,Not permissioned,NORTH END KWIKSAVE,91,https://www.portsmouth.gov.uk/Ext/Documents-External/PLN-Brownfield-Land-Site-091.pdf,,,
yes,,2016-10-02,,,,0.04,2017-12-18,15,15,15,Construction of 3-storey building to form a 17 study bedroom halls of residence for student use (Class C1) and 2 shops on ground floor (Class A1) with associated cycle and refuse stores,Portsmouth City Council,http://opendatacommunities.org/id/unitary-authority/portsmouth,not owned by a public authority,2015-05-01,full planning permission,http://publicaccess.portsmouth.gov.uk/online-applications/applicationDetails.do?activeTab=documents&keyVal=NKXUNKMOIS300,permissioned,108 - 112 ELM GROVE,96,https://www.portsmouth.gov.uk/Ext/Documents-External/PLN-Brownfield-Land-Site-096.pdf,,,
yes,,2016-10-21,,,,0.06,2017-12-18,8,8,8,Construction of a terrace of nine 2 and 2.5-storey dwellinghouse,Portsmouth City Council,http://opendatacommunities.org/id/unitary-authority/portsmouth,not owned by a public authority,2017-02-01,full planning permission,http://publicaccess.portsmouth.gov.uk/online-applications/applicationDetails.do?activeTab=documents&keyVal=OGN2Y3MOHQM00,permissioned,251 - 253 NEW ROAD (GOSPORT METAL TREATMENT),125,https://www.portsmouth.gov.uk/Ext/Documents-External/PLN-Brownfield-Land-Site-125.pdf,,,
yes,,2016-11-02,,,,0.06,2017-12-18,6,6,6,"Construction of a 3.5-storey block of seven flats with associated parking, landscaping, cycle and refuse stores following demolition of existing garage blocks",Portsmouth City Council,http://opendatacommunities.org/id/unitary-authority/portsmouth,not owned by a public authority,,,http://publicaccess.portsmouth.gov.uk/online-applications/applicationDetails.do?activeTab=documents&keyVal=NXCHQGMOGPA00,pending decision,GARAGES ADJACENT TO 1A ST CHADS AVENUE,145,https://www.portsmouth.gov.uk/Ext/Documents-External/PLN-Brownfield-Land-Site-145.pdf,,,
yes,,2016-11-13,,,,0.35,2017-12-18,60,60,60,"Existing car park site, identified as suitable for residential development",Portsmouth City Council,http://opendatacommunities.org/id/unitary-authority/portsmouth,not owned by a public authority,,,,Not permissioned,WIGHTLINK CAR PARK,165,https://www.portsmouth.gov.uk/Ext/Documents-External/PLN-Brownfield-Land-Site-165.pdf,,,
yes,,2016-11-14,,,,0.5,2017-12-18,150,150,150,Vacant site with potential for mixed use development including residential,Portsmouth City Council,http://opendatacommunities.org/id/unitary-authority/portsmouth,not owned by a public authority,,,,Not permissioned,PORTSMOUTH MAIL CENTRE,166,https://www.portsmouth.gov.uk/Ext/Documents-External/PLN-Brownfield-Land-Site-166.pdf,,,
yes,,2016-11-16,,,,0.27,2017-12-18,150,150,150,Prior approval for change of use from office (Class B1) to form 153 residential dwellings (Class C3),Portsmouth City Council,http://opendatacommunities.org/id/unitary-authority/portsmouth,not owned by a public authority,2017-09-20,Other,http://publicaccess.portsmouth.gov.uk/online-applications/applicationDetails.do?activeTab=documents&keyVal=OT2TUNMO02T00,permissioned,BRUNEL HOUSE,168,https://www.portsmouth.gov.uk/Ext/Documents-External/PLN-Brownfield-Land-Site-168.pdf,,,
yes,,2016-11-17,,,,1.18,2017-12-18,50,50,50,Construction of 2-storey building to form 72 bed residential care home and car parking,Portsmouth City Council,http://opendatacommunities.org/id/unitary-authority/portsmouth,owned by a public authority,2013-12-05,full planning permission,http://publicaccess.portsmouth.gov.uk/online-applications/applicationDetails.do?activeTab=documents&keyVal=MUIJE3MO5G000,permissioned,EAST LODGE,169,https://www.portsmouth.gov.uk/Ext/Documents-External/PLN-Brownfield-Land-Site-169.pdf,,,
yes,,2016-11-20,,,,2.54,2017-12-18,100,100,100,Part of the site still in use as printing press and distribution area. Former offices potential for residential redevelopment.,Portsmouth City Council,http://opendatacommunities.org/id/unitary-authority/portsmouth,not owned by a public authority,,,,Not permissioned,THE NEWS CENTRE,183,https://www.portsmouth.gov.uk/Ext/Documents-External/PLN-Brownfield-Land-Site-183.pdf,,,
yes,,2016-11-22,,,,33.13,2017-12-18,444,444,444,"Identified as potential for residential development, possible mixed use.",Portsmouth City Council,http://opendatacommunities.org/id/unitary-authority/portsmouth,mixed ownership,,,,Not permissioned,ST JAMES HOSPITAL,185,https://www.portsmouth.gov.uk/Ext/Documents-External/PLN-Brownfield-Land-Site-185.pdf,,,
yes,,2016-11-23,,,,0.2,2017-12-18,70,70,70,"Construction of up to 10-storey building to form halls of residence comprising 96 study bedrooms (Class C1) and communal facilities, cycle and refuse stores and car parking",Portsmouth City Council,http://opendatacommunities.org/id/unitary-authority/portsmouth,not owned by a public authority,2017-11-25,outline planning permission,http://publicaccess.portsmouth.gov.uk/online-applications/applicationDetails.do?activeTab=documents&keyVal=OQTMEKMOMII00,permissioned,UNITY HALL AND DEAF CENTRE,186,https://www.portsmouth.gov.uk/Ext/Documents-External/PLN-Brownfield-Land-Site-186.pdf,,,
