Deliverable,EndDate,FirstAddedDate,GeoX,GeoY,HazardousSubstances,Hectares,LastUpdatedDate,MinNetDwellings,NetDwellingsRangeFrom,NetDwellingsRangeTo,Notes,OrganisationLabel,OrganisationURI,OwnershipStatus,PermissionDate,PermissionType,PlanningHistory,PlanningStatus,SiteNameAddress,SiteReference,SiteplanURL,entity,point,brownfield-land
,,2017-12-19,-1.456517,53.235298,,0.92,2017-12-19,,1,6,Parts of the site have potential for future residential develoment subject to consideration of the impact upon listed structures/buildings and scheduled ancient monuments.,,http://opendatacommunities.org/id/district-council/chesterfield,,,,https://publicaccess.chesterfield.gov.uk/online-applications/propertyDetails.do?activeTab=relatedCases&keyVal=0016PUEPLI000,not permissioned,"Brampton Manor, Old Road, Chesterfield",15,https://www.chesterfield.gov.uk/media/562063/15-brampton-manor-old-road-chesterfield.pdf,,,
yes,,2017-12-19,-1.452349,53.249598,,0.72,2019-12-09,,1,20,"The site has been occupied by a permanent structure but the remains have not sufficiently blended into the landscape over the process of time. There is a possibility that the site may be required to meet unmet open space needs but there is no conclusive evidence to this effect, Whilst the nearby junior school is at capacity certain types of residential development would be possible without an increase in demand for school places. Furthermore the potential for expansion of the nearby schools is as yet undetermined. Provided biodiversity impacts can be mitigated the site would be appropriate for residential development.",,http://opendatacommunities.org/id/district-council/chesterfield,owned by a public authority,2019-09-24,full planning permission,https://publicaccess.chesterfield.gov.uk/online-applications/propertyDetails.do?previousCaseType=Application&keyVal=0012F6EPLI000&previousCaseNumber=CHE%2F19%2F00239%2FFUL&activeTab=summary&previousKeyVal=PQ5A79EPFXD00,permissioned,"Brockwell Court (Former), Cheedale Avenue, Newbold, Chesterfield",16,https://www.chesterfield.gov.uk/media/562066/16-brockwell-court-former-cheedale-avenue-newbold.pdf,,,
yes,,2017-12-19,-1.440974,53.235801,,0.25,2019-12-09,,1,12,The site appropriate for residential development. Constraints identified within the LAA are likely to be mitigable.,,http://opendatacommunities.org/id/district-council/chesterfield,owned by a public authority,2019-09-24,full planning permission,https://publicaccess.chesterfield.gov.uk/online-applications/propertyDetails.do?keyVal=K72Y86EP00200&activeTab=summary,permissioned,"Catherine Street, Bank Street and Catherine Street Chesterfield",17,https://www.chesterfield.gov.uk/media/562069/17-catherine-street-chesterfield.pdf,,,
yes,,2017-12-19,-1.376965,53.274298,,0.69,2017-12-19,,1,20,"Whilst no local centre is nearby (notwithstanding any centre developed within the Staveley Rother Corridor), the site is still appropriate for residential development being in regeneration priority area. Identified constraints are likely to be mitigable.",,http://opendatacommunities.org/id/district-council/chesterfield,owned by a public authority,,,https://publicaccess.chesterfield.gov.uk/online-applications/propertyDetails.do?previousCaseType=Application&previousKeyVal=ORIZHUEPL8000&activeTab=summary&previousCaseNumber=CHE%2F17%2F00428%2FDEM&keyVal=0012KDEPLI000,not permissioned,"Land at Duewell Court, Station Road, Barrow Hill",18,https://www.chesterfield.gov.uk/media/562072/18-land-at-duewell-court-station-road-barrow-hill.pdf,,,
yes,,2017-12-19,-1.456377,53.233302,,0.2,2019-12-09,,1,10,"The site is appropriate for residential development in terms of access to centres, services and facilities. Identified constraints are likely to be mitigable.",,http://opendatacommunities.org/id/district-council/chesterfield,owned by a public authority,2019-01-29,full planning permission,https://publicaccess.chesterfield.gov.uk/online-applications/propertyDetails.do?previousCaseType=Application&previousKeyVal=O2P2KKEP00M00&activeTab=summary&previousCaseNumber=CHE%2F16%2F00096%2FDEM&keyVal=000RVOEPLI000,permissioned,"Heaton Court (Former), Meynell Close, Chesterfield",23,https://www.chesterfield.gov.uk/media/562075/23-heaton-court-former-meynell-close-chesterfield.pdf,,,
yes,,2017-12-19,-1.321949,53.2778,,0.41,2017-12-19,,1,14,The site is appropriate for residential development despite no local centre nearby and limited accessibility to services and facilities given that it is within a regeneration priority area. Identified constraints are likely to be mitigable.,,http://opendatacommunities.org/id/district-council/chesterfield,owned by a public authority,,,,not permissioned,"Miller Avenue, Mastin Moor, Chesterfield",32,https://www.chesterfield.gov.uk/media/562078/32-miller-avenue-mastin-moor.pdf,,,
yes,,2017-12-19,-1.414648,53.255702,,1.6,2018-12-11,,45,45,Development is under construction. 45 dwellings based on brownfield element.,,http://opendatacommunities.org/id/district-council/chesterfield,not owned by a public authority,2018-01-09,reserved matters approval,https://publicaccess.chesterfield.gov.uk/online-applications/propertyDetails.do?previousCaseType=Application&previousKeyVal=N6W98SEP00T00&activeTab=summary&previousCaseNumber=CHE%2F14%2F00404%2FOUT&keyVal=NV6DW0EP03B00,permissioned,"Land North-East of Sainsburys Roundabout, Rother Way, Chesterfield",49,https://www.chesterfield.gov.uk/media/562081/49-land-north-east-of-sainsburys-roundabout-rother-way-chesterfield.pdf,,,
yes,,2017-12-19,-1.446608,53.231099,,5.71,2017-12-19,,1,135,Application for full planning permission is pending consideration.,,http://opendatacommunities.org/id/district-council/chesterfield,not owned by a public authority,,,https://publicaccess.chesterfield.gov.uk/online-applications/propertyDetails.do?previousCaseType=Application&previousKeyVal=OUB3YTEP04100&activeTab=summary&previousCaseNumber=CHE%2F17%2F00566%2FTPO&keyVal=JFAROTEP20000,pending decision,"Boythorpe Works (Former), Goytside Road Chesterfield",64,https://www.chesterfield.gov.uk/media/562084/64-boythorpe-works-former-goytside-road-chesterfield.pdf,,,
yes,,2017-12-19,-1.421246,53.243303,,19.22,2019-12-11,,1550,1550,Outline planning permission receieved. CHE/19/00116/REM and CHE/19/00007/REM recently approved which covers 177 dwellings and the Basin Square area of the scheme.,,http://opendatacommunities.org/id/district-council/chesterfield,not owned by a public authority,2011-03-09,outline planning permission,https://publicaccess.chesterfield.gov.uk/online-applications/propertyDetails.do?previousCaseType=Application&previousKeyVal=OGSFD2EP02A00&activeTab=summary&previousCaseNumber=CHE%2F16%2F00762%2FDOC&keyVal=KRTIMDEP00200,permissioned,"Land At East Of A61 Known as Chesterfield Waterside, Brimington Road, Chesterfield",68,https://www.chesterfield.gov.uk/media/562912/68-land-east-of-a61-known-as-chesterfield-waterside.pdf,,,
yes,,2017-12-19,-1.45621,53.241804,,0.68,2017-12-19,,1,20,The site has been occupied by a permanent structure but the remains have not sufficiently blended into the landscape over the process of time. It is in a location accessible to a centre and with reasonable accessibility to services and facilities and it is likely that constraints can be mitigated.,,http://opendatacommunities.org/id/district-council/chesterfield,owned by a public authority,,,https://publicaccess.chesterfield.gov.uk/online-applications/propertyDetails.do?previousCaseType=Application&previousKeyVal=OGDF9GEP02A00&activeTab=summary&previousCaseNumber=CHE%2F16%2F00745%2FTPOEXP&keyVal=00147YEPLI000,not permissioned,"Ashbrook Centre (Former), Cuttholme Road, Chesterfield",91,https://www.chesterfield.gov.uk/media/562087/91-ashbrooke-centre-former-cuttholme-road-chesterfield.pdf,,,
yes,,2018-12-11,-1.429687,53.23848,,0.86,2018-12-11,,1,39,"Included within draft local plan. The site has no significant physical or environmental constraints and those identified, including access, highway network limitations, heritage impact, air pollution, land stability should be mitigable.",,http://opendatacommunities.org/id/district-council/chesterfield,not owned by a public authority,,,,not permissioned,Allen & Orr Timber Yard,94,https://www.chesterfield.gov.uk/media/824279/94-allen-orr-timber-yard-chesterfield.pdf,,,
yes,,2017-12-19,-1.439559,53.238599,,0.62,2019-12-11,,1,70,"The site is appropriate for residential development in terms of access to centres, services and facilities. Identified constraints are likely to be mitigable.",,http://opendatacommunities.org/id/district-council/chesterfield,owned by a public authority,2019-11-06,full planning permission,https://publicaccess.chesterfield.gov.uk/online-applications/propertyDetails.do?previousCaseType=Application&previousKeyVal=K5L2ZLEP00M00&activeTab=summary&previousCaseNumber=CHE%2F08%2F00553%2FFUL&keyVal=K5L3V6EP00200,permissioned,"Goldwell Rooms (Former) and 6 Ashgate Road, Chesterfield",108,https://www.chesterfield.gov.uk/media/562093/108-goldwell-rooms-former-and-6-ashgate-road-chesterfield.pdf,,,
yes,,2017-12-19,-1.389072,53.264401,,0.97,2017-12-19,,37,37,Site has full planning permission and development is currently underway.,,http://opendatacommunities.org/id/district-council/chesterfield,not owned by a public authority,2016-04-05,reserved matters approval,https://publicaccess.chesterfield.gov.uk/online-applications/propertyDetails.do?previousCaseType=Application&previousKeyVal=OTLJRQEP04100&activeTab=summary&previousCaseNumber=CHE%2F17%2F00533%2FTPO&keyVal=0019FWEPLI000,permissioned,"Ringwood Centre, Victoria Street, Brimington, Chesterfield",111,https://www.chesterfield.gov.uk/media/562096/111-ringwood-centre-victoria-street-brimington.pdf,,,
yes,,2017-12-19,-1.390498,53.243204,,0.87,2018-12-11,,26,26,Site has reserved matters permission.,,http://opendatacommunities.org/id/district-council/chesterfield,not owned by a public authority,2018-11-20,reserved matters approval,https://publicaccess.chesterfield.gov.uk/online-applications/propertyDetails.do?previousCaseType=Application&previousKeyVal=NPO7KTEP00T00&activeTab=summary&previousCaseNumber=CHE%2F15%2F00344%2FOUT&keyVal=000Q6SEPLI000,permissioned,"292 Manor Road, Brimington, Chesterfield",125,https://www.chesterfield.gov.uk/media/562099/125-292-manor-road-brimington-chesterfield.pdf,,,
yes,,2017-12-19,-1.368983,53.251101,,0.53,2017-12-19,,1,16,The loss of the site to residential development has been accepted by the Council on the basis of alternative provision being within the same catchment as the Social Club. The site is appropriate for residential development and identified constriants are likely to be mitigable.,,http://opendatacommunities.org/id/district-council/chesterfield,,,,https://publicaccess.chesterfield.gov.uk/online-applications/propertyDetails.do?previousCaseType=Application&previousKeyVal=KUFQ6DEP01X00&activeTab=summary&previousCaseNumber=CHE%2F09%2F00756%2FOUT&keyVal=0017SQEPLI000,not permissioned,"Inkersall Social Club, Inkersall Green, Inkersall",126,https://www.chesterfield.gov.uk/media/562102/126-inkersall-social-club-inkersall-green-inkersall.pdf,,,
yes,,2017-12-19,-1.432344,53.238098,,0.65,2019-12-10,,1,29,"The site is appropriate for residential development, the loss of the offices on the site is policy compliant, there being no overriding planning reasons to protect the premises and land from other town centre uses. Identified constraints are likely to be mitigable. application awaiting decision (care units). Full application awaiting decision.",,http://opendatacommunities.org/id/district-council/chesterfield,not owned by a public authority,,,https://publicaccess.chesterfield.gov.uk/online-applications/propertyDetails.do?previousCaseType=Application&previousKeyVal=LW33IPEP02W00&activeTab=summary&previousCaseNumber=CHE%2F11%2F00835%2FCA&keyVal=001A6AEPLI000,not permissioned,"North East Derbyshire District Council Offices (Former), Saltergate, Chesterfield",128,https://www.chesterfield.gov.uk/media/562915/128-former-ne-derbyshire-district-council-offices-saltergate-chesterfield.pdf,,,
yes,,2017-12-19,-1.387573,53.263396,,0.71,2017-12-19,,1,23,The site has been occupied by a permanent structure but the remains have not sufficiently blended into the landscape over the process of time. Whilst nearby schools are at capacity certain types of residential development would be possible without an increase in demand for school places. Furthermore the potential for expansion of the nearby schools is as yet undetermined. The site has constraints but non appear to be unmitigable and the site is appropriate for residential development.,,http://opendatacommunities.org/id/district-council/chesterfield,,,,https://publicaccess.chesterfield.gov.uk/online-applications/propertyDetails.do?previousCaseType=Application&previousKeyVal=K9JUV7EP00M00&activeTab=summary&previousCaseNumber=CHE%2F08%2F00727%2FFUL&keyVal=IPSH33EPN1000,not permissioned,"Elm Street, Hollingwood, Brimington,",145,https://www.chesterfield.gov.uk/media/562108/145-elm-street-hollingwood-brimington.pdf,,,
yes,,2017-12-19,-1.449788,53.253002,,0.57,2017-12-19,,1,17,The site is an appropriate location for residential development. Identified constraints are likely to be mitigable.,,http://opendatacommunities.org/id/district-council/chesterfield,owned by a public authority,,,https://publicaccess.chesterfield.gov.uk/online-applications/propertyDetails.do?previousCaseType=Application&previousKeyVal=N7DAM7EP00T00&activeTab=summary&previousCaseNumber=CHE%2F14%2F00441%2FDEM&keyVal=0014PGEPLI000,not permissioned,"Derwent House HOP, Ulverston Road, Chesterfield",150,https://www.chesterfield.gov.uk/media/562111/150-derwent-house-hop-ulverston-road-chesterfield.pdf,,,
yes,,2017-12-19,-1.424839,53.246898,,0.91,2017-12-19,,1,25,On the basis that the site would only be available should Derbyshire County Council have concluded that the service/facility provided is no longer necessary the site is an appropriate location for residential development. The constraints posed by Sheffield Road to the west is not significant. Other identified constraints are likely to be mitigable.,,http://opendatacommunities.org/id/district-council/chesterfield,owned by a public authority,,,https://publicaccess.chesterfield.gov.uk/online-applications/propertyDetails.do?previousCaseType=Application&previousKeyVal=I00PCGEP20000&activeTab=summary&previousCaseNumber=CHE%2F04%2F00537%2FCPO&keyVal=0009EDEPLI000,not permissioned,"Red House HOP & Spire Lodge, Sheffield Road, Chesterfield",151,https://www.chesterfield.gov.uk/media/562114/151-red-house-hop-spire-lodge-sheffield-road-chesterfield.pdf,,,
yes,,2017-12-19,-1.437771,53.278996,,1.12,2017-12-19,,1,30,The site is not essential to ensuring an adequate supply of employment land or premises in terms of quantity. There is a need for further information on the relationship with adjoining commercial/industrial land uses and whether or not a good level of amenity might be feasible should adjoining land uses continue in commercial/industrial use. The site is not within walking distance of a centre and is not within a Regeneration Priority Area. There is insuffiicent information on the adequacy of education and GP provision in the locality. Accordingly the site is not currently considered to be appropriate for residential development.,,http://opendatacommunities.org/id/district-council/chesterfield,,,,https://publicaccess.chesterfield.gov.uk/online-applications/propertyDetails.do?previousCaseType=Application&previousKeyVal=8400130OLD&activeTab=summary&previousCaseNumber=CHE%2F0384%2F0184&keyVal=000DVTEPLI000,not permissioned,"Ash Glen Nursery (Former), Sheffield Road, Unstone",154,https://www.chesterfield.gov.uk/media/562117/154-ash-glen-nursery-former-sheffield-road-unstone.pdf,,,
yes,,2017-12-19,-1.437695,53.2802,,1.3,2019-12-10,,48,48,Outline permission received. REM pending consideration.,,http://opendatacommunities.org/id/district-council/chesterfield,not owned by a public authority,2017-10-10,outline planning permission,https://publicaccess.chesterfield.gov.uk/online-applications/propertyDetails.do?previousCaseType=Application&previousKeyVal=O48IFAEP04100&activeTab=summary&previousCaseNumber=CHE%2F16%2F00171%2FOUT&keyVal=000DW4EPLI000,permissioned,"Boat Sales (Former), Sheffield Road, Unstone",156,https://www.chesterfield.gov.uk/media/562123/156-boat-sales-former-sheffield-road-unstone.pdf,,,
yes,,2017-12-19,-1.443739,53.221297,,3.09,2019-12-10,,90,90,Outline permission lapsed in 2018.,,http://opendatacommunities.org/id/district-council/chesterfield,not owned by a public authority,,,https://publicaccess.chesterfield.gov.uk/online-applications/propertyDetails.do?previousCaseType=Application&previousKeyVal=NJNL0NEPGXY00&activeTab=summary&previousCaseNumber=CHE%2F15%2F00108%2FOUT&keyVal=00155XEPLI000,not permissioned,"Walton Hospital, Whitecotes Lane, Chesterfield",192,https://www.chesterfield.gov.uk/media/562126/192-walton-hospital-whitecotes-lane-chesterfield.pdf,,,
yes,,2017-12-19,-1.43941,53.220198,,1.5,2019-12-10,,60,60,Outline permission lapsed in 2019.,,http://opendatacommunities.org/id/district-council/chesterfield,not owned by a public authority,,,https://publicaccess.chesterfield.gov.uk/online-applications/propertyDetails.do?previousCaseType=Application&previousKeyVal=NUPO72EP00T00&activeTab=summary&previousCaseNumber=CHE%2F15%2F00598%2FOUT&keyVal=NUQ08QEP03B00,not permissioned,"Land South Of Walton Hospital, Harehill Road, Chesterfield",193,https://www.chesterfield.gov.uk/media/562129/193-land-south-of-walton-hospital-harehill-road-chesterfield.pdf,,,
yes,,2017-12-19,-1.337547,53.243802,,1.35,2019-12-11,,3,3,Site had full planning permission. Lapsed in 2017.,,http://opendatacommunities.org/id/district-council/chesterfield,,,,https://publicaccess.chesterfield.gov.uk/online-applications/propertyDetails.do?previousCaseType=Application&previousKeyVal=ND6FUEEP02A00&activeTab=summary&previousCaseNumber=CHE%2F14%2F00728%2FFUL&keyVal=0015DLEPLI000,not permissioned,"Middle Farm, Duckmanton, Chesterfield",244,https://www.chesterfield.gov.uk/media/562132/244-middle-farm-duckmanton.pdf,,,
yes,,2017-12-19,-1.425114,53.245398,,0.2,2019-12-09,,9,9,Site had outline planning permission which lapsed in Feb 2019.,,http://opendatacommunities.org/id/district-council/chesterfield,not owned by a public authority,,,https://publicaccess.chesterfield.gov.uk/online-applications/propertyDetails.do?previousCaseType=Application&previousKeyVal=NUPLCAEP00T00&activeTab=summary&previousCaseNumber=CHE%2F15%2F00595%2FOUT&keyVal=001996EPLI000,not permissioned,"The Conservatory Centre, Hazlehurst Lane, Stonegravels, Chesterfield",276,https://www.chesterfield.gov.uk/media/562135/276-the-conservatory-centre-hazlehurst-lane-stonegravels-chesterfield.pdf,,,
yes,,2017-12-19,-1.376476,53.263599,,0.55,2017-12-19,,1,10,The brownfield element of the site is in a suitable location in respect to services and facilities and identified constraints are likely to be mitigable.,,http://opendatacommunities.org/id/district-council/chesterfield,not owned by a public authority,,,https://publicaccess.chesterfield.gov.uk/online-applications/propertyDetails.do?previousCaseType=Application&previousKeyVal=OQPCVFEPL3U00&activeTab=summary&previousCaseNumber=CHE%2F17%2F00390%2FOUT&keyVal=000QS3EPLI000,not permissioned,"Pondhouse Farm, Troughbrook Road, Hollingwood, Chesterfield",315,https://www.chesterfield.gov.uk/media/562138/315-pondhouse-farm-troughbrook-road-hollingwood-chesterfield.pdf,,,
yes,,2017-12-19,-1.324821,53.2745,,0.2,2017-12-19,,1,6,The site is within a regeneration priority area and is suitable in priniciple for residential (Housing) development despite being currently distant from existing services and facilities. Identified constraints are likely to be mitigable.,,http://opendatacommunities.org/id/district-council/chesterfield,owned by a public authority,,,,not permissioned,"Edale Road (garage court), Mastin Moor, Chesterfield",317,https://www.chesterfield.gov.uk/media/562141/317-edale-road-garage-court-mastin-moor.pdf,,,
yes,,2017-12-19,-1.450988,53.2681,,4.49,2018-12-11,,106,106,Reserved matters permission received. Dwellings under construction.,,http://opendatacommunities.org/id/district-council/chesterfield,not owned by a public authority,2017-11-23,reserved matters approval,https://publicaccess.chesterfield.gov.uk/online-applications/propertyDetails.do?previousCaseType=Application&previousKeyVal=NJR4RQEPGYP00&activeTab=summary&previousCaseNumber=CHE%2F15%2F00116%2FOUT&keyVal=IF6PNZEP20000,permissioned,"Land Off Dunston Road, Chesterfield",336,https://www.chesterfield.gov.uk/media/562144/336-land-off-dunston-road-chesterfield.pdf,,,
yes,,2017-12-19,-1.425202,53.2388,,0.15,2019-12-11,,22,22,Reserved matters permission received.,,http://opendatacommunities.org/id/district-council/chesterfield,not owned by a public authority,2016-02-05,reserved matters approval,https://publicaccess.chesterfield.gov.uk/online-applications/propertyDetails.do?activeTab=relatedCases&keyVal=IA5SMDEPN1001,permissioned,"Basil Close, Chesterfield",382,https://www.chesterfield.gov.uk/media/562150/382-basil-close-chesterfield-s41-7sl.pdf,,,
yes,,2017-12-19,-1.425207,53.257497,,0.07,2019-12-11,,8,8,Reserved matters permission lapsed. New ouline permission approved April 2019.,,http://opendatacommunities.org/id/district-council/chesterfield,not owned by a public authority,2019-04-08,outline planning permission,https://publicaccess.chesterfield.gov.uk/online-applications/propertyDetails.do?activeTab=relatedCases&keyVal=0019XEEPLI000,permissioned,"Ryro Engineering, Shaw Street, Chesterfield",383,https://www.chesterfield.gov.uk/media/562153/383-ryro-engineering-shaw-street-chesterfield.pdf,,,
yes,,2017-12-19,-1.435785,53.2385,,0.08,2017-12-19,,10,10,Full planning permission received. Under construction.,,http://opendatacommunities.org/id/district-council/chesterfield,not owned by a public authority,2016-03-29,full planning permission,https://publicaccess.chesterfield.gov.uk/online-applications/propertyDetails.do?activeTab=relatedCases&keyVal=O0J36IEP03B00,permissioned,"Former Social Club, Saltergate, Chesterfield",385,https://www.chesterfield.gov.uk/media/562156/385-former-social-club-saltergate-chesterfield.pdf,,,
yes,,2017-12-19,-1.446095,53.255798,,0.24,2019-12-11,,10,10,Full planning permission received. Work on site commenced.,,http://opendatacommunities.org/id/district-council/chesterfield,not owned by a public authority,2016-04-26,full planning permission,https://publicaccess.chesterfield.gov.uk/online-applications/propertyDetails.do?activeTab=relatedCases&keyVal=0014R7EPLI000,permissioned,"Littlemoor Shopping Centre, Littlemoor Centre, Chesterfield",386,https://www.chesterfield.gov.uk/media/562159/386-littlemoor-shopping-centre-littlemoor-centre-s41-8qw.pdf,,,
yes,,2017-12-19,-1.437481,53.2417,,0.12,2019-12-11,,6,6,Full planning permission received. New permission pending consideration.,,http://opendatacommunities.org/id/district-council/chesterfield,not owned by a public authority,2015-12-14,full planning permission,https://publicaccess.chesterfield.gov.uk/online-applications/propertyDetails.do?activeTab=relatedCases&keyVal=000A1SEPLI000,permissioned,"Avondale Surgery, 3 - 5 Avondale Road, Chesterfield, Derbyshire, Chesterfield",387,https://www.chesterfield.gov.uk/media/562162/387-avondale-surgery-3-5-avondale-road-chesterfield.pdf,,,
yes,,2017-12-19,-1.400684,53.230599,,0.12,2019-12-11,,6,6,Reserved matters permission received. Currently under construction.,,http://opendatacommunities.org/id/district-council/chesterfield,not owned by a public authority,2017-11-08,reserved matters approval,https://publicaccess.chesterfield.gov.uk/online-applications/propertyDetails.do?previousCaseType=Application&previousKeyVal=OQG3HVEPL2L00&activeTab=summary&previousCaseNumber=CHE%2F17%2F00375%2FREM&keyVal=0001PLEPLI000,permissioned,"Hady Miners Welfare Club, Houldsworth Drive, Hady, Chesterfield",388,https://www.chesterfield.gov.uk/media/562165/387-hady-miners-welfare-club-houldsworth-drive-hady.pdf,,,
yes,,2017-12-19,-1.429826,53.235901,,0.06,2018-12-11,,10,10,Full planning permission received.,,http://opendatacommunities.org/id/district-council/chesterfield,not owned by a public authority,2018-06-20,full planning permission,https://publicaccess.chesterfield.gov.uk/online-applications/propertyDetails.do?previousCaseType=Application&previousKeyVal=O7Q0TDEPISM00&activeTab=summary&previousCaseNumber=CHE%2F16%2F00345%2FFUL&keyVal=0000UIEPLI000,permissioned,"Post Office, 1, Market Place, Chesterfield",389,https://www.chesterfield.gov.uk/media/562168/389-post-office-1-market-place-chesterfield.pdf,,,
yes,,2017-12-19,-1.453942,53.234001,,0.08,2017-12-19,,7,7,Full planning permission received.,,http://opendatacommunities.org/id/district-council/chesterfield,not owned by a public authority,2016-11-22,full planning permission,https://publicaccess.chesterfield.gov.uk/online-applications/propertyDetails.do?activeTab=relatedCases&keyVal=0014H4EPLI000,permissioned,"Jacksons Bakery, New Hall Road, Chesterfield",390,https://www.chesterfield.gov.uk/media/562171/390-jacksons-bakery-new-hall-road-chesterfield.pdf,,,
yes,,2017-12-19,-1.436471,53.246702,,0.09,2019-12-11,,5,5,Outline permission lapsed April 2018.,,http://opendatacommunities.org/id/district-council/chesterfield,not owned by a public authority,2015-04-08,,https://publicaccess.chesterfield.gov.uk/online-applications/propertyDetails.do?activeTab=relatedCases&keyVal=00174IEPLI000,not permissioned,"Fridays Chip Shop, 109 Highfield Road, Chesterfield, Derbyshire, Chesterfield",393,https://www.chesterfield.gov.uk/media/562174/393-fridays-chip-shop-109-highfield-road-chesterfield.pdf,,,
