Deliverable,EndDate,FirstAddedDate,GeoX,GeoY,HazardousSubstances,Hectares,LastUpdatedDate,MinNetDwellings,NetDwellingsRangeFrom,NetDwellingsRangeTo,Notes,OrganisationLabel,OrganisationURI,OwnershipStatus,PermissionDate,PermissionType,PlanningHistory,PlanningStatus,SiteNameAddress,SiteReference,SiteplanURL,entity,point,brownfield-land
,,,-2.762343,52.223014,,0.04,2020-01-07,,,,Proposed erection of a pair of semi-detached houses. (For DOC 6 see~182220),Herefordshire Council,http://opendatacommunities.org/id/unitary-authority/herefordshire,,2016-11-01,outline planning permission,,permissioned,"Site at The Birdcage, Barons Cross Road, Leominster, Herefordshire",161937,https://www.herefordshire.gov.uk/info/200142/planning_services/planning_application_search/details?id=161937,,,
,,,-2.510652,51.913726,,0,2020-01-07,,,,"Demolition of existing garage, construction of new dwelling. Minor~alterations to existing dwelling.",Herefordshire Council,http://opendatacommunities.org/id/unitary-authority/herefordshire,,2015-11-25,full planning permission,,permissioned,"East View, Bromsash, Ross-On-Wye, Herefordshire, HR9 7PN",153016,https://www.herefordshire.gov.uk/info/200142/planning_services/planning_application_search/details?id=153016,,,
,,,-2.580492,52.154337,,0,2020-01-07,,,,Variation of condition 2 for a dwelling and garage(153174) - to~relocate access and garage.,Herefordshire Council,http://opendatacommunities.org/id/unitary-authority/herefordshire,,2017-01-13,full planning permission,,permissioned,"Land at The Three Horseshoes Inn, Little Cowarne, Hereford, Herefordshire",163753,https://www.herefordshire.gov.uk/info/200142/planning_services/planning_application_search/details?id=163753,,,
,,,-2.698755,51.885067,,0,2020-01-07,,,,Proposed change of use of former agricultural building currently used~as an aircraft hanger to one residential unit. (For DOC 6 9 10~11 & 14 see 180046),Herefordshire Council,http://opendatacommunities.org/id/unitary-authority/herefordshire,,2016-07-04,full planning permission,,permissioned,"Tredunnock Farm, Llangarron, Ross-on-Wye, Herefordshire",161338,https://www.herefordshire.gov.uk/info/200142/planning_services/planning_application_search/details?id=161338,,,
,,,-2.824489,52.278437,,0,2020-01-07,,,,"Change of use of light industrial building to a domestic dwelling,~including allocation of a parcel of land to provide amenity space.~(For DOC 3, 4, 5, 6, 8 see 172217)",Herefordshire Council,http://opendatacommunities.org/id/unitary-authority/herefordshire,,2017-02-21,full planning permission,,permissioned,"Building adjacent The Old Vicarage, Lucton, Leominster, Herefordshire, HR6 9PN",163814,https://www.herefordshire.gov.uk/info/200142/planning_services/planning_application_search/details?id=163814,,,
,,,-2.972356,52.204766,,0,2020-01-07,,,,Conversion of chapel into two bedroom dwelling.,Herefordshire Council,http://opendatacommunities.org/id/unitary-authority/herefordshire,,2013-10-02,full planning permission,,permissioned,"Chapel adjacent to The Cottage, New Street, Lyonshall, Herefordshire, HR5 3HT",132123,https://www.herefordshire.gov.uk/info/200142/planning_services/planning_application_search/details?id=132123,,,
,,,-3.000526,52.198938,,0.38,2020-01-07,,,,"Change of use of The Court to a single dwelling house, including new~kitchen and bathroom, and private driveway to connect to existing~gated access to highway; improvements to part of The Cartshed for use~as a secure private store, and creation of private garden.~Construction of detached garage previously approved.",Herefordshire Council,http://opendatacommunities.org/id/unitary-authority/herefordshire,,2016-09-14,full planning permission,,permissioned,"Penrhos Court, Lyonshall, Kington, Herefordshire",161501,https://www.herefordshire.gov.uk/info/200142/planning_services/planning_application_search/details?id=161501,,,
,,,-3.0379,52.033201,,0.08,2020-01-07,,,,Proposed change of use and renovation of former chapel to three~bedroom dwelling including replacement rear extension and associated~landscaping and drainage.,Herefordshire Council,http://opendatacommunities.org/id/unitary-authority/herefordshire,,2015-09-15,full planning permission,,permissioned,"Llanrosser Methodist Church, Michaelchurch Escley, Hereford, Herefordshire, HR2 0PU",152247,https://www.herefordshire.gov.uk/info/200142/planning_services/planning_application_search/details?id=152247,,,
,,,-2.785089,51.900149,,0,2020-01-07,,,,Proposed demolition of redundant former village hall and rifle range~and erection of two detached dwellings.,Herefordshire Council,http://opendatacommunities.org/id/unitary-authority/herefordshire,,2015-01-14,full planning permission,,permissioned,"Former village hall and rifle club, Kingsthorne, Herefordshire",143339,https://www.herefordshire.gov.uk/info/200142/planning_services/planning_application_search/details?id=143339,,,
,,,-2.724045,51.982314,,0,2020-01-07,,,,Proposed new 3 bedroom detached dwelling. (For DOC 12 see 170242For~DOC 4 5 6 8 9 11 see 190694),Herefordshire Council,http://opendatacommunities.org/id/unitary-authority/herefordshire,,2016-02-23,full planning permission,,permissioned,"Land adjacent Rangers Lodge, Little Birch Road, Kingsthorne, Herefordshire",153552,https://www.herefordshire.gov.uk/info/200142/planning_services/planning_application_search/details?id=153552,,,
,,,-2.740622,51.966818,,0,2020-01-07,,,,Proposed dwelling and garage.,Herefordshire Council,http://opendatacommunities.org/id/unitary-authority/herefordshire,,2016-05-26,outline planning permission,,permissioned,"Land to the rear of Post Office and Shop, Wormelow, Hereford",160819,https://www.herefordshire.gov.uk/info/200142/planning_services/planning_application_search/details?id=160819,,,
,,,-2.510705,52.117924,,0,2020-01-07,,,,Proposed conversion of former public house to 3 no. residential units.,Herefordshire Council,http://opendatacommunities.org/id/unitary-authority/herefordshire,,2015-07-09,full planning permission,,permissioned,"Fir Tree Inn, Much Cowarne, Herefordshire, HR7 4JN",150405,https://www.herefordshire.gov.uk/info/200142/planning_services/planning_application_search/details?id=150405,,,
,,,-2.745327,51.967957,,0.08,2020-01-07,,,,Proposed new dwelling,Herefordshire Council,http://opendatacommunities.org/id/unitary-authority/herefordshire,,2015-02-24,full planning permission,,permissioned,"Land at Park House, Wormelow, Hereford, Herefordshire, HR2 8EQ",143737,https://www.herefordshire.gov.uk/info/200142/planning_services/planning_application_search/details?id=143737,,,
,,,-2.755397,51.977279,,0.12,2020-01-07,,,,Proposed 2 no. three bedroom dwellings.,Herefordshire Council,http://opendatacommunities.org/id/unitary-authority/herefordshire,,2015-10-09,full planning permission,,permissioned,"Land to the rear of Myrtle Cottage, Much Dewchurch, Herefordshire, HR2 8DL",151492,https://www.herefordshire.gov.uk/info/200142/planning_services/planning_application_search/details?id=151492,,,
,,,-2.511921,52.063427,,0.03,2020-01-07,,,,Proposed conversion of outbuilding to single dwelling. (For DOC 5 7 8~& 9 see 180093),Herefordshire Council,http://opendatacommunities.org/id/unitary-authority/herefordshire,,2017-01-20,full planning permission,,permissioned,"The Castle, Ashperton, Ledbury",163531,https://www.herefordshire.gov.uk/info/200142/planning_services/planning_application_search/details?id=163531,,,
,,,-2.907023,52.128137,,0,2020-01-07,,,,Change of use from Nursery School with residential accommodation to~sole use as residential dwelling. For DOC 4 5 6 7 8 & 9 see 180537.,Herefordshire Council,http://opendatacommunities.org/id/unitary-authority/herefordshire,,2016-09-05,full planning permission,,permissioned,"Norton House School, Norton Canon, Herefordshire, HR4 7BH",162150,https://www.herefordshire.gov.uk/info/200142/planning_services/planning_application_search/details?id=162150,,,
,,,-2.590417,52.122362,,0,2020-01-07,,,,Conversion of coach house building to residential use.,Herefordshire Council,http://opendatacommunities.org/id/unitary-authority/herefordshire,,2016-03-22,full planning permission,,permissioned,"Burley Gate House, Burley Gate, Hereford, Herefordshire, HR1 3QR",160258,https://www.herefordshire.gov.uk/info/200142/planning_services/planning_application_search/details?id=160258,,,
,,,-2.761568,51.947965,,0,2020-01-07,,,,Proposed refurbishment of existing rural building and ground floor~side extension to use the building as a residential dwelling.,Herefordshire Council,http://opendatacommunities.org/id/unitary-authority/herefordshire,,2016-05-24,full planning permission,,permissioned,"The Cave, Orcop Hill, Orcop, Herefordshire, HR2 8SF",160489,https://www.herefordshire.gov.uk/info/200142/planning_services/planning_application_search/details?id=160489,,,
,,,-2.743122,52.305445,,0.14,2020-01-07,,,,Change of use from chocolate factory to ancillary/holiday~accommodation for residential use,Herefordshire Council,http://opendatacommunities.org/id/unitary-authority/herefordshire,,2016-05-26,full planning permission,,permissioned,"Workshop at Orchard Farm, Orleton, Herefordshire, SY8 4HE",161033,https://www.herefordshire.gov.uk/info/200142/planning_services/planning_application_search/details?id=161033,,,
,,,-2.890308,52.218774,,0,2020-01-07,,,,Proposed conversion to a dwelling.,Herefordshire Council,http://opendatacommunities.org/id/unitary-authority/herefordshire,,2015-10-23,full planning permission,,permissioned,"Former Doctors Surgery, East Street, Pembridge, Herefordshire, HR6 9HA",151944,https://www.herefordshire.gov.uk/info/200142/planning_services/planning_application_search/details?id=151944,,,
,,,-2.947207,52.04114,,0,2020-01-07,,,,"Proposed conversion of the Coach House to form a one bedroom dwelling,~demolition and rebuilding of a single storey extension. (For DOC 3 see~ 172227)(For DOC 5 & 9 see 180211)",Herefordshire Council,http://opendatacommunities.org/id/unitary-authority/herefordshire,,2015-12-08,full planning permission,,permissioned,"Coach House at Wellbrook, Peterchurch, Herefordshire",152982,https://www.herefordshire.gov.uk/info/200142/planning_services/planning_application_search/details?id=152982,,,
,,,-2.635324,51.931659,,0.7,2020-01-07,,,,"Demolition of existing buildings and site clearance. Proposed 3 no.~4/5 bedroom dwellings and office building, with landscaping and~Sustainable Urban Drainage Scheme. (For DOC 3 & 8 see 180407)",Herefordshire Council,http://opendatacommunities.org/id/unitary-authority/herefordshire,,2015-03-18,full planning permission,,permissioned,"Mason's Potatoes, The Packhouse,, Dadnor, Ross-on-Wye, Herefordshire",143204,https://www.herefordshire.gov.uk/info/200142/planning_services/planning_application_search/details?id=143204,,,
,,,-2.650532,52.119052,,0,2020-01-07,,,,Proposed conversion of and alterations to offices to create one~holiday letting unit.,Herefordshire Council,http://opendatacommunities.org/id/unitary-authority/herefordshire,,2015-11-04,full planning permission,,permissioned,"White House, Preston Wynne, Herefordshire",152872,https://www.herefordshire.gov.uk/info/200142/planning_services/planning_application_search/details?id=152872,,,
,,,-2.743045,52.321817,,0.44,2020-01-07,,,,Proposed erection of dwelling (Re-submission of planning application~P140962/F),Herefordshire Council,http://opendatacommunities.org/id/unitary-authority/herefordshire,,2015-05-06,full planning permission,,permissioned,"High Bank, Richards Castle, Ludlow, Herefordshire, SY8 4EL",150419,https://www.herefordshire.gov.uk/info/200142/planning_services/planning_application_search/details?id=150419,,,
,,,-2.584637,51.913679,,0.16,2020-01-07,,,,"Demolition of garages and stores, removal of 4 mature trees, erection~of terrace of four, two storey houses, semi-detached pair of two~storey three bed houses, communal bin store and alteration of walls,~parking & landscaping",Herefordshire Council,http://opendatacommunities.org/id/unitary-authority/herefordshire,,2014-12-11,full planning permission,,permissioned,"Watsons Car Park Site, Church Street, Ross-on-Wye, Herefordshire",142121,https://www.herefordshire.gov.uk/info/200142/planning_services/planning_application_search/details?id=142121,,,
,,,-2.860214,52.255202,,0,2020-01-07,,,,Conversion of redundant rural building to form a single dwelling.,Herefordshire Council,http://opendatacommunities.org/id/unitary-authority/herefordshire,,2016-05-09,full planning permission,,permissioned,"Workshop Adjacent to Quyfields, Shobdon, Leominster, Herefordshire, HR6 9NX",160868,https://www.herefordshire.gov.uk/info/200142/planning_services/planning_application_search/details?id=160868,,,
,,,-2.54831,52.14987,,0.06,2020-01-07,,,,Proposed three bed detached house.,Herefordshire Council,http://opendatacommunities.org/id/unitary-authority/herefordshire,,2015-09-29,full planning permission,,permissioned,"Oakfields, Stoke Lacy, Bromyard, Herefordshire, HR7 4HE",152414,https://www.herefordshire.gov.uk/info/200142/planning_services/planning_application_search/details?id=152414,,,
,,,-2.559905,52.064116,,0,2020-01-07,,,,Proposed conversion of former forge into one unit of self-contained~holiday accommodation.,Herefordshire Council,http://opendatacommunities.org/id/unitary-authority/herefordshire,,2016-05-10,full planning permission,,permissioned,"The Forge, Tarrington, Herefordshire, HR1 4HX",153149,https://www.herefordshire.gov.uk/info/200142/planning_services/planning_application_search/details?id=153149,,,
,,,-2.923423,52.030315,,0,2020-01-07,,,,"Reinstatement of former cottage to residential accommodation, to~include two-storey extension, upgraded/improved driveway, a new~detached garage/workshop and associated works. (For DOC application~see 184199)(For DOC 4 see 190684)",Herefordshire Council,http://opendatacommunities.org/id/unitary-authority/herefordshire,,2016-07-12,full planning permission,,permissioned,"Site of former Myrtle Cottage, Vowchurch, Herefordshire, HR2 0RL",160774,https://www.herefordshire.gov.uk/info/200142/planning_services/planning_application_search/details?id=160774,,,
,,,-2.601648,51.865923,,4.82,2020-01-07,,,,Proposed conversion of existing stable block to 2 no. holiday units~with artist studio. Erection of timber stable block with all~associated work,Herefordshire Council,http://opendatacommunities.org/id/unitary-authority/herefordshire,,2016-02-11,full planning permission,,permissioned,"Stable Block At Arthurs Dingle, Leys Hill, Walford, Ross-On-Wye, Herefordshire, HR9 5QU",153570,https://www.herefordshire.gov.uk/info/200142/planning_services/planning_application_search/details?id=153570,,,
,,,-2.601727,51.866417,,1.46,2020-01-07,,,,"The demolition of all existing structures on the site, the permanent~cessation of existing uses and the erection of five detached dwelling~houses with associated garaging (For DOC 3 4 5 10 11 & 12 see 193439).",Herefordshire Council,http://opendatacommunities.org/id/unitary-authority/herefordshire,,2017-01-05,full planning permission,,permissioned,"Land at Cats, Leys Hill Road, Walford, Ross-on-Wye, Herefordshire, HR9 5QU",161689,https://www.herefordshire.gov.uk/info/200142/planning_services/planning_application_search/details?id=161689,,,
,,,-2.578366,51.880479,,0.26,2020-01-07,,,,Change of use into 1 bedroom holiday let with single integral garage.~(For DOC 4 & 5 see 174050),Herefordshire Council,http://opendatacommunities.org/id/unitary-authority/herefordshire,,2017-03-20,full planning permission,,permissioned,"Kiln Rise, Howle Hill, Ross-On-Wye, Herefordshire, HR9 5SH",170294,https://www.herefordshire.gov.uk/info/200142/planning_services/planning_application_search/details?id=170294,,,
,,,-2.730285,51.860061,,0,2020-01-07,,,,Amended house design for plot 5 and retention of existing dwelling.,Herefordshire Council,http://opendatacommunities.org/id/unitary-authority/herefordshire,,2016-04-08,full planning permission,,permissioned,"Welsh Newton Garage, Welsh Newton, Herefordshire",160358,https://www.herefordshire.gov.uk/info/200142/planning_services/planning_application_search/details?id=160358,,,
,,,-2.530084,51.914477,,0,2020-01-07,,,,Erection of 2 dwellinghouses (House Type 1 on Plots 3 & 4 ONLY) with~detached double garages.,Herefordshire Council,http://opendatacommunities.org/id/unitary-authority/herefordshire,,2015-03-13,full planning permission,,permissioned,"Land adjoining Porch Cottages, Weston Under Penyard, Ross-on-Wye, Herefordshire, HR9 7PG",143436,https://www.herefordshire.gov.uk/info/200142/planning_services/planning_application_search/details?id=143436,,,
,,,-2.858846,52.313264,,0,2020-01-07,,,,Conversion of redundant buildings to form a single dwelling. (For DOC~4 & 6 see 184049),Herefordshire Council,http://opendatacommunities.org/id/unitary-authority/herefordshire,,2016-04-06,full planning permission,,permissioned,"Land at Wigmore Hall, Wigmore, Leominster, Herefordshire, HR6 9UL",160282,https://www.herefordshire.gov.uk/info/200142/planning_services/planning_application_search/details?id=160282,,,
,,,-2.486719,52.252748,,0.12,2020-01-07,,,,Proposed conversion of church to dwelling with detached double garage,Herefordshire Council,http://opendatacommunities.org/id/unitary-authority/herefordshire,,2014-08-07,full planning permission,,permissioned,"St Andrews Church, Wolferlow, Bromyard, Herefordshire, HR7 4QA",140905,https://www.herefordshire.gov.uk/info/200142/planning_services/planning_application_search/details?id=140905,,,
,,,-2.579919,52.012323,,0.02,2020-01-07,,,,The conversion of an ex studio/workshop building into a dwelling. (For~DOC 3 see 171602),Herefordshire Council,http://opendatacommunities.org/id/unitary-authority/herefordshire,,2016-05-25,full planning permission,,permissioned,"Workshop opposite Terrace Hall, Woolhope, Herefordshire",161056,https://www.herefordshire.gov.uk/info/200142/planning_services/planning_application_search/details?id=161056,,,
,,,-2.722729,52.048881,,0.29,2020-01-07,,,,,Herefordshire Council,http://opendatacommunities.org/id/unitary-authority/herefordshire,,2015-01-21,full planning permission,,permissioned,"Land East of 20 Belmont Avenue, Hereford, Herefordshire, HR2 7JQ",123177,https://www.herefordshire.gov.uk/info/200142/planning_services/planning_application_search/details?id=123177,,,
,,,-2.708741,52.071668,,0.29,2020-01-07,,,,,Herefordshire Council,http://opendatacommunities.org/id/unitary-authority/herefordshire,,2014-09-08,reserved matters approval,,permissioned,"Land at Bridge Inn, College Road, Hereford, Herefordshire",142197,https://www.herefordshire.gov.uk/info/200142/planning_services/planning_application_search/details?id=142197,,,
,,,-2.715809,52.057491,,0.01,2020-01-07,,,,"Proposed redesign of shop front, convert first floor front offices to~2 x 1 bedroom flats. Subdivide second floor flat into 2 x 1 bedroom~flats. Insert 2 windows in rear elevation.",Herefordshire Council,http://opendatacommunities.org/id/unitary-authority/herefordshire,,2015-01-14,full planning permission,,permissioned,"11-13 Maylord Street, Hereford, Herefordshire, HR1 2DS",143495,https://www.herefordshire.gov.uk/info/200142/planning_services/planning_application_search/details?id=143495,,,
,,,-2.743613,52.072666,,0.07,2020-01-07,,,,Proposed development of 3 no. houses and associated access and~landscape works.,Herefordshire Council,http://opendatacommunities.org/id/unitary-authority/herefordshire,,2015-02-27,full planning permission,,permissioned,"Land off Grosvenor Place, Hereford",143799,https://www.herefordshire.gov.uk/info/200142/planning_services/planning_application_search/details?id=143799,,,
,,,-2.712864,52.056655,,0,2020-01-07,,,,"Proposed renewal of roof to rear wing, to facilitate an additional~residential dwelling within and associated alterations.",Herefordshire Council,http://opendatacommunities.org/id/unitary-authority/herefordshire,,2015-04-07,full planning permission,,permissioned,"30 Union Street, Hereford, Herefordshire, HR1 2BT",150244,https://www.herefordshire.gov.uk/info/200142/planning_services/planning_application_search/details?id=150244,,,
,,,-2.714283,52.058741,,0.07,2020-01-07,,,,Proposed erection of 8 dwellings. (For DOC application see 184271),Herefordshire Council,http://opendatacommunities.org/id/unitary-authority/herefordshire,,2016-03-14,full planning permission,,permissioned,"Land off Catherine Street, Hereford",150630,https://www.herefordshire.gov.uk/info/200142/planning_services/planning_application_search/details?id=150630,,,
,,,-2.731125,52.058476,,0.02,2020-01-07,,,,Site for proposed erection of 2 dwellings.,Herefordshire Council,http://opendatacommunities.org/id/unitary-authority/herefordshire,,2015-07-13,outline planning permission,,permissioned,"8 Cotterell Street, Hereford, HR4 0HQ",151031,https://www.herefordshire.gov.uk/info/200142/planning_services/planning_application_search/details?id=151031,,,
,,,-2.731161,52.057127,,0.04,2020-01-07,,,,Proposed conversion of church to residential dwelling.,Herefordshire Council,http://opendatacommunities.org/id/unitary-authority/herefordshire,,2015-10-02,full planning permission,,permissioned,"Chandos Street Methodist Church, Chandos Street, Hereford, Herefordshire, HR4 0EX",151077,https://www.herefordshire.gov.uk/info/200142/planning_services/planning_application_search/details?id=151077,,,
,,,-2.698185,52.066507,,0.04,2020-01-07,,,,Proposed demolition of an existing garage and construction of a new~dwelling. (For DOC 3 7 & 9 see 170839),Herefordshire Council,http://opendatacommunities.org/id/unitary-authority/herefordshire,,2015-07-17,full planning permission,,permissioned,"85 Aylestone Hil, Hereford, Herefordshire, HR1 1HX",151352,https://www.herefordshire.gov.uk/info/200142/planning_services/planning_application_search/details?id=151352,,,
,,,-2.718478,52.052036,,0.03,2020-01-07,,,,Proposed conversion of former pub function rooms into 6 self-contained~apartments and external stair to north elevation (For DOC 2 & 3 see~172539).,Herefordshire Council,http://opendatacommunities.org/id/unitary-authority/herefordshire,,2015-11-18,full planning permission,,permissioned,"1 St Martins Street, Hereford, Herefordshire, HR2 7RD",152246,https://www.herefordshire.gov.uk/info/200142/planning_services/planning_application_search/details?id=152246,,,
,,,-2.691056,52.049763,,0,2020-01-07,,,,Proposed conversion of outbuilding into a dwelling,Herefordshire Council,http://opendatacommunities.org/id/unitary-authority/herefordshire,,2016-10-24,full planning permission,,permissioned,"Outbuilding at Mavis Holt, 35 Hampton Park Road, Hereford, Herefordshire",152422,https://www.herefordshire.gov.uk/info/200142/planning_services/planning_application_search/details?id=152422,,,
,,,-2.700797,52.050704,,0,2020-01-07,,,,"Demolish of existing block of three garages and construction of a two~bedroom, two storey annexe.",Herefordshire Council,http://opendatacommunities.org/id/unitary-authority/herefordshire,,2016-05-19,full planning permission,,permissioned,"Land at 114 Eign Road, Hereford, Herefordshire, HR1 2RX",153057,https://www.herefordshire.gov.uk/info/200142/planning_services/planning_application_search/details?id=153057,,,
,,,-2.714958,52.059016,,0.01,2020-01-07,,,,Proposed conversion of ground floor restaurant to dwelling and~alterations to upper floors. (For DOC 4 see 173299),Herefordshire Council,http://opendatacommunities.org/id/unitary-authority/herefordshire,,2016-01-07,full planning permission,,permissioned,"82 Widemarsh Street, Hereford",153254,https://www.herefordshire.gov.uk/info/200142/planning_services/planning_application_search/details?id=153254,,,
,,,-2.716936,52.054976,,0,2020-01-07,,,,Conversion of first floor office and school use premises to~residential use - 4 flats.,Herefordshire Council,http://opendatacommunities.org/id/unitary-authority/herefordshire,,2016-04-12,full planning permission,,permissioned,"20 Broad Street, Hereford, HR4 9AP",153506,https://www.herefordshire.gov.uk/info/200142/planning_services/planning_application_search/details?id=153506,,,
,,,-2.714875,52.059268,,0.01,2020-01-07,,,,Proposed change of use of first floor to residential unit.,Herefordshire Council,http://opendatacommunities.org/id/unitary-authority/herefordshire,,2016-03-01,full planning permission,,permissioned,"92 - 94 Widemarsh Street, Hereford, HR4 9HG",160076,https://www.herefordshire.gov.uk/info/200142/planning_services/planning_application_search/details?id=160076,,,
,,,-2.688839,52.056384,,0,2020-01-07,,,,Proposed erection of a dwelling house and detached garage. (For DOC~conditions 6 12 13 15 & 17 see 170844),Herefordshire Council,http://opendatacommunities.org/id/unitary-authority/herefordshire,,2016-05-18,full planning permission,,permissioned,"Land at 82-84, Church Road, Hereford, HR1 1RS",160322,https://www.herefordshire.gov.uk/info/200142/planning_services/planning_application_search/details?id=160322,,,
,,,-2.709563,52.057259,,0,2020-01-07,,,,Proposed conversion of house into 2 nos. one bedroom flats.,Herefordshire Council,http://opendatacommunities.org/id/unitary-authority/herefordshire,,2016-05-10,full planning permission,,permissioned,"12 Kyrle Street, Hereford, HR1 2ET",160687,https://www.herefordshire.gov.uk/info/200142/planning_services/planning_application_search/details?id=160687,,,
,,,-2.70394,52.05768,,0,2020-01-07,,,,Erection of single storey detached unit for 4 single persons for~supported living.,Herefordshire Council,http://opendatacommunities.org/id/unitary-authority/herefordshire,,2016-09-12,full planning permission,,permissioned,"Lyndale Care Home, 24 Southbank Close, Hereford, Herefordshire, HR1 2TQ",161205,https://www.herefordshire.gov.uk/info/200142/planning_services/planning_application_search/details?id=161205,,,
