Deliverable,EndDate,FirstAddedDate,GeoX,GeoY,HazardousSubstances,Hectares,LastUpdatedDate,MinNetDwellings,NetDwellingsRangeFrom,NetDwellingsRangeTo,Notes,OrganisationLabel,OrganisationURI,OwnershipStatus,PermissionDate,PermissionType,PlanningHistory,PlanningStatus,SiteNameAddress,SiteReference,SiteplanURL,entity,point,brownfield-land
,,,-2.715771,52.064217,,0.07,2020-01-07,,,,"Proposed demolition of outbuilding, 3 No. 3 bedroom houses and 1~bedroom bungalow. (For DOC 3,5,6,7,8,9,10,11,12,13,15,16 & 17 see~192161)",Herefordshire Council,http://opendatacommunities.org/id/unitary-authority/herefordshire,,2016-10-21,full planning permission,,permissioned,"Land at 40 Newtown Road, Hereford, HR4 9LL",161356,https://www.herefordshire.gov.uk/info/200142/planning_services/planning_application_search/details?id=161356,,,
,,,-2.737903,52.050279,,0.26,2020-01-07,,,,Proposed new detached dwelling and garage.,Herefordshire Council,http://opendatacommunities.org/id/unitary-authority/herefordshire,,2016-07-08,full planning permission,,permissioned,"Plot adjacent to 83 Broomy Hill, Hereford",161414,https://www.herefordshire.gov.uk/info/200142/planning_services/planning_application_search/details?id=161414,,,
,,,-2.717547,52.043051,,0,2020-01-07,,,,"Demolition of part of building, conversion of shop and flat to 2 nos.~houses and erection of 2 nos. two bedroom houses and associated~parking.",Herefordshire Council,http://opendatacommunities.org/id/unitary-authority/herefordshire,,2016-12-05,full planning permission,,permissioned,"Land at 36 Holme Lacy Road, Hereford, HR2 6BY",163176,https://www.herefordshire.gov.uk/info/200142/planning_services/planning_application_search/details?id=163176,,,
,,,-2.718901,52.056564,,0.01,2020-01-07,,,,Proposed change of use of first floor to form two bedroom flat.,Herefordshire Council,http://opendatacommunities.org/id/unitary-authority/herefordshire,,2016-12-13,full planning permission,,permissioned,"Second Floor Flat, 24 Eign Gate, Hereford, HR4 0AB",163301,https://www.herefordshire.gov.uk/info/200142/planning_services/planning_application_search/details?id=163301,,,
,,,-2.720737,52.059188,,0,2020-01-07,,,,"Proposal to convert the public house into a pair of two-bedroomed~semi-detached houses and erection of a pair of semi-detached two~bedroomed houses within yard area, four parking spaces and accessed~from Richmond Street.",Herefordshire Council,http://opendatacommunities.org/id/unitary-authority/herefordshire,,2017-02-21,full planning permission,,permissioned,"The Moorfield Inn, Moorfield Street, Hereford",163501,https://www.herefordshire.gov.uk/info/200142/planning_services/planning_application_search/details?id=163501,,,
,,,-2.727002,52.057863,,0.03,2020-01-07,,,,Change of use from former audio shop to residential and division to~create additional dwelling.,Herefordshire Council,http://opendatacommunities.org/id/unitary-authority/herefordshire,,2017-01-05,full planning permission,,permissioned,"37 Whitecross Road, Hereford, HR4 0DE",163555,https://www.herefordshire.gov.uk/info/200142/planning_services/planning_application_search/details?id=163555,,,
,,,-2.721221,52.056649,,0,2020-01-07,,,,Proposed conversion of two ground floor retail units into two studio~flats (re-submission ref 160552).,Herefordshire Council,http://opendatacommunities.org/id/unitary-authority/herefordshire,,2017-03-01,full planning permission,,permissioned,"129-131 Eign Street, Hereford, Herefordshire",163719,https://www.herefordshire.gov.uk/info/200142/planning_services/planning_application_search/details?id=163719,,,
,,,-2.718212,52.056317,,0.01,2020-01-07,,,,"Proposed conversion of first, second and third floors from retail~space to 3 residential apartments.",Herefordshire Council,http://opendatacommunities.org/id/unitary-authority/herefordshire,,2017-02-16,full planning permission,,permissioned,"Flats at 15 - 17 Eign Gate, Hereford, HR4 0AB",163751,https://www.herefordshire.gov.uk/info/200142/planning_services/planning_application_search/details?id=163751,,,
,,,-2.713619,52.057334,,0.03,2020-01-07,,,,"Proposed change of use of first and second floors from retail into 7~residential apartments. Modification of shop front, removal of part~of first floor to facilitate a roof terrace area and removal of~brickwork infill to blind windows to the rear and insertion of new~matching windows.",Herefordshire Council,http://opendatacommunities.org/id/unitary-authority/herefordshire,,2017-02-13,full planning permission,,permissioned,"18 - 20 Commercial Street, Hereford, HR1 2DE",164042,https://www.herefordshire.gov.uk/info/200142/planning_services/planning_application_search/details?id=164042,,,
,,,-2.718576,52.053572,,0.01,2020-01-07,,,,Proposed conversion of existing retail shop into a single residential~unit including replacement of the existing shop frontage with new~powder colour coated aluminium frontage.,Herefordshire Council,http://opendatacommunities.org/id/unitary-authority/herefordshire,,2017-02-20,full planning permission,,permissioned,"12A Bridge Street, Hereford, HR4 9DF",164105,https://www.herefordshire.gov.uk/info/200142/planning_services/planning_application_search/details?id=164105,,,
,,,-2.73421,52.058916,,0,2020-01-07,,,,Reference 150247/F (Proposed change of use from Public House to 3 no~separate houses - domestic)- Change door and window material from wood~to UPVC double glazed (variation to conditions 2 & 3).,Herefordshire Council,http://opendatacommunities.org/id/unitary-authority/herefordshire,,2017-02-09,full planning permission,,permissioned,"The Cotterell Arms, 65 - 67 Cotterell Street, Hereford",164135,https://www.herefordshire.gov.uk/info/200142/planning_services/planning_application_search/details?id=164135,,,
,,,-2.731452,52.052603,,0.2,2020-01-07,,,,Conversion of the coach house to form a new dwelling with greenhouse~and outbuildings replaced by an extension to the coach house. Part of~the existing garden to be separated to form a separate curtilage. A~new gated opening to Prince Edward Drive for access. (For DOC 3 5 6 7~9 10 11 12 & 13 see 171695),Herefordshire Council,http://opendatacommunities.org/id/unitary-authority/herefordshire,,2017-03-21,full planning permission,,permissioned,"52 Broomy Hill, Hereford, HR4 0LH",164111,https://www.herefordshire.gov.uk/info/200142/planning_services/planning_application_search/details?id=164111,,,
,,,-2.749315,52.065572,,0,2020-01-07,,,,"Proposed erection of 2 chalet bungalows with garages, after outline~consent (141740).",Herefordshire Council,http://opendatacommunities.org/id/unitary-authority/herefordshire,,2017-03-24,full planning permission,,permissioned,"Land at 98 Kings Acre Road, Hereford, HR4 0RG",170350,https://www.herefordshire.gov.uk/info/200142/planning_services/planning_application_search/details?id=170350,,,
,,,-2.580827,51.913653,,0,2020-01-07,,,,Change of use of first floor from restaurant to residential.~Alteration of entrance doorway.,Herefordshire Council,http://opendatacommunities.org/id/unitary-authority/herefordshire,,2013-06-17,full planning permission,,permissioned,"First floor, 27 Gloucester Road, Ross-on- Wye, Herefordshire, HR9 5LE",130784,https://www.herefordshire.gov.uk/info/200142/planning_services/planning_application_search/details?id=130784,,,
,,,-2.585289,51.914629,,0.1,2020-01-07,,,,"Alterations, extension and conversion of existing building to provide~nine apartments with ancillary uses and works.",Herefordshire Council,http://opendatacommunities.org/id/unitary-authority/herefordshire,,2013-09-17,full planning permission,,permissioned,"Land rear of The Kings Head, High Street, Ross-on-Wye, Herefordshire",131206,https://www.herefordshire.gov.uk/info/200142/planning_services/planning_application_search/details?id=131206,,,
,,,-2.582546,51.915047,,0,2020-01-07,,,,Propose to demolish two store building (offices) and construct new two~storey building to form 2 no. one bedroom flats (residential).,Herefordshire Council,http://opendatacommunities.org/id/unitary-authority/herefordshire,,2015-06-30,full planning permission,,permissioned,"46 Broad Street, Ross-on-Wye, Herefordshire, HR9 7DY",150055,https://www.herefordshire.gov.uk/info/200142/planning_services/planning_application_search/details?id=150055,,,
,,,-2.583123,51.913524,,0.14,2020-01-07,,,,,Herefordshire Council,http://opendatacommunities.org/id/unitary-authority/herefordshire,,2015-10-01,full planning permission,,permissioned,"Rosswyn Hotel, 16-19 High Street, Ross-On-Wye, Herefordshire, HR9 5BZ",150234,https://www.herefordshire.gov.uk/info/200142/planning_services/planning_application_search/details?id=150234,,,
,,,-2.585651,51.916812,,0,2020-01-07,,,,Proposed new dwelling,Herefordshire Council,http://opendatacommunities.org/id/unitary-authority/herefordshire,,2015-09-25,full planning permission,,permissioned,"Site adjacent to Thrushes Nest, Rope Walk, Ross-On-Wye, Herefordshire, HR9 7BU",152308,https://www.herefordshire.gov.uk/info/200142/planning_services/planning_application_search/details?id=152308,,,
,,,-2.56442,51.913022,,0.58,2020-01-07,,,,Proposed erection of 6 dwellings. (For DOC 4 11 12 17~18 and part discharge of Condition 20 see 191843),Herefordshire Council,http://opendatacommunities.org/id/unitary-authority/herefordshire,,2016-05-26,full planning permission,,permissioned,"Land adjacent to Chase View Veterinary Clinic, Hildersley, Ross on Wye, Herefordshire, HR9 7NJ",153001,https://www.herefordshire.gov.uk/info/200142/planning_services/planning_application_search/details?id=153001,,,
,,,-2.58441,51.914165,,0,2020-01-07,,,,Proposed creation of two flats on the second floor third floor~including external and internal repairs.,Herefordshire Council,http://opendatacommunities.org/id/unitary-authority/herefordshire,,2016-02-22,full planning permission,,permissioned,"39 High Street, Ross-on-Wye, Herefordshire, HR9 5HD",153155,https://www.herefordshire.gov.uk/info/200142/planning_services/planning_application_search/details?id=153155,,,
,,,-2.582155,51.913988,,0,2020-01-07,,,,Proposed change of use of upper and lower basements to a single~dwelling,Herefordshire Council,http://opendatacommunities.org/id/unitary-authority/herefordshire,,2016-02-12,full planning permission,,permissioned,"12 Gloucester Road, Ross-On-Wye, Herefordshire, HR9 5BU",153797,https://www.herefordshire.gov.uk/info/200142/planning_services/planning_application_search/details?id=153797,,,
,,,-2.574951,51.912288,,0,2020-01-07,,,,"Proposed new dwelling (For DOC 1, 3-9 inclusive see 180896)",Herefordshire Council,http://opendatacommunities.org/id/unitary-authority/herefordshire,,2016-07-05,full planning permission,,permissioned,"Land at Twigworth, Camp Road, Ross-on-Wye, Herefordshire, HR9 5NJ",161429,https://www.herefordshire.gov.uk/info/200142/planning_services/planning_application_search/details?id=161429,,,
,,,-2.585433,51.914511,,0,2020-01-07,,,,Proposed change of use from 1st and 2nd floor offices to 2 no flats.,Herefordshire Council,http://opendatacommunities.org/id/unitary-authority/herefordshire,,2016-09-06,full planning permission,,permissioned,"5-6 High Street, Ross-on-Wye, Herefordshire, HR9 5HL",161967,https://www.herefordshire.gov.uk/info/200142/planning_services/planning_application_search/details?id=161967,,,
,,,-2.581754,51.916768,,0.01,2020-01-07,,,,Conversion of existing offices into a Flat,Herefordshire Council,http://opendatacommunities.org/id/unitary-authority/herefordshire,,2016-10-17,full planning permission,,permissioned,"12 Brookend Street, Ross-On-Wye, Herefordshire",162035,https://www.herefordshire.gov.uk/info/200142/planning_services/planning_application_search/details?id=162035,,,
,,,-2.72685,52.158048,,0.01,2020-01-07,,,,Convert outbuildings to holiday let.,Herefordshire Council,http://opendatacommunities.org/id/unitary-authority/herefordshire,,2016-06-14,full planning permission,,permissioned,"Outbuildings at Laurel Cottage, Hope under Dinmore, Leominster, Herefordshire, HR6 0PX",160948,https://www.herefordshire.gov.uk/info/200142/planning_services/planning_application_search/details?id=160948,,,
,,,-2.789156,52.073125,,1.21,2020-01-07,,,,,Herefordshire Council,http://opendatacommunities.org/id/unitary-authority/herefordshire,,2016-12-05,outline planning permission,,permissioned,"T J Crump Oakwrights Ltd, The Lakes, Swainshill, Herefordshire, HR4 7PU",150173,https://www.herefordshire.gov.uk/info/200142/planning_services/planning_application_search/details?id=150173,,,
,,,-2.781537,52.077932,,0,2020-01-07,,,,"Reserved matters (3, 6, 7, 8, 10, 11 & 13) for Outline planning~permission 141240 (Proposed erection of 5 terraced houses and~formation of parking)",Herefordshire Council,http://opendatacommunities.org/id/unitary-authority/herefordshire,,2016-01-07,reserved matters approval,,permissioned,"Travellers Rest Inn, Stretton Sugwas, Hereford, Herefordshire, HR4 7AL",152524,https://www.herefordshire.gov.uk/info/200142/planning_services/planning_application_search/details?id=152524,,,
,,,-2.74261,52.12917,,0,2020-01-07,,,,Change of use of the ground floor and car parking area at front of the~property from commercial to domestic use. Proposed detached double~garage. (For DOC 3 see 171032),Herefordshire Council,http://opendatacommunities.org/id/unitary-authority/herefordshire,,2016-08-05,full planning permission,,permissioned,"Khotla, Wellington, Hereford, Herefordshire, HR4 8AT",161262,https://www.herefordshire.gov.uk/info/200142/planning_services/planning_application_search/details?id=161262,,,
