Deliverable,EndDate,FirstAddedDate,GeoX,GeoY,HazardousSubstances,Hectares,LastUpdatedDate,MinNetDwellings,NetDwellingsRangeFrom,NetDwellingsRangeTo,Notes,OrganisationLabel,OrganisationURI,OwnershipStatus,PermissionDate,PermissionType,PlanningHistory,PlanningStatus,SiteNameAddress,SiteReference,SiteplanURL,entity,point,brownfield-land
,,,-2.975626,52.167023,,0.08,2020-01-07,,,,Proposed conversion of a redundant chapel into a dwelling house.,Herefordshire Council,http://opendatacommunities.org/id/unitary-authority/herefordshire,,2010-06-25,full planning permission,,permissioned,"Former Methodist Chapel, Almley, Woonton, Herefordshire, HR3 6PY",101020,https://www.herefordshire.gov.uk/info/200142/planning_services/planning_application_search/details?id=101020,,,
,,,-2.876817,52.269537,,0,2020-01-07,,,,"Proposed erection of an agricultural workers dwelling for the poultry~site at Uphampton Farm. (For DOC 3, 6, 8, 9 & 10 see 171072).",Herefordshire Council,http://opendatacommunities.org/id/unitary-authority/herefordshire,,2016-10-26,full planning permission,,permissioned,"Uphampton Farm, Belgate Lane, Uphampton Shobdon, Leominster, Herefordshire, HR6 9PA",162384,https://www.herefordshire.gov.uk/info/200142/planning_services/planning_application_search/details?id=162384,,,
,,,-2.800951,52.15737,,0,2020-01-07,,,,One proposed dwelling with garage and other associated works.,Herefordshire Council,http://opendatacommunities.org/id/unitary-authority/herefordshire,,2016-05-24,full planning permission,,permissioned,"Land at Bush House, Bush Bank, Herefordshire, HR4 8PQ",161067,https://www.herefordshire.gov.uk/info/200142/planning_services/planning_application_search/details?id=161067,,,
,,,-2.691581,52.158296,,0,2020-01-07,,,,Proposed demolition of former school building and erection of two~detached dwellings with associated detached garages.,Herefordshire Council,http://opendatacommunities.org/id/unitary-authority/herefordshire,,2015-06-08,full planning permission,,permissioned,"Land at The Walled Garden, Bodenham Manor, Bodenham, Hereford, Herefordshire, HR1 3JS",151090,https://www.herefordshire.gov.uk/info/200142/planning_services/planning_application_search/details?id=151090,,,
,,,-2.667887,52.153532,,0,2020-01-07,,,,Proposed reserved matters following outline approval 152415 (Proposed~site for 2 dwellings).,Herefordshire Council,http://opendatacommunities.org/id/unitary-authority/herefordshire,,2016-10-17,reserved matters approval,,permissioned,"Land at Wynmoor, Bodenham, Hereford, Herefordshire",162438,https://www.herefordshire.gov.uk/info/200142/planning_services/planning_application_search/details?id=162438,,,
,,,-2.691581,52.158296,,0.34,2020-01-07,,,,Demolition of former school buildings and erection of three detached~dwellings. (For DOC 3 4 6 7 see 173019),Herefordshire Council,http://opendatacommunities.org/id/unitary-authority/herefordshire,,2016-11-04,full planning permission,,permissioned,"Bodenham Manor, Bodenham, Hereford, Herefordshire",162506,https://www.herefordshire.gov.uk/info/200142/planning_services/planning_application_search/details?id=162506,,,
,,,-2.682065,52.1564,,0.44,2020-01-07,,,,Proposed conversion of redundant stables to form holiday accommodation,Herefordshire Council,http://opendatacommunities.org/id/unitary-authority/herefordshire,,2017-02-22,full planning permission,,permissioned,"The Forge, Bodenham, Herefordshire",162618,https://www.herefordshire.gov.uk/info/200142/planning_services/planning_application_search/details?id=162618,,,
,,,-2.472509,52.073256,,0.01,2020-01-07,,,,Change of use of property to a one bedroom Bed & Breakfast/self~catering accommodation.,Herefordshire Council,http://opendatacommunities.org/id/unitary-authority/herefordshire,,2017-03-01,full planning permission,,permissioned,"The Annexe, The Croft, Swinmore, Munsley, Herefordshire",164128,https://www.herefordshire.gov.uk/info/200142/planning_services/planning_application_search/details?id=164128,,,
,,,-2.611464,51.93219,,0,2020-01-07,,,,Proposed conversion of redundant garage and store to dwelling.,Herefordshire Council,http://opendatacommunities.org/id/unitary-authority/herefordshire,,2016-01-15,full planning permission,,permissioned,"Land at Ash Ingen Place, Bridstow, Ross-on-Wye, Herefordshire",152897,https://www.herefordshire.gov.uk/info/200142/planning_services/planning_application_search/details?id=152897,,,
,,,-2.599512,51.914962,,0.23,2020-01-07,,,,"Proposed erection of 4 no. new 4 bedroom dwellings, turning and~manoeuvring.",Herefordshire Council,http://opendatacommunities.org/id/unitary-authority/herefordshire,,2016-03-07,outline planning permission,,permissioned,"Orles Barn Hotel, Old Nursery Close, Ross-on-Wye, Herefordshire, HR9 6AE",153594,https://www.herefordshire.gov.uk/info/200142/planning_services/planning_application_search/details?id=153594,,,
,,,-2.677149,52.306165,,0,2020-01-07,,,,"Conversion of existing office and storage space to create staff living~accommodation, storage and office.",Herefordshire Council,http://opendatacommunities.org/id/unitary-authority/herefordshire,,2016-04-26,full planning permission,,permissioned,"Site at The Beech, Haynall Lane, Little Hereford, herefordshire",160361,https://www.herefordshire.gov.uk/info/200142/planning_services/planning_application_search/details?id=160361,,,
,,,-2.511565,52.187921,,0,2020-01-07,,,,Outline application for two dwellings,Herefordshire Council,http://opendatacommunities.org/id/unitary-authority/herefordshire,,2017-03-31,outline planning permission,,permissioned,"52 New Road, Bromyard, Herefordshire",161877,https://www.herefordshire.gov.uk/info/200142/planning_services/planning_application_search/details?id=161877,,,
,,,-2.504648,52.190621,,0.09,2020-01-07,,,,Conversion of former Grammar school building into five residential~dwellings. Demolition works include the removal of part of an~extension to the west elevation (For DOC 5 see 193830).,Herefordshire Council,http://opendatacommunities.org/id/unitary-authority/herefordshire,,2016-12-21,full planning permission,,permissioned,"Site at Old Grammar School, Church Street, Bromyard, Herefordshire, HR7 4DP",162480,https://www.herefordshire.gov.uk/info/200142/planning_services/planning_application_search/details?id=162480,,,
,,,-2.50743,52.189602,,0.05,2020-01-07,,,,Change of use of first and second floors to create three flats and~associated minor alterations to the listed building.,Herefordshire Council,http://opendatacommunities.org/id/unitary-authority/herefordshire,,2016-11-07,full planning permission,,permissioned,"Flats at 38 High Street, Bromyard, Herefordshire, HR7 4AE",162820,https://www.herefordshire.gov.uk/info/200142/planning_services/planning_application_search/details?id=162820,,,
,,,-2.779302,52.098761,,0,2020-01-07,,,,Proposed change of use of agricultural office building to residential~dwelling (C3 use) (For DOC 5 7 & 9 174386),Herefordshire Council,http://opendatacommunities.org/id/unitary-authority/herefordshire,,2016-11-03,full planning permission,,permissioned,"Tillington Fruit Farm, Tillington, Hereford, Herefordshire, HR4 8LD",153810,https://www.herefordshire.gov.uk/info/200142/planning_services/planning_application_search/details?id=153810,,,
,,,-2.779809,52.099351,,0,2020-01-07,,,,Proposed change of use of Coach House to residential dwelling (Class~C3) including associated conversion works and demolition of~outbuilding. (For DOC 6 & 7 see 193032),Herefordshire Council,http://opendatacommunities.org/id/unitary-authority/herefordshire,,2016-11-03,full planning permission,,permissioned,"Coach House at Fruit Farm Tillington Estate, Crowmoor Lane, Tillington, Herefordshire, HR4 8LD",160600,https://www.herefordshire.gov.uk/info/200142/planning_services/planning_application_search/details?id=160600,,,
,,,-2.779302,52.098761,,0,2020-01-07,,,,Application for approval of details reserved by conditions 5 7 & 9~attached to planning permission 153810,Herefordshire Council,http://opendatacommunities.org/id/unitary-authority/herefordshire,,2018-02-14,,,permissioned,"Tillington Fruit Farm, Tillington, Hereford, Herefordshire, HR4 8LD",174386,https://www.herefordshire.gov.uk/info/200142/planning_services/planning_application_search/details?id=174386,,,
,,,-2.775776,52.155506,,0,2020-01-07,,,,Conversion of outbuilding to a two bedroom living accommodation.(For~DOC 3 & 4 see 183295),Herefordshire Council,http://opendatacommunities.org/id/unitary-authority/herefordshire,,2017-02-09,full planning permission,,permissioned,"Stables at The Backwoods, Westhope, Hereford, Herefordshire, HR4 8BU",160340,https://www.herefordshire.gov.uk/info/200142/planning_services/planning_application_search/details?id=160340,,,
,,,-2.785271,52.154302,,0.39,2020-01-07,,,,Demolition of outbuildings and erection of four dwellings. (For DOC~16 see 170695),Herefordshire Council,http://opendatacommunities.org/id/unitary-authority/herefordshire,,2016-10-28,outline planning permission,,permissioned,"Site adjacent to Summerlease, Westhope Hill, Westhope, Herefordshire",162311,https://www.herefordshire.gov.uk/info/200142/planning_services/planning_application_search/details?id=162311,,,
,,,-3.079274,52.10108,,0,2020-01-07,,,,Erection of dwelling on site of part built commercial buidling,Herefordshire Council,http://opendatacommunities.org/id/unitary-authority/herefordshire,,2015-10-20,full planning permission,,permissioned,"Part OS 1330, The Garlands, Priory Wood, Clifford, Herefordshire",142860,https://www.herefordshire.gov.uk/info/200142/planning_services/planning_application_search/details?id=142860,,,
,,,-3.100722,52.105853,,0,2020-01-07,,,,Demolition of existing shed and construction of 1 no. dwelling and~replacement garage/store,Herefordshire Council,http://opendatacommunities.org/id/unitary-authority/herefordshire,,2016-04-04,full planning permission,,permissioned,"Site adjacent to Oakdene, Clifford, Whitney on Wye, Herefordshire",160200,https://www.herefordshire.gov.uk/info/200142/planning_services/planning_application_search/details?id=160200,,,
,,,-3.079187,52.101081,,0,2020-01-07,,,,Proposed variation of condition 2 of planning permission 142860~(Erection of dwelling on site of part built commercial building)~amendment to approved drawing to assist with building regulations~compliance.,Herefordshire Council,http://opendatacommunities.org/id/unitary-authority/herefordshire,,2017-03-17,full planning permission,,permissioned,"Land at The Garlands, Priory Wood, Clifford, Herefordshire",170353,https://www.herefordshire.gov.uk/info/200142/planning_services/planning_application_search/details?id=170353,,,
,,,-2.385894,52.124764,,0,2020-01-07,,,,Alterations and extension to create 2 no additional flats and~enlargement of domestic curtilage (by change of use) and erection of~carport with room above. (For DOC 5 8 & 9 see 170479).,Herefordshire Council,http://opendatacommunities.org/id/unitary-authority/herefordshire,,2017-02-03,full planning permission,,permissioned,"Flats at Queenswood, Cradley, Malvern, WR13 5NF",163936,https://www.herefordshire.gov.uk/info/200142/planning_services/planning_application_search/details?id=163936,,,
,,,-2.40062,52.119289,,0.32,2020-01-07,,,,Residential development of 4 dwellings,Herefordshire Council,http://opendatacommunities.org/id/unitary-authority/herefordshire,,2003-10-13,full planning permission,,permissioned,"Crown Inn, Cradley, Malvern, Herefordshire, WR13 5LS",30719,https://www.herefordshire.gov.uk/info/200142/planning_services/planning_application_search/details?id=30719,,,
,,,-2.402098,52.117149,,0,2020-01-07,,,,"Proposed removal of derelict sheds, animal pens and caravan and~construction of detached dwelling.",Herefordshire Council,http://opendatacommunities.org/id/unitary-authority/herefordshire,,2017-01-25,outline planning permission,,permissioned,"Land to the rear of Butterfields, Bosbury Road, Cradley, Worcestershire",161944,https://www.herefordshire.gov.uk/info/200142/planning_services/planning_application_search/details?id=161944,,,
,,,-2.60977,52.058142,,0,2020-01-07,,,,Proposed conversion of outbuilding into dwelling (For DOC 3 4 6 & 8~see 172018),Herefordshire Council,http://opendatacommunities.org/id/unitary-authority/herefordshire,,2017-01-23,full planning permission,,permissioned,"Woodavens, Dormington, Herefordshire, HR1 4ES",163491,https://www.herefordshire.gov.uk/info/200142/planning_services/planning_application_search/details?id=163491,,,
,,,-2.999323,52.068887,,0.14,2020-01-07,,,,Proposed erection of two houses,Herefordshire Council,http://opendatacommunities.org/id/unitary-authority/herefordshire,,2015-04-30,full planning permission,,permissioned,"Site adjacent to Cooper's Hall, Chapel Lane, Dorstone, Herefordshire",143678,https://www.herefordshire.gov.uk/info/200142/planning_services/planning_application_search/details?id=143678,,,
,,,-3.000354,52.068689,,0,2020-01-07,,,,Proposed two retirement cottages. (For DOC 4 6 9 11 12 and 15 see~171048),Herefordshire Council,http://opendatacommunities.org/id/unitary-authority/herefordshire,,2017-01-23,full planning permission,,permissioned,"Land adjacent to The Chapel, Chapel Lane, Dorstone, Herefordshire",163056,https://www.herefordshire.gov.uk/info/200142/planning_services/planning_application_search/details?id=163056,,,
,,,-2.915683,51.959661,,0,2020-01-07,,,,Proposed repair and conversion of existing church including partial~change of use to holiday let. New access and carparking.,Herefordshire Council,http://opendatacommunities.org/id/unitary-authority/herefordshire,,2017-03-13,full planning permission,,permissioned,"Church of St Michael and All Angels, Dulas, Herefordshire, HR2 0HL",164098,https://www.herefordshire.gov.uk/info/200142/planning_services/planning_application_search/details?id=164098,,,
,,,-3.005015,52.135893,,0.07,2020-01-07,,,,Proposed change of use of a doctors surgery into living accommodation~and proposed conservatory,Herefordshire Council,http://opendatacommunities.org/id/unitary-authority/herefordshire,,2015-01-29,full planning permission,,permissioned,"The Surgery, Eardisley, Hereford, Herefordshire, HR3 6NS",143624,https://www.herefordshire.gov.uk/info/200142/planning_services/planning_application_search/details?id=143624,,,
,,,-2.885936,51.944173,,0,2020-01-07,,,,Construction of three dwellings and alterations to the existing access,Herefordshire Council,http://opendatacommunities.org/id/unitary-authority/herefordshire,,2016-09-15,outline planning permission,,permissioned,"Land to the rear of the Laurels Veterinary Practice, Pontrilas Road, Ewyas Harold, Herefordshire, HR2 0EL",161674,https://www.herefordshire.gov.uk/info/200142/planning_services/planning_application_search/details?id=161674,,,
,,,-2.61481,52.006652,,0.22,2020-01-07,,,,Proposed new dwelling.,Herefordshire Council,http://opendatacommunities.org/id/unitary-authority/herefordshire,,2016-01-06,full planning permission,,permissioned,"New Inn, Fownhope, Hereford, HR1 4PE",152955,https://www.herefordshire.gov.uk/info/200142/planning_services/planning_application_search/details?id=152955,,,
,,,-2.56999,51.95332,,0.85,2020-01-07,,,,Proposed change of use and conversion of former activity barn to form~live/work unit,Herefordshire Council,http://opendatacommunities.org/id/unitary-authority/herefordshire,,2015-12-14,full planning permission,,permissioned,"Former Activity Barn, Hole-in-the-wall, Foy, Ross-on-Wye, Herefordshire",152359,https://www.herefordshire.gov.uk/info/200142/planning_services/planning_application_search/details?id=152359,,,
,,,-2.623759,51.875878,,0,2020-01-07,,,,"Demolition of former childcare facility. Proposed new dwelling and~detached double garage. (For DOC 3, 4, 5, 7, 8, 9, 10, 11, 12, 17, 18,~20, 21 & 24 see 173844)",Herefordshire Council,http://opendatacommunities.org/id/unitary-authority/herefordshire,,2017-03-16,full planning permission,,permissioned,"Land adjacent to Gas Works, Herefordshire",170132,https://www.herefordshire.gov.uk/info/200142/planning_services/planning_application_search/details?id=170132,,,
,,,-2.734982,52.029529,,0.01,2020-01-07,,,,Proposed demolition of existing administration building and erection~of a new chalet style bungalow.,Herefordshire Council,http://opendatacommunities.org/id/unitary-authority/herefordshire,,2016-01-20,full planning permission,,permissioned,"6a Graftonbury Mews, Grafton Lane, Hereford, Herefordshire, HR2 8BN",153500,https://www.herefordshire.gov.uk/info/200142/planning_services/planning_application_search/details?id=153500,,,
,,,-2.679436,52.060467,,0,2020-01-07,,,,Return former farmhouse to use as a dwellinghouse. Certification of~Class of Use as C3(a) is required for occupancy by a single person or~family. (For DOC 3 see 172338),Herefordshire Council,http://opendatacommunities.org/id/unitary-authority/herefordshire,,2017-02-14,full planning permission,,permissioned,"Lower House Farm, Netherwood Lane, Hereford, HR1 1UT",164079,https://www.herefordshire.gov.uk/info/200142/planning_services/planning_application_search/details?id=164079,,,
,,,-2.807456,52.238088,,0,2020-01-07,,,,2 proposed self build sustainable new dwellings with ancillary~outbuildings and landscaping (For DOC 2 5 7 8 11 & 12 see 170687) (For~DOC 3 & 4 see 181076) (For DOC 11 see 181375),Herefordshire Council,http://opendatacommunities.org/id/unitary-authority/herefordshire,,2016-10-05,full planning permission,,permissioned,"Cobnash House, Hostel Lane, Cobnash, Kingsland, Herefordshire",162033,https://www.herefordshire.gov.uk/info/200142/planning_services/planning_application_search/details?id=162033,,,
,,,-2.809413,52.248225,,0,2020-01-07,,,,Proposed new dwelling,Herefordshire Council,http://opendatacommunities.org/id/unitary-authority/herefordshire,,2016-12-21,full planning permission,,permissioned,"Land at The Garden House, Orchard Close, Kingsland, Leominster, Herefordshire, HR6 9QS",163290,https://www.herefordshire.gov.uk/info/200142/planning_services/planning_application_search/details?id=163290,,,
,,,-2.828486,52.008984,,0,2020-01-07,,,,Proposed change of use of outbuilding to a separate dwelling.,Herefordshire Council,http://opendatacommunities.org/id/unitary-authority/herefordshire,,2016-10-17,full planning permission,,permissioned,"Brookfield Lodge, Thruxton, Hereford, Herefordshire, HR2 9BB",162468,https://www.herefordshire.gov.uk/info/200142/planning_services/planning_application_search/details?id=162468,,,
,,,-3.028596,52.204298,,0,2020-01-07,,,,Proposed construction of 4 houses and garages.,Herefordshire Council,http://opendatacommunities.org/id/unitary-authority/herefordshire,,2012-05-16,full planning permission,,,"Land behind 43 Duke Street, Kington, Herefordshire, HR5 3BL",113545,https://www.herefordshire.gov.uk/info/200142/planning_services/planning_application_search/details?id=113545,,,
,,,-3.028783,52.195935,,0.23,2020-01-07,,,,"Proposed erection of new dwelling, annex and garage. (For DOC 5 & 6~see 173547)",Herefordshire Council,http://opendatacommunities.org/id/unitary-authority/herefordshire,,2014-06-20,full planning permission,,permissioned,"Kingswood Hall, Kingswood Road, Kington, Hereford, HR5 3HE",141330,https://www.herefordshire.gov.uk/info/200142/planning_services/planning_application_search/details?id=141330,,,
,,,-3.029182,52.204329,,0.06,2020-01-07,,,,Proposed dwelling.,Herefordshire Council,http://opendatacommunities.org/id/unitary-authority/herefordshire,,2016-06-10,full planning permission,,permissioned,"Land to the rear of Owls Rest, Lower Cross Lane, Kington, Herefordshire, HR5 3BG",161093,https://www.herefordshire.gov.uk/info/200142/planning_services/planning_application_search/details?id=161093,,,
,,,-3.031865,52.20391,,0,2020-01-07,,,,Change of use of old bakery to a one bed dwelling. A~covered bicycle store and garden and amenity area.,Herefordshire Council,http://opendatacommunities.org/id/unitary-authority/herefordshire,,2016-09-16,full planning permission,,permissioned,"Old Bakery, 12 Church Street, Kington, Herefordshire, HR5 3AZ",162420,https://www.herefordshire.gov.uk/info/200142/planning_services/planning_application_search/details?id=162420,,,
,,,-3.03241,52.185132,,0,2020-01-07,,,,Proposed staff accommodation facility to be built on the footprint of~an existing store building.,Herefordshire Council,http://opendatacommunities.org/id/unitary-authority/herefordshire,,2017-03-07,full planning permission,,permissioned,"The Oaklands, Kingswood, Kington, Herefordshire, HR5 3HF",163478,https://www.herefordshire.gov.uk/info/200142/planning_services/planning_application_search/details?id=163478,,,
,,,-2.967893,52.137426,,0,2020-01-07,,,,Proposed erection of one dwelling.,Herefordshire Council,http://opendatacommunities.org/id/unitary-authority/herefordshire,,2016-04-29,full planning permission,,permissioned,"Land at The Old Carpenters Shop, Kinnersley, Hereford, Herefordshire, HR3 6QB",160663,https://www.herefordshire.gov.uk/info/200142/planning_services/planning_application_search/details?id=160663,,,
,,,-2.650913,52.258313,,0,2020-01-07,,,,Change of use of redundant office/workshop to residential use,Herefordshire Council,http://opendatacommunities.org/id/unitary-authority/herefordshire,,2017-02-01,full planning permission,,permissioned,"The Sign Shop at Little Heath, Heath Road, Leysters, Herefordshire, HR6 0HT",163836,https://www.herefordshire.gov.uk/info/200142/planning_services/planning_application_search/details?id=163836,,,
,,,-2.421435,52.036687,,0,2020-01-07,,,,Proposed single dwelling.,Herefordshire Council,http://opendatacommunities.org/id/unitary-authority/herefordshire,,2015-06-19,full planning permission,,permissioned,"Tinsmiths, Rear of 8A High Street, Ledbury, Herefordshire, HR8 1DS",143537,https://www.herefordshire.gov.uk/info/200142/planning_services/planning_application_search/details?id=143537,,,
,,,-2.426943,52.036452,,0,2020-01-07,,,,Proposed change of use of redundant building into single dwelling.,Herefordshire Council,http://opendatacommunities.org/id/unitary-authority/herefordshire,,2015-06-23,full planning permission,,,"Land at 1 Bridge Street, Ledbury, Herefordshire, HR8 2AJ",151075,https://www.herefordshire.gov.uk/info/200142/planning_services/planning_application_search/details?id=151075,,,
,,,-2.422122,52.036883,,0.04,2020-01-07,,,,Proposed conversion of redundant upper floor accommodation into one~three bedroom self contained dwelling.,Herefordshire Council,http://opendatacommunities.org/id/unitary-authority/herefordshire,,2016-10-17,full planning permission,,permissioned,"4 High Street, Ledbury, Herefordshire, HR8 1DS",162063,https://www.herefordshire.gov.uk/info/200142/planning_services/planning_application_search/details?id=162063,,,
,,,-2.422444,52.035551,,0,2020-01-07,,,,Proposed flat conversion and formation of dormer at the rear.,Herefordshire Council,http://opendatacommunities.org/id/unitary-authority/herefordshire,,2017-02-14,full planning permission,,permissioned,"4 The Southend, Ledbury, Herefordshire, HR8 2EY",163055,https://www.herefordshire.gov.uk/info/200142/planning_services/planning_application_search/details?id=163055,,,
,,,-2.875131,52.363212,,0,2020-01-07,,,,"Proposed demolition of redundant outbuilding and garage. Construction~of new dwelling, garage and covered way.",Herefordshire Council,http://opendatacommunities.org/id/unitary-authority/herefordshire,,2015-05-27,full planning permission,,permissioned,"Land at rear of 48 Watling Street, Leintwardine, Craven Arms, Shropshire, SY 7 0LL",150996,https://www.herefordshire.gov.uk/info/200142/planning_services/planning_application_search/details?id=150996,,,
,,,-2.770761,52.224758,,1.39,2020-01-07,,,,,Herefordshire Council,http://opendatacommunities.org/id/unitary-authority/herefordshire,,2010-03-22,reserved matters approval,,permissioned,"Barons Cross Camp, Cholstrey Road, Leominster, HR6 8RT",100122,https://www.herefordshire.gov.uk/info/200142/planning_services/planning_application_search/details?id=100122,,,
,,,-2.760838,52.224058,,0,2020-01-07,,,,Proposed construction of 4 no. self-contained flats (For DOC 4 9 10 &~11 see 171850),Herefordshire Council,http://opendatacommunities.org/id/unitary-authority/herefordshire,,2014-11-26,full planning permission,,permissioned,"Land off Ebnal Close, Leominster, Herefordshire",141006,https://www.herefordshire.gov.uk/info/200142/planning_services/planning_application_search/details?id=141006,,,
,,,-2.732116,52.227692,,0.45,2020-01-07,,,,,Herefordshire Council,http://opendatacommunities.org/id/unitary-authority/herefordshire,,2016-05-13,full planning permission,,permissioned,"Land at, Pinsley Road, Leominster, Herefordshire, HR6 8NN",141022,https://www.herefordshire.gov.uk/info/200142/planning_services/planning_application_search/details?id=141022,,,
,,,-2.743133,52.233368,,0,2020-01-07,,,,Proposed 2 storey dwelling.,Herefordshire Council,http://opendatacommunities.org/id/unitary-authority/herefordshire,,2016-06-22,full planning permission,,permissioned,"Land adjacent 87 Bridge Street, Leominster, Herefordshire, HR6 8EA",160226,https://www.herefordshire.gov.uk/info/200142/planning_services/planning_application_search/details?id=160226,,,
,,,-2.739312,52.227225,,0.04,2020-01-07,,,,Proposed change of use from office accommodation to 3 no. flats,Herefordshire Council,http://opendatacommunities.org/id/unitary-authority/herefordshire,,2016-08-23,full planning permission,,permissioned,"26 High Street, Morris Mews, Leominster",161456,https://www.herefordshire.gov.uk/info/200142/planning_services/planning_application_search/details?id=161456,,,
