Deliverable,EndDate,FirstAddedDate,GeoX,GeoY,HazardousSubstances,Hectares,LastUpdatedDate,MinNetDwellings,NetDwellingsRangeFrom,NetDwellingsRangeTo,Notes,OrganisationLabel,OrganisationURI,OwnershipStatus,PermissionDate,PermissionType,PlanningHistory,PlanningStatus,point,SiteNameAddress,SiteplanURL,SiteReference
yes,,2017-12-13,-1.299998,53.017205,,0.24,2017-12-13,16,16,16,"Construct 16 dwellings, access road and associated landscaping including demolition of the Victory club",Broxtowe,http://opendatacommunities.org/id/district-council/broxtowe,not owned by a public authority,2017-03-28,full planning permission,,permissioned,,Eastwood & District Victory Club Walker Street Eastwood,http://www.arcgis.com/apps/webappviewer/index.html?id=08f516e5e14b48cfa555e52edb7e58f6&query=External_Layes_3711%2CSITEREFERENCE%2CSHLAA%2F00628%2FAVA#http://www.arcgis.com/apps/webappviewer/index.html?id=08f516e5e14b48cfa555e52edb7e58f6&query=External_Layes_3711%2CSITEREFERENCE%2CSHLAA%2F00628%2FAVA,SHLAA/00628/AVA
yes,,2017-12-13,-1.307039,53.0076,,3.57,2017-12-13,150,150,150,"Outline application to construct 150 dwellings, the formation of a primary access to the site, infrastructure, open space provision, land remediation, gas vent trench and surface water attenuation with some matters reserved",Broxtowe,http://opendatacommunities.org/id/district-council/broxtowe,not owned by a public authority,2015-05-21,outline planning permission,,permissioned,,Beamlight Newmanleys Road Eastwood,http://www.arcgis.com/apps/webappviewer/index.html?id=08f516e5e14b48cfa555e52edb7e58f6&query=External_Layes_3711%2CSITEREFERENCE%2CSHLAA%2F00521%2FAVA#http://www.arcgis.com/apps/webappviewer/index.html?id=08f516e5e14b48cfa555e52edb7e58f6&query=External_Layes_3711%2CSITEREFERENCE%2CSHLAA%2F00521%2FAVA,SHLAA/00521/AVA
yes,,2017-12-13,-1.244778,52.997028,,0.07,2017-12-13,6,6,6,Change use of public house (Class A4) to dwelling house (Class C3) to include six flats and erect two storey rear/side extension (revised scheme),Broxtowe,http://opendatacommunities.org/id/district-council/broxtowe,not owned by a public authority,2016-01-06,full planning permission,,permissioned,,The Larks Nest Larkfield Road Nuthall,http://www.arcgis.com/apps/webappviewer/index.html?id=08f516e5e14b48cfa555e52edb7e58f6&query=External_Layes_3711%2CSITEREFERENCE%2CSHLAA%2F00690%2FAVA#http://www.arcgis.com/apps/webappviewer/index.html?id=08f516e5e14b48cfa555e52edb7e58f6&query=External_Layes_3711%2CSITEREFERENCE%2CSHLAA%2F00690%2FAVA,SHLAA/00690/AVA
yes,,2017-12-13,-1.261152,52.999728,,4.44,2017-12-13,128,128,128,"See planning history for more details as numerous subsequent permission for different aspects of the site.. Hybrid application comprising: Outline application for the construction of 78 dwellings, including details of access and scale, all other matters reserved. Full application for change of use of Maltings No. 1 to 18 apartments and the tower to 2 apartments and the construction of a 3-storey building to comprise 24 new apartments",Broxtowe,http://opendatacommunities.org/id/district-council/broxtowe,not owned by a public authority,2015-12-21,other,,permissioned,,Hardy And Hansons Plc Kimberley Brewery Hardy Street Kimberley,http://www.arcgis.com/apps/webappviewer/index.html?id=08f516e5e14b48cfa555e52edb7e58f6&query=External_Layes_3711%2CSITEREFERENCE%2CSHLAA%2F00586%2FAVA#http://www.arcgis.com/apps/webappviewer/index.html?id=08f516e5e14b48cfa555e52edb7e58f6&query=External_Layes_3711%2CSITEREFERENCE%2CSHLAA%2F00586%2FAVA,SHLAA/00586/AVA
yes,,2017-12-13,-1.217945,52.929272,,0.03,2017-12-13,10,10,10,Construct 10 apartments,Broxtowe,http://opendatacommunities.org/id/district-council/broxtowe,not owned by a public authority,2015-08-28,full planning permission,,permissioned,,Car Park On Corner Of The Poplars Wollaton Road Beeston,http://www.arcgis.com/apps/webappviewer/index.html?id=08f516e5e14b48cfa555e52edb7e58f6&query=External_Layes_3711%2CSITEREFERENCE%2CSHLAA%2F00761%2FAVA#http://www.arcgis.com/apps/webappviewer/index.html?id=08f516e5e14b48cfa555e52edb7e58f6&query=External_Layes_3711%2CSITEREFERENCE%2CSHLAA%2F00761%2FAVA,SHLAA/00761/AVA
yes,,2017-12-13,-1.221745,52.922294,,0.09,2017-12-13,9,9,9,"Outline application to demolish existing buildings and construct 9 N° one and two bed apartments, in one, two and three storey blocks with 7 N° parking spaces and communal gardens with all matters reserved except layout",Broxtowe,http://opendatacommunities.org/id/district-council/broxtowe,not owned by a public authority,2015-01-14,outline planning permission,,permissioned,,22 High Road Chilwell,http://www.arcgis.com/apps/webappviewer/index.html?id=08f516e5e14b48cfa555e52edb7e58f6&query=External_Layes_3711%2CSITEREFERENCE%2CSHLAA%2F00634%2FAVA#http://www.arcgis.com/apps/webappviewer/index.html?id=08f516e5e14b48cfa555e52edb7e58f6&query=External_Layes_3711%2CSITEREFERENCE%2CSHLAA%2F00634%2FAVA,SHLAA/00634/AVA
yes,,2017-12-13,-1.271267,52.931687,,1.09,2017-12-13,10,10,10,"Hybrid planning application comprising: Full Application to construct shop (Class A1) including solar panels and with associated car parking, access and landscaping on a 0.78 ha site:. Hybrid planning application comprising: Outline Application to construct dwellings (Class C3) on 0.29 ha, with all matters reserved apart from the access.",Broxtowe,http://opendatacommunities.org/id/district-council/broxtowe,not owned by a public authority,2016-02-26,outline planning permission,,permissioned,,Units 12-15 Pinfold Trading Estate Nottingham Road Stapleford,http://www.arcgis.com/apps/webappviewer/index.html?id=08f516e5e14b48cfa555e52edb7e58f6&query=External_Layes_3711%2CSITEREFERENCE%2CSHLAA%2F00051%2FAVA#http://www.arcgis.com/apps/webappviewer/index.html?id=08f516e5e14b48cfa555e52edb7e58f6&query=External_Layes_3711%2CSITEREFERENCE%2CSHLAA%2F00051%2FAVA,SHLAA/00051/AVA
yes,,2017-12-13,-1.269082,52.93153,,0.32,2017-12-13,15,15,15,Construct 15 N° dwellings,Broxtowe,http://opendatacommunities.org/id/district-council/broxtowe,not owned by a public authority,2015-03-03,full planning permission,,permissioned,,"Moults Yard, 68-70 Nottingham Road, Stapleford",http://www.arcgis.com/apps/webappviewer/index.html?id=08f516e5e14b48cfa555e52edb7e58f6&query=External_Layes_3711%2CSITEREFERENCE%2CSHLAA%2F00012%2FAVA#http://www.arcgis.com/apps/webappviewer/index.html?id=08f516e5e14b48cfa555e52edb7e58f6&query=External_Layes_3711%2CSITEREFERENCE%2CSHLAA%2F00012%2FAVA,SHLAA/00012/AVA
yes,,2017-12-13,-1.219687,52.921759,,1.79,2017-12-13,47,47,47,"13/00003/OUT - Redevelopment and change use of existing industrial site for residential/commercial uses (to include Classes A1; A2; A3; A4; A5; B1(a); C2; C3; and D1 uses) - now lapsed. Construct 47 dwellings, retail unit (Class A1), car parking and highway infrastructure",Broxtowe,http://opendatacommunities.org/id/district-council/broxtowe,not owned by a public authority,,,,pending decision,,Myford Machine Tools Wilmot Lane Beeston,http://www.arcgis.com/apps/webappviewer/index.html?id=08f516e5e14b48cfa555e52edb7e58f6&query=External_Layes_3711%2CSITEREFERENCE%2CSHLAA%2F00408%2FAVA#http://www.arcgis.com/apps/webappviewer/index.html?id=08f516e5e14b48cfa555e52edb7e58f6&query=External_Layes_3711%2CSITEREFERENCE%2CSHLAA%2F00408%2FAVA,SHLAA/00408/AVA
yes,,2017-12-13,-1.209474,52.917394,,19.55,2017-12-13,310,310,310,Hybrid planning application comprising: Outline application for up to 310 residential units and community building with means of access included (all other matters reserved).,Broxtowe,http://opendatacommunities.org/id/district-council/broxtowe,not owned by a public authority,2017-11-03,outline planning permission,,permissioned,,Beeston Business Park Technology Drive Beeston,http://www.arcgis.com/apps/webappviewer/index.html?id=08f516e5e14b48cfa555e52edb7e58f6&query=External_Layes_3711%2CSITEREFERENCE%2CSHLAA%2F00499%2FAVA#http://www.arcgis.com/apps/webappviewer/index.html?id=08f516e5e14b48cfa555e52edb7e58f6&query=External_Layes_3711%2CSITEREFERENCE%2CSHLAA%2F00499%2FAVA,SHLAA/00499/AVA
yes,,2017-12-13,-1.222041,52.919895,,2.23,2017-12-13,250,250,250,"Full permission for 29 dwellings, outline permission for up to 221 further dwellings. Hybrid planning application comprising: Full application to construct 29 dwellings, including access, associated road infrastructure, car parking and landscaping. Outline application (including access) with some matters reserved to construct up to 221 dwellings and units with flexible uses (Classes D1, D2, A1, A2, A3, A4 and A5), following demolition of buildings",Broxtowe,http://opendatacommunities.org/id/district-council/broxtowe,not owned by a public authority,2017-11-17,other,,permissioned,,Former Bartons Bus Depot Queens Road West Chilwell,http://www.arcgis.com/apps/webappviewer/index.html?id=08f516e5e14b48cfa555e52edb7e58f6&query=External_Layes_3711%2CSITEREFERENCE%2CSHLAA%2F00195%2FAVA#http://www.arcgis.com/apps/webappviewer/index.html?id=08f516e5e14b48cfa555e52edb7e58f6&query=External_Layes_3711%2CSITEREFERENCE%2CSHLAA%2F00195%2FAVA,SHLAA/00195/AVA
yes,,2017-12-13,-1.191896,52.921303,,14.68,2017-12-13,400,400,400,"This site crossed the boundary with Nottingham City Council therefore the number of dwellings in the description is not expected to be delivered in its entirety within Broxtowe.. Outline application for mixed-use development comprising: up to 82,000sqm of employment floorspace, comprising office units (B1a); research and development (B1b); industrial process (B1c); general industrial (B2); storage and distribution (B8); residential institutions (C2); non-residential institutions (D1); up to 2,500sqm retail & food/drink (A1, A2, A3, A4 and A5); up to 675 residential units (C3); and associated works including demolition of existing structures; earthworks; remediation; access; car parking; pedestrian and cycle routes; open space; utilities; sustainable drainage systems",Broxtowe,http://opendatacommunities.org/id/district-council/broxtowe,not owned by a public authority,,,,pending decision,,The Boots Company Beeston site,http://www.arcgis.com/apps/webappviewer/index.html?id=08f516e5e14b48cfa555e52edb7e58f6&query=External_Layes_3711%2CSITEREFERENCE%2CSHLAA%2F00237%2FAVA#http://www.arcgis.com/apps/webappviewer/index.html?id=08f516e5e14b48cfa555e52edb7e58f6&query=External_Layes_3711%2CSITEREFERENCE%2CSHLAA%2F00237%2FAVA,SHLAA/00237/AVA
,,2017-12-13,-1.250633,52.91269,,94.57,2017-12-13,500,500,500,"Owned by the Ministry of Defence, a private body has ownership interest in the existing on-site residential units to the north.. Residential led allocation in the emerging Local Plan (not yet allocated).",Broxtowe,http://opendatacommunities.org/id/district-council/broxtowe,mixed ownership,,,,not permissioned,,Chetwynd Barracks Chetwynd Road Chilwell,http://www.arcgis.com/apps/webappviewer/index.html?id=08f516e5e14b48cfa555e52edb7e58f6&query=External_Layes_3711%2CSITEREFERENCE%2CSHLAA%2F00193%2FAVA#http://www.arcgis.com/apps/webappviewer/index.html?id=08f516e5e14b48cfa555e52edb7e58f6&query=External_Layes_3711%2CSITEREFERENCE%2CSHLAA%2F00193%2FAVA,SHLAA/00193/AVA
,,2017-12-13,-1.218269,52.929498,,0.06,2017-12-13,12,12,12,Residential allocation in the emerging Local Plan (not adopted).,Broxtowe,http://opendatacommunities.org/id/district-council/broxtowe,not owned by a public authority,,,,not permissioned,,Land Fronting Wollaton Road Beeston,http://www.arcgis.com/apps/webappviewer/index.html?id=08f516e5e14b48cfa555e52edb7e58f6&query=External_Layes_3711%2CSITEREFERENCE%2CSHLAA%2F00571%2FAVA#http://www.arcgis.com/apps/webappviewer/index.html?id=08f516e5e14b48cfa555e52edb7e58f6&query=External_Layes_3711%2CSITEREFERENCE%2CSHLAA%2F00571%2FAVA,SHLAA/00571/AVA
,,2017-12-13,-1.282266,52.924176,,0.3,2017-12-13,15,15,15,Outline permission to demolish existing commercial units and construct 15 N° dwellings lapsed.. Construct 15 N° dwellings,Broxtowe,http://opendatacommunities.org/id/district-council/broxtowe,not owned by a public authority,,,,not permissioned,,Works Bailey Street Stapleford,http://www.arcgis.com/apps/webappviewer/index.html?id=08f516e5e14b48cfa555e52edb7e58f6&query=External_Layes_3711%2CSITEREFERENCE%2CSHLAA%2F00239%2FAVA#http://www.arcgis.com/apps/webappviewer/index.html?id=08f516e5e14b48cfa555e52edb7e58f6&query=External_Layes_3711%2CSITEREFERENCE%2CSHLAA%2F00239%2FAVA,SHLAA/00239/AVA
,,2017-12-13,-1.206283,52.921931,,1.19,2017-12-13,21,21,21,Owned by Network Rail. Residential allocation in the emerging Local Plan (not adopted).,Broxtowe,http://opendatacommunities.org/id/district-council/broxtowe,not owned by a public authority,,,,not permissioned,,Beeston Cement Depot Station Road Beeston,http://www.arcgis.com/apps/webappviewer/index.html?id=08f516e5e14b48cfa555e52edb7e58f6&query=External_Layes_3711%2CSITEREFERENCE%2CSHLAA%2F00449%2FAVA#http://www.arcgis.com/apps/webappviewer/index.html?id=08f516e5e14b48cfa555e52edb7e58f6&query=External_Layes_3711%2CSITEREFERENCE%2CSHLAA%2F00449%2FAVA,SHLAA/00449/AVA
,,2017-12-13,-1.210551,52.919487,,1.32,2017-12-13,56,56,56,Residential allocation in the emerging Local Plan (not yet allocated).,Broxtowe,http://opendatacommunities.org/id/district-council/broxtowe,not owned by a public authority,,,,not permissioned,,"Beeston Maltings, Dovecote Lane, Beeston",http://www.arcgis.com/apps/webappviewer/index.html?id=08f516e5e14b48cfa555e52edb7e58f6&query=External_Layes_3711%2CSITEREFERENCE%2CSHLAA%2F00150%2FAVA#http://www.arcgis.com/apps/webappviewer/index.html?id=08f516e5e14b48cfa555e52edb7e58f6&query=External_Layes_3711%2CSITEREFERENCE%2CSHLAA%2F00150%2FAVA,SHLAA/00150/AVA
,,2017-12-13,-1.214823,52.925889,,1.39,2017-12-13,100,100,100,Owned by Broxtowe Borough Council.. Mixed use allocation in the emerging Local Plan (not adopted) with a minimum of 100 homes.,Broxtowe,http://opendatacommunities.org/id/district-council/broxtowe,owned by a public authority,,,,not permissioned,,The Square Beeston,http://www.arcgis.com/apps/webappviewer/index.html?id=08f516e5e14b48cfa555e52edb7e58f6&query=External_Layes_3711%2CSITEREFERENCE%2CSHLAA%2F00771%2FAVA#http://www.arcgis.com/apps/webappviewer/index.html?id=08f516e5e14b48cfa555e52edb7e58f6&query=External_Layes_3711%2CSITEREFERENCE%2CSHLAA%2F00771%2FAVA,SHLAA/00771/AVA
yes,,2017-12-13,-1.299311,53.019169,,7.47,2017-12-13,200,200,200,"Planning permission granetd at appeal with one year timelimit (which has now lapsed).. Construct 113 apartments, 27 bungalows, energy centre and associated access road, car parking, amenity space and landscaping.",Broxtowe,http://opendatacommunities.org/id/district-council/broxtowe,owned by a public authority,,,,not permissioned,,Walker Street Eastwood,http://www.arcgis.com/apps/webappviewer/index.html?id=08f516e5e14b48cfa555e52edb7e58f6&query=External_Layes_3711%2CSITEREFERENCE%2CSHLAA%2F00138%2FAVA#http://www.arcgis.com/apps/webappviewer/index.html?id=08f516e5e14b48cfa555e52edb7e58f6&query=External_Layes_3711%2CSITEREFERENCE%2CSHLAA%2F00138%2FAVA,SHLAA/00138/AVA
yes,,2017-12-13,-1.242212,52.929087,,3.52,2017-12-13,40,40,40,"Erection of 40 dwellings (following demolition of buildings and other associated structures) with associated vehicle access, car parking and landscaping.",Broxtowe,http://opendatacommunities.org/id/district-council/broxtowe,not owned by a public authority,2017-09-19,full planning permission,,permissioned,,"St Johns College, Peache Way, Bramcote",http://www.arcgis.com/apps/webappviewer/index.html?id=08f516e5e14b48cfa555e52edb7e58f6&query=External_Layes_3711%2CSITEREFERENCE%2CSHLAA%2F00343%2FAVA#http://www.arcgis.com/apps/webappviewer/index.html?id=08f516e5e14b48cfa555e52edb7e58f6&query=External_Layes_3711%2CSITEREFERENCE%2CSHLAA%2F00343%2FAVA,SHLAA/00343/AVA
yes,,2017-12-13,-1.195344,52.92068,,12.95,2017-12-13,150,150,150,Owned by Severn Trent. Residential allocation in the emerging Local Plan (not adopted).,Broxtowe,http://opendatacommunities.org/id/district-council/broxtowe,not owned by a public authority,,,,not permissioned,,"Land at Lilac Grove, Beeston",http://www.arcgis.com/apps/webappviewer/index.html?id=08f516e5e14b48cfa555e52edb7e58f6&query=External_Layes_3711%2CSITEREFERENCE%2CSHLAA%2F00258%2FAVA#http://www.arcgis.com/apps/webappviewer/index.html?id=08f516e5e14b48cfa555e52edb7e58f6&query=External_Layes_3711%2CSITEREFERENCE%2CSHLAA%2F00258%2FAVA,SHLAA/00258/AVA
,,2017-12-13,-1.261136,52.935166,,0.51,2017-12-13,11,11,11,Owned by Nottinghamshire County Council. Site is in a suitable urban location.,Broxtowe,http://opendatacommunities.org/id/district-council/broxtowe,owned by a public authority,,,,not permissioned,,"Wadsworth Rd, Stapleford, Nottingham",http://www.arcgis.com/apps/webappviewer/index.html?id=08f516e5e14b48cfa555e52edb7e58f6&query=External_Layes_3711%2CSITEREFERENCE%2CSHLAA%2F00419%2FAVA#http://www.arcgis.com/apps/webappviewer/index.html?id=08f516e5e14b48cfa555e52edb7e58f6&query=External_Layes_3711%2CSITEREFERENCE%2CSHLAA%2F00419%2FAVA,SHLAA/00419/AVA
yes,,2017-12-13,-1.305555,53.010918,,0.28,2017-12-13,13,13,13,Construct 13 N° dwellings (revised scheme),Broxtowe,http://opendatacommunities.org/id/district-council/broxtowe,not owned by a public authority,2016-07-15,full planning permission,,permissioned,,132 Chewton Street Eastwood,http://www.arcgis.com/apps/webappviewer/index.html?id=08f516e5e14b48cfa555e52edb7e58f6&query=External_Layes_3711%2CSITEREFERENCE%2CSHLAA%2F00163%2FAVA#http://www.arcgis.com/apps/webappviewer/index.html?id=08f516e5e14b48cfa555e52edb7e58f6&query=External_Layes_3711%2CSITEREFERENCE%2CSHLAA%2F00163%2FAVA,SHLAA/00163/AVA
