Deliverable,EndDate,FirstAddedDate,GeoX,GeoY,HazardousSubstances,Hectares,LastUpdatedDate,MinNetDwellings,NetDwellingsRangeFrom,NetDwellingsRangeTo,Notes,OrganisationLabel,OrganisationURI,OwnershipStatus,PermissionDate,PermissionType,PlanningHistory,PlanningStatus,point,SiteNameAddress,SiteplanURL,SiteReference
yes,,2017-10-16,-0.373416,50.809537,,0.58,2017-10-16,150,150,150,"This is a public owned site. The site is identified as an Area of Change (AOC 3) within the Core Strategy. This site has an opportunity to deliver a mixed used development of commercial, leisure and residential. Recent capacity work indicates that some 150 dwellings could be delivered on this site. The Council is actively supporting the redevelopment of this key site.. SHLAA Ref: WB08180",Worthing Borough Council,http://opendatacommunities.org/id/district-council/worthing,not owned by a public authority,,,https://www.adur-worthing.gov.uk/planning-policy/worthing-background-studies-and-info/housing/housing-capacity-shlaa/,not permissioned,,"Grafton Multi Storey Car Park, Augusta place","https://www.adur-worthing.gov.uk/media/media,146500,en.pdf",WBCBR20
yes,,2017-10-16,-0.367693,50.811265,,0.38,2017-10-16,10,10,10,This is a privately owned site. The site has been the subject of a number of planning applications. An application has been received (AWDM/0063/17) which appears to have achieved an acceptable solution on this site. It is expected that this application will be approved. The site is considered to offer a realistic prospect of delivering residential development.. SHLAA Ref: WB13020,Worthing Borough Council,http://opendatacommunities.org/id/district-council/worthing,not owned by a public authority,,,https://www.adur-worthing.gov.uk/planning-policy/worthing-background-studies-and-info/housing/housing-capacity-shlaa/,not permissioned,,7 The Steyne,"https://www.adur-worthing.gov.uk/media/media,146501,en.pdf",WBCBR21
yes,,2017-10-16,-0.386267,50.817216,,0.124,2017-10-16,32,32,32,"Proposed demolition of existing buildings (Bunces Home Hardware Store) and construction of a mixed-use development comprising 32 No. residential dwellings and 235 square metres (GIA) commercial floorspace with the potential for A1 (shops), A2 (professional and financial services), B1a/b (offices etc) and D1 (medical) uses in the form of a part 3, 4 and 5 storey building together with associated parking, landscaping and re-location of the site access from Chapel Road to Lennox Road. Planning Ref: AWDM/1542/16",Worthing Borough Council,http://opendatacommunities.org/id/district-council/worthing,not owned by a public authority,2017-04-27,,https://planning.adur-worthing.gov.uk/online-applications/,permissioned,,112 -114 Chapel Road,"https://www.adur-worthing.gov.uk/media/media,146502,en.pdf",WBCBR22
yes,,2017-10-16,-0.373448,50.82292,,0.079,2017-10-16,11,11,11,"This is a privately owned which is considered to be suitable, achievable and deliverable. A planning application has been submitted for 12 residential units (AWDM/1921/16) and the decision is pending.. Change of use from 2 x 4no. bedroom semi-detached dwellings to 7 no. one bedroom and 3 no. two bedroom flats/maisonettes with the addition of a second floor (no's 25 and 27 Broadwater Road). SHLAA Ref: WB17015 Planning Ref: AWDM/1921/16",Worthing Borough Council,http://opendatacommunities.org/id/district-council/worthing,not owned by a public authority,,,https://planning.adur-worthing.gov.uk/online-applications/,pending decision,,25 Broadwater Road,"https://www.adur-worthing.gov.uk/media/media,146503,en.pdf",WBCBR23
yes,,2017-10-16,-0.383772,50.83069,,0.112,2017-10-16,9,9,9,"This is a privately owned site. An outline planning application has been submitted, but not determined. Demolition of existing buildings and construction of apartment building comprising 8 x 2-bed residential units. Provision of associated car parking and cycle storage. (Outline application including details of access, layout and scale with all other matters reserved.. Planning Ref: AWDM/0603/17",Worthing Borough Council,http://opendatacommunities.org/id/district-council/worthing,not owned by a public authority,,,https://planning.adur-worthing.gov.uk/online-applications/,pending decision,,30 Poulters Lane,"https://www.adur-worthing.gov.uk/media/media,146504,en.pdf",WBCBR24
yes,,2017-10-16,-0.371039,50.812985,,0.035,2017-10-16,7,7,7,"This site is in private ownership. An application has been submitted and is pending decision .. Creation of 7 residential flats (6 x 1 bedroom flats and 1 x 2 bedroom flat), including the erection of a roof extension and installation of 6 windows to rear elevation and 1 window to front elevation.. Planning Ref: AWDM/0845/17",Worthing Borough Council,http://opendatacommunities.org/id/district-council/worthing,not owned by a public authority,,,https://planning.adur-worthing.gov.uk/online-applications/,pending decision,,"The Timothy Shelley, 47-49 Chapel","https://www.adur-worthing.gov.uk/media/media,146505,en.pdf",WBCBR25
yes,,2017-10-16,-0.392898,50.821714,,0.193,2017-10-16,22,22,22,This site is in private ownership. An application has been submitted and is pending decision.. Demolition of existing care home and erection of a part 2 and part 2.5 storey building containing 22 no. flats comprising 18 x 2-bedroom and 4 x 1-bedroom with associated parking of 26 spaces and landscaping. Retention of existing vehicular accesses onto Parkfield Road and formation of new vehicular access onto South Street Tarring. Planning Ref: AWDM/1075/17,Worthing Borough Council,http://opendatacommunities.org/id/district-council/worthing,not owned by a public authority,,,https://planning.adur-worthing.gov.uk/online-applications/,pending decision,,Irene House 1 Parkfield Road,"https://www.adur-worthing.gov.uk/media/media,146506,en.pdf",WBCBR26
