Deliverable,EndDate,FirstAddedDate,GeoX,GeoY,HazardousSubstances,Hectares,LastUpdatedDate,MinNetDwellings,NetDwellingsRangeFrom,NetDwellingsRangeTo,Notes,OrganisationLabel,OrganisationURI,OwnershipStatus,PermissionDate,PermissionType,PlanningHistory,PlanningStatus,point,SiteNameAddress,SiteplanURL,SiteReference
yes,,2017-12-18,,,,6.56,2018-12-12,650,650,650,Part of City Deal. Proposed for up to 650 dwelling mixed-use as part of larger development scheme for City Deal,Portsmouth City Council,http://opendatacommunities.org/id/unitary-authority/portsmouth,mixed ownership,,,,Not permissioned,,TIPNER WEST,https://www.portsmouth.gov.uk/ext/development-and-planning/planning/brownfield-land-register,001
yes,,2017-12-18,,,,15.46,2018-12-12,600,600,600,Part of City Deal. Proposed for up to 600 dwelling mixed-use as part of larger development scheme for City Deal,Portsmouth City Council,http://opendatacommunities.org/id/unitary-authority/portsmouth,owned by a public authority,,,,Not permissioned,,TIPNER FIRING RANGE,https://www.portsmouth.gov.uk/ext/development-and-planning/planning/brownfield-land-register,002
yes,,2017-12-18,,,,11.29,2018-12-12,600,600,600,"Outline planning permission granted for up to 600 homes, 615sqm commercial floor space and sea wall. Permission granted for Park & Ride facility.",Portsmouth City Council,http://opendatacommunities.org/id/unitary-authority/portsmouth,owned by a public authority,2012-03-30,outline planning permission,http://publicaccess.portsmouth.gov.uk/online-applications/applicationDetails.do?activeTab=summary&keyVal=L7GM7TMO5G000,permissioned,,LAND OFF AND BETWEEN M275 SOUTH OF TIPNER LAKE INCLUDING GREYHOUND STADIUM TWYFORD AVENUE,https://www.portsmouth.gov.uk/ext/development-and-planning/planning/brownfield-land-register,003
yes,,2017-12-18,,,,25.34,2018-12-12,500,500,500,"The site has considerable contaminated land issues through industrial use of the land, landfill and land reclamation. Therefore, before any development can take place the council will need to be satisfied that an appropriate scheme for remediation of the site is in place to deal with the historic land contamination.. Allocated in Core Strategy (2011-2027) for approx. 500 homes. Also part of City Deal.",Portsmouth City Council,http://opendatacommunities.org/id/unitary-authority/portsmouth,mixed ownership,,,,Not permissioned,,"PORT SOLENT, HMS EXCELLENT",https://www.portsmouth.gov.uk/ext/development-and-planning/planning/brownfield-land-register,004
yes,,2017-12-18,,,,0.26,2018-12-12,200,200,200,Subject to conditions. Change of use from office (Class B1) to halls of residence (Class C1) at levels 6-18 of Europa House and the annex building to form 262 study bedrooms with communal facilities,Portsmouth City Council,http://opendatacommunities.org/id/unitary-authority/portsmouth,,2015-06-18,full planning permission,http://publicaccess.portsmouth.gov.uk/online-applications/applicationDetails.do?activeTab=summary&keyVal=NJCF4FMOI3V00,permissioned,,"EUROPA HOUSE, HAVANT STREET",https://www.portsmouth.gov.uk/ext/development-and-planning/planning/brownfield-land-register,005
yes,,2017-12-18,,,,3.23,2018-12-12,160,160,160,"The site has considerable contaminated land issues. Therefore, before any development can take place the council will need to be satisfied that thorough investigation of the site has taken place and an appropriate scheme for remediation of the site is in place to deal with the historic land contamination.. Resolution to grant permission for 163 units. Allocated for residential development in Portsmouth City Plan 2001-2011.",Portsmouth City Council,http://opendatacommunities.org/id/unitary-authority/portsmouth,not owned by a public authority,,,http://publicaccess.portsmouth.gov.uk/online-applications/applicationDetails.do?activeTab=documents&keyVal=MSUUZTMO5G000,pending decision,,TRAFALGAR WHARF,https://www.portsmouth.gov.uk/ext/development-and-planning/planning/brownfield-land-register,006
yes,,2017-12-18,,,,2.52,2018-12-12,100,100,100,Resolution to grant permission subject to S106.. Outline application for the construction of up to 108 dwellings,Portsmouth City Council,http://opendatacommunities.org/id/unitary-authority/portsmouth,owned by a public authority,2017-09-20,Other,http://publicaccess.portsmouth.gov.uk/online-applications/applicationDetails.do?activeTab=documents&keyVal=OL60SKMOJTS00,permissioned,,DRAYTON DAIRY,https://www.portsmouth.gov.uk/ext/development-and-planning/planning/brownfield-land-register,007
yes,,2017-12-18,,,,5.45,2018-12-12,130,130,130,Previous planning application withdrawn for 131 residential dwellings. Recent refused planning application for access road to accommodate residential development.,Portsmouth City Council,http://opendatacommunities.org/id/unitary-authority/portsmouth,not owned by a public authority,,,,Not permissioned,,QINETIQ - FRASER BATTERY,https://www.portsmouth.gov.uk/ext/development-and-planning/planning/brownfield-land-register,008
yes,,2017-12-18,,,,0.84,2018-12-12,30,30,30,Subject to conditions. Construction of eight-storey building comprising 38 apartments above extended landscapes podium level and associated car parking facilities,Portsmouth City Council,http://opendatacommunities.org/id/unitary-authority/portsmouth,not owned by a public authority,2012-03-15,full planning permission,http://publicaccess.portsmouth.gov.uk/online-applications/applicationDetails.do?activeTab=documents&keyVal=LDTP2UMO02T00,permissioned,,QUEENS HOTEL,https://www.portsmouth.gov.uk/ext/development-and-planning/planning/brownfield-land-register,009
yes,,2017-12-18,,,,0.11,2018-12-12,40,40,40,Conversion of east wing to form 9 maisonettes and 31 flats including construction of mansard roof to form additional floor and external alterations,Portsmouth City Council,http://opendatacommunities.org/id/unitary-authority/portsmouth,,2013-07-18,full planning permission,http://publicaccess.portsmouth.gov.uk/online-applications/applicationDetails.do?activeTab=documents&keyVal=KYYKV6MO04R00,permissioned,,THE ROYAL BEACH HOTEL (EAST WING) ST HELENS PARADE,https://www.portsmouth.gov.uk/ext/development-and-planning/planning/brownfield-land-register,010
yes,,2017-12-18,,,,0.07,2018-12-12,10,10,10,Part demolition of former bingo hall and conversion to form retail unit (Class A1/A2) and 10 dwellinghouse; conversion/extension of outbuilding to form dwellinghouse; provision of associated refuse/ bicycle stores and car parking,Portsmouth City Council,http://opendatacommunities.org/id/unitary-authority/portsmouth,not owned by a public authority,2018-05-30,full planning permission,http://publicaccess.portsmouth.gov.uk/online-applications/applicationDetails.do?activeTab=documents&keyVal=OTLPCOMOG6Y00,permissioned,,140-142 KINGSTON ROAD (BINGO HALL),https://www.portsmouth.gov.uk/ext/development-and-planning/planning/brownfield-land-register,011
yes,,2018-12-18,,,,0.11,2018-12-12,8,8,8,Construction of 8 three-storey dwellinghouses following demolition of existing buildings,Portsmouth City Council,http://opendatacommunities.org/id/unitary-authority/portsmouth,not owned by a public authority,2018-10-17,full planning permission,http://publicaccess.portsmouth.gov.uk/online-applications/applicationDetails.do?activeTab=documents&keyVal=P8I92PMOFOW00,permissioned,,GARAGES AT EXMOUTH ROAD,https://www.portsmouth.gov.uk/ext/development-and-planning/planning/brownfield-land-register,012
yes,,2017-12-18,,,,0.25,2018-12-12,7,7,7,Construction of four 3-storey houses and three 2-storey houses with associated access road and car parking after demolition of existing buildings,Portsmouth City Council,http://opendatacommunities.org/id/unitary-authority/portsmouth,not owned by a public authority,2015-09-11,full planning permission,http://publicaccess.portsmouth.gov.uk/online-applications/applicationDetails.do?activeTab=documents&keyVal=NR2RVQMOLKU00,permissioned,,"FORMER AQUATICS CENTRE, 201 HIGHLAND ROAD AND 197 AND LAND AT REAR",https://www.portsmouth.gov.uk/ext/development-and-planning/planning/brownfield-land-register,013
yes,,2017-12-18,,,,0.19,2018-12-12,15,15,15,"Promoted through SHLAA call for sites. The site has considerable contaminated land issues. The site has considerable contaminated land issues. Therefore, before any development can take place the council will need to be satisfied that thorough investigation of the site has taken place and an appropriate scheme for remediation of the site is in place to deal with the historic land contamination.. Site adjacent to existing marina, previously promoted for residential development.",Portsmouth City Council,http://opendatacommunities.org/id/unitary-authority/portsmouth,not owned by a public authority,,,,Not permissioned,,LAND SOUTH OF MARINA KEEP,https://www.portsmouth.gov.uk/ext/development-and-planning/planning/brownfield-land-register,014
yes,,2017-12-18,,,,0.17,2018-12-12,10,10,10,"Vacant retail unit, being promoted for residential development",Portsmouth City Council,http://opendatacommunities.org/id/unitary-authority/portsmouth,not owned by a public authority,,,,Not permissioned,,NORTH END KWIKSAVE,https://www.portsmouth.gov.uk/ext/development-and-planning/planning/brownfield-land-register,015
yes,,2017-12-18,,,,0.04,2018-12-12,15,15,15,Construction of 3-storey building to form a 17 study bedroom halls of residence for student use (Class C1) and 2 shops on ground floor (Class A1) with associated cycle and refuse stores,Portsmouth City Council,http://opendatacommunities.org/id/unitary-authority/portsmouth,not owned by a public authority,2015-05-01,full planning permission,http://publicaccess.portsmouth.gov.uk/online-applications/applicationDetails.do?activeTab=documents&keyVal=NKXUNKMOIS300,permissioned,,108 - 112 ELM GROVE,https://www.portsmouth.gov.uk/ext/development-and-planning/planning/brownfield-land-register,016
yes,,2017-12-18,,,,0.06,2018-12-12,8,8,8,Construction of a terrace of nine 2 and 2.5-storey dwellinghouse,Portsmouth City Council,http://opendatacommunities.org/id/unitary-authority/portsmouth,not owned by a public authority,2017-02-01,full planning permission,http://publicaccess.portsmouth.gov.uk/online-applications/applicationDetails.do?activeTab=documents&keyVal=OGN2Y3MOHQM00,permissioned,,251 - 253 NEW ROAD (GOSPORT METAL TREATMENT),https://www.portsmouth.gov.uk/ext/development-and-planning/planning/brownfield-land-register,017
yes,,2017-12-18,,,,0.35,2018-12-12,60,60,60,"Promoted through SHLAA call for sites. The site has considerable contaminated land issues. Therefore, before any development can take place the council will need to be satisfied that thorough investigation of the site has taken place and an appropriate scheme for remediation of the site is in place to deal with the historic land contamination.. Existing car park site, identified as suitable for residential development",Portsmouth City Council,http://opendatacommunities.org/id/unitary-authority/portsmouth,not owned by a public authority,,,,Not permissioned,,WIGHTLINK CAR PARK,https://www.portsmouth.gov.uk/ext/development-and-planning/planning/brownfield-land-register,018
yes,,2017-12-18,,,,0.5,2018-12-12,150,150,150,Promoted through SHLAA call for sites. Vacant site with potential for mixed use development including residential,Portsmouth City Council,http://opendatacommunities.org/id/unitary-authority/portsmouth,not owned by a public authority,,,http://publicaccess.portsmouth.gov.uk/online-applications/applicationDetails.do?activeTab=documents&keyVal=P5VYDIMO0F800,Not permissioned,,PORTSMOUTH MAIL CENTRE,https://www.portsmouth.gov.uk/ext/development-and-planning/planning/brownfield-land-register,019
yes,,2017-12-18,,,,0.27,2018-12-12,150,150,150,Prior approval for change of use from office (Class B1) to form 153 residential dwellings (Class C3),Portsmouth City Council,http://opendatacommunities.org/id/unitary-authority/portsmouth,not owned by a public authority,2017-09-20,Other,http://publicaccess.portsmouth.gov.uk/online-applications/applicationDetails.do?activeTab=documents&keyVal=OT2TUNMO02T00,permissioned,,BRUNEL HOUSE,https://www.portsmouth.gov.uk/ext/development-and-planning/planning/brownfield-land-register,020
yes,,2017-12-18,,,,1.18,2018-12-12,50,50,50,Construction of 2-storey building to form 72 bed residential care home and car parking,Portsmouth City Council,http://opendatacommunities.org/id/unitary-authority/portsmouth,owned by a public authority,2013-12-05,full planning permission,http://publicaccess.portsmouth.gov.uk/online-applications/applicationDetails.do?activeTab=documents&keyVal=MUIJE3MO5G000,permissioned,,EAST LODGE,https://www.portsmouth.gov.uk/ext/development-and-planning/planning/brownfield-land-register,021
yes,,2017-12-18,,,,2.54,2018-12-12,100,100,100,Part of the site still in use as printing press and distribution area. Former offices potential for residential redevelopment.,Portsmouth City Council,http://opendatacommunities.org/id/unitary-authority/portsmouth,not owned by a public authority,,,,Not permissioned,,THE NEWS CENTRE,https://www.portsmouth.gov.uk/ext/development-and-planning/planning/brownfield-land-register,022
yes,,2017-12-18,,,,33.13,2018-12-12,444,444,444,"Promoted through SHLAA call for sites. Identified as potential for residential development, possible mixed use.",Portsmouth City Council,http://opendatacommunities.org/id/unitary-authority/portsmouth,mixed ownership,,,,Not permissioned,,ST JAMES HOSPITAL,https://www.portsmouth.gov.uk/ext/development-and-planning/planning/brownfield-land-register,023
yes,,2017-12-18,,,,0.2,2018-12-12,70,70,70,"Construction of up to 10-storey building to form halls of residence comprising 96 study bedrooms (Class C1) and communal facilities, cycle and refuse stores and car parking",Portsmouth City Council,http://opendatacommunities.org/id/unitary-authority/portsmouth,not owned by a public authority,2017-11-25,outline planning permission,http://publicaccess.portsmouth.gov.uk/online-applications/applicationDetails.do?activeTab=documents&keyVal=OQTMEKMOMII00,permissioned,,UNITY HALL AND DEAF CENTRE,https://www.portsmouth.gov.uk/ext/development-and-planning/planning/brownfield-land-register,024
yes,,2018-12-12,,,,0.31,2018-12-12,6,6,6,Conversion of second floor from Dance Studio (Class D2) to form six dwellings (Class C3) with associated external alterations,Portsmouth City Council,http://opendatacommunities.org/id/unitary-authority/portsmouth,not owned by a public authority,2018-09-14,full planning permission,http://publicaccess.portsmouth.gov.uk/online-applications/applicationDetails.do?activeTab=documents&keyVal=P6O0TLMOMGO00,permissioned,,75 LONDON ROAD,https://www.portsmouth.gov.uk/ext/development-and-planning/planning/brownfield-land-register,025
yes,,2018-12-12,,,,0.09,2018-12-12,6,6,6,Change of use to first and second floors from offices (Class B1) to form 6 flats (Class C3),Portsmouth City Council,http://opendatacommunities.org/id/unitary-authority/portsmouth,not owned by a public authority,2018-08-24,full planning permission,http://publicaccess.portsmouth.gov.uk/online-applications/applicationDetails.do?activeTab=documents&keyVal=P94UULMOG0000,permissioned,,"COSHAM DELIVERY OFFICE, NORTHERN ROAD",https://www.portsmouth.gov.uk/ext/development-and-planning/planning/brownfield-land-register,026
yes,,2018-12-12,,,,0.16,2018-12-12,20,20,20,,Portsmouth City Council,http://opendatacommunities.org/id/unitary-authority/portsmouth,not owned by a public authority,,,,Not permissioned,,ROYAL MARINE MUSEUM,https://www.portsmouth.gov.uk/ext/development-and-planning/planning/brownfield-land-register,027
yes,,2018-12-12,,,,0.03,2018-12-12,40,40,40,"Outline application for construction of a twelve storey building (3,317sqm GEA) to provide 76no. 'co-living' bedspaces�",Portsmouth City Council,http://opendatacommunities.org/id/unitary-authority/portsmouth,not owned by a public authority,,,http://publicaccess.portsmouth.gov.uk/online-applications/applicationDetails.do?activeTab=documents&keyVal=P8TM2KMOFUE00,pending decision,,"THE INVINCIBLE, WICKHAM STREET",https://www.portsmouth.gov.uk/ext/development-and-planning/planning/brownfield-land-register,028
yes,,2018-12-12,,,,0.12,2018-12-12,40,40,40,,Portsmouth City Council,http://opendatacommunities.org/id/unitary-authority/portsmouth,owned by a public authority,,,,Not permissioned,,"POLICE STATION, KINGSTON CRESCENT",https://www.portsmouth.gov.uk/ext/development-and-planning/planning/brownfield-land-register,029
yes,,2018-12-12,,,,0.28,2018-12-12,50,50,50,,Portsmouth City Council,http://opendatacommunities.org/id/unitary-authority/portsmouth,owned by a public authority,,,http://publicaccess.portsmouth.gov.uk/online-applications/applicationDetails.do?keyVal=ZZZWCDMOXD000&activeTab=summary,Not permissioned,,COSHAM POLICE STATION/ HEALTH CENTRE,https://www.portsmouth.gov.uk/ext/development-and-planning/planning/brownfield-land-register,030
yes,,2018-12-12,,,,0.74,2018-12-12,50,50,50,,Portsmouth City Council,http://opendatacommunities.org/id/unitary-authority/portsmouth,owned by a public authority,,,,Not permissioned,,PCMI SIGNS,https://www.portsmouth.gov.uk/ext/development-and-planning/planning/brownfield-land-register,031
yes,,2018-12-12,,,,0.39,2018-12-12,91,91,91,,Portsmouth City Council,http://opendatacommunities.org/id/unitary-authority/portsmouth,owned by a public authority,,,,Not permissioned,,CITY RECORDS OFFICE,https://www.portsmouth.gov.uk/ext/development-and-planning/planning/brownfield-land-register,032
yes,,2018-12-12,,,,0.03,2018-12-12,20,20,20,Outline application for the demolition of existing buildings and the construction of student residential accommodation (21 units) in a four storey building (Scale and access to be considered).,Portsmouth City Council,http://opendatacommunities.org/id/unitary-authority/portsmouth,mixed ownership,,,http://publicaccess.portsmouth.gov.uk/online-applications/applicationDetails.do?activeTab=documents&keyVal=PIUYABMOKFB00,pending decision,,MIDDLE STREET,https://www.portsmouth.gov.uk/ext/development-and-planning/planning/brownfield-land-register,033
yes,,2018-12-12,,,,0.28,2018-12-12,200,200,200,Change of use of building from offices (Class B1(a)) to a Student Hall of Residence (Class C1) comprising 309 study studios,Portsmouth City Council,http://opendatacommunities.org/id/unitary-authority/portsmouth,not owned by a public authority,,,http://publicaccess.portsmouth.gov.uk/online-applications/applicationDetails.do?activeTab=documents&keyVal=PHXQBUMOK0000,pending decision,,WINGFIELD HOUSE,https://www.portsmouth.gov.uk/ext/development-and-planning/planning/brownfield-land-register,034
yes,,2018-12-12,,,,0.02,2018-12-12,5,5,5,CONSTRUCTION OF A 3 STOREY BUILDING TO FORM 5 DWELLINGS (FOLLOWING DEMOLITION OF EXISTING REAR PART OF BUILDING),Portsmouth City Council,http://opendatacommunities.org/id/unitary-authority/portsmouth,not owned by a public authority,2018-03-06,full planning permission,http://publicaccess.portsmouth.gov.uk/online-applications/applicationDetails.do?activeTab=documents&keyVal=OHEWTFMOI2V00,permissioned,,REAR OF 40 HIGH STREET,https://www.portsmouth.gov.uk/ext/development-and-planning/planning/brownfield-land-register,035
yes,,,,,,0.09,2018-12-12,20,20,20,Construction of minimum of 20 residential dwellings with retail use at ground and first floor,Portsmouth City Council,http://opendatacommunities.org/id/unitary-authority/portsmouth,not owned by a public authority,,,,Not permissioned,,208-220 COMMERCIAL ROAD & 7-13 CRASSWELL STREET,https://www.portsmouth.gov.uk/ext/development-and-planning/planning/brownfield-land-register,036
yes,,2018-12-12,,,,0.13,2018-12-12,12,12,12,CONVERSION OF EXISTING BUILDING TO 12 FLATS,Portsmouth City Council,http://opendatacommunities.org/id/unitary-authority/portsmouth,not owned by a public authority,2017-05-18,full planning permission,http://publicaccess.portsmouth.gov.uk/online-applications/applicationDetails.do?activeTab=documents&keyVal=OE1RD8MOGI500,permissioned,,"PORTLAND HOTEL, 38 KENT ROAD",https://www.portsmouth.gov.uk/ext/development-and-planning/planning/brownfield-land-register,037
yes,,2018-12-12,,,,0.27,2018-12-12,15,15,15,"15 DWELLINGS COMPRISING 8 THREE-STOREY HOUSES IN 2 TERRACES, 6 FLATS IN PART 2/3-STOREY BUILDING & 1 MAISONETTE",Portsmouth City Council,http://opendatacommunities.org/id/unitary-authority/portsmouth,not owned by a public authority,2018-03-22,outline planning permission,http://publicaccess.portsmouth.gov.uk/online-applications/applicationDetails.do?activeTab=documents&keyVal=OIJDPZMOIMK00,permissioned,,REAR OF ODEON CINEMA 92/96 LONDON ROAD,https://www.portsmouth.gov.uk/ext/development-and-planning/planning/brownfield-land-register,038
yes,,2017-12-18,,,,0.06,2018-12-12,6,6,6,"Construction of a 3.5-storey block of seven flats with associated parking, landscaping, cycle and refuse stores following demolition of existing garage blocks",Portsmouth City Council,http://opendatacommunities.org/id/unitary-authority/portsmouth,not owned by a public authority,,,http://publicaccess.portsmouth.gov.uk/online-applications/applicationDetails.do?activeTab=documents&keyVal=NXCHQGMOGPA00,pending decision,,GARAGES ADJACENT TO 1A ST CHADS AVENUE,https://www.portsmouth.gov.uk/ext/development-and-planning/planning/brownfield-land-register,039
yes,,2018-12-12,,,,0.04,2018-12-12,11,11,11,CONSTRUCTION OF 4 STOREY BUILDING COMPRISING 11 NO. 1 BED APARTMENTS (FOLLOWING DEMOLTION OF EXISTING BUILDING),Portsmouth City Council,http://opendatacommunities.org/id/unitary-authority/portsmouth,mixed ownership,2017-12-18,full planning permission,http://publicaccess.portsmouth.gov.uk/online-applications/applicationDetails.do?activeTab=documents&keyVal=OMWVN9MOKOM00,permissioned,,FORMER AMBULANCE STATION LAND ADJACENT TO THE HARBOUR CAR PARK,https://www.portsmouth.gov.uk/ext/development-and-planning/planning/brownfield-land-register,040
yes,,2018-12-12,,,,0.22,2018-12-12,153,153,153,APPLICATION FOR PRIOR APPROVAL RELATING TO THE CHANGE OF USE FROM OFFICES (CLASS B1A) TO 153 RESIDENTIAL UNITS,Portsmouth City Council,http://opendatacommunities.org/id/unitary-authority/portsmouth,not owned by a public authority,2017-09-20,full planning permission,http://publicaccess.portsmouth.gov.uk/online-applications/applicationDetails.do?activeTab=documents&keyVal=OT2TUNMO02T00,permissioned,,BRUNEL HOUSE 42 THE HARD,https://www.portsmouth.gov.uk/ext/development-and-planning/planning/brownfield-land-register,041
yes,,2018-12-12,,,,0.19,2018-12-12,30,30,30,APPLICATION FOR PRIOR APPROVAL RELATING TO THE CHANGE OF USE FROM OFFICE USE (CLASS B1) OF PART OF FLOORS TO FLATS,Portsmouth City Council,http://opendatacommunities.org/id/unitary-authority/portsmouth,not owned by a public authority,2017-12-18,full planning permission,http://publicaccess.portsmouth.gov.uk/online-applications/applicationDetails.do?activeTab=documents&keyVal=OJVX08MOJ8500,permissioned,,ENTERPRISE HOUSE ISAMBARD BRUNEL ROAD,https://www.portsmouth.gov.uk/ext/development-and-planning/planning/brownfield-land-register,042
yes,,2018-12-12,,,,0.05,2018-12-12,6,6,6,CHANGE OF USE OF PUBLIC HOUSE (CLASS A4) TO 6 DWELLINGS,Portsmouth City Council,http://opendatacommunities.org/id/unitary-authority/portsmouth,not owned by a public authority,2017-09-28,full planning permission,http://publicaccess.portsmouth.gov.uk/online-applications/applicationDetails.do?activeTab=documents&keyVal=OQD5NJMOMA400,permissioned,,PUBLIC HOUSE 127 ST MARYS ROAD,https://www.portsmouth.gov.uk/ext/development-and-planning/planning/brownfield-land-register,043
yes,,2018-12-12,,,,0.04,2018-12-12,6,6,6,CONS OF BUILDING WITH UNDERCROFT TO FORM 7 SELF CONTAINED FLATS AFTER DEMO OF EXISTING BUIDING,Portsmouth City Council,http://opendatacommunities.org/id/unitary-authority/portsmouth,not owned by a public authority,2016-11-03,full planning permission,http://publicaccess.portsmouth.gov.uk/online-applications/applicationDetails.do?activeTab=documents&keyVal=O6RGZ1MOKVF00,permissioned,,GARAGE AND WORKSHOPS TRAFALGAR PLACE,https://www.portsmouth.gov.uk/ext/development-and-planning/planning/brownfield-land-register,044
yes,,2018-12-12,,,,0.04,2018-12-12,7,7,7,CHANGE OF USE FROM STUDENT HALLS OF RESIDENCE TO FORM 7 FLATS,Portsmouth City Council,http://opendatacommunities.org/id/unitary-authority/portsmouth,not owned by a public authority,2017-05-26,full planning permission,http://publicaccess.portsmouth.gov.uk/online-applications/applicationDetails.do?activeTab=documents&keyVal=ON3ZTJMOKRH00,permissioned,,32 WESTERN PARADE,https://www.portsmouth.gov.uk/ext/development-and-planning/planning/brownfield-land-register,045
yes,,2018-12-12,,,,0.01,2018-12-12,9,9,9,"APP FOR PRIOR APPROVAL RELATING TO THE CHANGE OF USE FROM B1(A) OFFICE USE OF FLOOR 1, 2 & 3 TO 9 C3 FLATS",Portsmouth City Council,http://opendatacommunities.org/id/unitary-authority/portsmouth,not owned by a public authority,2017-03-23,full planning permission,http://publicaccess.portsmouth.gov.uk/online-applications/applicationDetails.do?activeTab=documents&keyVal=OKFND9MO0DR00,permissioned,,"FLOORS 1,2 &3, 101 COMMERCIAL ROAD",https://www.portsmouth.gov.uk/ext/development-and-planning/planning/brownfield-land-register,046
yes,,2018-12-12,,,,0.03,2018-12-12,5,5,5,CONVERSION OF EXISTING 5 DWELLINGS (CLASS C4) TO FORM 10 DWELLINGS (CLASS C3),Portsmouth City Council,http://opendatacommunities.org/id/unitary-authority/portsmouth,not owned by a public authority,2017-09-08,full planning permission,http://publicaccess.portsmouth.gov.uk/online-applications/applicationDetails.do?activeTab=documents&keyVal=ORNOTDMOMYO00,permissioned,,11 OSBORNE ROAD,https://www.portsmouth.gov.uk/ext/development-and-planning/planning/brownfield-land-register,047
