Deliverable,EndDate,FirstAddedDate,GeoX,GeoY,HazardousSubstances,Hectares,LastUpdatedDate,MinNetDwellings,NetDwellingsRangeFrom,NetDwellingsRangeTo,Notes,OrganisationLabel,OrganisationURI,OwnershipStatus,PermissionDate,PermissionType,PlanningHistory,PlanningStatus,SiteNameAddress,SiteReference,SiteplanURL,entity,point,brownfield-land
,,2018-01-15,1.156828,51.789301,,0.16,2018-01-15,23,23,23,"Demolition of all existing buildings (use classes C1 Hotels, A3 Restaurants, A4 Drinking Establishments and Sui Generis Nightclub). Construction of building fronting Rosemary Road containing three A1 retail/A3 restaurant units at ground floor with 17 holiday flats above; Construction of 34 holiday flats in an up to six storey building to the rear; and construction of basement cycle and car parking access from rear service road (off Beach Road), and egress onto Rosemary Road.",Tendring District Council,http://opendatacommunities.org/id/district-council/tendring,not owned by a public authority,,,https://idox.tendringdc.gov.uk/online-applications/propertyDetails.do?activeTab=relatedCases&keyVal=001GB1QBLI000,pending decision,"Sandles Inn, 26 Rosemary Road, Clacton On Sea, Essex CO15 1NZ",15/00578/FUL,https://idox.tendringdc.gov.uk/online-applications/applicationDetails.do?activeTab=map&keyVal=NN3PR3QB0GD00,,,
yes,,2018-01-15,1.289262,51.9462,,0.02,2018-01-15,3,3,3,"Demolition of existing building (retail ground floor & residential 1st, 2nd, 3rd floors) and replacement with new residential 4 storey building providing 8 proposed apartments.",Tendring District Council,http://opendatacommunities.org/id/district-council/tendring,not owned by a public authority,2015-06-16,full planning permission,https://idox.tendringdc.gov.uk/online-applications/propertyDetails.do?activeTab=relatedCases&keyVal=001EL0QBLI000,permissioned,"20 - 20B Market Street, Harwich CO12 3DX",15/00615/FUL,https://idox.tendringdc.gov.uk/online-applications/applicationDetails.do?activeTab=map&keyVal=NN9NLWQB0GS00,,,
yes,,2018-01-15,1.271002,51.848196,,0.07,2018-01-15,8,8,8,"Demolition of existing commercial building and erection of new building containing 8 No. flats and 1 No. retail unit (Use Classes A1, A2 and A3), with associated parking, cycle and bin- stores",Tendring District Council,http://opendatacommunities.org/id/district-council/tendring,not owned by a public authority,2017-08-16,full planning permission,https://idox.tendringdc.gov.uk/online-applications/propertyDetails.do?activeTab=relatedCases&keyVal=MJAEN0QB03B00,permissioned,"27-31 High Street, Walton On The Naze, Essex CO14 8BN",17/01038/FUL,https://idox.tendringdc.gov.uk/online-applications/applicationDetails.do?activeTab=map&keyVal=ORY6F4QB0EL00,,,
yes,,2018-01-15,1.15832,51.841011,,0.46,2018-01-15,7,7,7,Proposed conversion to 8 no. apartments. Change of use from C2 to C3.,Tendring District Council,http://opendatacommunities.org/id/district-council/tendring,not owned by a public authority,2017-09-27,full planning permission,https://idox.tendringdc.gov.uk/online-applications/propertyDetails.do?activeTab=relatedCases&keyVal=000F5JQBLI000,permissioned,"274 Harwich Road, Little Clacton, Clacton On Sea, Essex CO16 9PY",17/01048/FUL,https://idox.tendringdc.gov.uk/online-applications/applicationDetails.do?activeTab=map&keyVal=OS5W9RQB0KO00,,,
yes,,2018-01-15,1.11836,51.77336,,0.02,2018-01-15,7,7,7,Demolition of existing fire damaged building and erection of new block of flats.,Tendring District Council,http://opendatacommunities.org/id/district-council/tendring,not owned by a public authority,2017-02-02,full planning permission,https://idox.tendringdc.gov.uk/online-applications/propertyDetails.do?activeTab=relatedCases&keyVal=000MBIQBLI000,permissioned,"7 Sea Pink Way, Jaywick, Essex CO15 2HQ",16/01358/FUL,https://idox.tendringdc.gov.uk/online-applications/applicationDetails.do?activeTab=map&keyVal=OCS432QB0GS00,,,
,,2018-01-15,1.245941,51.929875,,0.1,2018-01-15,9,9,9,Permission granted - expired 17.01.2015. Demolition completed.. Demolition of existing buildings and construction of 9 one bedroom flats.,Tendring District Council,http://opendatacommunities.org/id/district-council/tendring,not owned by a public authority,2012-01-17,,https://idox.tendringdc.gov.uk/online-applications/propertyDetails.do?activeTab=relatedCases&keyVal=001F68QBLI000,Not Permissioned,723 Main Road Harwich Essex,11/01124/FUL,https://idox.tendringdc.gov.uk/online-applications/applicationDetails.do?activeTab=map&keyVal=LRYT6ZQB07Y00,,,
yes,,2018-01-15,1.210781,51.926884,,0.62,2018-01-15,8,8,8,Redevelopment of site with eight dwellings.,Tendring District Council,http://opendatacommunities.org/id/district-council/tendring,not owned by a public authority,2016-06-02,full planning permission,https://idox.tendringdc.gov.uk/online-applications/propertyDetails.do?activeTab=relatedCases&keyVal=MBL014QB03B00,permissioned,"Land Site of Former Ramsey Primary School, Wix Road, Ramsey, Essex",15/01575/FUL,https://idox.tendringdc.gov.uk/online-applications/applicationDetails.do?activeTab=map&keyVal=NW7EX1QB0GS00,,,
yes,,2018-01-15,1.064189,51.944707,,0.04,2018-01-15,7,7,7,"Alterations and extensions of existing vacant bank premises, to provide a retail unit and change of use to multi-residential accommodation. (1 Retail Unit, 6 Flats and 1 House).",Tendring District Council,http://opendatacommunities.org/id/district-council/tendring,not owned by a public authority,2017-11-10,full planning permission,https://idox.tendringdc.gov.uk/online-applications/propertyDetails.do?activeTab=relatedCases&keyVal=001E5JQBLI000,permissioned,"2 High Street, Manningtree, Essex CO11 1AD",17/01479/FUL,https://idox.tendringdc.gov.uk/online-applications/applicationDetails.do?activeTab=map&keyVal=OVUUROQB0LD00,,,
yes,,2018-01-15,1.247233,51.832491,,0.1,2018-01-15,8,8,8,"Demolition of existing buildings and redevelopment of site to provide retail units (use class A1) at ground floor level, eight two - bedroom residential units (use class C3) at first and second floor level, and associated parking and works.",Tendring District Council,http://opendatacommunities.org/id/district-council/tendring,not owned by a public authority,2014-07-15,full planning permission,https://idox.tendringdc.gov.uk/online-applications/propertyDetails.do?activeTab=relatedCases&keyVal=MM0U3RQB03B01,permissioned,"70-84A Connaught Avenue, Frinton",14/00693/FUL,https://idox.tendringdc.gov.uk/online-applications/applicationDetails.do?activeTab=map&keyVal=N6A5IUQB0G400,,,
yes,,2018-01-15,1.28496,51.940505,,0.05,2018-01-15,8,8,8,Erection of 8 x one bed flats,Tendring District Council,http://opendatacommunities.org/id/district-council/tendring,not owned by a public authority,2016-03-22,full planning permission,https://idox.tendringdc.gov.uk/online-applications/propertyDetails.do?activeTab=relatedCases&keyVal=0012RFQBLI000,permissioned,"79 Stour Road, Harwich",15/01791/FUL,https://idox.tendringdc.gov.uk/online-applications/applicationDetails.do?activeTab=map&keyVal=NYF3JHQB01U00,,,
yes,,2018-01-15,1.163058,51.85806,,0.22,2018-01-15,8,8,8,Reserved matters application for the demolition of existing garage workshops and erection of 8 no. mixed residential units and one shop/office.,Tendring District Council,http://opendatacommunities.org/id/district-council/tendring,not owned by a public authority,2016-10-31,reserved matters approval,https://idox.tendringdc.gov.uk/online-applications/propertyDetails.do?activeTab=relatedCases&keyVal=001JZUQBLI000,permissioned,"Forbourn Motors, High Street, Thorpe-le-Soken",16/01397/DETAIL,https://idox.tendringdc.gov.uk/online-applications/applicationDetails.do?activeTab=map&keyVal=OD2VICQB0K100,,,
yes,,2018-01-15,1.081013,51.943954,,0.21,2018-01-15,2,2,2,"Demolition of an existing extension, conversion of a building comprising of four flats and office to provide three dwellings, the construction of three new dwellings, associated access and landscaping.",Tendring District Council,http://opendatacommunities.org/id/district-council/tendring,not owned by a public authority,2015-12-24,full planning permission,https://idox.tendringdc.gov.uk/online-applications/propertyDetails.do?activeTab=relatedCases&keyVal=001K6PQBLI000,permissioned,"The Abbey, High Street, Mistley",15/01634/FUL,https://idox.tendringdc.gov.uk/online-applications/applicationDetails.do?activeTab=map&keyVal=NWVIXSQB0JH00,,,
yes,,2018-01-15,1.154419,51.789086,,0.07,2018-01-15,7,7,7,,Tendring District Council,http://opendatacommunities.org/id/district-council/tendring,not owned by a public authority,2017-01-31,full planning permission,https://idox.tendringdc.gov.uk/online-applications/propertyDetails.do?activeTab=relatedCases&keyVal=OYA2O4QB03B00,permissioned,"The Carlton, Rosemary Road, Clacton On Sea, Essex",16/00562/FUL,https://idox.tendringdc.gov.uk/online-applications/applicationDetails.do?activeTab=map&keyVal=O5MF8LQB0EL00,,,
yes,,2018-01-15,1.267731,51.931754,,0.25,2018-01-15,6,6,6,Proposed residential development to provide 6 detached dwellings.,Tendring District Council,http://opendatacommunities.org/id/district-council/tendring,not owned by a public authority,2015-01-06,outline planning permission,https://idox.tendringdc.gov.uk/online-applications/propertyDetails.do?activeTab=relatedCases&keyVal=001EZRQBLI000,permissioned,"Former Red Cross Centre, Manor Lane, Dovercourt, CO12 4EB",14/01552/OUT,https://idox.tendringdc.gov.uk/online-applications/applicationDetails.do?activeTab=map&keyVal=NDQOJMQB0G400,,,
,,2018-01-15,1.035097,51.88916,,0.48,2018-01-15,8,8,8,"Proposed 8 new supported living apartments, staff office, car park and landscaping and demolition of existing lean-to store and wall to make way new access driveway.",Tendring District Council,http://opendatacommunities.org/id/district-council/tendring,not owned by a public authority,2014-12-19,,https://idox.tendringdc.gov.uk/online-applications/propertyDetails.do?activeTab=relatedCases&keyVal=LTQDBYQB03B00,Not Permissioned,"Hamilton Lodge, Parsons Hill, Great Bromley",14/01560/FUL,https://idox.tendringdc.gov.uk/online-applications/applicationDetails.do?activeTab=map&keyVal=NDSELDQB0G400,,,
yes,,2018-01-15,1.059937,51.858462,,0.59,2018-01-15,8,8,8,Erection of eight two-storey dwellings following demolition of and alteration to existing buildings.,Tendring District Council,http://opendatacommunities.org/id/district-council/tendring,not owned by a public authority,2017-08-14,full planning permission,https://idox.tendringdc.gov.uk/online-applications/propertyDetails.do?activeTab=relatedCases&keyVal=001LF1QBLI000,permissioned,"Sturricks Farm, Sturrick Lane, Great Bentley, Colchester, Essex",17/00456/FUL,https://idox.tendringdc.gov.uk/online-applications/applicationDetails.do?activeTab=map&keyVal=ON43S4QB0KO00,,,
yes,,2017-12-29,1.104947,51.772139,,0.05,2017-12-29,9,9,9,"Demolition of existing detached bungalows and erection of four storey block of flats, comprising of car parking and storage to ground floor and first, second and third floor residential with associated amenity.",Tendring District Council,http://opendatacommunities.org/id/district-council/tendring,not owned by a public authority,2017-01-12,full planning permission,https://idox.tendringdc.gov.uk/online-applications/propertyDetails.do?activeTab=relatedCases&keyVal=O8RGQPQB03B01,permissioned,"32-37 Brooklands, Jaywick, Essex CO15 2JS",16/00920/FUL,https://idox.tendringdc.gov.uk/online-applications/applicationDetails.do?activeTab=map&keyVal=O8T18DQB0JH00,,,
yes,,2018-01-15,1.164873,51.866585,,0.21,2018-01-15,6,6,6,,Tendring District Council,http://opendatacommunities.org/id/district-council/tendring,not owned by a public authority,2015-02-23,Other,https://idox.tendringdc.gov.uk/online-applications/propertyDetails.do?activeTab=relatedCases&keyVal=0004NRQBLI000,permissioned,"Valley Barns, Golden Lane, Thorpe le Soken",15/00013/COUNOT,https://idox.tendringdc.gov.uk/online-applications/applicationDetails.do?activeTab=map&keyVal=NHUSIXQB0GS00,,,
yes,,2018-01-15,0.998936,51.853685,,0.09,2018-01-15,4,4,4,Extensions and alterations to create 7 flats with associated parking facilities - revisions to 17/00495/FUL including the demolition and rebuilding of the walls to the former bungalow and changes to the fenestration and external materials.,Tendring District Council,http://opendatacommunities.org/id/district-council/tendring,not owned by a public authority,2017-12-01,full planning permission,https://idox.tendringdc.gov.uk/online-applications/propertyDetails.do?activeTab=relatedCases&keyVal=000U58QBLI000,permissioned,"58/58A Station Road, Alresford, Colchester, Essex",17/01721/FUL,https://idox.tendringdc.gov.uk/online-applications/applicationDetails.do?activeTab=map&keyVal=OXK8LHQB0LD00,,,
yes,,2017-12-29,1.156717,51.787443,,0.09,2017-12-29,14,14,14,Planning Permission expired. Demolition of existing building containing bar/restaurant and flat over (to facilitate construction of new 5 storey building with restaurant/bar at ground floor level with car parking under and 14 residential apartments over approved under 11/01317/FUL).,Tendring District Council,http://opendatacommunities.org/id/district-council/tendring,not owned by a public authority,,,https://idox.tendringdc.gov.uk/online-applications/propertyDetails.do?activeTab=relatedCases&keyVal=001G95QBLI000,Not Permissioned,"3 Marine Parade East, Clacton-on-Sea, Essex CO15 1PT",14/01375/FUL,https://idox.tendringdc.gov.uk/online-applications/applicationDetails.do?activeTab=map&keyVal=NCANP0QB0G400,,,
yes,,2017-12-29,1.103896,51.772088,,0.06,2017-12-29,11,11,11,"Demolition of existing detached bungalows and erection of four storey block of flats, comprising of car parking and storage to ground floor and first, second and third floor residential with associated amenity.",Tendring District Council,http://opendatacommunities.org/id/district-council/tendring,not owned by a public authority,2017-01-12,full planning permission,https://idox.tendringdc.gov.uk/online-applications/propertyDetails.do?activeTab=relatedCases&keyVal=0009TWQBLI000,permissioned,"23 - 27 Brooklands, Jaywick, Essex",16/00921/FUL,https://idox.tendringdc.gov.uk/online-applications/applicationDetails.do?activeTab=map&keyVal=O8T23GQB0JH00,,,
yes,,2017-12-29,1.148464,51.797025,,0.88,2017-12-29,60,60,60,"Demolition of building, site clearance with retention of TPO trees (excluding tree ref T13 under 16/01364/TPO) and redevelopment of the site to a C2 use as an independent living residential home with 60 units with associated infrastructure, car parking and vehicle access and hard and soft landscaping.",Tendring District Council,http://opendatacommunities.org/id/district-council/tendring,owned by a public authority,2017-02-24,full planning permission,https://idox.tendringdc.gov.uk/online-applications/propertyDetails.do?activeTab=relatedCases&keyVal=0017T5QBLI000,permissioned,"Coppins Court, Coppins Road, Clacton On Sea, Essex",16/01916/FUL,https://idox.tendringdc.gov.uk/online-applications/applicationDetails.do?activeTab=map&keyVal=OH3LP6QB0KO00,,,
yes,,2017-12-29,1.158442,51.804801,,0.27,2017-12-29,9,9,9,Construction of 9no. almshouse-type two bed dwellings.,Tendring District Council,http://opendatacommunities.org/id/district-council/tendring,not owned by a public authority,2017-12-22,full planning permission,https://idox.tendringdc.gov.uk/online-applications/propertyDetails.do?activeTab=relatedCases&keyVal=00069VQBLI000,permissioned,"Former Car Park off Ravensdale, Clacton On Sea, Essex",17/01708/FUL,https://idox.tendringdc.gov.uk/online-applications/applicationDetails.do?activeTab=map&keyVal=OXENTEQB0KO00,,,
yes,,2017-12-29,1.254404,51.933039,,1.72,2017-12-29,66,66,66,"Demolition of existing buildings and redevelopment to provide 66 dwellings with associated highways, infrastructure and landscaping works.",Tendring District Council,http://opendatacommunities.org/id/district-council/tendring,not owned by a public authority,2016-12-16,full planning permission,https://idox.tendringdc.gov.uk/online-applications/propertyDetails.do?activeTab=relatedCases&keyVal=OV6RNNQB03B02,permissioned,"Former Delfords Factory Site, 606 Main Road, Harwich, Essex",16/00729/FUL,https://idox.tendringdc.gov.uk/online-applications/applicationDetails.do?activeTab=map&keyVal=O70Q8UQB0GS00,,,
yes,,2017-12-29,1.268648,51.850266,,0.21,2017-12-29,16,16,16,A two storey enabled living facility providing 16 apartments for profoundly disabled adults.,Tendring District Council,http://opendatacommunities.org/id/district-council/tendring,not owned by a public authority,2017-08-11,full planning permission,https://idox.tendringdc.gov.uk/online-applications/propertyDetails.do?activeTab=relatedCases&keyVal=NR40VEQB03B00,permissioned,"Former Martello Caravan Park, Kirby Road, Walton On The Naze, Essex",17/00571/FUL,https://idox.tendringdc.gov.uk/online-applications/applicationDetails.do?activeTab=map&keyVal=ONZIAPQB01U00,,,
,,2017-12-29,1.15595,51.787428,,0.36,2017-12-29,47,47,47,"Refurbishment, partial demolition and extension to form 25 bed hotel, bar, restaurant, up to 7 (A1/A2/A3/B1/D1) Commercial Units, 47 apartments, new public realm and landscape planting.",Tendring District Council,http://opendatacommunities.org/id/district-council/tendring,not owned by a public authority,2009-08-25,full planning permission,https://idox.tendringdc.gov.uk/online-applications/propertyDetails.do?activeTab=relatedCases&keyVal=001GH9QBLI000,permissioned,"Royal Hotel, Marine Parade East. Clacton-on-Sea CO15 1PT",06/00255/FUL,https://idox.tendringdc.gov.uk/online-applications/applicationDetails.do?activeTab=map&keyVal=IUQ9HCQBV1000,,,
yes,,2017-12-29,1.163076,51.847761,,1.9,2017-12-29,54,54,54,"Planning Permission expired. Conversion of existing Grade II listed maltings building to residential use (creating 31 apartments) including the part demolition, re-building and alteration of the existing structure. Conversion of existing vacant King Edward VII public house to private residential (creating 3 apartments). Demolition of former stable block and development of 20 new dwellings and commercial unit including associated infrastructure and public open space.",Tendring District Council,http://opendatacommunities.org/id/district-council/tendring,not owned by a public authority,,,https://idox.tendringdc.gov.uk/online-applications/propertyDetails.do?activeTab=relatedCases&keyVal=JF9GW8QBB3001,Not Permissioned,"Land at Thorpe Maltings & Former King Edward VII Public House, Station Road, Thorpe le soken",13/01385/FUL,https://idox.tendringdc.gov.uk/online-applications/applicationDetails.do?activeTab=map&keyVal=MXA5NGQB09L00,,,
yes,,2017-12-29,1.251836,51.84471,,0.27,2017-12-29,12,12,12,Construction of 12 almshouse-type one bed dwellings.,Tendring District Council,http://opendatacommunities.org/id/district-council/tendring,not owned by a public authority,2017-09-28,full planning permission,https://idox.tendringdc.gov.uk/online-applications/propertyDetails.do?activeTab=relatedCases&keyVal=OXJXPEQB03B02,permissioned,"The Ernest Luff Home, 2 Luff Way, Walton On The Naze, Essex CO14 8SW",17/01080/FUL,https://idox.tendringdc.gov.uk/online-applications/applicationDetails.do?activeTab=map&keyVal=OSCUT2QB0KO00,,,
yes,,2017-12-29,1.081865,51.944088,,0.25,2017-12-29,45,45,45,"Demolition of existing warehouse and construction of a new building comprising 45 dwellings, quay level warehouse floorspace, office floorspace and car parking provision.",Tendring District Council,http://opendatacommunities.org/id/district-council/tendring,not owned by a public authority,2014-06-26,full planning permission,https://idox.tendringdc.gov.uk/online-applications/propertyDetails.do?activeTab=relatedCases&keyVal=001E8TQBLI000,permissioned,"Thorn Quay Warehouse, High Street, Mistley, Manningtree, Essex CO11 1HB",12/00427/FUL,https://idox.tendringdc.gov.uk/online-applications/applicationDetails.do?activeTab=map&keyVal=M2MBDRQB07Y00,,,
yes,,2017-12-29,1.156987,51.791739,,0.09,2017-12-29,9,9,9,"Change of use of former care-home and dwelling and erection of single storey rear extension to create 11 self-contained flats; demolition of existing flat-roof rear extension, and removal of metal fire escapes, along with associated parking, cycle-storage, bin-store and communal garden area.",Tendring District Council,http://opendatacommunities.org/id/district-council/tendring,not owned by a public authority,2017-08-31,full planning permission,https://idox.tendringdc.gov.uk/online-applications/propertyDetails.do?activeTab=relatedCases&keyVal=K8FAXQQB03B01,permissioned,"Sea Breeze, 32 and 34 Carnarvon Road, Clacton On Sea, Essex CO15 6QE",17/00435/FUL,https://idox.tendringdc.gov.uk/online-applications/applicationDetails.do?activeTab=map&keyVal=OMUOE8QB0EL00,,,
yes,,2018-01-15,1.083599,51.943705,,0.19,2018-01-15,6,6,6,,Tendring District Council,http://opendatacommunities.org/id/district-council/tendring,not owned by a public authority,2014-07-08,full planning permission,https://idox.tendringdc.gov.uk/online-applications/propertyDetails.do?activeTab=relatedCases&keyVal=NVR5YIQB03B00,permissioned,"The Barley Kiln, Malt Store and Malt Kiln, The Quayside Maltings,High Street, Mistley",13/01213/FUL,https://idox.tendringdc.gov.uk/online-applications/applicationDetails.do?activeTab=map&keyVal=MVDJVDQB09L00,,,
,,2017-12-29,1.155824,51.789331,,0.09,2017-12-29,16,16,16,Conversion of the existing first and second floors and erection of a third floor and extensions to create 16 self contained flats.,Tendring District Council,http://opendatacommunities.org/id/district-council/tendring,not owned by a public authority,2015-10-23,full planning permission,https://idox.tendringdc.gov.uk/online-applications/propertyDetails.do?activeTab=relatedCases&keyVal=001GEIQBLI000,permissioned,"Rumours Nightclub, 50 Rosemary Road, Clacton On Sea, Essex CO15 1PB",14/00593/FUL,https://idox.tendringdc.gov.uk/online-applications/applicationDetails.do?activeTab=map&keyVal=N55H65QB09L00,,,
yes,,2017-12-29,1.251886,51.8371,,0.12,2017-12-29,9,9,9,"Demolition of a mixed commercial and residential building and two commercial units and erection of 2 no. apartment blocks containing 10 residential units with ancillary car parking, garaging and bin store.",Tendring District Council,http://opendatacommunities.org/id/district-council/tendring,not owned by a public authority,2016-08-23,full planning permission,https://idox.tendringdc.gov.uk/online-applications/propertyDetails.do?activeTab=relatedCases&keyVal=00024PQBLI000,permissioned,"88 - 90 Pole Barn Lane, Frinton On Sea, Essex CO13 9NG",16/00538/FUL,https://idox.tendringdc.gov.uk/online-applications/applicationDetails.do?activeTab=map&keyVal=O5IY1RQB01U00,,,
yes,,2017-12-29,1.238819,51.929941,,2.48,2017-12-29,38,38,38,Hybrid application consisting of: Full application for a replacement factory on northern component of site (following demolition of existing office).,Tendring District Council,http://opendatacommunities.org/id/district-council/tendring,not owned by a public authority,2017-05-16,outline planning permission,https://idox.tendringdc.gov.uk/online-applications/propertyDetails.do?activeTab=relatedCases&keyVal=001EX4QBLI000,permissioned,"Sato UK Limited, Valley Road, Dovercourt, Harwich, Essex CO12 4RR",17/00370/OUT,https://idox.tendringdc.gov.uk/online-applications/applicationDetails.do?activeTab=map&keyVal=NVUWN9QB0GS00,,,
yes,,2017-12-29,1.121092,51.858505,,0.81,2017-12-29,24,24,24,,Tendring District Council,http://opendatacommunities.org/id/district-council/tendring,owned by a public authority,,,,Not permissioned,"Land at Weeley Council Offices, Thorpe Road, Weeley CO16 9AJ",MSA1,https://www.tendringdc.gov.uk/sites/default/files/documents/planning/planning%20policy/brownfield/SAMU1%20EDME%20Maltings%20Mistley.pdf,,,
yes,,2017-12-29,1.151095,51.802469,,0.38,2017-12-29,20,20,20,,Tendring District Council,http://opendatacommunities.org/id/district-council/tendring,not owned by a public authority,,,https://idox.tendringdc.gov.uk/online-applications/propertyDetails.do?activeTab=relatedCases&keyVal=001H55QBLI000,Not permissioned,"Orchard Works, r/o London Road, Clacton-on-Sea, Essex CO15 3SY",MSA3,https://idox.tendringdc.gov.uk/online-applications/applicationDetails.do?activeTab=map&keyVal=OUD50BQB0EL00,,,
yes,,2017-12-29,1.129953,51.802337,,2.3,2017-12-29,90,90,90,,Tendring District Council,http://opendatacommunities.org/id/district-council/tendring,not owned by a public authority,,,https://idox.tendringdc.gov.uk/online-applications/propertyDetails.do?activeTab=relatedCases&keyVal=0001GHQBLI000,Not permissioned,"Land Off Waterworks Drive, Clacton-on-Sea, Essex CO16 8AW",MSA6,https://www.tendringdc.gov.uk/sites/default/files/documents/planning/planning%20policy/brownfield/MSA6%20Land%20off%20Waterworks%20Drive.pdf,,,
yes,,2017-12-29,1.271962,51.848772,,0.06,2017-12-29,15,15,15,,Tendring District Council,http://opendatacommunities.org/id/district-council/tendring,not owned by a public authority,,,https://idox.tendringdc.gov.uk/online-applications/propertyDetails.do?activeTab=relatedCases&keyVal=0003G0QBLI000,Not permissioned,"Former Town Hall Site, Public Conveniences and Depot, Mill Lane, Walton-on-Naze",MSA9,https://www.tendringdc.gov.uk/sites/default/files/documents/planning/planning%20policy/brownfield/MSA9%20Former%20Town%20Hall%20Site%2C%20Mill%20Lane.pdf,,,
yes,,2017-12-29,1.267263,51.84295,,0.8,2017-12-29,15,15,15,,Tendring District Council,http://opendatacommunities.org/id/district-council/tendring,not owned by a public authority,,,https://idox.tendringdc.gov.uk/online-applications/propertyDetails.do?activeTab=relatedCases&keyVal=001G4BQBLI000,Not permissioned,"Southcliffe Trailer Park, Woodberry Way, Walton-on-the-Naze, Essex CO14 8PE",MSA10,https://www.tendringdc.gov.uk/sites/default/files/documents/planning/planning%20policy/brownfield/MSA10%20Southcliff%20Trailer%20Park.pdf,,,
