Deliverable,EndDate,FirstAddedDate,GeoX,GeoY,HazardousSubstances,Hectares,LastUpdatedDate,MinNetDwellings,NetDwellingsRangeFrom,NetDwellingsRangeTo,Notes,OrganisationLabel,OrganisationURI,OwnershipStatus,PermissionDate,PermissionType,PlanningHistory,PlanningStatus,point,SiteNameAddress,SiteplanURL,SiteReference
yes,,2017-11-09,-1.73146,54.375864,,0.85,2018-11-22,40,40,40,Outline Permission (14/00109/OUT) granted Sept 2014 for up to 40 dwellings now expired. Full application refused (15/00587/FULL) due to lack of affordable housing. Appeal dismissed March 2016.. Redevelopment for up to 40 dwellings,Richmondshire District Council,http://opendatacommunities.org/id/district-council/richmondshire,not owned by a public authority,,,,not permissioned,,"Land at Somerset Close, Catterick Garrison",https://www.richmondshire.gov.uk/planning/planning-policy/brownfield-land-register/,SHLAA120
,,2017-11-09,-1.680673,54.380117,,0.9,2018-11-22,20,20,25,Extensive planning history inc mixed use development (07/00282/FULL). The site could be redeveloped for housing for between 20 and 25 dwellings,Richmondshire District Council,http://opendatacommunities.org/id/district-council/richmondshire,,,,,not permissioned,,"Land adjacent Lidl, Colburn, Catterick Garrison",https://www.richmondshire.gov.uk/planning/planning-policy/brownfield-land-register/,SHLAA185
,,2017-11-09,-1.680713,54.380881,,0.56,2018-11-22,15,15,20,"Certificate of Lawfulness for the Implementation of Planning Permission ref: 12/00515/FULL for Full Planning Permission for Development of Land to Provide Specialist Autism Centre Comprising a Total of 24 Bedrooms Together with Associated Communal Facilities, Car Parking and Landscaping. Permission not to be implemented further and is currently being marketed for sale. The site could be redeveloped for housing for between 15 and 20 dwellings",Richmondshire District Council,http://opendatacommunities.org/id/district-council/richmondshire,not owned by a public authority,2012-09-24,full planning permission,,permissioned,,"Richmond Park, Colburn, Catterick Garrison",https://www.richmondshire.gov.uk/planning/planning-policy/brownfield-land-register/,SHLAA186
yes,,2017-11-09,-1.739007,54.404504,,0.06,2018-11-22,5,5,5,Full permission (15/00992/FULL) granted & site being marketed to developers.. Refurbishment and extension of Friary Lodge to create 5 No apartments,Richmondshire District Council,http://opendatacommunities.org/id/district-council/richmondshire,owned by a public authority,2016-03-24,full planning permission,,permissioned,,"Friary Lodge, Richmond",https://www.richmondshire.gov.uk/planning/planning-policy/brownfield-land-register/,SHLAA228
yes,,2017-11-09,-1.705661,54.332566,,0.05,2018-11-22,14,14,14,"Revised application granted (17/00098/FULL). Demolition of existing buildings, erection of 13 new build dwellings and conversion of existing building to 1 dwelling (14 in total) together with new garaging and ancillary works",Richmondshire District Council,http://opendatacommunities.org/id/district-council/richmondshire,not owned by a public authority,2018-01-17,full planning permission,,permissioned,,"Adelphi House, Hunton",https://www.richmondshire.gov.uk/planning/planning-policy/brownfield-land-register/,SHLAA307
yes,,2017-11-09,-1.646505,54.473838,,0.15,2018-11-22,6,6,6,Application for 6 units permitted (14/00917/FULL). Demolition of Haulage Depot and construction of 1 No. Detached Dwelling and 5. No Terraced Dwellings including associated access and car parking,Richmondshire District Council,http://opendatacommunities.org/id/district-council/richmondshire,not owned by a public authority,2018-10-18,full planning permission,,permissioned,,"Old Haulage Depot, Barton",https://www.richmondshire.gov.uk/planning/planning-policy/brownfield-land-register/,SHLAA153
yes,,2018-11-22,-1.708196,54.374255,,5.8,2018-11-22,100,100,125,This could be redeveloped for between 100 and 125 units,Richmondshire District Council,http://opendatacommunities.org/id/district-council/richmondshire,owned by a public authority,,,,not permissioned,,"Former Duchess Kent Hospital, Catterick Garrison",https://www.richmondshire.gov.uk/planning/planning-policy/brownfield-land-register/,SHLAA371
yes,,2018-11-22,-1.710025,54.372489,,4,2018-11-22,170,170,170,"Permission granted for up to 170 services families homes (16/00145/OUT). Residential Development (Up to a Maximum of 170 Units) with Associated Access, Landscaping and Open Space, Service Families Accommodation",Richmondshire District Council,http://opendatacommunities.org/id/district-council/richmondshire,owned by a public authority,2017-03-17,outline planning permission,,permissioned,,"Land North Le Cateau School, Catterick Garrison",https://www.richmondshire.gov.uk/planning/planning-policy/brownfield-land-register/,SHLAA378
