Deliverable,EndDate,FirstAddedDate,GeoX,GeoY,HazardousSubstances,Hectares,LastUpdatedDate,MinNetDwellings,NetDwellingsRangeFrom,NetDwellingsRangeTo,Notes,OrganisationLabel,OrganisationURI,OwnershipStatus,PermissionDate,PermissionType,PlanningHistory,PlanningStatus,SiteNameAddress,SiteReference,SiteplanURL,entity,point,brownfield-land
yes,,2017-12-14,-0.747469,51.6284,,0.04,2018-12-18,5,5,5,Change of use of existing building (use class A2) to residential (use class C3) comprising 4 x 1 bed and 1 x 2 bed flats,Wycombe District Council,http://opendatacommunities.org/id/district-council/wycombe,not owned by a public authority,2018-06-02,full planning permission,,permissioned,"6 Easton Street, High Wycombe, HP11 1NJ",HABBEY304,https://mywycombe.wycombe.gov.uk/mywycombe.aspx?MapSource=Wycombe/AllMaps&StartEasting=486794.0&StartNorthing=192928.92&StartZoom=300&o=1&Layers=brownfield&ZoomPin=1,,,
yes,,2017-12-14,-0.747603,51.6279,,0.06,2018-12-18,10,10,10,"Retention of office use at ground floor and raising of roof to rear element of building, conversion of the upper floors to provide 10 x 1 bed flats with associated parking and landscaping (alternative scheme to pp 16/07844/FUL)",Wycombe District Council,http://opendatacommunities.org/id/district-council/wycombe,not owned by a public authority,2017-05-24,full planning permission,,permissioned,"89 - 90 Easton Street, High Wycombe, HP11 1LT",HABBEY322,https://mywycombe.wycombe.gov.uk/mywycombe.aspx?MapSource=Wycombe/AllMaps&StartEasting=486785.78&StartNorthing=192868.61&StartZoom=300&o=1&Layers=brownfield&ZoomPin=1,,,
yes,,2017-12-14,-0.766004,51.618,,0.08,2018-12-18,7,7,7,"Demolition of existing buildings and erection of single block comprising 7 x 1 bed and 2 x 2 bed apartments with internal cycle stores, bin stores, parking and associated landscaping",Wycombe District Council,http://opendatacommunities.org/id/district-council/wycombe,not owned by a public authority,2017-06-01,full planning permission,,permissioned,"30 & 30a Marlow Road, High Wycombe, HP11 1TB",HABBEY323,https://mywycombe.wycombe.gov.uk/mywycombe.aspx?MapSource=Wycombe/AllMaps&StartEasting=485530.735&StartNorthing=191744.725&StartZoom=300&o=1&Layers=brownfield&ZoomPin=1,,,
yes,,2017-12-14,-0.757558,51.6329,,0.42,2018-12-18,72,72,72,"Prior notification application (Part 3, Class O) for change of use of existing building falling within Class B1(a) (offices) to Class C3 (dwellinghouses) to create 72 dwellings comprising of 62 studio flats, 8 x 1 bed units and 2 x 2 bed units).",Wycombe District Council,http://opendatacommunities.org/id/district-council/wycombe,not owned by a public authority,2017-08-14,full planning permission,,permissioned,"Aria House, 80 Oxford Road, High Wycombe, HP11 2DX",HABBEY331,https://mywycombe.wycombe.gov.uk/mywycombe.aspx?MapSource=Wycombe/AllMaps&StartEasting=486087.23&StartNorthing=193415.731&StartZoom=300&o=1&Layers=brownfield&ZoomPin=1,,,
yes,,2017-12-14,-0.764279,51.6261,,0.06,2018-12-18,6,6,6,"Construction of part two storey, part first floor extensions with 2 x balconies to front and associated external alterations in connection with conversion of existing offices to 5 x 2 bed flats",Wycombe District Council,http://opendatacommunities.org/id/district-council/wycombe,not owned by a public authority,2017-09-21,full planning permission,,permissioned,"195b, c, d, & e Desborough Avenue, High Wycombe, HP11 2TW",HABBEY334,https://mywycombe.wycombe.gov.uk/mywycombe.aspx?MapSource=Wycombe/AllMaps&StartEasting=485634.905&StartNorthing=192648.62&StartZoom=300&o=1&Layers=brownfield&ZoomPin=1,,,
yes,,2017-12-14,-0.711494,51.5768,,0.11,2018-12-18,6,6,6,"Prior notification application (Part 3, Class O) for change of use of existing building falling within Class B1(a) (office) to Class C3 (dwellinghouse) to create 6 dwellings",Wycombe District Council,http://opendatacommunities.org/id/district-council/wycombe,not owned by a public authority,2017-09-21,full planning permission,,permissioned,"Unit 3, Station Court, Station Road, Bourne End",HBOURN143,https://mywycombe.wycombe.gov.uk/mywycombe.aspx?MapSource=Wycombe/AllMaps&StartEasting=489385.314&StartNorthing=187225.263&StartZoom=300&o=1&Layers=brownfield&ZoomPin=1,,,
yes,,2017-12-14,-0.706859,51.5772,,0.1,2018-12-18,5,5,5,"Erection of 3 storey building comprising 4 x 2 bed and 1 x 1 bed flats together with undercroft car parking, cycle parking and bin storage along with associated amenity space and landscaping",Wycombe District Council,http://opendatacommunities.org/id/district-council/wycombe,not owned by a public authority,2017-10-24,full planning permission,,permissioned,"Land North of Comino House, Furlong Road, Bourne End",HBOURN144,https://mywycombe.wycombe.gov.uk/mywycombe.aspx?MapSource=Wycombe/AllMaps&StartEasting=489705.595&StartNorthing=187278.875&StartZoom=300&o=1&Layers=brownfield&ZoomPin=1,,,
yes,,2017-12-14,-0.774797,51.5733,,0.03,2018-12-18,6,6,6,Prior notification application (Class J) for change of use of existing building falling within Class B1(a) (offices) to 2 x 1 bed and 4 x 2 bed flats falling within Class C3 (dwellinghouses).,Wycombe District Council,http://opendatacommunities.org/id/district-council/wycombe,not owned by a public authority,2017-11-27,full planning permission,,permissioned,"Abbey House, 28 - 30 Chapel Street, Marlow, SL7 1DD",HMARSE090,https://mywycombe.wycombe.gov.uk/mywycombe.aspx?MapSource=Wycombe/AllMaps&StartEasting=485005.199&StartNorthing=186769.642&StartZoom=300&o=1&Layers=brownfield&ZoomPin=1,,,
yes,,2017-12-14,-0.774195,51.5697,,0.06,2018-12-18,7,7,7,"Erection of two storey rear extension to create enlarged retail unit at ground floor, 4 x 2-bed & 3 x 1-bed flats with undercroft parking & separate bin stores for retail and residential. Insertion of new doorway and internal staircase to listed buildin",Wycombe District Council,http://opendatacommunities.org/id/district-council/wycombe,not owned by a public authority,2017-09-22,full planning permission,,permissioned,79 - 81 High Street Marlow Buckinghamshire SL7 1AB,HMARSE119,https://mywycombe.wycombe.gov.uk/mywycombe.aspx?MapSource=Wycombe/AllMaps&StartEasting=485053.66&StartNorthing=186369.271&StartZoom=300&o=1&Layers=brownfield&ZoomPin=1,,,
yes,,2017-12-14,-0.768,51.6333,,0.06,2018-12-18,7,7,7,"Construction of new second floor and part ground and first floor accommodation to create 7 apartments (5 x 1 bed and 2 x 2 bed) including part change of use from retail to residential, bin and cycle storage",Wycombe District Council,http://opendatacommunities.org/id/district-council/wycombe,not owned by a public authority,2017-08-24,full planning permission,,permissioned,2 Dashwood Avenue High Wycombe Buckinghamshire HP12 3DN,HOAKCA216,https://mywycombe.wycombe.gov.uk/mywycombe.aspx?MapSource=Wycombe/AllMaps&StartEasting=485363.835&StartNorthing=193446.147&StartZoom=300&o=1&Layers=brownfield&ZoomPin=1,,,
yes,,2017-12-14,-0.772412,51.6334,,0.04,2018-12-18,5,5,5,"Change of use of existing Public House to 4 x 1-bed, 2 x 2-bed self-contained flats with erection of part first floor, part two storey rear extension, first floor side extension with associated bin and cycle stores",Wycombe District Council,http://opendatacommunities.org/id/district-council/wycombe,not owned by a public authority,2017-12-18,full planning permission,,permissioned,The Half Moon Dashwood Avenue High Wycombe Buckinghamshire HP12 3DZ,HOAKCA219,https://mywycombe.wycombe.gov.uk/mywycombe.aspx?MapSource=Wycombe/AllMaps&StartEasting=485058.365&StartNorthing=193447.02&StartZoom=300&o=1&Layers=brownfield&ZoomPin=1,,,
yes,,2017-12-14,-0.733508,51.6259,,0.05,2018-12-18,8,8,8,"Construction of three storey building containing 2 x 2 bed & 6 x 1 bed apartments with car parking, amenity space, bin & cycle storage and associated landscaping works",Wycombe District Council,http://opendatacommunities.org/id/district-council/wycombe,not owned by a public authority,2017-06-26,full planning permission,,permissioned,Princes Gate High Wycombe Buckinghamshire,HRYEME183,https://mywycombe.wycombe.gov.uk/mywycombe.aspx?MapSource=Wycombe/AllMaps&StartEasting=487765.265&StartNorthing=192659.886&StartZoom=300&o=1&Layers=brownfield&ZoomPin=1,,,
yes,,2017-12-14,-0.775635,51.6386,,0.22,2018-12-18,10,10,10,"Demolition of existing 2 x dwellings, 1 x outbuilding and a garage and erection of 2 x apartment buildings containing 9 x 2 bed flats and 3 x 1 bed flats with associated cycle storage, refuse storage, landscaping and parking",Wycombe District Council,http://opendatacommunities.org/id/district-council/wycombe,not owned by a public authority,2017-11-23,full planning permission,,permissioned,232 & 232C West Wycombe Road High Wycombe Buckinghamshire HP12 3AR,HSANDS123,https://mywycombe.wycombe.gov.uk/mywycombe.aspx?MapSource=Wycombe/AllMaps&StartEasting=484825.47&StartNorthing=194030.735&StartZoom=300&o=1&Layers=brownfield&ZoomPin=1,,,
yes,,2017-12-14,-0.77738,51.6344,,0.06,2018-12-18,5,5,5,Demolition of existing dwelling and construction of 5 x 2 bed and 1 x studio flats with associated bin and cycle stores and parking,Wycombe District Council,http://opendatacommunities.org/id/district-council/wycombe,not owned by a public authority,2018-03-26,full planning permission,,permissioned,15 Prestwood Close High Wycombe Buckinghamshire HP12 3DE,HSANDS126,https://mywycombe.wycombe.gov.uk/mywycombe.aspx?MapSource=Wycombe/AllMaps&StartEasting=484712.582&StartNorthing=193559.13&StartZoom=300&o=1&Layers=brownfield&ZoomPin=1,,,
yes,,2017-12-14,-0.909563,51.661,,0.48,2018-12-18,40,40,40,"Prior notification application (Part 3, Class O) for change of use of existing building falling within Class B1(a) (offices) to Class C3 (dwellinghouses) to create 40 x 1 bed apartments",Wycombe District Council,http://opendatacommunities.org/id/district-council/wycombe,not owned by a public authority,2017-11-24,full planning permission,,permissioned,Axis40 Oxford Road Stokenchurch Buckinghamshire HP14 3SX,HSTOKE150,https://mywycombe.wycombe.gov.uk/mywycombe.aspx?MapSource=Wycombe/AllMaps&StartEasting=475520.68&StartNorthing=196366.144&StartZoom=300&o=1&Layers=brownfield&ZoomPin=1,,,
yes,,2017-12-14,-0.73356,51.6437,,0.11,2018-12-18,6,6,6,"Erection of 2 storey rear extension to provide 2 x 2 bed flats, sub division of existing 3 bed flat at first floor level to provide 1 x 2 bed flat & 1 x 1 bed flat, car parking and amenity space provision",Wycombe District Council,http://opendatacommunities.org/id/district-council/wycombe,not owned by a public authority,2017-08-23,full planning permission,,permissioned,133 Amersham Road High Wycombe Buckinghamshire HP13 5AD,HTERAH209,https://mywycombe.wycombe.gov.uk/mywycombe.aspx?MapSource=Wycombe/AllMaps&StartEasting=487727.372&StartNorthing=194637.814&StartZoom=300&o=1&Layers=brownfield&ZoomPin=1,,,
yes,,2017-12-14,-0.750159,51.6325,,0.06,2018-12-18,5,5,5,"Construction of part two storey/part single storey side extension & single storey lower ground rear extension with associated alterations in connection with conversion to 3 x 1 bed and 2 x 2 bed flats, new access off Priory Avenue to new parking area an",Wycombe District Council,http://opendatacommunities.org/id/district-council/wycombe,not owned by a public authority,2017-04-05,full planning permission,,permissioned,The Priory Centre 11 Priory Road High Wycombe Buckinghamshire HP13 6SL,HTERAH234,https://mywycombe.wycombe.gov.uk/mywycombe.aspx?MapSource=Wycombe/AllMaps&StartEasting=486600.103&StartNorthing=193378.304&StartZoom=300&o=1&Layers=brownfield&ZoomPin=1,,,
yes,,2017-12-14,-0.748728,51.6378,,0.18,2018-12-18,8,8,8,"Demolition of existing dwellings and construction of two blocks comprising 8 x 2 bed and 2 x 1 bed flats with associated parking, bin/cycle storage and landscaping",Wycombe District Council,http://opendatacommunities.org/id/district-council/wycombe,not owned by a public authority,2017-10-11,full planning permission,,permissioned,10 - 12 Coningsby Road High Wycombe Buckinghamshire HP13 5NX,HTERAH240,https://mywycombe.wycombe.gov.uk/mywycombe.aspx?MapSource=Wycombe/AllMaps&StartEasting=486689.02&StartNorthing=193970.599&StartZoom=300&o=1&Layers=brownfield&ZoomPin=1,,,
yes,,2017-12-14,-0.830451,51.7283,,0.22,2018-12-18,8,8,8,Outline application (including details of access and layout) for demolition of existing buildings and erection of 9 x 2 bed apartments and 1 no 2 bed bungalow with associated external works and new access,Wycombe District Council,http://opendatacommunities.org/id/district-council/wycombe,not owned by a public authority,2018-02-15,outline planning permission,,permissioned,8 - 10 Wellington Avenue Princes Risborough Buckinghamshire HP27 9HY,HTHRIS175,https://mywycombe.wycombe.gov.uk/mywycombe.aspx?MapSource=Wycombe/AllMaps&StartEasting=480872.61&StartNorthing=203937.43&StartZoom=300&o=1&Layers=brownfield&ZoomPin=1,,,
yes,,2017-12-14,-0.684571,51.5872,,0.08,2018-12-18,6,6,6,Demolition of the existing dwelling and the erection of a terrace of three two-storey cottages and a separate building comprising four one-bedroom apartments together with parking and amenity space,Wycombe District Council,http://opendatacommunities.org/id/district-council/wycombe,not owned by a public authority,2017-02-21,full planning permission,,permissioned,35 The Green Wooburn Green Buckinghamshire HP10 0EU,HTHWOO101,https://mywycombe.wycombe.gov.uk/mywycombe.aspx?MapSource=Wycombe/AllMaps&StartEasting=491229.965&StartNorthing=188420.282&StartZoom=300&o=1&Layers=brownfield&ZoomPin=1,,,
yes,,2017-12-14,-0.703891,51.6117,,0.41,2018-12-18,20,20,20,Prior notification application (Part 3 Class O) for change of use of existing building falling within Class B1(a) (Offices) to Class C3 (Dwellinghouses) to create 14 x 1-bed & 6 x 2-bed flats (20 in total),Wycombe District Council,http://opendatacommunities.org/id/district-council/wycombe,not owned by a public authority,2017-09-21,full planning permission,,permissioned,Oakingham House Kingsmead Business Park Frederick Place Loudwater Buckinghamshire HP11 1JU,HTYLER152,https://mywycombe.wycombe.gov.uk/mywycombe.aspx?MapSource=Wycombe/AllMaps&StartEasting=489843.14&StartNorthing=191124.675&StartZoom=300&o=1&Layers=brownfield&ZoomPin=1,,,
yes,,2017-12-14,-0.700812,51.6054,,0.25,2018-12-18,27,27,27,"Prior notification application (Part 3, Class O) for change of use of existing building falling within Class B1(a) (offices) to Class C3 (dwellinghouses) to create 27 apartments",Wycombe District Council,http://opendatacommunities.org/id/district-council/wycombe,not owned by a public authority,2017-11-24,full planning permission,,permissioned,Attobus Treadaway Hill Loudwater Buckinghamshire HP10 9QL,HTYLER153,https://mywycombe.wycombe.gov.uk/mywycombe.aspx?MapSource=Wycombe/AllMaps&StartEasting=490068.975&StartNorthing=190418.685&StartZoom=300&o=1&Layers=brownfield&ZoomPin=1,,,
yes,,2017-12-14,-0.710374,51.5825,,0.15,2018-12-18,8,8,8,,Wycombe District Council,http://opendatacommunities.org/id/district-council/wycombe,not owned by a public authority,,,,not permissioned,"Windrush House, Bourne End",SBE0050,https://mywycombe.wycombe.gov.uk/mywycombe.aspx?MapSource=Wycombe/AllMaps&StartEasting=489451.7&StartNorthing=187862.575&StartZoom=300&o=1&Layers=brownfield&ZoomPin=1,,,
,,2017-12-14,-0.771823,51.6338,,0.9,2018-12-18,70,70,70,,Wycombe District Council,http://opendatacommunities.org/id/district-council/wycombe,not owned by a public authority,,,,not permissioned,"Dashwood Avenue, High Wycombe",SHW0020,https://mywycombe.wycombe.gov.uk/mywycombe.aspx?MapSource=Wycombe/AllMaps&StartEasting=485098.225&StartNorthing=193501.722&StartZoom=300&o=1&Layers=brownfield&ZoomPin=1,,,
yes,,2017-12-14,-0.760696,51.634,,0.08,2018-12-18,13,13,13,"Demolition of 46 West Wycombe Road, erection of a four storey block of 14 x 1 bed apartments, bin & cycle stores.",Wycombe District Council,http://opendatacommunities.org/id/district-council/wycombe,not owned by a public authority,2016-07-04,full planning permission,,permissioned,46 West Wycombe Road High Wycombe Buckinghamshire HP11 2LW,SHW0067,https://mywycombe.wycombe.gov.uk/mywycombe.aspx?MapSource=Wycombe/AllMaps&StartEasting=485868.1&StartNorthing=193526.89&StartZoom=300&o=1&Layers=brownfield&ZoomPin=1,,,
yes,,2017-12-14,-0.750474,51.6406,,0.11,2018-12-18,5,5,5,Conversion of existing dwelling into 2 x 2 bed flats and erection of two storey attached unit comprising 4 x 1 bed flats with associated parking,Wycombe District Council,http://opendatacommunities.org/id/district-council/wycombe,not owned by a public authority,2013-07-09,full planning permission,,permissioned,207 Hughenden Road High Wycombe Buckinghamshire HP13 5PL,SHW0121,https://mywycombe.wycombe.gov.uk/mywycombe.aspx?MapSource=Wycombe/AllMaps&StartEasting=486562.875&StartNorthing=194278.04&StartZoom=300&o=1&Layers=brownfield&ZoomPin=1,,,
,,2017-12-14,-0.769934,51.6335,,0.02,2018-12-18,5,5,5,,Wycombe District Council,http://opendatacommunities.org/id/district-council/wycombe,not owned by a public authority,,,,not permissioned,34 Dashwood Avenue High Wycombe Buckinghamshire HP12 3DX,SHW0210,https://mywycombe.wycombe.gov.uk/mywycombe.aspx?MapSource=Wycombe/AllMaps&StartEasting=485229.691&StartNorthing=193460.123&StartZoom=300&o=1&Layers=brownfield&ZoomPin=1,,,
yes,,2017-12-14,-0.773306,51.6372,,0.14,2018-12-18,10,10,10,Construction of two storey rear extension including lower ground level to both properties and conversion of existing pair of semi detached dwellings to form 12 x 1 bed flats,Wycombe District Council,http://opendatacommunities.org/id/district-council/wycombe,not owned by a public authority,2014-05-23,full planning permission,,permissioned,209-211 West Wycombe Road High Wycombe Buckinghamshire HP12 3AW,SHW0262,https://mywycombe.wycombe.gov.uk/mywycombe.aspx?MapSource=Wycombe/AllMaps&StartEasting=484989.36&StartNorthing=193871.555&StartZoom=300&o=1&Layers=brownfield&ZoomPin=1,,,
yes,,2017-12-14,-0.771874,51.6368,,0.19,2018-12-18,9,9,9,Demolition of No. 195 and 197 West Wycombe Road. Partial demolition of No.193 West Wycombe Road. Erection of 1 block containing 11 x 2 bed apartments.,Wycombe District Council,http://opendatacommunities.org/id/district-council/wycombe,not owned by a public authority,2016-05-09,full planning permission,,permissioned,193-197 West Wycombe Road High Wycombe Buckinghamshire HP12 3AW,SHW0263,https://mywycombe.wycombe.gov.uk/mywycombe.aspx?MapSource=Wycombe/AllMaps&StartEasting=485089.15&StartNorthing=193833.58&StartZoom=300&o=1&Layers=brownfield&ZoomPin=1,,,
yes,,2017-12-14,-0.744881,51.6283,,3.21,2018-12-18,137,137,137,Allocated in the Delivery and Site Allocations Document,Wycombe District Council,http://opendatacommunities.org/id/district-council/wycombe,owned by a public authority,,,,not permissioned,"Easton Street / Eastern Quarter, High Wycombe",SHW0322,https://mywycombe.wycombe.gov.uk/mywycombe.aspx?MapSource=Wycombe/AllMaps&StartEasting=486973.3&StartNorthing=192920.825&StartZoom=300&o=1&Layers=brownfield&ZoomPin=1,,,
,,2017-12-14,-0.742521,51.6291,,0.68,2018-12-18,90,90,90,,Wycombe District Council,http://opendatacommunities.org/id/district-council/wycombe,owned by a public authority,,,,not permissioned,"Duke Street, High Wycombe",SHW0332,https://mywycombe.wycombe.gov.uk/mywycombe.aspx?MapSource=Wycombe/AllMaps&StartEasting=487135.125&StartNorthing=193012.501&StartZoom=300&o=1&Layers=brownfield&ZoomPin=1,,,
,,2017-12-14,-0.765186,51.6327,,0.55,2018-12-18,11,11,11,,Wycombe District Council,http://opendatacommunities.org/id/district-council/wycombe,owned by a public authority,,,,not permissioned,"Land forming part of the former Green Street County First School site, Desborough Street, High Wycombe",SHW0334,https://mywycombe.wycombe.gov.uk/mywycombe.aspx?MapSource=Wycombe/AllMaps&StartEasting=485559.65&StartNorthing=193385.275&StartZoom=300&o=1&Layers=brownfield&ZoomPin=1,,,
yes,,2017-12-14,-0.763971,51.6318,,0.33,2018-12-18,77,77,77,"Demolition of existing former factory building, construction of 74 residential units comprising 1, 2 and 3 bedroom flats, and 7 B1 units, landscaping, underground parking",Wycombe District Council,http://opendatacommunities.org/id/district-council/wycombe,not owned by a public authority,2012-10-29,full planning permission,,permissioned,"Needham Bowl, Leigh Street",SHW0335,https://mywycombe.wycombe.gov.uk/mywycombe.aspx?MapSource=Wycombe/AllMaps&StartEasting=485645.585&StartNorthing=193278.135&StartZoom=300&o=1&Layers=brownfield&ZoomPin=1,,,
yes,,2017-12-14,-0.757783,51.6307,,0.18,2018-12-18,45,45,45,,Wycombe District Council,http://opendatacommunities.org/id/district-council/wycombe,owned by a public authority,,,,not permissioned,"Collins House and 32 Bridge St, Corner of Bridge St/Desborough Rd",SHW0339,https://mywycombe.wycombe.gov.uk/mywycombe.aspx?MapSource=Wycombe/AllMaps&StartEasting=486075.755&StartNorthing=193172.39&StartZoom=300&o=1&Layers=brownfield&ZoomPin=1,,,
yes,,2017-12-14,-0.777399,51.6238,,0.7,2018-12-18,40,40,40,,Wycombe District Council,http://opendatacommunities.org/id/district-council/wycombe,not owned by a public authority,,,,not permissioned,"Delafield Heights South, Longland Way / Pettifer Way, previously known as Flats off Chairborough Road",SHW0400,https://mywycombe.wycombe.gov.uk/mywycombe.aspx?MapSource=Wycombe/AllMaps&StartEasting=484731.15&StartNorthing=192372.572&StartZoom=300&o=1&Layers=brownfield&ZoomPin=1,,,
yes,,2017-12-14,-0.728796,51.6236,,0.11,2018-12-18,11,11,11,,Wycombe District Council,http://opendatacommunities.org/id/district-council/wycombe,not owned by a public authority,,,,not permissioned,"Frank Hudson Furniture Factory, Rosebery Avenue, High Wycombe",SHW0402,https://mywycombe.wycombe.gov.uk/mywycombe.aspx?MapSource=Wycombe/AllMaps&StartEasting=488095.865&StartNorthing=192410.2&StartZoom=300&o=1&Layers=brownfield&ZoomPin=1,,,
,,2017-12-14,-0.770595,51.6329,,0.21,2018-12-18,9,9,9,,Wycombe District Council,http://opendatacommunities.org/id/district-council/wycombe,not owned by a public authority,,,,not permissioned,"Ogilvie Road, High Wycombe",SHW0406,https://mywycombe.wycombe.gov.uk/mywycombe.aspx?MapSource=Wycombe/AllMaps&StartEasting=485184.94&StartNorthing=193400.5&StartZoom=300&o=1&Layers=brownfield&ZoomPin=1,,,
yes,,2017-12-14,-0.733671,51.6255,,0.16,2018-12-18,32,32,32,"Demolition of existing building and construction of 32 x 2 bedroom apartments, alteration to the existing access, landscaping and car parking",Wycombe District Council,http://opendatacommunities.org/id/district-council/wycombe,not owned by a public authority,2016-12-12,full planning permission,,permissioned,"JC and MP Smith, Princes Gate (also known as Ricketts road, Ryedale), High Wycombe, HP13 7AB",SHW0419,https://mywycombe.wycombe.gov.uk/mywycombe.aspx?MapSource=Wycombe/AllMaps&StartEasting=487754.704&StartNorthing=192618.725&StartZoom=300&o=1&Layers=brownfield&ZoomPin=1,,,
,,2017-12-14,-0.735804,51.6261,,0.19,2018-12-18,11,11,11,,Wycombe District Council,http://opendatacommunities.org/id/district-council/wycombe,not owned by a public authority,,,,not permissioned,"Netley Works, 89 Queens Road, High Wycombe",SHW0421,https://mywycombe.wycombe.gov.uk/mywycombe.aspx?MapSource=Wycombe/AllMaps&StartEasting=487605.86&StartNorthing=192684.315&StartZoom=300&o=1&Layers=brownfield&ZoomPin=1,,,
yes,,2017-12-14,-0.765098,51.6302,,0.24,2018-12-18,14,14,14,"Demolition of existing factory building and erection of two, 2.5 storey residential blocks comprising of 14 x 2 bed flats with associated parking and landscaping.",Wycombe District Council,http://opendatacommunities.org/id/district-council/wycombe,not owned by a public authority,2016-08-01,full planning permission,,permissioned,"Kitchener Works, Kitchener Road, adjacent to Smewin Court, High Wycombe",SHW0432,https://mywycombe.wycombe.gov.uk/mywycombe.aspx?MapSource=Wycombe/AllMaps&StartEasting=485570.535&StartNorthing=193100.88&StartZoom=300&o=1&Layers=brownfield&ZoomPin=1,,,
,,2017-12-14,-0.780564,51.624,,0.39,2018-12-18,10,10,10,,Wycombe District Council,http://opendatacommunities.org/id/district-council/wycombe,not owned by a public authority,,,,not permissioned,"Garages between Chiltern Avenue and Rutland Avenue, High Wycombe",SHW0436,https://mywycombe.wycombe.gov.uk/mywycombe.aspx?MapSource=Wycombe/AllMaps&StartEasting=484511.575&StartNorthing=192395.63&StartZoom=300&o=1&Layers=brownfield&ZoomPin=1,,,
,,2017-12-14,-0.758454,51.6322,,0.19,2018-12-18,10,10,10,,Wycombe District Council,http://opendatacommunities.org/id/district-council/wycombe,owned by a public authority,,,,not permissioned,"Brook Street, High Wycombe",SHW0440,https://mywycombe.wycombe.gov.uk/mywycombe.aspx?MapSource=Wycombe/AllMaps&StartEasting=486026.65&StartNorthing=193328.925&StartZoom=300&o=1&Layers=brownfield&ZoomPin=1,,,
,,2017-12-14,-0.75682,51.6319,,0.51,2018-12-18,7,7,7,,Wycombe District Council,http://opendatacommunities.org/id/district-council/wycombe,not owned by a public authority,,,,not permissioned,"Corner of Bridge Street/Oxford Road, High Wycombe",SHW0463,https://mywycombe.wycombe.gov.uk/mywycombe.aspx?MapSource=Wycombe/AllMaps&StartEasting=486140.212&StartNorthing=193305.32&StartZoom=300&o=1&Layers=brownfield&ZoomPin=1,,,
,,2017-12-14,-0.7219,51.6416,,0.25,2018-12-18,6,6,6,,Wycombe District Council,http://opendatacommunities.org/id/district-council/wycombe,not owned by a public authority,,,,not permissioned,"Garages at Tyzack Road, High Wycombe",SHW0466,https://mywycombe.wycombe.gov.uk/mywycombe.aspx?MapSource=Wycombe/AllMaps&StartEasting=488538.125&StartNorthing=194424.95&StartZoom=300&o=1&Layers=brownfield&ZoomPin=1,,,
