Deliverable,EndDate,FirstAddedDate,GeoX,GeoY,HazardousSubstances,Hectares,LastUpdatedDate,MinNetDwellings,NetDwellingsRangeFrom,NetDwellingsRangeTo,Notes,OrganisationLabel,OrganisationURI,OwnershipStatus,PermissionDate,PermissionType,PlanningHistory,PlanningStatus,SiteNameAddress,SiteReference,SiteplanURL,entity,point,brownfield-land
yes,,2020-12-19,0.086366,52.552103,,0.293,2020-12-19,,28,28,"Change of use from office (B1) to 28no flats (C3), comprising of 5 x 2-bed and 23 x 1-bed | Old School House Dartford Road March Cambridgeshire PE15 8AE",,http://opendatacommunities.org/id/district-council/fenland,not owned by a public authority,2019-07-15,full planning permission,https://www.fenland.gov.uk/publicaccess/applicationDetails.do?activeTab=documents&keyVal=PRI32PHE01U00,permissioned,Old School House Dartford Road March Cambridgeshire PE15 8AE,BLR0039,https://fenland.gov.uk/media/17400/Brownfield-Register-Site-Maps/pdf/BLR-2020-Site-Plans.pdf,,,
yes,,2020-12-19,0.084309,52.561776,,0.125,2020-12-19,,5,5,Erect 5 dwellings (comprising of 3 x 1-bed and 2 x 2-bed flats) and associated parking,,http://opendatacommunities.org/id/district-council/fenland,not owned by a public authority,2019-09-12,full planning permission,https://www.fenland.gov.uk/publicaccess/applicationDetails.do?activeTab=documents&keyVal=PSQ22LHE03000,permissioned,Nelson House 22 Norwood Road March Cambridgeshire,BLR0040,https://fenland.gov.uk/media/17400/Brownfield-Register-Site-Maps/pdf/BLR-2020-Site-Plans.pdf,,,
yes,,2020-12-19,0.159501,52.664725,,0.029,2020-12-19,,15,15,Erect 5-storey mixed use development (1 x retail unit to ground floor and 11 x 1-bed and 4 x 2-bed flats to remaining floors) involving demolition of existing derelict structures in a Conservation Area,,http://opendatacommunities.org/id/district-council/fenland,not owned by a public authority,2019-10-10,full planning permission,https://www.fenland.gov.uk/publicaccess/applicationDetails.do?activeTab=documents&keyVal=PSW4YAHE01U00,permissioned,11 - 12 High Street Wisbech Cambridgeshire,BLR0041,https://fenland.gov.uk/media/17400/Brownfield-Register-Site-Maps/pdf/BLR-2020-Site-Plans.pdf,,,
yes,,2020-12-19,0.044803,52.461078,,0.029,2020-12-19,,6,6,Erection of a 3-storey block of 6 x flats comprising of 4 x 2 bed and 2 x 1-bed flats involving the demolition of existing building.,,http://opendatacommunities.org/id/district-council/fenland,not owned by a public authority,2017-03-17,full planning permission,https://www.fenland.gov.uk/publicaccess/applicationDetails.do?activeTab=documents&keyVal=O9L03LHE06P00,permissioned,"26, Bridge Street, Chatteris, PE16 6RF",BLR0042,https://fenland.gov.uk/media/17400/Brownfield-Register-Site-Maps/pdf/BLR-2020-Site-Plans.pdf,,,
yes,,2020-12-19,0.089599,52.552132,,0.365,2020-12-19,,9,9,Change of use from Education Centre (D1) to 9no dwellings (C3) comprising of 1 x 3-bed 2-storey dwelling and 4 x 2-bed and 4 x 1-bed flats involving partial demolition,,http://opendatacommunities.org/id/district-council/fenland,not owned by a public authority,2020-02-04,full planning permission,https://www.fenland.gov.uk/publicaccess/applicationDetails.do?activeTab=documents&keyVal=PX9EBWHE01U00,permissioned,34 Station Road March Cambridgeshire PE15 8LE,BLR0043,https://fenland.gov.uk/media/17400/Brownfield-Register-Site-Maps/pdf/BLR-2020-Site-Plans.pdf,,,
yes,,2020-12-19,0.173129,52.65435,,6.112,2020-12-19,,137,137,"Erection of 137 dwellings, alterations to Ramnoth Road and Elm High Road junction to form a new vehicular & pedestrian access and associated works & infrastructure",,http://opendatacommunities.org/id/district-council/fenland,not owned by a public authority,2020-03-23,full planning permission,https://www.fenland.gov.uk/publicaccess/applicationDetails.do?activeTab=documents&keyVal=OC05NIHE01U00,permissioned,The College Of West Anglia Elm High Road Wisbech Cambridgeshire,BLR0044,https://fenland.gov.uk/media/17400/Brownfield-Register-Site-Maps/pdf/BLR-2020-Site-Plans.pdf,,,
yes,,2020-12-19,0.17655,52.674847,,0.241,2020-12-19,,9,9,"Erect 9 x dwellings (4 x 1-storey 2-bed and 5 x 2-storey 3-bed), 4 x garages (2 x twin) and a 1.8m high (max height) fence fronting Lynn Road involving demolition of existing building(s)",,http://opendatacommunities.org/id/district-council/fenland,not owned by a public authority,2020-01-17,full planning permission,https://www.fenland.gov.uk/publicaccess/applicationDetails.do?activeTab=documents&keyVal=PZIISGHE06P00,permissioned,Wisbech Vehicle Exchange Old Lynn Road Wisbech Cambridgeshire,BLR0045,https://fenland.gov.uk/media/17400/Brownfield-Register-Site-Maps/pdf/BLR-2020-Site-Plans.pdf,,,
yes,,2020-12-19,0.16147,52.668995,,0.525,2020-12-19,,19,19,Erect 19 x 2-storey 3-bed dwellings including extension to existing footway and demolition of buildings,,http://opendatacommunities.org/id/district-council/fenland,not owned by a public authority,2020-02-18,full planning permission,https://www.fenland.gov.uk/publicaccess/applicationDetails.do?activeTab=documents&keyVal=Q0V66XHE01U00,permissioned,Site Of Old British Gas Depot Chase Street Wisbech Cambridgeshire,BLR0046,https://fenland.gov.uk/media/17400/Brownfield-Register-Site-Maps/pdf/BLR-2020-Site-Plans.pdf,,,
yes,,2020-12-19,0.065453,52.563976,,0.296,2020-12-19,,8,8,"Reserved Matters application relating to detailed matters of access, appearance, landscaping, layout and scale pursuant to F/YR19/0307/O for the erection of 8 x 3-storey 4-bed",,http://opendatacommunities.org/id/district-council/fenland,not owned by a public authority,2020-03-13,reserved matters approval,https://www.fenland.gov.uk/publicaccess/applicationDetails.do?activeTab=documents&keyVal=Q037LPHE01U00,permissioned,Land East Of 3 Woodville Drive Westry March Cambridgeshire,BLR0047,https://fenland.gov.uk/media/17400/Brownfield-Register-Site-Maps/pdf/BLR-2020-Site-Plans.pdf,,,
yes,,2020-12-19,0.08916,52.550976,,0.081,2020-12-19,,26,26,"Erection of a part 2-storey, part 3 storey and part 4-storey building comprising of: 1 x retail unit (A1) and up to 26 x flats involving demolition of existing building (outline application with matters committed in respect of layout and scale)",,http://opendatacommunities.org/id/district-council/fenland,not owned by a public authority,2019-11-08,outline planning permission,https://www.fenland.gov.uk/publicaccess/applicationDetails.do?activeTab=documents&keyVal=PIYBVKHE06P00,permissioned,15 Station Road March Cambridgeshire PE15 8LB,BLR0048,https://fenland.gov.uk/media/17400/Brownfield-Register-Site-Maps/pdf/BLR-2020-Site-Plans.pdf,,,
