Deliverable,EndDate,FirstAddedDate,GeoX,GeoY,HazardousSubstances,Hectares,LastUpdatedDate,MinNetDwellings,NetDwellingsRangeFrom,NetDwellingsRangeTo,Notes,OrganisationLabel,OrganisationURI,OwnershipStatus,PermissionDate,PermissionType,PlanningHistory,PlanningStatus,SiteNameAddress,SiteReference,SiteplanURL,entity,point,brownfield-land
,,2017-12-19,-2.274338,53.559692,,0.1,2017-12-19,,5,5,52413 for 5 townhouses lapsed 07/07/13,,http://opendatacommunities.org/id/metropolitan-district-council/bury,not owned by a public authority,,,https://planning.bury.gov.uk/online-applications/search.do?action=simple,not permissioned,"Former Petrol Station, Parr Lane, Unsworth, Bury",HL/1958/00,http://maps.bury.gov.uk/webmaplayers8/Map.aspx?x=381925&y=407043&resolution=0.5&epsg=27700&mapname=bury_shlaa_external&baseLayer=GreyScaleBury&datalayers=Brownfield%20Land%20Register%20Now%2CBury%20Council%2CselectFeaturesControl_container,,,
,,2017-12-19,-2.290475,53.61672,,0.33,2018-12-13,,24,24,61196 - outline permission,,http://opendatacommunities.org/id/metropolitan-district-council/bury,not owned by a public authority,2018-03-28,outline planning permission,https://planning.bury.gov.uk/online-applications/search.do?action=simple,permissioned,"Works opposite 101 Mather Road, Bury",HL/1981/00,http://maps.bury.gov.uk/webmaplayers8/Map.aspx?x=380882&y=413392&resolution=0.5&epsg=27700&mapname=bury_shlaa_external&baseLayer=GreyScaleBury&datalayers=Brownfield%20Land%20Register%20Now%2CBury%20Council%2CselectFeaturesControl_container,,,
,,2017-12-19,-2.261835,53.600742,,0.1,2017-12-19,,9,9,44080 (9 apartments) - lapsed 24/05/10,,http://opendatacommunities.org/id/metropolitan-district-council/bury,not owned by a public authority,,,https://planning.bury.gov.uk/online-applications/search.do?action=simple,not permissioned,"Fairfield Service Station, Rochdale Old Road, Bury",HL/2057/00,http://maps.bury.gov.uk/webmaplayers8/Map.aspx?x=382770&y=411607&resolution=0.5&epsg=27700&mapname=bury_shlaa_external&baseLayer=GreyScaleBury&datalayers=Brownfield%20Land%20Register%20Now%2CBury%20Council%2CselectFeaturesControl_container,,,
,,2017-12-19,-2.316917,53.588969,,0.07,2017-12-19,,5,5,59398 - Erection of 5 no. Dwellings approved on 27/07/2016,,http://opendatacommunities.org/id/metropolitan-district-council/bury,not owned by a public authority,,,https://planning.bury.gov.uk/online-applications/search.do?action=simple,not permissioned,"Wellington Garage, Deardens Street, Bury",HL/2127/00,http://maps.bury.gov.uk/webmaplayers8/Map.aspx?x=379119&y=410312&resolution=0.5&epsg=27700&mapname=bury_shlaa_external&baseLayer=GreyScaleBury&datalayers=Brownfield%20Land%20Register%20Now%2CBury%20Council%2CselectFeaturesControl_container,,,
yes,,2020-10-22,-2.307053,53.59321,,0.32,2020-10-22,,36,36,63992 - 36 apartments approved 13/03/20,,http://opendatacommunities.org/id/metropolitan-district-council/bury,not owned by a public authority,2020-03-13,full planning permission,https://planning.bury.gov.uk/online-applications/search.do?action=simple,permissioned,"Former PJ Power Site, Millett Street, Bury",HL/2132/00,http://maps.bury.gov.uk/webmaplayers8/Map.aspx?x=379774&y=410781&resolution=0.5&epsg=27700&mapname=bury_shlaa_external&baseLayer=GreyScaleBury&datalayers=Brownfield%20Land%20Register%20Now%2CBury%20Council%2CselectFeaturesControl_container,,,
yes,,2017-12-19,-2.314554,53.563646,,22.98,2020-10-22,,400,400,Application 55901 to extend the time limit for implementation of the original outline permission (45598) was granted on 04/07/2013. 62969 - outline application for 400 dwellings approved 19/12/18,,http://opendatacommunities.org/id/metropolitan-district-council/bury,owned by a public authority,2018-12-19,outline planning permission,https://planning.bury.gov.uk/online-applications/search.do?action=simple,permissioned,"East Lancs Paper Mill Site, Rectory Lane, Radcliffe",HL/2146/00,http://maps.bury.gov.uk/webmaplayers8/Map.aspx?x=379263&y=407494&resolution=0.5&epsg=27700&mapname=bury_shlaa_external&baseLayer=GreyScaleBury&datalayers=Brownfield%20Land%20Register%20Now%2CBury%20Council%2CselectFeaturesControl_container,,,
yes,,2017-12-19,-2.333826,53.560781,,2.31,2017-12-19,,90,90,52038 - expired outline permission for residential development,,http://opendatacommunities.org/id/metropolitan-district-council/bury,owned by a public authority,,,https://planning.bury.gov.uk/online-applications/search.do?action=simple,not permissioned,"Radcliffe High School, School Street, Radcliffe",HL/2148/00,http://maps.bury.gov.uk/webmaplayers8/Map.aspx?x=377985&y=407181&resolution=0.5&epsg=27700&mapname=bury_shlaa_external&baseLayer=GreyScaleBury&datalayers=Brownfield%20Land%20Register%20Now%2CBury%20Council%2CselectFeaturesControl_container,,,
,,2017-12-19,-2.323188,53.55743,,0.09,2017-12-19,,12,12,52412 - expired permission,,http://opendatacommunities.org/id/metropolitan-district-council/bury,not owned by a public authority,,,https://planning.bury.gov.uk/online-applications/search.do?action=simple,not permissioned,"44-48 Stand Lane & 4-6 New Street, Radcliffe",HL/2149/00,http://maps.bury.gov.uk/webmaplayers8/Map.aspx?x=378688&y=406805&resolution=0.5&epsg=27700&mapname=bury_shlaa_external&baseLayer=GreyScaleBury&datalayers=Brownfield%20Land%20Register%20Now%2CBury%20Council%2CselectFeaturesControl_container,,,
yes,,2017-12-19,-2.331235,53.559583,,0.25,2020-10-22,,9,9,62166 - permission granted for 7 dwellings 20/6/18,,http://opendatacommunities.org/id/metropolitan-district-council/bury,owned by a public authority,2019-06-26,full planning permission,https://planning.bury.gov.uk/online-applications/search.do?action=simple,permissioned,"Hutchinson Way/Hindle Street, Radcliffe",HL/2157/00,http://maps.bury.gov.uk/webmaplayers8/Map.aspx?x=378156&y=407047&resolution=0.5&epsg=27700&mapname=bury_shlaa_external&baseLayer=GreyScaleBury&datalayers=Brownfield%20Land%20Register%20Now%2CBury%20Council%2CselectFeaturesControl_container,,,
,,2017-12-19,-2.273857,53.566964,,0.26,2020-10-22,,9,9,,,http://opendatacommunities.org/id/metropolitan-district-council/bury,not owned by a public authority,,,https://planning.bury.gov.uk/online-applications/search.do?action=simple,not permissioned,"Rear of Unsworth Methodist Church, Hollins Lane, Bury",HL/2169/00,http://maps.bury.gov.uk/webmaplayers8/Map.aspx?x=381960&y=407852&resolution=0.5&epsg=27700&mapname=bury_shlaa_external&baseLayer=GreyScaleBury&datalayers=Brownfield%20Land%20Register%20Now%2CBury%20Council%2CselectFeaturesControl_container,,,
,,2017-12-19,-2.283241,53.516176,,0.17,2017-12-19,,8,8,Expired permissions: 37237 (full planning permission) lapsed for 8 no sheltered flats. 42362/04 - Renewal of 35292 - 32 bed Special Care Unit,,http://opendatacommunities.org/id/metropolitan-district-council/bury,not owned by a public authority,,,https://planning.bury.gov.uk/online-applications/search.do?action=simple,not permissioned,"The Heathlands Village, Heathlands Drive, Prestwich",HL/2175/00,http://maps.bury.gov.uk/webmaplayers8/Map.aspx?x=381316&y=402204&resolution=0.5&epsg=27700&mapname=bury_shlaa_external&baseLayer=GreyScaleBury&datalayers=Brownfield%20Land%20Register%20Now%2CBury%20Council%2CselectFeaturesControl_container,,,
yes,,2017-12-19,-2.341106,53.572445,,0.42,2020-10-22,,14,14,57224 - Erection of 11 no. detached dwellings with access road and demolition of existing bridge structure (resubmission) on part of site approved 23/10/2015. 56712 - Approval for the importation and re-use of inert material to create a level site to make,,http://opendatacommunities.org/id/metropolitan-district-council/bury,not owned by a public authority,2019-10-11,full planning permission,https://planning.bury.gov.uk/online-applications/search.do?action=simple,permissioned,"Land adjacent to 41 Station Close, Radcliffe, Manchester, M26 4GW",HL/2178/00,http://maps.bury.gov.uk/webmaplayers8/Map.aspx?x=377509&y=408481&resolution=0.5&epsg=27700&mapname=bury_shlaa_external&baseLayer=GreyScaleBury&datalayers=Brownfield%20Land%20Register%20Now%2CBury%20Council%2CselectFeaturesControl_container,,,
,,2020-10-22,-2.321095,53.597991,,2.67,2020-10-22,,108,108,"Outline approval for 108 dwellings - 64128, approved 31/7/19",,http://opendatacommunities.org/id/metropolitan-district-council/bury,not owned by a public authority,2019-07-31,outline planning permission,https://planning.bury.gov.uk/online-applications/search.do?action=simple,permissioned,"Former Andrew Textiles Ltd site, Premier Mill, Walshaw Road, Bury, BL8 1NG",HL/2200/00,http://maps.bury.gov.uk/webmaplayers8/Map.aspx?x=378847&y=411317&resolution=0.5&epsg=27700&mapname=bury_shlaa_external&baseLayer=GreyScaleBury&datalayers=Brownfield%20Land%20Register%20Now%2CBury%20Council%2CselectFeaturesControl_container,,,
,,2017-12-19,-2.277569,53.596572,,0.5,2017-12-19,,39,39,"58985 - Demolition of existing buildings and residential development comprising 39 no. dwellings (15 no. houses and 24 no. apartments), new access from Deal Street, carparking and landscaping approved on 04/01/2016",,http://opendatacommunities.org/id/metropolitan-district-council/bury,not owned by a public authority,,,https://planning.bury.gov.uk/online-applications/search.do?action=simple,not permissioned,"Site of Hartshead Works, Deal Street, Bury, BL9 7PU",HL/2206/00,http://maps.bury.gov.uk/webmaplayers8/Map.aspx?x=381727&y=411147&resolution=0.5&epsg=27700&mapname=bury_shlaa_external&baseLayer=GreyScaleBury&datalayers=Brownfield%20Land%20Register%20Now%2CBury%20Council%2CselectFeaturesControl_container,,,
,,2017-12-19,-2.29188,53.599118,,0.16,2017-12-19,,8,8,,,http://opendatacommunities.org/id/metropolitan-district-council/bury,not owned by a public authority,,,https://planning.bury.gov.uk/online-applications/search.do?action=simple,not permissioned,"Yard, North of Birch Street, Bury",HL/2219/00,http://maps.bury.gov.uk/webmaplayers8/Map.aspx?x=380781&y=411434&resolution=0.5&epsg=27700&mapname=bury_shlaa_external&baseLayer=GreyScaleBury&datalayers=Brownfield%20Land%20Register%20Now%2CBury%20Council%2CselectFeaturesControl_container,,,
,,2017-12-19,-2.289298,53.597138,,0.41,2017-12-19,,30,30,,,http://opendatacommunities.org/id/metropolitan-district-council/bury,mixed ownership,,,https://planning.bury.gov.uk/online-applications/search.do?action=simple,not permissioned,"Corner Walmersley Road/Moorgate, Bury",HL/2227/00,http://maps.bury.gov.uk/webmaplayers8/Map.aspx?x=380951&y=411213&resolution=0.5&epsg=27700&mapname=bury_shlaa_external&baseLayer=GreyScaleBury&datalayers=Brownfield%20Land%20Register%20Now%2CBury%20Council%2CselectFeaturesControl_container,,,
,,2017-12-19,-2.302424,53.592377,,0.7,2017-12-19,,50,50,,,http://opendatacommunities.org/id/metropolitan-district-council/bury,owned by a public authority,,,https://planning.bury.gov.uk/online-applications/search.do?action=simple,not permissioned,"Former Police Station, Irwell Street, Bury",HL/2241/00,http://maps.bury.gov.uk/webmaplayers8/Map.aspx?x=380080&y=410687&resolution=0.5&epsg=27700&mapname=bury_shlaa_external&baseLayer=GreyScaleBury&datalayers=Brownfield%20Land%20Register%20Now%2CBury%20Council%2CselectFeaturesControl_container,,,
,,2017-12-19,-2.337834,53.563619,,0.34,2017-12-19,,17,17,57117 - expired outline residential development approved 19/03/2014,,http://opendatacommunities.org/id/metropolitan-district-council/bury,not owned by a public authority,,,https://planning.bury.gov.uk/online-applications/search.do?action=simple,not permissioned,"Land opposite 9 to 21 Unsworth Street, Radcliffe",HL/2253/00,http://maps.bury.gov.uk/webmaplayers8/Map.aspx?x=377721&y=407498&resolution=0.5&epsg=27700&mapname=bury_shlaa_external&baseLayer=GreyScaleBury&datalayers=Brownfield%20Land%20Register%20Now%2CBury%20Council%2CselectFeaturesControl_container,,,
,,2017-12-19,-2.336252,53.562113,,0.14,2017-12-19,,6,6,,,http://opendatacommunities.org/id/metropolitan-district-council/bury,not owned by a public authority,,,https://planning.bury.gov.uk/online-applications/search.do?action=simple,not permissioned,"Mill, Water Street/Bolton Street, Radcliffe",HL/2255/00,http://maps.bury.gov.uk/webmaplayers8/Map.aspx?x=377825&y=407330&resolution=0.5&epsg=27700&mapname=bury_shlaa_external&baseLayer=GreyScaleBury&datalayers=Brownfield%20Land%20Register%20Now%2CBury%20Council%2CselectFeaturesControl_container,,,
,,2017-12-19,-2.319306,53.567175,,0.24,2018-12-13,,13,13,59984 - Outline - Demolition of existing care home and erection of 13 no. dwellings,,http://opendatacommunities.org/id/metropolitan-district-council/bury,not owned by a public authority,2017-12-20,outline planning permission,https://planning.bury.gov.uk/online-applications/search.do?action=simple,permissioned,"Land at and to the rear of 77 Bury Road, Radcliffe",HL/2260/00,http://maps.bury.gov.uk/webmaplayers8/Map.aspx?x=378950&y=407888&resolution=0.5&epsg=27700&mapname=bury_shlaa_external&baseLayer=GreyScaleBury&datalayers=Brownfield%20Land%20Register%20Now%2CBury%20Council%2CselectFeaturesControl_container,,,
,,2017-12-19,-2.281501,53.53351,,0.25,2017-12-19,,9,9,"54722 - Outline - Demolition of existing buildings and erection of 9 no. dwellings and associated access and car parking approved 2/3/12, permission expired",,http://opendatacommunities.org/id/metropolitan-district-council/bury,not owned by a public authority,,,https://planning.bury.gov.uk/online-applications/search.do?action=simple,not permissioned,"Land adjacent Metro, Heys Road, Prestwich",HL/2286/00,http://maps.bury.gov.uk/webmaplayers8/Map.aspx?x=381439&y=404132&resolution=0.5&epsg=27700&mapname=bury_shlaa_external&baseLayer=GreyScaleBury&datalayers=Brownfield%20Land%20Register%20Now%2CBury%20Council%2CselectFeaturesControl_container,,,
yes,,2017-12-19,-2.289283,53.621496,,10.81,2020-10-22,,268,268,63533 Full planning permission for 268 dwellings approved 6/2/20,,http://opendatacommunities.org/id/metropolitan-district-council/bury,not owned by a public authority,2020-02-06,full planning permission,https://planning.bury.gov.uk/online-applications/search.do?action=simple,permissioned,"Tetrosyl Site, Bevis Green Works, Walmersley Old Road, Bury",HL/2303/00,http://maps.bury.gov.uk/webmaplayers8/Map.aspx?x=380963&y=413923&resolution=0.5&epsg=27700&mapname=bury_shlaa_external&baseLayer=GreyScaleBury&datalayers=Brownfield%20Land%20Register%20Now%2CBury%20Council%2CselectFeaturesControl_container,,,
,,2017-12-19,-2.309203,53.540093,,0.42,2017-12-19,,12,12,,,http://opendatacommunities.org/id/metropolitan-district-council/bury,not owned by a public authority,,,https://planning.bury.gov.uk/online-applications/search.do?action=simple,not permissioned,"Buildings at Park Lane Farm, Philips Park, Whitefield",HL/2310/00,http://maps.bury.gov.uk/webmaplayers8/Map.aspx?x=379606&y=404872&resolution=0.5&epsg=27700&mapname=bury_shlaa_external&baseLayer=GreyScaleBury&datalayers=Brownfield%20Land%20Register%20Now%2CBury%20Council%2CselectFeaturesControl_container,,,
,,2017-12-19,-2.321663,53.609144,,0.33,2017-12-19,,10,10,,,http://opendatacommunities.org/id/metropolitan-district-council/bury,not owned by a public authority,,,https://planning.bury.gov.uk/online-applications/search.do?action=simple,not permissioned,"Garside Garage including Scrap Yard & Stables, Garside Hey Road, Tottington",HL/2312/00,http://maps.bury.gov.uk/webmaplayers8/Map.aspx?x=378815&y=412558&resolution=0.5&epsg=27700&mapname=bury_shlaa_external&baseLayer=GreyScaleBury&datalayers=Brownfield%20Land%20Register%20Now%2CBury%20Council%2CselectFeaturesControl_container,,,
,,2020-10-22,-2.30541,53.572811,,6.21,2020-10-22,,200,200,,,http://opendatacommunities.org/id/metropolitan-district-council/bury,not owned by a public authority,,,https://planning.bury.gov.uk/online-applications/search.do?action=simple,not permissioned,"Land at Bury Road/York Street, Radcliffe, Manchester, M26 2WH",HL/2338/00,http://maps.bury.gov.uk/webmaplayers8/Map.aspx?x=379873&y=408511&resolution=0.5&epsg=27700&mapname=bury_shlaa_external&baseLayer=GreyScaleBury&datalayers=Brownfield%20Land%20Register%20Now%2CBury%20Council%2CselectFeaturesControl_container,,,
yes,,2017-12-19,-2.337344,53.634753,,2.38,2017-12-19,,22,22,59715 - Demolition of existing buildings and erection of 22 no. dwellings including works to culverted watercourse approved on 01/11/2016.,,http://opendatacommunities.org/id/metropolitan-district-council/bury,not owned by a public authority,2016-11-01,full planning permission,https://planning.bury.gov.uk/online-applications/search.do?action=simple,permissioned,"Redisher Works, Holcombe Old Road, Holcombe Brook, Ramsbottom",HL/2340/00,http://maps.bury.gov.uk/webmaplayers8/Map.aspx?x=377791&y=415412&resolution=0.5&epsg=27700&mapname=bury_shlaa_external&baseLayer=GreyScaleBury&datalayers=Brownfield%20Land%20Register%20Now%2CBury%20Council%2CselectFeaturesControl_container,,,
yes,,2017-12-19,-2.2854,53.594954,,0.1,2017-12-19,,19,19,59332 - Prior notification for proposed change of use from first and second floors office use (Class B1(a) ) to 16 no. one and 3 no. two bedroomed apartments (Class C3) - Prior Approval Required and Granted on 16/11/2015.,,http://opendatacommunities.org/id/metropolitan-district-council/bury,not owned by a public authority,2015-11-16,full planning permission,https://planning.bury.gov.uk/online-applications/search.do?action=simple,permissioned,"Acorn Business Centre, Fountain Street North, Bury, BL9 7AN",HL/2374/01,http://maps.bury.gov.uk/webmaplayers8/Map.aspx?x=381208&y=410969&resolution=0.5&epsg=27700&mapname=bury_shlaa_external&baseLayer=GreyScaleBury&datalayers=Brownfield%20Land%20Register%20Now%2CBury%20Council%2CselectFeaturesControl_container,,,
,,2017-12-19,-2.319579,53.561341,,0.15,2017-12-19,,8,8,,,http://opendatacommunities.org/id/metropolitan-district-council/bury,not owned by a public authority,,,https://planning.bury.gov.uk/online-applications/search.do?action=simple,not permissioned,"Works off East Street, Radcliffe",HL/2383/00,http://maps.bury.gov.uk/webmaplayers8/Map.aspx?x=378929&y=407239&resolution=0.5&epsg=27700&mapname=bury_shlaa_external&baseLayer=GreyScaleBury&datalayers=Brownfield%20Land%20Register%20Now%2CBury%20Council%2CselectFeaturesControl_container,,,
,,2017-12-19,-2.292371,53.595863,,2.66,2017-12-19,,75,75,,,http://opendatacommunities.org/id/metropolitan-district-council/bury,mixed ownership,,,https://planning.bury.gov.uk/online-applications/search.do?action=simple,not permissioned,"Area of land and buildings north of The Rock, Bury",HL/2390/00,http://maps.bury.gov.uk/webmaplayers8/Map.aspx?x=380747&y=411072&resolution=0.5&epsg=27700&mapname=bury_shlaa_external&baseLayer=GreyScaleBury&datalayers=Brownfield%20Land%20Register%20Now%2CBury%20Council%2CselectFeaturesControl_container,,,
,,2017-12-19,-2.307992,53.568562,,5.16,2020-10-22,,90,90,,,http://opendatacommunities.org/id/metropolitan-district-council/bury,not owned by a public authority,,,https://planning.bury.gov.uk/online-applications/search.do?action=simple,not permissioned,"Bealey Industrial Estate, Hallam Street, Off Dumers Lane, Radcliffe",HL/2441/00,http://maps.bury.gov.uk/webmaplayers8/Map.aspx?x=379700&y=408039&resolution=0.5&epsg=27700&mapname=bury_shlaa_external&baseLayer=GreyScaleBury&datalayers=Brownfield%20Land%20Register%20Now%2CBury%20Council%2CselectFeaturesControl_container,,,
,,2017-12-19,-2.284078,53.533144,,1.89,2020-10-22,,200,200,"54978 - expired outline permission for town centre mixed use development comprising uses with floor areas up to: food retail 6,040m2, non food retail 2,218m2, restaurant 385m2, library 1,287m2, offices 3,360m2, residential 36 units, hotel 70 bed, new long",,http://opendatacommunities.org/id/metropolitan-district-council/bury,mixed ownership,,,https://planning.bury.gov.uk/online-applications/search.do?action=simple,not permissioned,"Longfield Suite, Prestwich",HL/2492/00,http://maps.bury.gov.uk/webmaplayers8/Map.aspx?x=381268&y=404092&resolution=0.5&epsg=27700&mapname=bury_shlaa_external&baseLayer=GreyScaleBury&datalayers=Brownfield%20Land%20Register%20Now%2CBury%20Council%2CselectFeaturesControl_container,,,
,,2017-12-19,-2.293852,53.57417,,0.9,2017-12-19,,25,25,,,http://opendatacommunities.org/id/metropolitan-district-council/bury,owned by a public authority,,,https://planning.bury.gov.uk/online-applications/search.do?action=simple,not permissioned,"Former Millwood School, Fletcher Fold Road, Bury, BL9 9RX",HL/2520/00,http://maps.bury.gov.uk/webmaplayers8/Map.aspx?x=380639&y=408659&resolution=0.5&epsg=27700&mapname=bury_shlaa_external&baseLayer=GreyScaleBury&datalayers=Brownfield%20Land%20Register%20Now%2CBury%20Council%2CselectFeaturesControl_container,,,
,,2017-12-19,-2.289042,53.577391,,1.34,2017-12-19,,30,30,,,http://opendatacommunities.org/id/metropolitan-district-council/bury,owned by a public authority,,,https://planning.bury.gov.uk/online-applications/search.do?action=simple,not permissioned,"William Kemp Heaton Day Centre (Site B), St.Peters Road, Bury, BL9 9RP",HL/2526/01,http://maps.bury.gov.uk/webmaplayers8/Map.aspx?x=380959&y=409016&resolution=0.5&epsg=27700&mapname=bury_shlaa_external&baseLayer=GreyScaleBury&datalayers=Brownfield%20Land%20Register%20Now%2CBury%20Council%2CselectFeaturesControl_container,,,
yes,,2017-12-19,-2.326233,53.564747,,0.26,2020-10-22,,8,8,63805 - Erection of 8 affordable homes approved 29/3/19,,http://opendatacommunities.org/id/metropolitan-district-council/bury,owned by a public authority,2019-03-29,full planning permission,https://planning.bury.gov.uk/online-applications/search.do?action=simple,permissioned,"Former Whittaker House (remaining area), Whittaker Street, Radcliffe, M26 2TD",HL/2527/00,http://maps.bury.gov.uk/webmaplayers8/Map.aspx?x=378490&y=407620&resolution=0.5&epsg=27700&mapname=bury_shlaa_external&baseLayer=GreyScaleBury&datalayers=Brownfield%20Land%20Register%20Now%2CBury%20Council%2CselectFeaturesControl_container,,,
,,2017-12-19,-2.368729,53.572758,,3.84,2017-12-19,,70,70,,,http://opendatacommunities.org/id/metropolitan-district-council/bury,not owned by a public authority,,,https://planning.bury.gov.uk/online-applications/search.do?action=simple,not permissioned,"Fold Mill, Bradley Lane, Bradley Lane, Radcliffe, BL2 6RR",HL/2532/00,http://maps.bury.gov.uk/webmaplayers8/Map.aspx?x=375680&y=408525&resolution=0.5&epsg=27700&mapname=bury_shlaa_external&baseLayer=GreyScaleBury&datalayers=Brownfield%20Land%20Register%20Now%2CBury%20Council%2CselectFeaturesControl_container,,,
,,2017-12-19,-2.26024,53.520759,,0.21,2017-12-19,,12,12,"54764 - Demolition of 2 no. detached dwellings; Construction of new apartment building comprising of 14 no. apartments with associated underground parking and amenity space approved 27/6/12, permission lapsed",,http://opendatacommunities.org/id/metropolitan-district-council/bury,not owned by a public authority,,,https://planning.bury.gov.uk/online-applications/search.do?action=simple,not permissioned,"46-48 Bury Old Road, Prestwich",HL/2586/00,http://maps.bury.gov.uk/webmaplayers8/Map.aspx?x=382843&y=402708&resolution=0.5&epsg=27700&mapname=bury_shlaa_external&baseLayer=GreyScaleBury&datalayers=Brownfield%20Land%20Register%20Now%2CBury%20Council%2CselectFeaturesControl_container,,,
,,2017-12-19,-2.32032,53.645272,,0.12,2017-12-19,,5,5,"54544 - Development of 5 dwellings approved 21/12/11, permission lapsed",,http://opendatacommunities.org/id/metropolitan-district-council/bury,not owned by a public authority,,,https://planning.bury.gov.uk/online-applications/search.do?action=simple,not permissioned,"Spring Steet Sawmills, Spring Street, Ramsbottom",HL/2599/00,http://maps.bury.gov.uk/webmaplayers8/Map.aspx?x=378922&y=416577&resolution=0.5&epsg=27700&mapname=bury_shlaa_external&baseLayer=GreyScaleBury&datalayers=Brownfield%20Land%20Register%20Now%2CBury%20Council%2CselectFeaturesControl_container,,,
,,2017-12-19,-2.300919,53.569757,,0.44,2017-12-19,,14,14,"55583 - Erection of 14 no. three-storey dwellings approved 30/09/2013, permission lapsed",,http://opendatacommunities.org/id/metropolitan-district-council/bury,not owned by a public authority,,,https://planning.bury.gov.uk/online-applications/search.do?action=simple,not permissioned,"Land adjacent to SE of 11 Morris Street, Radcliffe, Manchester, M26 2HF",HL/2648/00,http://maps.bury.gov.uk/webmaplayers8/Map.aspx?x=380169&y=408170&resolution=0.5&epsg=27700&mapname=bury_shlaa_external&baseLayer=GreyScaleBury&datalayers=Brownfield%20Land%20Register%20Now%2CBury%20Council%2CselectFeaturesControl_container,,,
yes,,2017-12-19,-2.27613,53.517244,,4.44,2020-10-22,,124,124,63324 - RM approval for 124 dwellings approved 6/12/19,,http://opendatacommunities.org/id/metropolitan-district-council/bury,not owned by a public authority,2019-12-06,reserved matters approval,https://planning.bury.gov.uk/online-applications/search.do?action=simple,permissioned,"Mountheath Industrial Estate, George Street, Prestwich",HL/2652/00,http://maps.bury.gov.uk/webmaplayers8/Map.aspx?x=381788&y=402321&resolution=0.5&epsg=27700&mapname=bury_shlaa_external&baseLayer=GreyScaleBury&datalayers=Brownfield%20Land%20Register%20Now%2CBury%20Council%2CselectFeaturesControl_container,,,
yes,,2020-10-22,-2.319852,53.563497,,0.12,2020-10-22,,15,15,64518 - 3 storey block of 15 apartments approved 22/1/20,,http://opendatacommunities.org/id/metropolitan-district-council/bury,not owned by a public authority,2020-01-22,full planning permission,https://planning.bury.gov.uk/online-applications/search.do?action=simple,permissioned,"Land adjacent St.Mary's Social Club, Pine Street, Radcliffe, M26 2WQ",HL/2654/00,http://maps.bury.gov.uk/webmaplayers8/Map.aspx?x=378912&y=407479&resolution=0.5&epsg=27700&mapname=bury_shlaa_external&baseLayer=GreyScaleBury&datalayers=Brownfield%20Land%20Register%20Now%2CBury%20Council%2CselectFeaturesControl_container,,,
,,2017-12-19,-2.31034,53.647904,,0.12,2020-10-22,,6,6,"59249 - Demolition of existing garages and erection of 6 no. Dwellings with associated landscaping and car parking approved on 21/01/2016, permission lapsed",,http://opendatacommunities.org/id/metropolitan-district-council/bury,owned by a public authority,,,https://planning.bury.gov.uk/online-applications/search.do?action=simple,not permissioned,"Garage Colony at junction of Fern Street and Quarry Street, Peel Brow, Ramsbottom",HL/2724/00,http://maps.bury.gov.uk/webmaplayers8/Map.aspx?x=379583&y=416867&resolution=0.5&epsg=27700&mapname=bury_shlaa_external&baseLayer=GreyScaleBury&datalayers=Brownfield%20Land%20Register%20Now%2CBury%20Council%2CselectFeaturesControl_container,,,
yes,,2017-12-19,-2.290766,53.516149,,0.11,2020-10-22,,15,15,60348 - Variation of condition no. 2 (approved plans) of planning permission 59290 to show the amended rear elevation and modified internal layout approved on 01/09/2016. 62765 - Demolition of existing public house and erection of 15 no. apartment buildin,,http://opendatacommunities.org/id/metropolitan-district-council/bury,not owned by a public authority,2018-09-14,full planning permission,https://planning.bury.gov.uk/online-applications/search.do?action=simple,permissioned,"51 Rainsough Brow, Prestwich, Manchester, M25 9XW",HL/2797/00,http://maps.bury.gov.uk/webmaplayers8/Map.aspx?x=380817&y=402203&resolution=0.5&epsg=27700&mapname=bury_shlaa_external&baseLayer=GreyScaleBury&datalayers=Brownfield%20Land%20Register%20Now%2CBury%20Council%2CselectFeaturesControl_container,,,
,,2020-10-22,-2.327517,53.601947,,0.99,2020-10-22,,9,9,"60452 - Conversion to 6 apartments, 2 semi-detached houses and 1 bungalow, approved 2/11/16, permission lapsed",,http://opendatacommunities.org/id/metropolitan-district-council/bury,not owned by a public authority,,,https://planning.bury.gov.uk/online-applications/search.do?action=simple,not permissioned,"Lake Hill, Walshaw Road, Bury, BL8 1PT",HL/2826/00,http://maps.bury.gov.uk/webmaplayers8/Map.aspx?x=378424&y=411759&resolution=0.5&epsg=27700&mapname=bury_shlaa_external&baseLayer=GreyScaleBury&datalayers=Brownfield%20Land%20Register%20Now%2CBury%20Council%2CselectFeaturesControl_container,,,
,,2017-12-19,-2.315562,53.648205,,0.07,2020-10-22,,8,8,60708 - Demolition of former police station and erection of building to include 2 no. shop units with 8 no. apartments above was granted planning permission on 25/01/2017. permission lapsed,,http://opendatacommunities.org/id/metropolitan-district-council/bury,not owned by a public authority,,,https://planning.bury.gov.uk/online-applications/search.do?action=simple,not permissioned,"Former Ramsbottom Police Station, Bridge Street, Ramsbottom, Bury, BL0 9AB",HL/2839/00,http://maps.bury.gov.uk/webmaplayers8/Map.aspx?x=379238&y=416902&resolution=0.5&epsg=27700&mapname=bury_shlaa_external&baseLayer=GreyScaleBury&datalayers=Brownfield%20Land%20Register%20Now%2CBury%20Council%2CselectFeaturesControl_container,,,
yes,,2018-12-13,-2.339919,53.601328,,0.06,2018-12-13,,13,13,60762 - Proposed extension and conversion of existing mill to provide 13 no. 1 & 2 bedroom residential apartments with 16 no. car parking spaces and associated works approved on 28/04/2017,,http://opendatacommunities.org/id/metropolitan-district-council/bury,not owned by a public authority,2017-04-28,full planning permission,https://planning.bury.gov.uk/online-applications/search.do?action=simple,permissioned,"Victoria Mill, High Street, Walshaw, Bury, BL8 3FS",HL/2841/00,http://maps.bury.gov.uk/webmaplayers8/Map.aspx?x=377603&y=411694&resolution=0.5&epsg=27700&mapname=bury_shlaa_external&baseLayer=GreyScaleBury&datalayers=Brownfield%20Land%20Register%20Now%2CBury%20Council%2CselectFeaturesControl_container,,,
yes,,2017-12-19,-2.287535,53.593412,,0.1,2020-10-22,,9,9,"60798 - Proposed development of 6 no. shops (Class A1) and 24 no. flats in 3 and 4 storey building was approved on 03/04/2017 64331 - development of 5 shops, 1 café and 9 apartments approved 23/8/19",,http://opendatacommunities.org/id/metropolitan-district-council/bury,owned by a public authority,2019-08-23,full planning permission,https://planning.bury.gov.uk/online-applications/search.do?action=simple,permissioned,"Land off Rochdale Road, Bury, BL9 7AX",HL/2842/00,http://maps.bury.gov.uk/webmaplayers8/Map.aspx?x=381066&y=410798&resolution=0.5&epsg=27700&mapname=bury_shlaa_external&baseLayer=GreyScaleBury&datalayers=Brownfield%20Land%20Register%20Now%2CBury%20Council%2CselectFeaturesControl_container,,,
yes,,2020-10-22,-2.299275,53.634082,,1.41,2020-10-22,,6,6,,,http://opendatacommunities.org/id/metropolitan-district-council/bury,not owned by a public authority,2017-03-01,full planning permission,https://planning.bury.gov.uk/online-applications/search.do?action=simple,permissioned,"Bast House Farm Barns, Manchester Road, Ramsbottom, Bury, BL9 5LZ",HL/2843/00,http://maps.bury.gov.uk/webmaplayers8/Map.aspx?x=380308&y=415326&resolution=0.5&epsg=27700&mapname=bury_shlaa_external&baseLayer=GreyScaleBury&datalayers=Brownfield%20Land%20Register%20Now%2CBury%20Council%2CselectFeaturesControl_container,,,
,,2017-12-19,-2.310247,53.546544,,0.17,2017-12-19,,6,6,"60924 - Demolition of existing dwelling and erection of 7no. flats, approved 26/04/2017",,http://opendatacommunities.org/id/metropolitan-district-council/bury,not owned by a public authority,2017-04-26,full planning permission,https://planning.bury.gov.uk/online-applications/search.do?action=simple,permissioned,"54 Ringley Road, Whitefield, Manchester, M45 7LL",HL/2844/00,http://maps.bury.gov.uk/webmaplayers8/Map.aspx?x=379540&y=405590&resolution=0.5&epsg=27700&mapname=bury_shlaa_external&baseLayer=GreyScaleBury&datalayers=Brownfield%20Land%20Register%20Now%2CBury%20Council%2CselectFeaturesControl_container,,,
yes,,2017-12-19,-2.299586,53.524424,,0.61,2020-10-22,,7,7,"60904 - Residential development of 4 no. Dwellings, approved 25/04/2017 64977 - residential development of 7 dwellings, approved 26/3/20",,http://opendatacommunities.org/id/metropolitan-district-council/bury,not owned by a public authority,2020-03-26,full planning permission,https://planning.bury.gov.uk/online-applications/search.do?action=simple,permissioned,"Former Viridor Waste Transfer Site, off Buckley Lane, Prestwich, Manchester, M25 3HR",HL/2880/00,http://maps.bury.gov.uk/webmaplayers8/Map.aspx?x=380236&y=403126&resolution=0.5&epsg=27700&mapname=bury_shlaa_external&baseLayer=GreyScaleBury&datalayers=Brownfield%20Land%20Register%20Now%2CBury%20Council%2CselectFeaturesControl_container,,,
,,2018-12-13,-2.284152,53.573457,,0.18,2018-12-13,,8,8,61135 - Outline application for the construction of 8 no. Dwellings was approved on 24/10/2017,,http://opendatacommunities.org/id/metropolitan-district-council/bury,not owned by a public authority,2017-10-24,outline planning permission,https://planning.bury.gov.uk/online-applications/search.do?action=simple,permissioned,"Car Park To The North Of 129 Croft Lane, Bury, BL9 8QH",HL/2889/00,http://maps.bury.gov.uk/webmaplayers8/Map.aspx?x=381281&y=408577&resolution=0.5&epsg=27700&mapname=bury_shlaa_external&baseLayer=GreyScaleBury&datalayers=Brownfield%20Land%20Register%20Now%2CBury%20Council%2CselectFeaturesControl_container,,,
yes,,2020-10-22,-2.256732,53.52171,,0.15,2020-10-22,,8,8,64642 - approval for erection of 4-storey block of 9 flats (net gain of 8 units) approved 18/12/19,,http://opendatacommunities.org/id/metropolitan-district-council/bury,not owned by a public authority,2019-12-18,full planning permission,https://planning.bury.gov.uk/online-applications/search.do?action=simple,permissioned,"72 Park Road, Prestwich, Manchester, M25 0FA",HL/2890/00,http://maps.bury.gov.uk/webmaplayers8/Map.aspx?x=383076&y=402813&resolution=0.5&epsg=27700&mapname=bury_shlaa_external&baseLayer=GreyScaleBury&datalayers=Brownfield%20Land%20Register%20Now%2CBury%20Council%2CselectFeaturesControl_container,,,
yes,,2017-12-19,-2.305298,53.592801,,0.78,2020-10-22,,49,49,64093 - Conversion of building to 39 apartments and erection of 10 townhouses approved 19/5/20 (after SHLAA cut off date),,http://opendatacommunities.org/id/metropolitan-district-council/bury,not owned by a public authority,,,https://planning.bury.gov.uk/online-applications/search.do?action=simple,not permissioned,"Bury Magistrates Court, Tenters Street, Bury, BL9 0HX",HL/2893/00,http://maps.bury.gov.uk/webmaplayers8/Map.aspx?x=379890&y=410735&resolution=0.5&epsg=27700&mapname=bury_shlaa_external&baseLayer=GreyScaleBury&datalayers=Brownfield%20Land%20Register%20Now%2CBury%20Council%2CselectFeaturesControl_container,,,
yes,,2020-10-22,-2.31479,53.550747,,0.11,2020-10-22,,12,12,63376 - conversion to 13 apartments approved 31/1/19,,http://opendatacommunities.org/id/metropolitan-district-council/bury,not owned by a public authority,2019-01-31,full planning permission,https://planning.bury.gov.uk/online-applications/search.do?action=simple,permissioned,"The Old School, 1 Walker Street, Radcliffe, Manchester, M26 1FH",HL/2950/00,http://maps.bury.gov.uk/webmaplayers8/Map.aspx?x=379241&y=406059&resolution=0.5&epsg=27700&mapname=bury_shlaa_external&baseLayer=GreyScaleBury&datalayers=Brownfield%20Land%20Register%20Now%2CBury%20Council%2CselectFeaturesControl_container,,,
,,2018-12-13,-2.285217,53.547703,,1.12,2018-12-13,,30,30,,,http://opendatacommunities.org/id/metropolitan-district-council/bury,owned by a public authority,,,https://planning.bury.gov.uk/online-applications/search.do?action=simple,not permissioned,"Wheatfield Centre, Victoria Avenue, Whitefield",HL/2956/00,http://maps.bury.gov.uk/webmaplayers8/Map.aspx?x=381199&y=405712&resolution=0.5&epsg=27700&mapname=bury_shlaa_external&baseLayer=GreyScaleBury&datalayers=Brownfield%20Land%20Register%20Now%2CBury%20Council%2CselectFeaturesControl_container,,,
,,2018-12-13,-2.296257,53.546651,,0.21,2018-12-13,,8,8,,,http://opendatacommunities.org/id/metropolitan-district-council/bury,owned by a public authority,,,https://planning.bury.gov.uk/online-applications/search.do?action=simple,not permissioned,"Former Whitefield Library and Adult Learning Centre, Pinfold Lane, Whitefield, M45 7NY",HL/2957/00,http://maps.bury.gov.uk/webmaplayers8/Map.aspx?x=380467&y=405598&resolution=0.5&epsg=27700&mapname=bury_shlaa_external&baseLayer=GreyScaleBury&datalayers=Brownfield%20Land%20Register%20Now%2CBury%20Council%2CselectFeaturesControl_container,,,
yes,,2020-10-22,-2.286456,53.541192,,0.12,2020-10-22,,11,11,63003 - Erection of office building and apartment building (11 dwl) approved 11/6/19,,http://opendatacommunities.org/id/metropolitan-district-council/bury,not owned by a public authority,2019-06-11,full planning permission,https://planning.bury.gov.uk/online-applications/search.do?action=simple,permissioned,"85 Bury Old Road, Whitefield, Manchester, M45 7AY",HL/2985/00,http://maps.bury.gov.uk/webmaplayers8/Map.aspx?x=381114&y=404988&resolution=0.5&epsg=27700&mapname=bury_shlaa_external&baseLayer=GreyScaleBury&datalayers=Brownfield%20Land%20Register%20Now%2CBury%20Council%2CselectFeaturesControl_container,,,
yes,,2020-10-22,-2.313019,53.631719,,0.19,2020-10-22,,16,16,63630 - 16 apartments approved 9/10/19,,http://opendatacommunities.org/id/metropolitan-district-council/bury,not owned by a public authority,2019-10-09,full planning permission,https://planning.bury.gov.uk/online-applications/search.do?action=simple,permissioned,"Land off Kay Street, Summerseat, Bury",HL/2995/00,http://maps.bury.gov.uk/webmaplayers8/Map.aspx?x=379398&y=415067&resolution=0.5&epsg=27700&mapname=bury_shlaa_external&baseLayer=GreyScaleBury&datalayers=Brownfield%20Land%20Register%20Now%2CBury%20Council%2CselectFeaturesControl_container,,,
,,2020-10-22,-2.320686,53.563945,,0.22,2020-10-22,,9,9,Previously part of wider site which now has separate planning approval.,,http://opendatacommunities.org/id/metropolitan-district-council/bury,not owned by a public authority,,,https://planning.bury.gov.uk/online-applications/search.do?action=simple,not permissioned,"7-9 Bury Road, Radcliffe",HL/3000/00,http://maps.bury.gov.uk/webmaplayers8/Map.aspx?x=378857&y=407529&resolution=0.5&epsg=27700&mapname=bury_shlaa_external&baseLayer=GreyScaleBury&datalayers=Brownfield%20Land%20Register%20Now%2CBury%20Council%2CselectFeaturesControl_container,,,
yes,,2020-10-22,-2.271168,53.536086,,0.19,2020-10-22,,9,9,64287 - conversion to 9 dwellings approved 19/8/19,,http://opendatacommunities.org/id/metropolitan-district-council/bury,not owned by a public authority,2019-08-19,full planning permission,https://planning.bury.gov.uk/online-applications/search.do?action=simple,permissioned,"399-415 Bury Old Road, Prestwich, Manchester, M25 1PS",HL/3016/00,http://maps.bury.gov.uk/webmaplayers8/Map.aspx?x=382125&y=404416&resolution=0.5&epsg=27700&mapname=bury_shlaa_external&baseLayer=GreyScaleBury&datalayers=Brownfield%20Land%20Register%20Now%2CBury%20Council%2CselectFeaturesControl_container,,,
,,2020-10-22,-2.322497,53.62924,,0.83,2020-10-22,,25,25,,,http://opendatacommunities.org/id/metropolitan-district-council/bury,owned by a public authority,,,https://planning.bury.gov.uk/online-applications/search.do?action=simple,not permissioned,"New Summerseat House, Summerseat Lane, Ramsbottom, Bury, BL0 9UD",HL/3027/00,http://maps.bury.gov.uk/webmaplayers8/Map.aspx?x=378770&y=414794&resolution=0.5&epsg=27700&mapname=bury_shlaa_external&baseLayer=GreyScaleBury&datalayers=Brownfield%20Land%20Register%20Now%2CBury%20Council%2CselectFeaturesControl_container,,,
yes,,2020-10-22,-2.335091,53.56422,,0.09,2020-10-22,,7,7,63832 - 7 dwellings approved 18/2/20,,http://opendatacommunities.org/id/metropolitan-district-council/bury,not owned by a public authority,2020-02-18,full planning permission,https://planning.bury.gov.uk/online-applications/search.do?action=simple,permissioned,"Land at Smyrna Street (junction with Shire Gardens), Radcliffe, M26 4BN",HL/3033/00,http://maps.bury.gov.uk/webmaplayers8/Map.aspx?x=377903&y=407564&resolution=0.5&epsg=27700&mapname=bury_shlaa_external&baseLayer=GreyScaleBury&datalayers=Brownfield%20Land%20Register%20Now%2CBury%20Council%2CselectFeaturesControl_container,,,
,2020-10-22,2017-12-19,-2.320685,53.564014,,0.26,2020-10-22,,17,17,42339 - outline planning permission lapsed 14/05/07. 62315 - change of use of ground floor to office and storage; 5 no. apartments on first floor; second floor extension to form 5 no. apartments (10 no. apartments total) for part of site at 11 Bury Road. Archived from brownfield land register October 2020 - under construction.,,http://opendatacommunities.org/id/metropolitan-district-council/bury,not owned by a public authority,,,https://planning.bury.gov.uk/online-applications/search.do?action=simple,not permissioned,"Adj 13 Bury Road, Radcliffe",HL/2004/00,http://maps.bury.gov.uk/webmaplayers8/Map.aspx?x=378857&y=407535&resolution=0.5&epsg=27700&mapname=bury_shlaa_external&baseLayer=GreyScaleBury&datalayers=Brownfield%20Land%20Register%20now%2CBury%20Council%2CselectFeaturesControl_container,,,
,2020-10-22,2017-12-19,-2.27505,53.565072,,0.13,2020-10-22,,6,6,Archived from brownfield land register October 2020 - not available.,,http://opendatacommunities.org/id/metropolitan-district-council/bury,not owned by a public authority,,,https://planning.bury.gov.uk/online-applications/search.do?action=simple,not permissioned,"Land adjacent 75 Hollins Lane, Bury",HL/2170/00,http://maps.bury.gov.uk/webmaplayers8/Map.aspx?x=381880&y=407640&resolution=0.5&epsg=27700&mapname=bury_shlaa_external&baseLayer=GreyScaleBury&datalayers=Brownfield%20Land%20Register%20now%2CBury%20Council%2CselectFeaturesControl_container,,,
,2020-10-22,2017-12-19,-2.29166,53.523651,,0.31,2020-10-22,,30,30,53800 - expired permission for 30 apartments. Archived from brownfield land register October 2020 - under construction.,,http://opendatacommunities.org/id/metropolitan-district-council/bury,not owned by a public authority,,,https://planning.bury.gov.uk/online-applications/search.do?action=simple,not permissioned,"Park Hotel - Off Lowther Road, Prestwich",HL/2183/00,http://maps.bury.gov.uk/webmaplayers8/Map.aspx?x=380761&y=403036&resolution=0.5&epsg=27700&mapname=bury_shlaa_external&baseLayer=GreyScaleBury&datalayers=Brownfield%20Land%20Register%20now%2CBury%20Council%2CselectFeaturesControl_container,,,
,2020-10-22,2017-12-19,-2.299002,53.58948,,0.37,2020-10-22,,200,200,Archived from brownfield land register October 2020 - not available.,,http://opendatacommunities.org/id/metropolitan-district-council/bury,owned by a public authority,,,https://planning.bury.gov.uk/online-applications/search.do?action=simple,not permissioned,"Land off Knowsley Street, Bury",HL/2230/00,http://maps.bury.gov.uk/webmaplayers8/Map.aspx?x=380305&y=410362&resolution=0.5&epsg=27700&mapname=bury_shlaa_external&baseLayer=GreyScaleBury&datalayers=Brownfield%20Land%20Register%20now%2CBury%20Council%2CselectFeaturesControl_container,,,
,2020-10-22,2017-12-19,-2.29797,53.590939,,0.62,2020-10-22,,30,30,Archived from brownfield land register October 2020 - not available.,,http://opendatacommunities.org/id/metropolitan-district-council/bury,not owned by a public authority,,,https://planning.bury.gov.uk/online-applications/search.do?action=simple,not permissioned,"Angouleme Way/Haymarket Street, Bury",HL/2236/00,http://maps.bury.gov.uk/webmaplayers8/Map.aspx?x=380374&y=410524&resolution=0.5&epsg=27700&mapname=bury_shlaa_external&baseLayer=GreyScaleBury&datalayers=Brownfield%20Land%20Register%20now%2CBury%20Council%2CselectFeaturesControl_container,,,
,2020-10-22,2017-12-19,-2.330966,53.563959,,0.11,2020-10-22,,19,19,59375 - Outline - demolition of existing building and erection of 1 building containing 19 no. apartments with associated car parking and amenity space granted 25/4/17. Archived from brownfield land register October 2020 - under construction.,,http://opendatacommunities.org/id/metropolitan-district-council/bury,mixed ownership,2017-04-25,outline planning permission,https://planning.bury.gov.uk/online-applications/search.do?action=simple,permissioned,"Royal British Legion Club, off Water Street, Radcliffe",HL/2252/00,http://maps.bury.gov.uk/webmaplayers8/Map.aspx?x=378176&y=407532&resolution=0.5&epsg=27700&mapname=bury_shlaa_external&baseLayer=GreyScaleBury&datalayers=Brownfield%20Land%20Register%20now%2CBury%20Council%2CselectFeaturesControl_container,,,
,2020-10-22,2017-12-19,-2.333973,53.583428,,0.35,2020-10-22,,15,15,Planning application 51934 for demolition of restaurant and erection of 15 dwellings expired 15/02/13. Archived from brownfield land register October 2020 - not available.,,http://opendatacommunities.org/id/metropolitan-district-council/bury,not owned by a public authority,,,https://planning.bury.gov.uk/online-applications/search.do?action=simple,not permissioned,"Dil Se Indian Restaurant (former Jolly Carters Pub), 207 Bury & Bolton Road, Radcliffe",HL/2288/00,http://maps.bury.gov.uk/webmaplayers8/Map.aspx?x=377987&y=409699&resolution=0.5&epsg=27700&mapname=bury_shlaa_external&baseLayer=GreyScaleBury&datalayers=Brownfield%20Land%20Register%20now%2CBury%20Council%2CselectFeaturesControl_container,,,
,2020-10-22,2017-12-19,-2.336125,53.588078,,0.14,2020-10-22,,14,14,54303 - expired outline permission for 14 sheltered flats. Archived from brownfield land register October 2020 - not available.,,http://opendatacommunities.org/id/metropolitan-district-council/bury,not owned by a public authority,,,https://planning.bury.gov.uk/online-applications/search.do?action=simple,not permissioned,"Land off Mile Lane, Bury",HL/2381/00,http://maps.bury.gov.uk/webmaplayers8/Map.aspx?x=377847&y=410217&resolution=0.5&epsg=27700&mapname=bury_shlaa_external&baseLayer=GreyScaleBury&datalayers=Brownfield%20Land%20Register%20now%2CBury%20Council%2CselectFeaturesControl_container,,,
,2020-10-22,2017-12-19,-2.290474,53.616952,,0.16,2020-10-22,,9,9,58133 -Outline application for demolition of the existing buildings and redevelopment of the site for up to 9 dwellings approved 20/1/15. 63056 - outline application for demolition of existing mill and erection of 4no. dwellings - approved 12/10/18. Archived from brownfield land register October 2020 - not available.,,http://opendatacommunities.org/id/metropolitan-district-council/bury,not owned by a public authority,,,https://planning.bury.gov.uk/online-applications/search.do?action=simple,not permissioned,"Windacre Works, Mather Road, Bury, BL9 6RB",HL/2311/00,http://maps.bury.gov.uk/webmaplayers8/Map.aspx?x=380882&y=413416&resolution=0.5&epsg=27700&mapname=bury_shlaa_external&baseLayer=GreyScaleBury&datalayers=Brownfield%20Land%20Register%20now%2CBury%20Council%2CselectFeaturesControl_container,,,
,2020-10-22,2017-12-19,-2.286031,53.594851,,8.35,2020-10-22,,200,200,Archived from brownfield land register October 2020 - not available.,,http://opendatacommunities.org/id/metropolitan-district-council/bury,mixed ownership,,,https://planning.bury.gov.uk/online-applications/search.do?action=simple,not permissioned,"York Street Industrial Area (Area Search), Bury",HL/2374/00,http://maps.bury.gov.uk/webmaplayers8/Map.aspx?x=381166&y=410956&resolution=0.5&epsg=27700&mapname=bury_shlaa_external&baseLayer=GreyScaleBury&datalayers=Brownfield%20Land%20Register%20now%2CBury%20Council%2CselectFeaturesControl_container,,,
,2020-10-22,2017-12-19,-2.289677,53.513697,,3.66,2020-10-22,,122,122,61474 - Outline - residential development of up to 118 homes including means of access approved 5/5/17. Archived from brownfield land register October 2020 - under construction.,,http://opendatacommunities.org/id/metropolitan-district-council/bury,not owned by a public authority,2017-10-25,outline planning permission,https://planning.bury.gov.uk/online-applications/search.do?action=simple,permissioned,"Site of former Cussons Sons & Co Ltd, Kersal Vale Road, Prestwich, M7 0GL",HL/2394/00,http://maps.bury.gov.uk/webmaplayers8/Map.aspx?x=380888&y=401928&resolution=0.5&epsg=27700&mapname=bury_shlaa_external&baseLayer=GreyScaleBury&datalayers=Brownfield%20Land%20Register%20now%2CBury%20Council%2CselectFeaturesControl_container,,,
,2020-10-22,2017-12-19,-2.333117,53.564861,,0.06,2020-10-22,,5,5,54338 - Application to extend the time limit for implementation of planning permission 50761 for Outline residential development - 5 dwellings. Archived from brownfield land register October 2020 - under construction.,,http://opendatacommunities.org/id/metropolitan-district-council/bury,not owned by a public authority,,,https://planning.bury.gov.uk/online-applications/search.do?action=simple,not permissioned,"Land Adj Siddall Street, Radcliffe",HL/2453/00,http://maps.bury.gov.uk/webmaplayers8/Map.aspx?x=378034&y=407633&resolution=0.5&epsg=27700&mapname=bury_shlaa_external&baseLayer=GreyScaleBury&datalayers=Brownfield%20Land%20Register%20now%2CBury%20Council%2CselectFeaturesControl_container,,,
,2020-10-22,2017-12-19,-2.313039,53.646943,,2.23,2020-10-22,,60,60,Archived from brownfield land register October 2020 - flood risk.,,http://opendatacommunities.org/id/metropolitan-district-council/bury,not owned by a public authority,,,https://planning.bury.gov.uk/online-applications/search.do?action=simple,not permissioned,"Mondi Paper Mill, Holcombe Mill, Peel Bridge, Ramsbottom, BL0 0BS",HL/2519/00,http://maps.bury.gov.uk/webmaplayers8/Map.aspx?x=379404&y=416759&resolution=0.5&epsg=27700&mapname=bury_shlaa_external&baseLayer=GreyScaleBury&datalayers=Brownfield%20Land%20Register%20now%2CBury%20Council%2CselectFeaturesControl_container,,,
,2020-10-22,2017-12-19,-2.32586,53.548001,,0.2,2020-10-22,,5,5,"56856 Outline - Residential development for 5 no. dwellings, approved 17/01/2014. Archived from brownfield land register October 2020 - under construction.",,http://opendatacommunities.org/id/metropolitan-district-council/bury,not owned by a public authority,,,https://planning.bury.gov.uk/online-applications/search.do?action=simple,not permissioned,"Land adjacent to Outwood Gate Farm, Ringley Road West, Radcliffe, Manchester, M26 1DL",HL/2672/00,http://maps.bury.gov.uk/webmaplayers8/Map.aspx?x=378506&y=405755&resolution=0.5&epsg=27700&mapname=bury_shlaa_external&baseLayer=GreyScaleBury&datalayers=Brownfield%20Land%20Register%20now%2CBury%20Council%2CselectFeaturesControl_container,,,
yes,2020-10-22,2017-12-19,-2.323356,53.560034,,0.08,2020-10-22,,10,10,62712 - Conversion of existing building into 6 no. flats and erection of adjacent 2 storey building to form 4 no. flats - approved 3/8/18. Archived from brownfield land register October 2020 - under construction.,,http://opendatacommunities.org/id/metropolitan-district-council/bury,not owned by a public authority,,,https://planning.bury.gov.uk/online-applications/search.do?action=simple,not permissioned,"Former Radcliffe Times Building, 44 Church Street West, Radcliffe",HL/2675/00,http://maps.bury.gov.uk/webmaplayers8/Map.aspx?x=378678&y=407093&resolution=0.5&epsg=27700&mapname=bury_shlaa_external&baseLayer=GreyScaleBury&datalayers=Brownfield%20Land%20Register%20now%2CBury%20Council%2CselectFeaturesControl_container,,,
yes,2020-10-22,2017-12-19,-2.30145,53.587434,,0.14,2020-10-22,,6,6,61018 - Change of use from mixed use development to create 5 no. Self-contained flats; refurbishment of Oddfellows meeting house and erection of 2 no. Semi-detached dwellings was granted planning permission on 28/03/2017. 1 dwelling already on the site. Archived from brownfield land register October 2020 - under construction.,,http://opendatacommunities.org/id/metropolitan-district-council/bury,not owned by a public authority,2017-03-29,full planning permission,https://planning.bury.gov.uk/online-applications/search.do?action=simple,permissioned,"The Oddfellows House, 94 Manchester Road, Bury, BL9 0TH",HL/2881/00,http://maps.bury.gov.uk/webmaplayers8/Map.aspx?x=380142&y=410135&resolution=0.5&epsg=27700&mapname=bury_shlaa_external&baseLayer=GreyScaleBury&datalayers=Brownfield%20Land%20Register%20now%2CBury%20Council%2CselectFeaturesControl_container,,,
yes,2020-10-22,2018-12-13,-2.286706,53.596297,,0.05,2020-10-22,,5,5,62336 - Prior notification for proposed change of use of existing industrial building (Class B1c) to 7 no. dwelling houses (Class C3) - Prior Approval Required and Granted 08/03/2018. Archived from brownfield land register October 2020 - completed.,,http://opendatacommunities.org/id/metropolitan-district-council/bury,not owned by a public authority,2018-03-08,full planning permission,https://planning.bury.gov.uk/online-applications/search.do?action=simple,permissioned,"Barnbrook Building, Barnbrook Street, Bury, BL9 7DT",HL/2952/00,http://maps.bury.gov.uk/webmaplayers8/Map.aspx?x=381122&y=411117&resolution=0.5&epsg=27700&mapname=bury_shlaa_external&baseLayer=GreyScaleBury&datalayers=Brownfield%20Land%20Register%20now%2CBury%20Council%2CselectFeaturesControl_container,,,
