Deliverable,EndDate,FirstAddedDate,GeoX,GeoY,HazardousSubstances,Hectares,LastUpdatedDate,MinNetDwellings,NetDwellingsRangeFrom,NetDwellingsRangeTo,Notes,OrganisationLabel,OrganisationURI,OwnershipStatus,PermissionDate,PermissionType,PlanningHistory,PlanningStatus,SiteNameAddress,SiteReference,SiteplanURL,entity,point,brownfield-land
yes,,2017-11-20,-0.024064,52.974125,,0.48,2019-12-05,50,50,60,"Planning permission for the development of 60 dwellings (B/17/0121). The site is identified as a housing allocation capable of providing 50 dwellings in the South East Lincolnshire Local Plan 2011-2036: Adopted March 2019, site ref no: Cen001.. 1. Erection of two apartment blocks, one fronting John Adams Way and the other fronting White Horse Lane, Boston 2. Erection of one dwelling attached to the north gable of 82 High Street, Boston 3. Conversion of Haven Wharf warehouse to provide 21 flats 4. Relevant demolition in a conservation area including the demolition of outbuilding to the rear of 78 High Street Boston, an industrial building attached to the south elevation of Haven Wharf Warehouse and buildings nos 1, 2 and 3",Boston Borough Council,http://opendatacommunities.org/id/district-council/boston,not owned by a public authority,2018-06-06,full planning permission,https://www.mybostonuk.com/planning-application-search/?ref=B/17/0121,permissioned,"Whitehorse Lane, Boston",BLR/BOS/001,http://www.mybostonuk.com/wp-content/uploads/2019/12/Whitehorse-Lane.pdf,,,
yes,,2017-11-20,-0.024521,52.971615,,0.19,2019-12-05,17,17,17,"9 dwellings completed, 8 outstanding but there has been no activity for about 15 years.. Residential development for 17 houses",Boston Borough Council,http://opendatacommunities.org/id/district-council/boston,not owned by a public authority,2003-09-18,full planning permission,https://www.mybostonuk.com/planning-application-search/?ref=B/03/0358,permissioned,"138-142 High Street, Boston",BLR/BOS/002,http://www.mybostonuk.com/wp-content/uploads/2019/12/138-142-High-Street.pdf,,,
yes,,2017-11-20,-0.046633,52.982599,,1.16,2019-12-05,35,35,46,"The site is identified as a housing allocation capable of providing 35 dwellings in the South East Lincolnshire Local Plan 2011-2036: Adopted (March 2018), site ref no: Fen002.. Demolition of dwelling and outbuildings; Outline planning permission for up to 46 no. residential dwellings with consideration given to access (Appearance, Landscaping, Layout, and Scale reserved matters for later approval)",Boston Borough Council,http://opendatacommunities.org/id/district-council/boston,not owned by a public authority,,outline planning permission,https://www.mybostonuk.com/planning-application-search/?ref=B/18/0435,pending decision,"Land to the north of Langrick Road, Boston",BLR/BOS/003,http://www.mybostonuk.com/wp-content/uploads/2019/12/Land-to-the-north-of-Langrick-Road.pdf,,,
yes,,2017-11-20,-0.016725,52.978606,,0.25,2019-12-05,8,8,14,An outline planning application B/09/0074 for residential development (maximum 14 dwellings) plus means of access has lapsed.,Boston Borough Council,http://opendatacommunities.org/id/district-council/boston,not owned by a public authority,,,,not permissioned,"Land to the north of Main Ridge East, Boston",BLR/BOS/007,http://www.mybostonuk.com/wp-content/uploads/2019/12/Main-Ridge-East.pdf,,,
yes,,2017-11-20,-0.028468,52.964093,,2.08,2019-12-05,60,60,62,"A planning application B/15/0009 for the Demolition of existing buildings and outline consent (up to 60 dwellings) with consideration given to access. (Matters relating to appearance, landscaping, layout and scale are reserved for later approval) has lapsed. The Site is also shown as a commitment on the SE Lincolnshire Adopted Local Plan. (The application had not lapsed on 31 Match 2017, which is the date housing data is calculated at).",Boston Borough Council,http://opendatacommunities.org/id/district-council/boston,owned by a public authority,,,,not permissioned,"Former Norton Lea (NHS) Site, Cork Tree Crescent, London Road, Boston",BLR/BOS/011,http://www.mybostonuk.com/wp-content/uploads/2019/12/Norton-Lea.pdf,,,
yes,,2017-11-20,-0.020716,52.983833,,1.21,2019-12-05,36,36,48,Planning permission was granted subject to the signing of a s106 agreement and as a consequence the site is shown as a commitment in the SE Lincolnshire Adopted Local Plan. The application was withdrawn afterwards.,Boston Borough Council,http://opendatacommunities.org/id/district-council/boston,not owned by a public authority,,,,not permissioned,"Magnadata International, Norfolk Street, Boston",BLR/BOS/012,http://www.mybostonuk.com/wp-content/uploads/2019/12/Norfolk-Street.pdf,,,
yes,,2017-11-20,-0.021798,52.987546,,5.78,2019-12-05,173,173,173,,Boston Borough Council,http://opendatacommunities.org/id/district-council/boston,not owned by a public authority,,,,not permissioned,"Magnadata International, Horncastle Road, Boston",BLR/BOS/013,http://www.mybostonuk.com/wp-content/uploads/2019/12/Horncastle-Road.pdf,,,
yes,,2017-11-20,-0.065123,52.967545,,2.84,2019-12-05,85,85,85,"The site is identified as a housing allocation capable of providing 85 dwellings in the South East Lincolnshire Local Plan Adopted March 2019, site ref no: Wyb013.",Boston Borough Council,http://opendatacommunities.org/id/district-council/boston,not owned by a public authority,,,,not permissioned,"Land to the south of Swineshead Road, Boston",BLR/BOS/015,http://www.mybostonuk.com/wp-content/uploads/2019/12/Land-to-the-south-of-Swineshead-Road.pdf,,,
yes,,2017-11-20,-0.044968,52.952183,,1.38,2019-12-05,28,28,41,"The site is identified as a housing allocation capable of providing 41 dwellings in the South East Lincolnshire Local Plan 2011-2036: Adopted March 2019, site ref no: Wyb041.",Boston Borough Council,http://opendatacommunities.org/id/district-council/boston,not owned by a public authority,,,,not permissioned,"291-293 London Road, Wyberton, Boston",BLR/BOS/016,http://www.mybostonuk.com/wp-content/uploads/2019/12/291-293-London-Road.pdf,,,
yes,,2017-11-20,-0.032065,52.980947,,0.12,2019-12-05,9,9,9,"A planning application (B/18/0370) for the erection of 3 no. three storey apartment blocks consisting of 55 no. flats including some amenity facilities, following demolition of existing public house and additional land was refused.. Conversion of a public house to 4 apartments, and the erection of 5.no attached 3 storey apartments",Boston Borough Council,http://opendatacommunities.org/id/district-council/boston,not owned by a public authority,2017-03-06,full planning permission,https://www.mybostonuk.com/planning-application-search/?ref=B/16/0424,permissioned,"New Castle Inn, 36 Fydell Street, Boston",BLR/BOS/027,http://www.mybostonuk.com/wp-content/uploads/2019/12/New-Castle-Inn.pdf,,,
yes,,2017-11-20,-0.033265,52.966321,,0.33,2019-12-05,6,6,8,The site has been cleared and condition discharge application has been submitted.. Application for approval of reserved matters (including appearance and landscaping) for the erection of 8 no. dwellings,Boston Borough Council,http://opendatacommunities.org/id/district-council/boston,not owned by a public authority,2018-04-09,reserved matters approval,https://www.mybostonuk.com/planning-application-search/?ref=B/17/0494,permissioned,"Land off Carmel Green, Park Road, Boston",BLR/BOS/030,http://www.mybostonuk.com/wp-content/uploads/2019/12/Carmel-Green.pdf,,,
yes,,2018-12-11,-0.023272,52.980387,,0.64,2019-12-05,15,15,15,"B/18/0059 Listed Building Consent for Listed building consent for single storey extension and refurbishment of 4 Wide Bargate. Demolition of part of the boundary wall to the Methodist Church and replacement with realigned wall and railings including pedestrian gate.. Demolition of 36 Strait Bargate and 2 Wide Bargate and part of the boundary wall to the Methodist Church. Refurbishment and extension of Grade II listed 4 Wide Bargate. Erection of 14 no. retail units (A1); 2 no. retail units (A3/A5); and 15 no. residential apartments, with associated car parking. Creation of a new pedestrian (and delivery/service vehicle) link connecting Wide Bargate to Red Lion Street",Boston Borough Council,http://opendatacommunities.org/id/district-council/boston,not owned by a public authority,2018-10-04,full planning permission,https://www.mybostonuk.com/planning-application-search/?ref=B/18/0060,permissioned,"NCP Carpark, Red Lion Street, Boston",BLR/BOS/031,http://www.mybostonuk.com/wp-content/uploads/2019/12/Red-Lion-Street.pdf,,,
yes,,2018-12-11,-0.030836,52.983066,,0.12,2019-12-05,24,24,24,"B/16/0283 Listed building Consent for demolition of part of boundary wall shared with The Witham Tavern. The site has been cleared but is overgrown suggesting little progress for a while.. Demolition of a chandlery, detached house and cottage and reduction in height of boundary walls plus the construction of 24 residential apartments together with ancillary external works including parking provision and the extinguishing of a vehicular access point",Boston Borough Council,http://opendatacommunities.org/id/district-council/boston,not owned by a public authority,2016-11-10,full planning permission,https://www.mybostonuk.com/planning-application-search/?ref=B/16/0282,permissioned,"5-7 Witham Bank East, Boston.",BLR/BOS/033,http://www.mybostonuk.com/wp-content/uploads/2019/12/5-7-Witham-Bank-East.pdf,,,
yes,,2018-12-11,-0.031353,52.983497,,0.21,2019-12-05,6,6,6,"The site is in the Boston Conservation Area. Consent for demolition has been granted, B/11/0515, and implemented.",Boston Borough Council,http://opendatacommunities.org/id/district-council/boston,not owned by a public authority,,,,not permissioned,"1, Witham Town, Boston",BLR/BOS/035,http://www.mybostonuk.com/wp-content/uploads/2019/12/Witham-Town.pdf,,,
yes,,2019-12-05,-0.019016,52.976711,,2.06,2019-12-05,62,62,62,The football club are building a new ground and will play the 2020/21 season from it. This site is under different ownership and is for sale.,Boston Borough Council,http://opendatacommunities.org/id/district-council/boston,not owned by a public authority,,,,not permissioned,Boston United and Glider Drome Boston.,BLR/BOS/036,http://www.mybostonuk.com/wp-content/uploads/2019/12/Boston-United-and-Glider-Drome.pdf,,,
yes,,2019-12-05,-0.026515,52.979488,,0.14,2019-12-05,5,5,5,This is the largest under developed site on Wormgate. It is against the river and so floof risk will have to be ameliorated.,Boston Borough Council,http://opendatacommunities.org/id/district-council/boston,not owned by a public authority,,,,not permissioned,"34-40 Wormgate, Boston",BLR/BOS/037,http://www.mybostonuk.com/wp-content/uploads/2019/12/Wormgate.pdf,,,
yes,,2017-11-20,-0.062775,52.927121,,1.25,2019-12-05,25,25,25,"The site is identified as a housing allocation capable of providing 25 dwellings in the South East Lincolnshire Local Plan 2011-2036: Adopted March 2019), site ref no: Kir016.",Boston Borough Council,http://opendatacommunities.org/id/district-council/boston,not owned by a public authority,,,,not permissioned,"31-33 London Road, Kirton",BLR/KIR/001,http://www.mybostonuk.com/wp-content/uploads/2019/12/31-33-London-Road.pdf,,,
yes,,2017-11-20,-0.185392,52.970224,,1.35,2019-12-05,35,35,35,"All 35 outstanding. Permission has been implemented owing to construction of access road. No further development has occurred for about 10 years.. Application for the approval of reserved matters for the construction of 35 dwellings plus new estate road, landscaping and associated works",Boston Borough Council,http://opendatacommunities.org/id/district-council/boston,not owned by a public authority,2008-07-07,reserved matters approval,https://www.mybostonuk.com/planning-application-search/?ref=B/08/0156,permissioned,"Old Station Yard, Swineshead Bridge, Boston",BLR/SWI/004,http://www.mybostonuk.com/wp-content/uploads/2019/12/Old-Station-Yard.pdf,,,
yes,,2017-11-20,0.13119,53.040034,,0.5,2019-12-05,27,27,27,All 27 outstanding. Outline application for residential development (27 dwellings) with all matters reserved,Boston Borough Council,http://opendatacommunities.org/id/district-council/boston,not owned by a public authority,2017-08-21,outline planning permission,https://www.mybostonuk.com/planning-application-search/?ref=B/16/0296,permissioned,"Geo H Kime & Co., Main Road, Wrangle",BLR/WRA/001,http://www.mybostonuk.com/wp-content/uploads/2019/12/Geo-H-Kime-Co.pdf,,,
