Deliverable,EndDate,FirstAddedDate,GeoX,GeoY,HazardousSubstances,Hectares,LastUpdatedDate,MinNetDwellings,NetDwellingsRangeFrom,NetDwellingsRangeTo,Notes,OrganisationLabel,OrganisationURI,OwnershipStatus,PermissionDate,PermissionType,PlanningHistory,PlanningStatus,point,SiteNameAddress,SiteplanURL,SiteReference
yes,,2017-08-18,-0.837814,51.409471,,6.65,2020-08-08,126,126,126,Full application for the erection of mixed use development for Town Centre uses and 126 residential units,Wokingham Borough Council,http://opendatacommunities.org/id/unitary-authority/wokingham,not owned by a public authority,2016-03-30,full planning permission,,permissioned,,"Elms Field & The Paddocks, Elms Rd, Wokingham",http://planning.wokingham.gov.uk/FastWebPL/welcome.asp,BR024
yes,,2017-08-18,-0.848241,51.403045,,0.55,2020-08-08,42,42,42,Prior approval submission for the conversion of existing office (Use Class B1(a)) to 42no residential apartments (Use Class C3).,Wokingham Borough Council,http://opendatacommunities.org/id/unitary-authority/wokingham,not owned by a public authority,2016-07-20,full planning permission,,permissioned,,Nigra Building Mulberry Business Park Fishponds Road RG41 2GY,http://planning.wokingham.gov.uk/FastWebPL/welcome.asp,BR063
yes,,2017-11-29,-0.848269,51.403081,,0.62,2020-08-08,14,14,14,Full application for the proposed raising of roof height to create a new second floor extension to create 9no self contained residential apartments including a communal garden and upgraded cycle storage and refuse facilities.,Wokingham Borough Council,http://opendatacommunities.org/id/unitary-authority/wokingham,not owned by a public authority,2017-02-27,full planning permission,,permissioned,,Nigra Building (Roof Space) Mulberry Business Park Fishponds Road Wokingham RG41 2GY .,http://planning.wokingham.gov.uk/FastWebPL/welcome.asp,BR069
yes,,2017-08-18,-0.85012,51.402659,,0.4,2020-08-08,34,34,34,Prior approval submission for the conversion of existing office (Use Class B1(a)) to 33no residential apartments (Use Class C3).,Wokingham Borough Council,http://opendatacommunities.org/id/unitary-authority/wokingham,not owned by a public authority,2019-07-10,full planning permission,,permissioned,,Rosa Building Mulberry Business Park Fishponds Wokingham Berkshire RG41 2GY,http://planning.wokingham.gov.uk/FastWebPL/welcome.asp,BR076
yes,,2017-08-18,-0.849743,51.402197,,0.51,2020-08-08,57,57,57,Prior approval submission for the conversion of existing office (Use Class B1(a)) to 45no residential apartments (Use Class C3).,Wokingham Borough Council,http://opendatacommunities.org/id/unitary-authority/wokingham,not owned by a public authority,2019-09-03,full planning permission,,permissioned,,Ilex House Fishponds Road Wokingham Berkshire RG41 2GY,http://planning.wokingham.gov.uk/FastWebPL/welcome.asp,BR077
yes,,2017-08-18,-0.846177,51.425649,,5.36,2020-08-08,74,74,74,Reserved Matters application pursuant to Outline planning consent O/2014/2242 for 74 dwellings,Wokingham Borough Council,http://opendatacommunities.org/id/unitary-authority/wokingham,not owned by a public authority,2017-07-17,reserved matters approval,,permissioned,,"North Wokingham - Matthewsgreen Farm, Phase 3",http://planning.wokingham.gov.uk/FastWebPL/welcome.asp,BR104
yes,,2017-08-18,-0.951463,51.409931,,4.46,2020-08-08,126,126,126,"Reserved Matters application pursuant to planning consent VAR/2013/0602 for a development of 126 dwellings, a sports pavilion, public open space, landscaping and associated works. This application comprises details of appearance, landscaping, layout and s cale.",Wokingham Borough Council,http://opendatacommunities.org/id/unitary-authority/wokingham,not owned by a public authority,2017-06-30,reserved matters approval,,permissioned,,"Land At The Manor, Brookers Hill Shinfield Reading RG2 9BX",http://planning.wokingham.gov.uk/FastWebPL/welcome.asp,BR175
yes,,2018-04-01,-0.898358,51.378475,,2.58,2020-08-08,114,114,114,Application for the Reserved Matters for the erection of 114 dwellings,Wokingham Borough Council,http://opendatacommunities.org/id/unitary-authority/wokingham,not owned by a public authority,2018-01-22,reserved matters approval,,permissioned,,"Land At, Arborfield Garrison Biggs Lane Arborfield - (Parcel Q)",http://planning.wokingham.gov.uk/FastWebPL/welcome.asp,BR192
yes,,2018-04-01,-0.891594,51.386028,,2.81,2020-08-08,79,79,79,Application for approval of Reserved Matters pursuant to Outline Planning Consent O/2014/2280 for 79 dwellings,Wokingham Borough Council,http://opendatacommunities.org/id/unitary-authority/wokingham,not owned by a public authority,2017-08-09,reserved matters approval,,permissioned,,"Land At, Arborfield Garrison Biggs Lane Arborfield -Parcel U2",http://planning.wokingham.gov.uk/FastWebPL/welcome.asp,BR193
yes,,2018-04-01,-0.901872,51.378122,,8.98,2020-08-08,179,179,179,Reserved Matters application pursuant to Outline Planning Consent O/2014/2280 for the erection of 179 dwellings,Wokingham Borough Council,http://opendatacommunities.org/id/unitary-authority/wokingham,not owned by a public authority,2017-07-25,reserved matters approval,,permissioned,,"Land At, Arborfield Garrison Biggs Lane Arborfield - Parcel H, I and J",http://planning.wokingham.gov.uk/FastWebPL/welcome.asp,BR194
yes,,2018-04-01,-0.891645,51.413067,,48.2,2020-08-08,18,18,18,Full application for the redevelopment of Former Bearwood Golf Course to provide a new football training ground and academy facility & 18 net residential units,Wokingham Borough Council,http://opendatacommunities.org/id/unitary-authority/wokingham,not owned by a public authority,2015-07-20,full planning permission,,permissioned,,"Former Bearwood Golf Course, Mole Rd, Sindlesham",http://planning.wokingham.gov.uk/FastWebPL/welcome.asp,BR197
yes,,2018-04-01,-0.838417,51.407786,,2.16,2020-08-08,55,55,55,Full planning application for the redevelopment of the Carnival Pool site to create leisure led development as part of the regeneration of Wokingham town centre. The proposals include the demolition of all existing buildings on site and the construction of: a leisure centre (use class D2); library (use class D1); restaurant (use class A3); commercial unit for non-residential institution or assembly and leisure use (use classes D1 or D2); 55 dwellings (use class C3); pedestrian and vehicular access including a pedestrian boulevard and realignment of Wellington Road; car parking; hard and soft landscaping; realignment of an existing footpath; drainage and,Wokingham Borough Council,http://opendatacommunities.org/id/unitary-authority/wokingham,not owned by a public authority,2018-02-02,full planning permission,,permissioned,,"Carnival Pool, Wellington Rd, Wokingham",http://planning.wokingham.gov.uk/FastWebPL/welcome.asp,BR201
yes,,2018-04-01,-0.86179,51.423041,,0.79,2020-08-08,43,43,43,"Full application for proposed erection of 43 dwellings (7 x 1 bedroom apartments, 11 x 2 bedroom apartments, 17 x 3 bedroom houses and 8 x 4 bedroom houses) together with associated access improvements, parking and refuse storage following the demolition of existing buildings.",Wokingham Borough Council,http://opendatacommunities.org/id/unitary-authority/wokingham,not owned by a public authority,2017-05-18,full planning permission,,permissioned,,Hewden Plant Hire Old Forest Road Wokingham RG41 1HY,http://planning.wokingham.gov.uk/FastWebPL/welcome.asp,BR202
yes,,2018-04-01,-0.858333,51.459622,,1.08,2020-08-08,16,16,16,Full planning application for the proposed erection of 16 no. dwellings with garages and parking spaces with new access to Whistley Green following demolition of derelict greenhouses.,Wokingham Borough Council,http://opendatacommunities.org/id/unitary-authority/wokingham,not owned by a public authority,2017-08-15,full planning permission,,permissioned,,Valley Nurseries Whistley Green Hurst RG10 0DX,http://planning.wokingham.gov.uk/FastWebPL/welcome.asp,BR204
yes,,2018-04-01,-0.885124,51.431718,,0.1,2020-08-08,8,8,8,Prior approval for proposed change of use from Offices to 8 residential apartments.,Wokingham Borough Council,http://opendatacommunities.org/id/unitary-authority/wokingham,not owned by a public authority,2017-11-03,Other,,permissioned,,498 Reading Road Winnersh Berkshire RG41 5EX,http://planning.wokingham.gov.uk/FastWebPL/welcome.asp,BR212
yes,,2018-04-01,-0.85012,51.400366,,0.21,2020-08-08,25,25,25,Prior approval submission for the conversion of existing office building (Use Class B1(a)) to 18no residential apartments (Use Class C3).,Wokingham Borough Council,http://opendatacommunities.org/id/unitary-authority/wokingham,not owned by a public authority,2020-02-05,full planning permission,,permissioned,,"12 Oaklands Business Centre, Oaklands Park Wokingham RG412FD",http://planning.wokingham.gov.uk/FastWebPL/welcome.asp,BR213
yes,,2018-04-01,-0.84596,51.404587,,0.35,2020-08-08,23,23,23,Prior approval submission for the conversion of existing offices (use class B1 (a)) to 23 apartments (use class C3),Wokingham Borough Council,http://opendatacommunities.org/id/unitary-authority/wokingham,not owned by a public authority,2018-02-27,full planning permission,,permissioned,,Quoin House Fishponds Road RG41 2QJ,http://planning.wokingham.gov.uk/FastWebPL/welcome.asp,BR218
yes,,2018-04-01,-0.843985,51.42302,,10.03,2020-08-08,243,243,243,Application for the approval of Reserved Matters pursuant to Outline planning consent O/2014/2242 for the erection of 253 residential dwellings,Wokingham Borough Council,http://opendatacommunities.org/id/unitary-authority/wokingham,not owned by a public authority,2017-02-14,reserved matters approval,,permissioned,,"North Wokingham - Matthewsgreen Farm, Phase 4",http://planning.wokingham.gov.uk/FastWebPL/welcome.asp,BR220
yes,,2018-04-01,-0.903365,51.379961,,10.76,2020-08-08,223,223,223,Application for Reserved Matters for the erection of 223 dwellings,Wokingham Borough Council,http://opendatacommunities.org/id/unitary-authority/wokingham,not owned by a public authority,2016-11-23,reserved matters approval,,permissioned,,"Land At, Arborfield Garrison Biggs Lane Arborfield Parcel A-G",http://planning.wokingham.gov.uk/FastWebPL/welcome.asp,BR221
yes,,2018-04-01,-0.884445,51.386302,,6.56,2020-08-08,127,127,127,Application for Reserved Matters for the erection of 127 dwellings,Wokingham Borough Council,http://opendatacommunities.org/id/unitary-authority/wokingham,not owned by a public authority,2016-09-14,reserved matters approval,,permissioned,,"Land At, Arborfield Garrison Biggs Lane Arborfield Parcel T",http://planning.wokingham.gov.uk/FastWebPL/welcome.asp,BR222
yes,,2018-04-01,-0.867657,51.477814,,0.07,2020-08-08,8,8,8,"Full Planning application for alterations to existing roof structure, facades and ground floor. Change of use on ground and first floor form offices and second floor from single flat to 8 self- contained apartments(C3 use).",Wokingham Borough Council,http://opendatacommunities.org/id/unitary-authority/wokingham,owned by a public authority,2017-03-23,full planning permission,,permissioned,,Kingsbridge House Wargrave Road Twyford RG10 9NY,http://planning.wokingham.gov.uk/FastWebPL/welcome.asp,BR229
yes,,2020-08-08,-0.843339,51.404166,,0.3,2020-08-08,8,8,8,Prior approval submission for the conversion of existing offices (Use Class B1(a)) to 65no residential flats (10no studio and 55no one bedroom)(Use Class C3).,Wokingham Borough Council,http://opendatacommunities.org/id/unitary-authority/wokingham,not owned by a public authority,,full planning permission,,permissioned,,Cyber House 2 (Roof Space) Molly Millars Lane Wokingham Berkshire RG41 2PX,http://planning.wokingham.gov.uk/FastWebPL/welcome.asp,BR231
yes,,2020-08-08,-0.858984,51.378063,,5.4,2020-08-08,249,249,249,"Full planning application for the proposed redevelopment of the existing Gorse Ride South Estate, comprising demolition of existing buildings and replacement with 249 no. dwellings (mixed-tenure flats and houses) together with associated access, parking, landscaping, public open space and drainage.",Wokingham Borough Council,http://opendatacommunities.org/id/unitary-authority/wokingham,not owned by a public authority,,full planning permission,,permissioned,,Gorse Ride Regeneration Phase 2,http://planning.wokingham.gov.uk/FastWebPL/welcome.asp,BR232
yes,,2020-09-18,-0.841668,51.410588,,0.22,2020-09-18,20,20,20,,Wokingham Borough Council,http://opendatacommunities.org/id/unitary-authority/wokingham,owned by a public authority,,,,not permissioned,,"Station Road, Wokingham Berks RG40 2AN",http://planning.wokingham.gov.uk/FastWebPL/welcome.asp,BR233
