Deliverable,EndDate,FirstAddedDate,GeoX,GeoY,HazardousSubstances,Hectares,LastUpdatedDate,MinNetDwellings,NetDwellingsRangeFrom,NetDwellingsRangeTo,Notes,OrganisationLabel,OrganisationURI,OwnershipStatus,PermissionDate,PermissionType,PlanningHistory,PlanningStatus,SiteNameAddress,SiteReference,SiteplanURL,entity,point,brownfield-land
yes,,2017-12-31,,,,0.02,2019-12-31,1,1,1,"Demolition of existing outbuilding, and construction of single storey one bedroom dwelling with basement. http://www.planningservices.haringey.gov.uk/portal/servlets/ApplicationSearchServlet?PKID=274687",Haringey Council,http://opendatacommunities.org/id/london-borough-council/haringey,not owned by a public authority,2014-09-18,full planning permission,,permissioned,Land rear of 24 Great North Road London N6 4LU,HGY/2014/1977,http://www.planningservices.haringey.gov.uk/portal/servlets/ApplicationSearchServlet?PKID=274687,,,
yes,,2017-12-31,,,,0.04,2019-12-31,2,2,2,Provision of 2 new semi-detached dwellings. http://www.planningservices.haringey.gov.uk/portal/servlets/ApplicationSearchServlet?PKID=275596,Haringey Council,http://opendatacommunities.org/id/london-borough-council/haringey,not owned by a public authority,2014-10-20,full planning permission,,permissioned,"Land at rear of 41, Mount View Road London N4 4SS",HGY/2014/2342,http://www.planningservices.haringey.gov.uk/portal/servlets/ApplicationSearchServlet?PKID=275596,,,
yes,,2017-12-31,,,,0.16,2019-12-31,18,18,18,Erection of a part 4 / part 5 storey building to contain retail development on the ground floor consisting of 422sq.m of A1 use and 218sq.m of A3 use with 18 residential units on the upper floors. http://www.planningservices.haringey.gov.uk/portal/servlets/ApplicationSearchServlet?PKID=272263,Haringey Council,http://opendatacommunities.org/id/london-borough-council/haringey,not owned by a public authority,2014-10-31,full planning permission,,permissioned,159 Tottenham Lane London N8 9BT,HGY/2014/0484,http://www.planningservices.haringey.gov.uk/portal/servlets/ApplicationSearchServlet?PKID=272263,,,
yes,,2017-12-31,,,,0.02,2019-12-31,1,1,1,Demolition of existing garages and erection of part single/part two storey two bedroom single dwelling house. http://www.planningservices.haringey.gov.uk/portal/servlets/ApplicationSearchServlet?PKID=274015,Haringey Council,http://opendatacommunities.org/id/london-borough-council/haringey,not owned by a public authority,2014-09-15,full planning permission,,permissioned,Land Between 41-43 Rectory Gardens London N8 7PJ,HGY/2014/1591,http://www.planningservices.haringey.gov.uk/portal/servlets/ApplicationSearchServlet?PKID=274015,,,
yes,,2017-12-31,,,,0.14,2019-12-31,25,25,25,"Erection of building behind retained Archway Road facade and fronting Causton Road to provide 25 residential dwellings (Class C3) at basement, ground, first, second, third floor level, including retention of existing facade fronting Archway Road and side return wall on Causton Road. Demolition of all existing buildings to the rear. Retention of retail floor space unit at ground floor level (Class A1). Change of use or part ground floor and part basement from retail (Class A1) to Class B1 use. Provision of associated residential amenity space, landscaping and car parking.. http://www.planningservices.haringey.gov.uk/portal/servlets/ApplicationSearchServlet?PKID=283951",Haringey Council,http://opendatacommunities.org/id/london-borough-council/haringey,not owned by a public authority,2016-03-31,full planning permission,,permissioned,191-201 Archway Road London N6 5BN,HGY/2015/2517,http://www.planningservices.haringey.gov.uk/portal/servlets/ApplicationSearchServlet?PKID=283951,,,
yes,,2017-12-31,,,,0.01,2019-12-31,2,2,2,Erection of 2 x 2 bed houses. http://www.planningservices.haringey.gov.uk/portal/servlets/ApplicationSearchServlet?PKID=280788,Haringey Council,http://opendatacommunities.org/id/london-borough-council/haringey,not owned by a public authority,2015-12-14,full planning permission,,permissioned,Rear of 74A Manor Road London N17 0JJ,HGY/2015/1071,http://www.planningservices.haringey.gov.uk/portal/servlets/ApplicationSearchServlet?PKID=280788,,,
yes,,2017-12-31,,,,0.03,2019-12-31,1,1,1,"The creation of a new dwelling, (C3 residential) following the demolition of six garages.. http://www.planningservices.haringey.gov.uk/portal/servlets/ApplicationSearchServlet?PKID=278532",Haringey Council,http://opendatacommunities.org/id/london-borough-council/haringey,not owned by a public authority,2015-08-04,full planning permission,,permissioned,320 High Road London N22 8JR,HGY/2015/0075,http://www.planningservices.haringey.gov.uk/portal/servlets/ApplicationSearchServlet?PKID=278532,,,
yes,,2017-12-31,,,,0.14,2019-12-31,1,1,1,"Demolition of existing derelict garages and erection of a 3-storey, part basement single family dwelling. http://www.planningservices.haringey.gov.uk/portal/servlets/ApplicationSearchServlet?PKID=275893",Haringey Council,http://opendatacommunities.org/id/london-borough-council/haringey,not owned by a public authority,2015-08-07,full planning permission,,permissioned,Land to the rear of 11-13 Stanhope Gardens London N6 5TT London,HGY/2014/2547,http://www.planningservices.haringey.gov.uk/portal/servlets/ApplicationSearchServlet?PKID=275893,,,
yes,,2017-12-31,,,,0.15,2019-12-31,1,1,1,Demolition of the existing storage lock up garages and development of new two storey house (partially cut into site) with integral garage. http://www.planningservices.haringey.gov.uk/portal/servlets/ApplicationSearchServlet?PKID=284030,Haringey Council,http://opendatacommunities.org/id/london-borough-council/haringey,not owned by a public authority,2015-11-11,full planning permission,,permissioned,62 Shepherds Hill London N6 5RN London,HGY/2015/2513,http://www.planningservices.haringey.gov.uk/portal/servlets/ApplicationSearchServlet?PKID=284030,,,
yes,,2017-12-31,,,,0.01,2019-12-31,1,1,1,"Demolition of the existing, derelict double garages and the construction of a three bedroom double-storey house with one storey being on the lower ground floor.. http://www.planningservices.haringey.gov.uk/portal/servlets/ApplicationSearchServlet?PKID=282908",Haringey Council,http://opendatacommunities.org/id/london-borough-council/haringey,not owned by a public authority,2015-10-02,full planning permission,,permissioned,Rear of 2 Birchington Road (in Coleridge Road) London N8 8HR,HGY/2015/1975,http://www.planningservices.haringey.gov.uk/portal/servlets/ApplicationSearchServlet?PKID=282908,,,
yes,,2017-12-31,,,,0.01,2019-12-31,1,1,1,Proposals for a new-build two storey ground floor and semi-basement lower ground floor Upside Down House.. http://www.planningservices.haringey.gov.uk/portal/servlets/ApplicationSearchServlet?PKID=284419,Haringey Council,http://opendatacommunities.org/id/london-borough-council/haringey,not owned by a public authority,2016-01-28,full planning permission,,permissioned,38 Stapleton Hall Road London N4 3QD,HGY/2015/2972,http://www.planningservices.haringey.gov.uk/portal/servlets/ApplicationSearchServlet?PKID=284419,,,
yes,,2017-12-31,,,,0.04,2019-12-31,3,3,3,Erection of a 2 storey terrace of three 2 bedroom starter homes with landscaping to front and rear. http://www.planningservices.haringey.gov.uk/portal/servlets/ApplicationSearchServlet?PKID=282219,Haringey Council,http://opendatacommunities.org/id/london-borough-council/haringey,not owned by a public authority,2016-06-22,full planning permission,,permissioned,Land rear of 6-8 Brownlow Road London N11 2DE London,HGY/2015/1643,http://www.planningservices.haringey.gov.uk/portal/servlets/ApplicationSearchServlet?PKID=282219,,,
yes,,2017-12-31,,,,0.4,2019-12-31,63,63,63,"Demolition of existing building and construction of one 23 storey building (22 storeys above ground, previous description omitted ground floor) with single basement, one 7 storey building and 4no. 3 storey townhouses comprising residential (private and affordable) use, with 879 sqm of market (sui generis) or A2, A3, B1 flexible commercial floorspace at ground floor, servicing yard and associated plant and landscaping (amended description and revised floor plans and elevations due to minor design alterations). http://www.planningservices.haringey.gov.uk/portal/servlets/ApplicationSearchServlet?PKID=284795",Haringey Council,http://opendatacommunities.org/id/london-borough-council/haringey,mixed ownership,2016-06-29,full planning permission,,permissioned,Apex House 820 Seven Sisters Road London N15 5PQ,HGY/2015/2915,http://www.planningservices.haringey.gov.uk/portal/servlets/ApplicationSearchServlet?PKID=284795,,,
yes,,2017-12-31,,,,0.11,2019-12-31,2,2,2,Demolition of lock-up garages and erection of two single-family dwelling houses.. http://www.planningservices.haringey.gov.uk/portal/servlets/ApplicationSearchServlet?PKID=287444,Haringey Council,http://opendatacommunities.org/id/london-borough-council/haringey,not owned by a public authority,2016-05-23,full planning permission,,permissioned,Garages to rear of Embassy Court Bounds Green Road London N11 2EU London,HGY/2016/0323,http://www.planningservices.haringey.gov.uk/portal/servlets/ApplicationSearchServlet?PKID=287444,,,
yes,,2017-12-31,,,,0.01,2019-12-31,2,2,2,Erection of two storey building to create 2 x 2 bed flats. http://www.planningservices.haringey.gov.uk/portal/servlets/ApplicationSearchServlet?PKID=287916,Haringey Council,http://opendatacommunities.org/id/london-borough-council/haringey,not owned by a public authority,2016-05-25,full planning permission,,permissioned,Land Adjacent To 8 Elmcroft London N8 7ES London,HGY/2016/0475,http://www.planningservices.haringey.gov.uk/portal/servlets/ApplicationSearchServlet?PKID=287916,,,
yes,,2017-12-31,,,,0.01,2019-12-31,3,3,3,Construction of new residential block comprising 2 x 2 bed flats and 1 x 1 bed flat to replace the existing commercial units. http://www.planningservices.haringey.gov.uk/portal/servlets/ApplicationSearchServlet?PKID=285365,Haringey Council,http://opendatacommunities.org/id/london-borough-council/haringey,not owned by a public authority,2016-07-12,full planning permission,,permissioned,The partial ground floor of 2a Westerfield Road and 687F Seven Sisters Road London N15 5LD,HGY/2015/3578,http://www.planningservices.haringey.gov.uk/portal/servlets/ApplicationSearchServlet?PKID=285365,,,
yes,,2017-12-31,,,,0.03,2019-12-31,4,4,4,"Construction of a building for four residential dwellings comprising 2 x 3 bed and 2 x 1 bed, with access, landscaping and associated works.. http://www.planningservices.haringey.gov.uk/portal/servlets/ApplicationSearchServlet?PKID=289010",Haringey Council,http://opendatacommunities.org/id/london-borough-council/haringey,not owned by a public authority,2016-07-20,full planning permission,,permissioned,Site adjoining 87A Rathcoole Gardens London N8 9PH,HGY/2016/1007,http://www.planningservices.haringey.gov.uk/portal/servlets/ApplicationSearchServlet?PKID=289010,,,
yes,,2017-12-31,,,,0.12,2019-12-31,31,31,31,"Demolition of existing building, construction of new road and construction of a lower ground, first, second and set back third storey building comprising of 31 new residential flats and new office space (amended plans showing revised design). http://www.planningservices.haringey.gov.uk/portal/servlets/ApplicationSearchServlet?PKID=283648",Haringey Council,http://opendatacommunities.org/id/london-borough-council/haringey,not owned by a public authority,2016-08-01,full planning permission,,permissioned,255 Lordship Lane London N17 6AA,HGY/2015/2321,http://www.planningservices.haringey.gov.uk/portal/servlets/ApplicationSearchServlet?PKID=283648,,,
yes,,2017-12-31,,,,0.01,2019-12-31,3,3,3,"Demolition of existing garages and redevelopment to provide three studio flats (Class C3 Residential); new matching balustrade and access over existing single storey structure; together with associated amenity space, cycle storage, and refuse provision.. http://www.planningservices.haringey.gov.uk/portal/servlets/ApplicationSearchServlet?PKID=287887",Haringey Council,http://opendatacommunities.org/id/london-borough-council/haringey,not owned by a public authority,2016-07-08,full planning permission,,permissioned,Land adjoining The Beehive Stoneleigh Road London N17 9BQ,HGY/2016/0444,http://www.planningservices.haringey.gov.uk/portal/servlets/ApplicationSearchServlet?PKID=287887,,,
yes,,2017-12-31,,,,0.03,2019-12-31,6,6,6,"Demolition of existing building and erection of a four storey building comprising two ground floor retail units (in flexible Class A1/A2 use) 2 x 1 bed flats, 3 x 2 bed flats and 1 x 3 bed flat (Class C3 use) with a communal roof terrace.. http://www.planningservices.haringey.gov.uk/portal/servlets/ApplicationSearchServlet?PKID=285779",Haringey Council,http://opendatacommunities.org/id/london-borough-council/haringey,not owned by a public authority,2016-07-11,full planning permission,,permissioned,316 High Road London N15 4BP,HGY/2015/3504,http://www.planningservices.haringey.gov.uk/portal/servlets/ApplicationSearchServlet?PKID=285779,,,
yes,,2017-12-31,,,,0.02,2019-12-31,7,7,7,"Demolition of garages and erection of a four storey residential building comprising a total of seven flats. The proposed residential mix is 1 x 3 bed flats, 4 x 2 bed flats and 2 x 1 bed flats. http://www.planningservices.haringey.gov.uk/portal/servlets/ApplicationSearchServlet?PKID=277876",Haringey Council,http://opendatacommunities.org/id/london-borough-council/haringey,not owned by a public authority,2016-08-05,full planning permission,,permissioned,Land to The Rear 418 High Road London N17 9JB,HGY/2014/3174,http://www.planningservices.haringey.gov.uk/portal/servlets/ApplicationSearchServlet?PKID=277876,,,
yes,,2017-12-31,,,,0.03,2019-12-31,9,9,9,"Erection of part 3 storey, part 4 storey building to accommodate 9 residential units with private and communal amenity and basement car parking for 4 vehicles. http://www.planningservices.haringey.gov.uk/portal/servlets/ApplicationSearchServlet?PKID=290127",Haringey Council,http://opendatacommunities.org/id/london-borough-council/haringey,not owned by a public authority,2016-08-18,full planning permission,,permissioned,Cleopatra House Pembroke Road London N8 7RQ,HGY/2016/1677,http://www.planningservices.haringey.gov.uk/portal/servlets/ApplicationSearchServlet?PKID=290127,,,
yes,,2017-12-31,,,,0.08,2019-12-31,9,9,9,"Demolition of existing structures and redevelopment of the site to provide 9 residential units (Use Class C3) comprising 5 x residential flats and 4 mews houses, and 200sqm of flexible retail / office unit (Use Class A1 / A3 / B1) including basement car. http://www.planningservices.haringey.gov.uk/portal/servlets/ApplicationSearchServlet?PKID=286502",Haringey Council,http://opendatacommunities.org/id/london-borough-council/haringey,not owned by a public authority,2016-09-20,full planning permission,,permissioned,109 Fortis Green London N2 9HR,HGY/2015/3813,http://www.planningservices.haringey.gov.uk/portal/servlets/ApplicationSearchServlet?PKID=286502,,,
yes,,2017-12-31,,,,0.14,2019-12-31,9,9,9,"Demolition of existing lock-up garages and construction of 9 residential units (comprising 6 x 4 bed town houses, 2 x 2 bed flats, and 1 x 1 bed flat) and 87.9sq metres of commercial floor area with associated access road, parking areas and cycle stores. http://www.planningservices.haringey.gov.uk/portal/servlets/ApplicationSearchServlet?PKID=287953",Haringey Council,http://opendatacommunities.org/id/london-borough-council/haringey,not owned by a public authority,2016-09-26,full planning permission,,permissioned,Lock up Garages Cline Road London N11 2NE,HGY/2016/0558,http://www.planningservices.haringey.gov.uk/portal/servlets/ApplicationSearchServlet?PKID=287953,,,
yes,,2017-12-31,,,,0.03,2019-12-31,2,2,2,"Erection of 2 two-storey dwellings with associated cycle parking, refuse/recycling facilities and access.. http://www.planningservices.haringey.gov.uk/portal/servlets/ApplicationSearchServlet?PKID=291559",Haringey Council,http://opendatacommunities.org/id/london-borough-council/haringey,not owned by a public authority,2016-09-13,full planning permission,,permissioned,31-34 Corbett Grove London N22 8DQ London,HGY/2016/2692,http://www.planningservices.haringey.gov.uk/portal/servlets/ApplicationSearchServlet?PKID=291559,,,
yes,,2017-12-31,,,,0.02,2019-12-31,2,2,2,Erection of 2 x 1 bed single storey dwellings. http://www.planningservices.haringey.gov.uk/portal/servlets/ApplicationSearchServlet?PKID=288655,Haringey Council,http://opendatacommunities.org/id/london-borough-council/haringey,not owned by a public authority,2016-10-03,full planning permission,,permissioned,Land adjacent to no.34 Colless Road and 1 Wakefield Road London N15 4NN,HGY/2016/0900,http://www.planningservices.haringey.gov.uk/portal/servlets/ApplicationSearchServlet?PKID=288655,,,
yes,,2017-12-31,,,,0.1,2019-12-31,4,4,4,"Development of the site to provide 4 x 4 bedroom townhouses with associated private amenity space, car and cycle parking and landscaping. http://www.planningservices.haringey.gov.uk/portal/servlets/ApplicationSearchServlet?PKID=289338",Haringey Council,http://opendatacommunities.org/id/london-borough-council/haringey,not owned by a public authority,2016-10-03,full planning permission,,permissioned,Land Adjacent to Hornsey Bowling Club Rectory Gardens London N8 7QT,HGY/2016/1307,http://www.planningservices.haringey.gov.uk/portal/servlets/ApplicationSearchServlet?PKID=289338,,,
yes,,2017-12-31,,,,0.02,2019-12-31,7,7,7,Demolition of 3 no portacabins trading as shops and erection of a 4 storey building and detached single storey building comprising 3 no shops and 7 no flats comprising 3 x 1 bed and 4 x 2 bed flats. http://www.planningservices.haringey.gov.uk/portal/servlets/ApplicationSearchServlet?PKID=272686,Haringey Council,http://opendatacommunities.org/id/london-borough-council/haringey,not owned by a public authority,2016-10-07,full planning permission,,permissioned,14-18 Lymington Avenue London N22 6JA,HGY/2014/0710,http://www.planningservices.haringey.gov.uk/portal/servlets/ApplicationSearchServlet?PKID=272686,,,
yes,,2017-12-31,,,,0.02,2019-12-31,1,1,1,Erection of new two storey building to form 1 x 3 bedroom self contained dwelling. http://www.planningservices.haringey.gov.uk/portal/servlets/ApplicationSearchServlet?PKID=300551,Haringey Council,http://opendatacommunities.org/id/london-borough-council/haringey,not owned by a public authority,2017-01-25,full planning permission,,permissioned,67 De Quincey Road London N17 7DJ London,HGY/2016/4156,http://www.planningservices.haringey.gov.uk/portal/servlets/ApplicationSearchServlet?PKID=300551,,,
yes,,2017-12-31,,,,0.07,2019-12-31,12,12,12,Demolition of existing car repair/servicing garage and construction of a part 2 and part 4 storey building to provide 12 residential units with 7 car parking spaces including 2 wheelchair car parking spaces and ancillary servicing accommodation. http://www.planningservices.haringey.gov.uk/portal/servlets/ApplicationSearchServlet?PKID=285593,Haringey Council,http://opendatacommunities.org/id/london-borough-council/haringey,not owned by a public authority,2016-10-11,full planning permission,,permissioned,168 Park View Road London N17 9BL,HGY/2015/3398,http://www.planningservices.haringey.gov.uk/portal/servlets/ApplicationSearchServlet?PKID=285593,,,
yes,,2017-12-31,,,,0.02,2019-12-31,1,1,1,"Erection of a new two storey, four bedroom dwelling and associated site works. http://www.planningservices.haringey.gov.uk/portal/servlets/ApplicationSearchServlet?PKID=294174",Haringey Council,http://opendatacommunities.org/id/london-borough-council/haringey,not owned by a public authority,2016-10-27,full planning permission,,permissioned,29a Woodside Gardens London N17 6UN London,HGY/2016/3004,http://www.planningservices.haringey.gov.uk/portal/servlets/ApplicationSearchServlet?PKID=294174,,,
yes,,2017-12-31,,,,1.04,2019-12-31,174,174,174,"Demolition of the existing buildings and redevelopment of the site to provide two buildings of between 4 and 14 storeys in height comprising 174 residential units (Use Class C3) and 294 sqm flexible B1 floorspace, including the provision of private and communal amenity areas, child play space, secure cycle parking, car parking, refuse and recycling storage areas and other associated development. http://www.planningservices.haringey.gov.uk/portal/servlets/ApplicationSearchServlet?PKID=290081",Haringey Council,http://opendatacommunities.org/id/london-borough-council/haringey,not owned by a public authority,2016-10-28,full planning permission,,permissioned,Railway Approach Hampden Road London N8 0HG,HGY/2016/1573,http://www.planningservices.haringey.gov.uk/portal/servlets/ApplicationSearchServlet?PKID=290081,,,
yes,,2017-12-31,,,,0.97,2019-12-31,145,145,145,"Outline Application with matters of layout, scale, appearance and landscaping reserved for mixed use redevelopment to comprise the demolition of existing buildings/ structures and associated site clearance and erection of new buildings / structures to provide residential units, employment uses (Use Class B1 and B8), retail uses (Use Class A1 and A3), community uses (Use Class D1) associated access, parking and servicing space, infrastructure, public realm works and ancillary development. http://www.planningservices.haringey.gov.uk/portal/servlets/ApplicationSearchServlet?PKID=288375",Haringey Council,http://opendatacommunities.org/id/london-borough-council/haringey,not owned by a public authority,2016-11-30,outline planning permission,,permissioned,500 White Hart Lane London N17 7NA London,HGY/2016/0828,http://www.planningservices.haringey.gov.uk/portal/servlets/ApplicationSearchServlet?PKID=288375,,,
yes,,2017-12-31,,,,8.48,2019-12-31,285,285,285,"A number of permissions cover this development (See Site Allocation). Proposed demolition and comprehensive phased redevelopment for stadium (Class D2) with hotel (Class C1), Tottenham Experience (sui generis), sports centre (Class D2); community (Class D1) and / or offices (Class B1); housing (Class C3); and health centre (Class D1); together with associated facilities including the construction of new and altered roads, footways; public and private open spaces; landscaping and related works. Details of appearance and landscape are reserved in relation to the residential buildings and associated community and / or office building. Details of appearance and scale are reserved in relation to the sports centre building. Details of appearance are reserved in relation to the health centre building. Proposal includes the demolition of 3 locally listed buildings and includes works to a Grade II Listed building for which a separate Listed Building application has been submitted (Ref: HGY/2015/3001). The proposal is EIA development.. http://www.haringey.gov.uk/sites/haringeygovuk/files/final_haringey_tottenham_aap_dtp_online.pdf",Haringey Council,http://opendatacommunities.org/id/london-borough-council/haringey,not owned by a public authority,2016-04-15,full planning permission,,permissioned,Tottenham Hotspur Football Club 748 High Road London N17 0AP London,HGY/2015/3000,http://www.planningservices.haringey.gov.uk/portal/servlets/ApplicationSearchServlet?PKID=284412,,,
yes,,2017-12-31,,,,0.72,2019-12-31,130,130,130,"Demolition of the existing retail warehouse and the redevelopment of the site to provide a part 4, part 5 and part 7 storey mixed use residential scheme, comprising 133 residential units (42 x 1-bed, 62 x 2-bed and 29 x 3-bed) and 940sqm of flexible A1/A2/A3/B1/D1 or D2 floorspace at ground floor level, 14 disabled car parking spaces for the residential use, with 3 additional spaces and 1 disabled space for the ground floor use, a new vehicular access off Colina Road and associated landscaping. Works also include the upgrading of Colina Mews and Colina Road.. http://www.planningservices.haringey.gov.uk/portal/servlets/ApplicationSearchServlet?PKID=290615",Haringey Council,http://opendatacommunities.org/id/london-borough-council/haringey,not owned by a public authority,2016-12-09,full planning permission,,permissioned,590-598 Green Lanes London N8 0RA,HGY/2016/1807,http://www.planningservices.haringey.gov.uk/portal/servlets/ApplicationSearchServlet?PKID=290615,,,
yes,,2017-12-31,,,,0.01,2019-12-31,1,1,1,Demolition of existing storage unit (with change of use permission to residential) and construction of single storey house incorpating a basement and mezzanine level.. http://www.planningservices.haringey.gov.uk/portal/servlets/ApplicationSearchServlet?PKID=278210,Haringey Council,http://opendatacommunities.org/id/london-borough-council/haringey,not owned by a public authority,2016-09-25,full planning permission,,permissioned,2A & 3A Collins Yard Scotland Green London N17 9TS,HGY/2014/3434,http://www.planningservices.haringey.gov.uk/portal/servlets/ApplicationSearchServlet?PKID=278210,,,
yes,,2017-12-31,,,,0.01,2019-12-31,1,1,1,Construction of two bedroom dwelling with basement and ground floor levels. http://www.planningservices.haringey.gov.uk/portal/servlets/ApplicationSearchServlet?PKID=296396,Haringey Council,http://opendatacommunities.org/id/london-borough-council/haringey,not owned by a public authority,2016-12-12,full planning permission,,permissioned,2A Lancaster Road London N4 4PP London,HGY/2016/3332,http://www.planningservices.haringey.gov.uk/portal/servlets/ApplicationSearchServlet?PKID=296396,,,
