Deliverable,EndDate,FirstAddedDate,GeoX,GeoY,HazardousSubstances,Hectares,LastUpdatedDate,MinNetDwellings,NetDwellingsRangeFrom,NetDwellingsRangeTo,Notes,OrganisationLabel,OrganisationURI,OwnershipStatus,PermissionDate,PermissionType,PlanningHistory,PlanningStatus,SiteNameAddress,SiteReference,SiteplanURL,entity,point,brownfield-land
yes,,2017-12-31,,,,0.01,2019-12-31,1,1,1,Permission has lapsed. Demolition of existing garage and erection of 1 x 2 storey two bedroom self-contained dwelling.. http://www.planningservices.haringey.gov.uk/portal/servlets/ApplicationSearchServlet?PKID=204646,Haringey Council,http://opendatacommunities.org/id/london-borough-council/haringey,not owned by a public authority,2009-12-09,full planning permission,,permissioned,Site between 186-188 Hermitage Road London N4 1NN London,HGY/2009/1559,http://www.planningservices.haringey.gov.uk/portal/servlets/ApplicationSearchServlet?PKID=204646,,,
yes,,2017-12-31,,,,0.23,2019-12-31,42,42,42,"Retention of the existing structural frame comprising Scotland Green House, rebuilding of the front and rear elevations, adding a fourth storey to the existing building and erection of a new four storey building to the front of the site to provide 42 residential units and one commercial unit.. http://www.planningservices.haringey.gov.uk/portal/servlets/ApplicationSearchServlet?PKID=204381",Haringey Council,http://opendatacommunities.org/id/london-borough-council/haringey,not owned by a public authority,2010-01-18,full planning permission,,permissioned,624 High Road London N17 9TL London,HGY/2009/1532,http://www.planningservices.haringey.gov.uk/portal/servlets/ApplicationSearchServlet?PKID=204381,,,
yes,,2017-12-31,,,,0.03,2019-12-31,1,1,1,Application for a new planning permission to replace an extant planning permission (HGY/2005/1416) for erection of a 2 storey 5 bedroom end of terrace house with rooms at basement and roof and 1 off street parking space. http://www.planningservices.haringey.gov.uk/portal/servlets/ApplicationSearchServlet?PKID=216974,Haringey Council,http://opendatacommunities.org/id/london-borough-council/haringey,not owned by a public authority,2010-08-27,full planning permission,,permissioned,"Land forming part of 60,Grand Avenue London N10 3BP London",HGY/2010/1305,http://www.planningservices.haringey.gov.uk/portal/servlets/ApplicationSearchServlet?PKID=216974,,,
yes,,2017-12-31,,,,0.01,2019-12-31,1,1,1,Permission has lapsed. Demolition of existing garage and erection of 1 x basement level and two storey one bedroom house.. http://www.planningservices.haringey.gov.uk/portal/servlets/ApplicationSearchServlet?PKID=228736,Haringey Council,http://opendatacommunities.org/id/london-borough-council/haringey,not owned by a public authority,2011-03-22,full planning permission,,permissioned,Land To The Rear Of 100 Wightman Road London N4 1RN London,HGY/2011/0141,http://www.planningservices.haringey.gov.uk/portal/servlets/ApplicationSearchServlet?PKID=228736,,,
yes,,2017-12-31,,,,0.03,2019-12-31,8,8,8,"Application for a new planning permission to replace an extant planning permission HGY/2008/0659 in order to extend the time limit for implementation: erection of 2 storey building comprising 3 x one bed flats, 4 x two bed flats and 1 x maisonette with a. http://www.planningservices.haringey.gov.uk/portal/servlets/ApplicationSearchServlet?PKID=234685",Haringey Council,http://opendatacommunities.org/id/london-borough-council/haringey,not owned by a public authority,2011-05-24,full planning permission,,permissioned,Land at 24A Birstall Road London N15 5EN London,HGY/2011/0655,http://www.planningservices.haringey.gov.uk/portal/servlets/ApplicationSearchServlet?PKID=234685,,,
yes,,2017-12-31,,,,4.59,2019-12-31,950,950,1080,"Outline planning application for demolition of existing structures and redevelopment to provide a residential led, mixed-use development, comprising between 950 to 1,080 residential units (C3); with 460sqm to 700sqm of office uses (B1); 370sqm to 700sqm of retail/financial and professional services uses (A1/A2); 190sqm to 550sqm of restaurant/cafe/drinking establishment uses (A3/A4); 325sqm to 550sqm of community/assembly/leisure uses (D1/D2); new landscaping, public and private open space, and energy centre, two utility compounds, up to 251 car parking spaces, cycle parking, access and other associated infrastructure works.. http://www.planningservices.haringey.gov.uk/portal/servlets/ApplicationSearchServlet?PKID=197286",Haringey Council,http://opendatacommunities.org/id/london-borough-council/haringey,not owned by a public authority,2012-03-21,outline planning permission,,permissioned,"Land at Haringey Heartlands, between Hornsey Park Road, Mayes Road, Clarendon Road and the Kings Cross / East Coast Mainline London",HGY/2009/0503,http://www.planningservices.haringey.gov.uk/portal/servlets/ApplicationSearchServlet?PKID=197286,,,
yes,,2017-12-31,,,,0.15,2019-12-31,9,9,9,"Demolition of no's 29-31 Aylmer Road and erection of a part 4/part 5 storey building comprising of 9 self contained flats to provide 6 x 2 bedroom apartments and 3 x 3 bedroom apartments. Provision of 14 covered car parking spaces, 1 visitor's space, cy. http://www.planningservices.haringey.gov.uk/portal/servlets/ApplicationSearchServlet?PKID=256442",Haringey Council,http://opendatacommunities.org/id/london-borough-council/haringey,not owned by a public authority,2012-12-21,full planning permission,,permissioned,29/31 Aylmer Road London N2 0BS,HGY/2012/0554,http://www.planningservices.haringey.gov.uk/portal/servlets/ApplicationSearchServlet?PKID=256442,,,
yes,,2017-12-31,,,,0.01,2019-12-31,1,1,1,"Demolition of existing garages and erection of 1 x 2 storey, two bed dwelling. http://www.planningservices.haringey.gov.uk/portal/servlets/ApplicationSearchServlet?PKID=261175",Haringey Council,http://opendatacommunities.org/id/london-borough-council/haringey,not owned by a public authority,2013-03-04,full planning permission,,permissioned,Garages Rear of 269 Archway Road London N6 5BT,HGY/2012/1572,http://www.planningservices.haringey.gov.uk/portal/servlets/ApplicationSearchServlet?PKID=261175,,,
yes,,2017-12-31,,,,0.83,2019-12-31,163,163,163,"Demolition of existing buildings and erection of a mixed use development comprising class C3 residential, class A1/A2/A3/A4 uses, with access, parking and associated landscaping and public realm improvements. http://www.haringey.gov.uk/planning-and-building-control/planning/planning-policy/local-plan/local-plan-site-allocations-dpd",Haringey Council,http://opendatacommunities.org/id/london-borough-council/haringey,mixed ownership,2012-07-12,full planning permission,,permissioned,"Wards Corner Site, High Road London N15 London",HGY/2012/0915,http://www.planningservices.haringey.gov.uk/portal/servlets/ApplicationSearchServlet?PKID=307535,,,
yes,,2017-12-31,,,,2.14,2019-12-31,438,438,438,"Demolition of existing structures and buildings and redevelopment of the site to provide a mixed-use development comprising approximately 3,250sqm (GIA) foodstore (A1 use) and 114 space surface level car parking for the foodstore; 438 residential units including affordable housing and ancillary residential gym, approximately 356sqm (GIA) unit on Hornsey High Street (flexible A1, A2 (including a temporary marketing suite), or D1 use); two live/work units fronting onto Cross Lane; together with private amenity space and new public realm, including publicly accessible routes through the site; an energy centre; 178 car parking spaces for the residential use (within a basement and undercroft); cycle parking; refuse storage; recycling centre in the foodstore car park; access; and other infrastructure work. http://www.haringey.gov.uk/planning-and-building-control/planning/planning-policy/local-plan/local-plan-site-allocations-dpd",Haringey Council,http://opendatacommunities.org/id/london-borough-council/haringey,mixed ownership,2014-04-04,full planning permission,,permissioned,Hornsey Reuse and Recycling Centre High Street London N8 7QB,HGY/2013/2019,http://www.planningservices.haringey.gov.uk/portal/servlets/ApplicationSearchServlet?PKID=270227,,,
yes,,2017-12-31,,,,0.01,2019-12-31,1,1,1,Erection of a two storey two bedroom house. http://www.planningservices.haringey.gov.uk/portal/servlets/ApplicationSearchServlet?PKID=271884,Haringey Council,http://opendatacommunities.org/id/london-borough-council/haringey,not owned by a public authority,2014-03-24,full planning permission,,permissioned,Site adjoining 1 Coningsby Road London N4 1EG,HGY/2014/0267,http://www.planningservices.haringey.gov.uk/portal/servlets/ApplicationSearchServlet?PKID=271884,,,
yes,,2017-12-31,,,,0.14,2019-12-31,4,4,4,Demolition of 33 existing lock-up garages and erection of 4 x 2 storey four bedroom houses with basement floors and associated landscaping and car parking. http://www.planningservices.haringey.gov.uk/portal/servlets/ApplicationSearchServlet?PKID=262172,Haringey Council,http://opendatacommunities.org/id/london-borough-council/haringey,not owned by a public authority,2013-06-04,full planning permission,,permissioned,Land rear of 27-47 Cecile Park London N8,HGY/2012/1705,http://www.planningservices.haringey.gov.uk/portal/servlets/ApplicationSearchServlet?PKID=262172,,,
yes,,2017-12-31,,,,0.01,2019-12-31,2,2,2,"Erection of new three storey residential building with flat roof, comprising 2 x two bed flats, with provision of bin store to front.. http://www.planningservices.haringey.gov.uk/portal/servlets/ApplicationSearchServlet?PKID=268547",Haringey Council,http://opendatacommunities.org/id/london-borough-council/haringey,not owned by a public authority,2013-10-09,full planning permission,,permissioned,Land to rear of 14 Lansdowne Road London N17 9XE,HGY/2013/1685,http://www.planningservices.haringey.gov.uk/portal/servlets/ApplicationSearchServlet?PKID=268547,,,
yes,,2017-12-31,,,,0.02,2019-12-31,1,1,1,Demolition of an existing building and erection of a new building with retail unit on the ground floor with storage in the basement and a two bedroom flat on the first and second floor. http://www.planningservices.haringey.gov.uk/portal/servlets/ApplicationSearchServlet?PKID=271248,Haringey Council,http://opendatacommunities.org/id/london-borough-council/haringey,not owned by a public authority,2014-03-07,full planning permission,,permissioned,21 Great Cambridge Road London N17 7LH,HGY/2014/0090,http://www.planningservices.haringey.gov.uk/portal/servlets/ApplicationSearchServlet?PKID=271248,,,
yes,,2017-12-31,,,,0.05,2019-12-31,3,3,3,Demolition of existing warehouse and erection of 1 x 4 bed house and 2 x 2 bed mews houses with provision of bin and cycle storage. http://www.planningservices.haringey.gov.uk/portal/servlets/ApplicationSearchServlet?PKID=315175,Haringey Council,http://opendatacommunities.org/id/london-borough-council/haringey,not owned by a public authority,2013-11-22,full planning permission,,permissioned,30 Summerhill Road London N15 4HD London,HGY/2017/2431,http://www.planningservices.haringey.gov.uk/portal/servlets/ApplicationSearchServlet?PKID=315175,,,
yes,,2017-12-31,,,,0.43,2019-12-31,28,28,28,"Demolition of existing specialist school (D1 use) and night club (sui generis use) and partial demolition of existing restaurant building (A3 use). Conversion of retained buildings and erection of new buildings of 3 storeys to provide 1,054sqm of floorspace as replacement specialist school including community use accessed from Muswell hill (D1 use), partly accommodated within the existing vacant building at No.56 Muswell Hill, 28 residential units (C3 use), and a 288sqm ground floor retail unit at No.56 Muswell Hill (A1/A2/A3 use). Provision of car parking, cycle parking and associated hard and soft landscaping. http://www.planningservices.haringey.gov.uk/portal/servlets/ApplicationSearchServlet?PKID=270248",Haringey Council,http://opendatacommunities.org/id/london-borough-council/haringey,not owned by a public authority,2014-02-14,full planning permission,,permissioned,56 Muswell Hill London N10 3ST,HGY/2013/2069,http://www.planningservices.haringey.gov.uk/portal/servlets/ApplicationSearchServlet?PKID=270248,,,
yes,,2017-12-31,,,,0.19,2019-12-31,3,3,3,Development of a terrace of three x 4 bedroom houses. http://www.planningservices.haringey.gov.uk/portal/servlets/ApplicationSearchServlet?PKID=270884,Haringey Council,http://opendatacommunities.org/id/london-borough-council/haringey,not owned by a public authority,2014-02-14,full planning permission,,permissioned,Land to rear of 1-11 The Drive London N11 2DY,HGY/2013/2396,http://www.planningservices.haringey.gov.uk/portal/servlets/ApplicationSearchServlet?PKID=270884,,,
yes,,2017-12-31,,,,0.01,2019-12-31,2,2,2,Construction of two storey 2 bedroom residential unit with associated outside space on the site of an unused garage. http://www.planningservices.haringey.gov.uk/portal/servlets/ApplicationSearchServlet?PKID=271300,Haringey Council,http://opendatacommunities.org/id/london-borough-council/haringey,not owned by a public authority,2014-01-29,full planning permission,,permissioned,1A Hewitt Road London N8 0BS,HGY/2013/2566,http://www.planningservices.haringey.gov.uk/portal/servlets/ApplicationSearchServlet?PKID=271300,,,
yes,,2017-12-31,,,,6.32,2019-12-31,505,505,505,"Outline planning permission (for the entire site) for a residential led mixed use development comprising the demolition of existing buildings and structures; the construction of buildings across the site to include residential (up to 505 units) and flexible retail or business uses (Use Classes A1-A5 or B1); pedestrian/cycle footbridges, modification works to the existing vehicular access and associated highway works; refurbishment of existing infrastructure (including provision of an on-site energy centre, if required), landscaping and public realm works; new servicing arrangements; car/cycle parking; and associated and facilitating works. All matters are reserved for the pedestrian footbridges, Phases 2 and 3 Buildings and detailed permission is sought with no matters reserved for the Phase 1 Buildings. The detailed component of the application (Phase 1 buildings only) comprises the demolition of existing buildings; the construction of buildings ranging from 16 to 21 storeys to accommodate 249 residential units and 307m2 (GIA) of flexible retail or business uses (Use Classes A1-A5 or B1); modification works to the existing vehicular access and associated highway works; infrastructure (including provision of an on-site energy centre, if required), landscaping and public realm works; new servicing arrangements; car/cycle parking; and associated and facilitating works.. http://www.planningservices.haringey.gov.uk/portal/servlets/ApplicationSearchServlet?PKID=290435",Haringey Council,http://opendatacommunities.org/id/london-borough-council/haringey,mixed ownership,2017-06-13,outline planning permission,,permissioned,Hale Wharf,17140201,http://www.planningservices.haringey.gov.uk/portal/servlets/ApplicationSearchServlet?PKID=290435,,,
yes,,2017-12-31,,,,1.48,2019-12-31,160,160,160,http://www.haringey.gov.uk/planning-and-building-control/planning/planning-policy/local-plan/local-plan-site-allocations-dpd,Haringey Council,http://opendatacommunities.org/id/london-borough-council/haringey,owned by a public authority,,,,,Park Grove and Durnsford Road,17140364,http://www.haringey.gov.uk/planning-and-building-control/planning/planning-policy/local-plan/local-plan-site-allocations-dpd,,,
yes,,2017-12-31,,,,0.44,2019-12-31,35,35,35,http://www.haringey.gov.uk/planning-and-building-control/planning/planning-policy/local-plan/local-plan-site-allocations-dpd,Haringey Council,http://opendatacommunities.org/id/london-borough-council/haringey,owned by a public authority,,,,,Cranwood Care Home,17140365,http://www.haringey.gov.uk/planning-and-building-control/planning/planning-policy/local-plan/local-plan-site-allocations-dpd,,,
yes,,2017-12-31,,,,0.91,2019-12-31,87,87,87,http://www.haringey.gov.uk/planning-and-building-control/planning/planning-policy/local-plan/local-plan-site-allocations-dpd,Haringey Council,http://opendatacommunities.org/id/london-borough-council/haringey,owned by a public authority,,,,,L/A Coronation Sidings,17140337,http://www.haringey.gov.uk/planning-and-building-control/planning/planning-policy/local-plan/local-plan-site-allocations-dpd,,,
yes,,2017-12-31,,,,2.17,2019-12-31,206,206,206,http://www.haringey.gov.uk/planning-and-building-control/planning/planning-policy/local-plan/local-plan-site-allocations-dpd,Haringey Council,http://opendatacommunities.org/id/london-borough-council/haringey,mixed ownership,,,,,Clarendon Road South,17140043,http://www.haringey.gov.uk/planning-and-building-control/planning/planning-policy/local-plan/local-plan-site-allocations-dpd,,,
yes,,2017-12-31,,,,1.04,2019-12-31,66,66,66,http://www.haringey.gov.uk/planning-and-building-control/planning/planning-policy/local-plan/local-plan-site-allocations-dpd,Haringey Council,http://opendatacommunities.org/id/london-borough-council/haringey,not owned by a public authority,,,,,Barber Wilson,17140023,http://www.haringey.gov.uk/planning-and-building-control/planning/planning-policy/local-plan/local-plan-site-allocations-dpd,,,
yes,,2017-12-31,,,,0.46,2019-12-31,95,95,95,http://www.haringey.gov.uk/planning-and-building-control/planning/planning-policy/local-plan/local-plan-site-allocations-dpd,Haringey Council,http://opendatacommunities.org/id/london-borough-council/haringey,not owned by a public authority,,,,,Westbury and Whymark Avenues,17140006,http://www.haringey.gov.uk/planning-and-building-control/planning/planning-policy/local-plan/local-plan-site-allocations-dpd,,,
yes,,2017-12-31,,,,0.69,2019-12-31,124,124,124,http://www.haringey.gov.uk/planning-and-building-control/planning/planning-policy/local-plan/local-plan-site-allocations-dpd,Haringey Council,http://opendatacommunities.org/id/london-borough-council/haringey,not owned by a public authority,,,,,Wood Green Cultural Quarter (East),17140046,http://www.haringey.gov.uk/planning-and-building-control/planning/planning-policy/local-plan/local-plan-site-allocations-dpd,,,
yes,,2017-12-31,,,,2.04,2019-12-31,355,355,355,http://www.haringey.gov.uk/planning-and-building-control/planning/planning-policy/local-plan/local-plan-site-allocations-dpd,Haringey Council,http://opendatacommunities.org/id/london-borough-council/haringey,not owned by a public authority,,,,,Wood Green Cultural Quarter (South),17140338,http://www.haringey.gov.uk/planning-and-building-control/planning/planning-policy/local-plan/local-plan-site-allocations-dpd,,,
yes,,2017-12-31,,,,0.31,2019-12-31,29,29,29,http://www.haringey.gov.uk/planning-and-building-control/planning/planning-policy/local-plan/local-plan-site-allocations-dpd,Haringey Council,http://opendatacommunities.org/id/london-borough-council/haringey,not owned by a public authority,,,,,NW of Clarendon Square,17140226,http://www.haringey.gov.uk/planning-and-building-control/planning/planning-policy/local-plan/local-plan-site-allocations-dpd,,,
yes,,2017-12-31,,,,1.37,2019-12-31,195,195,195,http://www.haringey.gov.uk/planning-and-building-control/planning/planning-policy/local-plan/local-plan-site-allocations-dpd,Haringey Council,http://opendatacommunities.org/id/london-borough-council/haringey,mixed ownership,,,,,Clarendon Square Gateway,17140225,http://www.haringey.gov.uk/planning-and-building-control/planning/planning-policy/local-plan/local-plan-site-allocations-dpd,,,
yes,,2017-12-31,,,,0.71,2019-12-31,66,66,66,http://www.haringey.gov.uk/sites/haringeygovuk/files/final_haringey_tottenham_aap_dtp_online.pdf,Haringey Council,http://opendatacommunities.org/id/london-borough-council/haringey,mixed ownership,,,,,Constable Crescent,17140152,http://www.haringey.gov.uk/sites/haringeygovuk/files/final_haringey_tottenham_aap_dtp_online.pdf,,,
yes,,2017-12-31,,,,1.28,2019-12-31,297,297,297,http://www.haringey.gov.uk/sites/haringeygovuk/files/final_haringey_tottenham_aap_dtp_online.pdf,Haringey Council,http://opendatacommunities.org/id/london-borough-council/haringey,mixed ownership,,,,,Station Square West,17140197,http://www.haringey.gov.uk/sites/haringeygovuk/files/final_haringey_tottenham_aap_dtp_online.pdf,,,
yes,,2017-12-31,,,,1.49,2019-12-31,64,64,64,"Regeneration of Saltram Close Estate comprising: Site A: i) erection of new community centre and Under 5's playground, ii) filling in of existing underpass and creation of 1 x 1 bed maisonette to Block A, 2 x 3 bed maisonettes to Block B & 4 x 1 bed, 4 x 3 bed flats to Block C, iii) demolition of existing garages & alterations to existing pedestrian access way. Site B: i) change of use of existing playground to residential comprising erection of 3 & 6 storey building comprising 6 x 4 bed houses, 5 x 3 bed flats and 4 x 1 bed flats with associated landscaping and ii) construction of new access road. Site C: demolition of existing factory buildings and erection of 3 storey building comprising 15 x 2 bed flats with associated landscaping.. http://www.planningservices.haringey.gov.uk/portal/servlets/ApplicationSearchServlet?PKID=122813",Haringey Council,http://opendatacommunities.org/id/london-borough-council/haringey,mixed ownership,,,,,Saltram Close Housing Estate Stainby Road London N15 London,17140296,http://www.planningservices.haringey.gov.uk/portal/servlets/ApplicationSearchServlet?PKID=122813,,,
yes,,2017-12-31,,,,1.57,2019-12-31,334,334,334,http://www.haringey.gov.uk/planning-and-building-control/planning/planning-policy/local-plan/local-plan-site-allocations-dpd,Haringey Council,http://opendatacommunities.org/id/london-borough-council/haringey,mixed ownership,,,,,16-54 Wood Green High Road,17140221,http://www.haringey.gov.uk/planning-and-building-control/planning/planning-policy/local-plan/local-plan-site-allocations-dpd,,,
yes,,2017-12-31,,,,0.58,2019-12-31,106,106,106,http://www.haringey.gov.uk/planning-and-building-control/planning/planning-policy/local-plan/local-plan-site-allocations-dpd,Haringey Council,http://opendatacommunities.org/id/london-borough-council/haringey,not owned by a public authority,,,,,Green Ridings House,17140331,http://www.haringey.gov.uk/planning-and-building-control/planning/planning-policy/local-plan/local-plan-site-allocations-dpd,,,
yes,,2017-12-31,,,,1.29,2019-12-31,310,310,310,http://www.haringey.gov.uk/planning-and-building-control/planning/planning-policy/local-plan/local-plan-site-allocations-dpd,Haringey Council,http://opendatacommunities.org/id/london-borough-council/haringey,not owned by a public authority,,,,,Wood Green Bus Garage,17140235,http://www.haringey.gov.uk/planning-and-building-control/planning/planning-policy/local-plan/local-plan-site-allocations-dpd,,,
yes,,2017-12-31,,,,1.38,2019-12-31,138,138,138,Permission has been granted for improvements to the station HGY/2013/2610. http://www.haringey.gov.uk/sites/haringeygovuk/files/final_haringey_tottenham_aap_dtp_online.pdf,Haringey Council,http://opendatacommunities.org/id/london-borough-council/haringey,owned by a public authority,,,,,Tottenham Hale Station,17140199,http://www.haringey.gov.uk/sites/haringeygovuk/files/final_haringey_tottenham_aap_dtp_online.pdf,,,
yes,,2017-12-31,,,,4.77,2019-12-31,922,992,992,http://www.haringey.gov.uk/sites/haringeygovuk/files/final_haringey_tottenham_aap_dtp_online.pdf,Haringey Council,http://opendatacommunities.org/id/london-borough-council/haringey,not owned by a public authority,,,,,Tottenham Hale Retail Park,17140151,http://www.haringey.gov.uk/sites/haringeygovuk/files/final_haringey_tottenham_aap_dtp_online.pdf,,,
yes,,2017-12-31,,,,0.54,2019-12-31,45,45,45,http://www.haringey.gov.uk/planning-and-building-control/planning/planning-policy/local-plan/local-plan-site-allocations-dpd,Haringey Council,http://opendatacommunities.org/id/london-borough-council/haringey,not owned by a public authority,,,,,Summersby Road,17140310,http://www.haringey.gov.uk/planning-and-building-control/planning/planning-policy/local-plan/local-plan-site-allocations-dpd,,,
yes,,2017-12-31,,,,0.86,2019-12-31,72,72,72,http://www.haringey.gov.uk/planning-and-building-control/planning/planning-policy/local-plan/local-plan-site-allocations-dpd,Haringey Council,http://opendatacommunities.org/id/london-borough-council/haringey,not owned by a public authority,,,,,460-470 Archway Road,17140078,http://www.haringey.gov.uk/planning-and-building-control/planning/planning-policy/local-plan/local-plan-site-allocations-dpd,,,
yes,,2017-12-31,,,,1.07,2019-12-31,108,108,108,http://www.haringey.gov.uk/planning-and-building-control/planning/planning-policy/local-plan/local-plan-site-allocations-dpd,Haringey Council,http://opendatacommunities.org/id/london-borough-council/haringey,owned by a public authority,,,,,LBH Civic Centre,17140231,http://www.haringey.gov.uk/planning-and-building-control/planning/planning-policy/local-plan/local-plan-site-allocations-dpd,,,
yes,,2017-12-31,,,,0.61,2019-12-31,40,40,40,http://www.haringey.gov.uk/planning-and-building-control/planning/planning-policy/local-plan/local-plan-site-allocations-dpd,Haringey Council,http://opendatacommunities.org/id/london-borough-council/haringey,mixed ownership,,,,,Cross Lane,17140359,http://www.haringey.gov.uk/planning-and-building-control/planning/planning-policy/local-plan/local-plan-site-allocations-dpd,,,
