Deliverable,EndDate,FirstAddedDate,GeoX,GeoY,HazardousSubstances,Hectares,LastUpdatedDate,MinNetDwellings,NetDwellingsRangeFrom,NetDwellingsRangeTo,Notes,OrganisationLabel,OrganisationURI,OwnershipStatus,PermissionDate,PermissionType,PlanningHistory,PlanningStatus,SiteNameAddress,SiteReference,SiteplanURL,entity,point,brownfield-land
yes,,2019-12-31,,,,1.821,2019-12-31,156,156,156,"Hybrid planning application comprised of: Full proposals for the demolition of the existing buildings within the Berol Yard site and retention of Berol House. Erection of two buildings between 8 and 14 storeys providing 156 residential units, 891 sqm (GEA) of commercial floorspace (Class A1/A3/B1/D1), 7,275 sqm (GEA) of education floorspace (Class D1), car and cycle parking, open space, landscaping and other associated works. Outline proposals (all matters reserved) for the alteration/conversion of ground, first and second floors of Berol House with up to 3,685 sqm (GEA) of commercial floorspace (A1/A3/B1/D1) and the introduction of a two storey roof level extension introducing up to 18 residential units, cycle parking and other associated works. Amendments to scheme including replacement of accommodation with build-to-rent and reconfiguration of internal residential and commercial layout.. http://www.planningservices.haringey.gov.uk/portal/servlets/ApplicationSearchServlet?",Haringey Council,http://opendatacommunities.org/id/london-borough-council/haringey,not owned by a public authority,2018-06-08,full planning permission,,permissioned,"Berol Yard Ashley Road,,N17 9LJ",HGY/2017/2044,http://www.planningservices.haringey.gov.uk/portal/servlets/ApplicationSearchServlet,,,
yes,,2019-12-31,,,,1.271,2019-12-31,377,377,377,"Demolition of the existing buildings and erection of two buildings to provide 1,211 sqm of commercial floorspace (GEA) (Class A1/A3/B1/D1), 377 residential units (Class C3), new public realm, landscaped amenity space, car and cycle parking and all associated works.. http://www.planningservices.haringey.gov.uk/portal/servlets/ApplicationSearchServlet?",Haringey Council,http://opendatacommunities.org/id/london-borough-council/haringey,not owned by a public authority,2018-06-08,full planning permission,,permissioned,"Ashley Gardens Ashley Road,,N17 9LH",HGY/2017/2045,http://www.planningservices.haringey.gov.uk/portal/servlets/ApplicationSearchServlet,,,
yes,,2019-12-31,,,,1.4,2019-12-31,146,146,146,"Refurbishment and change of use of the Hornsey Town Hall from B1 Use and Sui-Generis Use to a mixed use scheme comprising a hotel (Use Class C1), food and beverage uses (Use Classes A3 and A4), community uses (Use Class D1, D2 and Sui-Generis Use) and co-working use (Use Class B1). Use of the Town Hall roof terrace as a bar (Use Class A4). Removal of east wing extension and erection of east wing roof extensions to the Town Hall. Change of use of the ground floor of Broadway Annex Building East to food and beverage use/drinking establishment use (Use Class A3/A4). Provision of 146 residential units (including 11 affordable) comprising: the erection of a 7 storey building; the erection of a part 4, part, 5, part 6, part 7 storey building and associated car parking at basement level; change of use of the first and second floors of the Broadway Annexe to residential use and the erection of an extension to the rear of the Broadway Annex; the erection of a residential mews block to the rear of the Broadway Annexe. Alterations and landscaping improvements to the town hall square and open spaces. Provision of cycle parking. Demolition of the Weston Clinic building; courtyard infill extension to the Town Hall; Hornsey Library garage; Library annex and energy centre. Demolition and replacement of metal stairwell to the rear of the Assembly Hall and demolition and replacement of stage hoist structure adjoining the Assembly Hall.. http://www.planningservices.haringey.gov.uk/portal/servlets/ApplicationSearchServlet?",Haringey Council,http://opendatacommunities.org/id/london-borough-council/haringey,mixed ownership,2018-03-13,full planning permission,,permissioned,"Hornsey Town Hall The Broadway,,N8 9JJ",HGY/2017/2220,http://www.planningservices.haringey.gov.uk/portal/servlets/ApplicationSearchServlet,,,
yes,,2019-12-31,,,,0.083,2019-12-31,8,8,8,"Demolition of carwash and garage (sui generis) to build residential (use class C3). Demolition of the existing single storey garage building and the erection of a four bedroom detached house and an apartment block consisting of 7 self-contained flats (1 no. 1 bed 2 person, 5 no. 2 bed 3 person and 1 no. 3 bed 5 person) together with 6 car parking spaces, landscaping and external works including alteration to vehicular access from Hermitage Road. http://www.planningservices.haringey.gov.uk/portal/servlets/ApplicationSearchServlet?",Haringey Council,http://opendatacommunities.org/id/london-borough-council/haringey,not owned by a public authority,2018-02-21,full planning permission,,permissioned,"348 Hermitage Road,,N15 5RE",HGY/2017/2625,http://www.planningservices.haringey.gov.uk/portal/servlets/ApplicationSearchServlet,,,
yes,,2019-12-31,,,,0.093,2019-12-31,7,7,7,"Part demolition, refurbishment, conversion and extension of existing public house with construction of new residential building containing six apartments and two houses to the rear. http://www.planningservices.haringey.gov.uk/portal/servlets/ApplicationSearchServlet?",Haringey Council,http://opendatacommunities.org/id/london-borough-council/haringey,not owned by a public authority,2018-08-07,full planning permission,,permissioned,"102 Northumberland Park,,N17 0TS",HGY/2017/2821,http://www.planningservices.haringey.gov.uk/portal/servlets/ApplicationSearchServlet,,,
yes,,2019-12-31,,,,1.32,2019-12-31,230,230,230,"Partial demolition, change of use and extension of the Chocolate Factory buildings. Demolition of the remaining buildings and redevelopment to create four new build blocks ranging in height from three up to 18 storeys. Mixed use development comprising 10,657 sq.m (GIA) of commercial floorspace (flexible Use Classes A1, A3, B1, D1 and D2), 230 Class C3 residential units together with associated residential and commercial car parking, public realm works and access. This application is accompanied by an Environmental Impact Assessment.. http://www.planningservices.haringey.gov.uk/portal/servlets/ApplicationSearchServlet?",Haringey Council,http://opendatacommunities.org/id/london-borough-council/haringey,not owned by a public authority,2019-02-15,full planning permission,,permissioned,"Land At The Chocolate Factory And Parma House, 5 Clarendon Road,,N22 6XJ",HGY/2017/3020,http://www.planningservices.haringey.gov.uk/portal/servlets/ApplicationSearchServlet,,,
yes,,2019-12-31,,,,0.104,2019-12-31,6,6,6,"The demolition of existing buildings and the construction of a part single, part three storey building to provide 8 self-contained flats. http://www.planningservices.haringey.gov.uk/portal/servlets/ApplicationSearchServlet?",Haringey Council,http://opendatacommunities.org/id/london-borough-council/haringey,not owned by a public authority,2018-06-22,full planning permission,,permissioned,"65 & 67 North Road,,N6 4BJ",HGY/2017/3071,http://www.planningservices.haringey.gov.uk/portal/servlets/ApplicationSearchServlet,,,
yes,,2019-12-31,,,,5.71,2019-12-31,,,,"Hybrid planning permission (part Outline, part Detailed) for the demolition of Olympia Trading Estate and Western Road buildings and structures, and a phased, residential led mixed use development comprising the construction of buildings across the site to include the following 163,300sqm GEA Use Class C3 Residential; 7,168sqm to 7,500sqm GEA Class B1 Business; 1,500sqm to 3,950sqm GEA Class A1-A5; 417sqm GEA Class D1 Day Nursery; and up to 2,500sqm GEA Class D2 Leisure; New Basement Level; Two Energy Centres; Vehicular Access, Parking; Realignment of Mary Neuner Road; Open space; Associated Infrastructure and Interim Works; Site Preparation Works. - Outline Permission is sought for 103,150sqm Class C3 Residential; 7,500sqm Class B1 Business Use; 1,500sqm to 3,950sqm Class A1-A5; and up to 2,500sqm Class D2 Leisure Use; Buildings up to 103.90m AOD; associated cycle and car parking provision; new basement level; energy centre; new public square, public realm works and landscaping; vehicular access and new servicing arrangements; associated highway works; and facilitating works. All matters (Appearance, Landscaping, Layout, Scale and Access) are Reserved. Vehicular access into the Basement Car Park from Mary Neuner Road and Western Road are submitted in detail. - Detailed Permission is sought for the construction of Building A1-A4, B1-B4 and C1; ranging from 2 to 15 storeys to accommodate 622 residential units; 332sqm Class B1 Business Use/Class A1-A5 Use; 417sqm Day Nursery; associated cycle and car parking provision; two basements; energy centre; public realm works and landscaping; vehicular access and new servicing arrangements; associated highway works; Realignment of Mary Neuner Road. This application is accompanied by an Environmental Impact Assessment.. http://www.planningservices.haringey.gov.uk/portal/servlets/ApplicationSearchServlet?",Haringey Council,http://opendatacommunities.org/id/london-borough-council/haringey,not owned by a public authority,2018-04-19,outline planning permission,,permissioned,"Land At Haringey Heartlands Hornsey Park Road, Mayes Road,,Coburg Road, Western Road,N8",HGY/2017/3117,http://www.planningservices.haringey.gov.uk/portal/servlets/ApplicationSearchServlet,,,
yes,,2019-12-31,,,,0.008,2019-12-31,1,1,1,Erection of two storey 1 x 2-bed/3-person house. http://www.planningservices.haringey.gov.uk/portal/servlets/ApplicationSearchServlet?,Haringey Council,http://opendatacommunities.org/id/london-borough-council/haringey,not owned by a public authority,2018-01-23,full planning permission,,permissioned,"73 Manor Road,,N17 0JH",HGY/2017/3306,http://www.planningservices.haringey.gov.uk/portal/servlets/ApplicationSearchServlet,,,
yes,,2019-12-31,,,,0.019,2019-12-31,1,1,1,Erection of a 3-bed 5-person detached house. http://www.planningservices.haringey.gov.uk/portal/servlets/ApplicationSearchServlet?,Haringey Council,http://opendatacommunities.org/id/london-borough-council/haringey,not owned by a public authority,2018-01-23,full planning permission,,permissioned,"Land Adjacent To 46 Denmark Road,,N8 0DZ",HGY/2017/3536,http://www.planningservices.haringey.gov.uk/portal/servlets/ApplicationSearchServlet,,,
yes,,2019-12-31,,,,1.16,2019-12-31,99,99,99,"Demolition of existing buildings and erection of a part 1,3,4,5,6,7 storey mixed use development comprising 25 Commercial Units (B1/B2), music rehearsal space (Sui Generis), café (A3), exhibition space (Sui Generis) (commercial spaces totalling 2446.9m2 gross), and 99 Residential Units (C3) including 12 apartments tethered to the commercial space, plus site access, replacement open space, landscaping, plant and other associated development. http://www.planningservices.haringey.gov.uk/portal/servlets/ApplicationSearchServlet?",Haringey Council,http://opendatacommunities.org/id/london-borough-council/haringey,not owned by a public authority,2018-07-09,full planning permission,,permissioned,"Bernard Works Bernard Road,,N15 4NE",HGY/2017/3584,http://www.planningservices.haringey.gov.uk/portal/servlets/ApplicationSearchServlet,,,
yes,,2019-12-31,,,,0.005,2019-12-31,1,1,1,Erection of 2 bedroom dwelling house inserted within existing perimeter brickwork shell of disused storage building.. http://www.planningservices.haringey.gov.uk/portal/servlets/ApplicationSearchServlet?,Haringey Council,http://opendatacommunities.org/id/london-borough-council/haringey,not owned by a public authority,2018-02-27,full planning permission,,permissioned,"1 Windsor Road,,N17 9DE",HGY/2017/3625,http://www.planningservices.haringey.gov.uk/portal/servlets/ApplicationSearchServlet,,,
yes,,2019-12-31,,,,0.05,2019-12-31,3,3,3,"Partial Demolition of first floor, comprising one residential unit (38sq m). Development of new rear extension at ground, first and second floor levels to provide additional floorspace to existing A class units at ground floor and 4no. additional residential units at first and second floors (2x2 bed units and 2x3 bed units). Remodelling of 2no. existing residential units (1 x 1bed and 1 x 2 bed) to create 2no. studios. Creation of cycle and bin stores and enhancement of existing residential access from Canning Crescent. http://www.planningservices.haringey.gov.uk/portal/servlets/ApplicationSearchServlet?",Haringey Council,http://opendatacommunities.org/id/london-borough-council/haringey,not owned by a public authority,2018-11-09,full planning permission,,permissioned,"266-272 High Road,,N22 8JX",HGY/2017/3631,http://www.planningservices.haringey.gov.uk/portal/servlets/ApplicationSearchServlet,,,
yes,,2019-12-31,,,,0.025,2019-12-31,4,4,4,"Demolition of former MOT garage and outbuildings at rear, and erection of a 2 storey end of terrace building to the Baronet Grove frontage comprising two 1 bedroom flats, together with a part two-storey, part single-storey rear extension to provide a 1 bedroom flat and a studio flat.. http://www.planningservices.haringey.gov.uk/portal/servlets/ApplicationSearchServlet?",Haringey Council,http://opendatacommunities.org/id/london-borough-council/haringey,not owned by a public authority,2018-10-18,full planning permission,,permissioned,"12a Baronet Grove,,N17 0LX",HGY/2017/3632,http://www.planningservices.haringey.gov.uk/portal/servlets/ApplicationSearchServlet,,,
yes,,2019-12-31,,,,0.048,2019-12-31,3,3,3,"Erection of a part 2 part single storey block comprising 3 x 1-bed flats with associated access, cycle parking amenity space and landscaping.. http://www.planningservices.haringey.gov.uk/portal/servlets/ApplicationSearchServlet?",Haringey Council,http://opendatacommunities.org/id/london-borough-council/haringey,not owned by a public authority,2018-08-17,full planning permission,,permissioned,"Land To Rear Of 2 Summerhill Road,,N15 4HD",HGY/2018/0015,http://www.planningservices.haringey.gov.uk/portal/servlets/ApplicationSearchServlet,,,
yes,,2019-12-31,,,,0.017,2019-12-31,1,1,1,"Demolition of three existing garages and erection of a three storey, four bedroom dwelling, including basement excavation and the removal of three trees.. http://www.planningservices.haringey.gov.uk/portal/servlets/ApplicationSearchServlet?",Haringey Council,http://opendatacommunities.org/id/london-borough-council/haringey,not owned by a public authority,2018-06-25,full planning permission,,permissioned,"45a Wolseley Road,,N8 8RS",HGY/2018/0035,http://www.planningservices.haringey.gov.uk/portal/servlets/ApplicationSearchServlet,,,
yes,,2019-12-31,,,,0.063,2019-12-31,15,15,15,"Demolition of existing car repair/servicing garage and construction of a part 3, part 4 and part 5 storey building to provide 15 residential units with 5 car parking spaces including 1 wheelchair car parking space, 24 cycle spaces and ancillary servicing accommodation.. http://www.planningservices.haringey.gov.uk/portal/servlets/ApplicationSearchServlet?",Haringey Council,http://opendatacommunities.org/id/london-borough-council/haringey,not owned by a public authority,2019-02-28,full planning permission,,permissioned,"168 Park View Road,,N17 9BL",HGY/2018/0076,http://www.planningservices.haringey.gov.uk/portal/servlets/ApplicationSearchServlet,,,
yes,,2019-12-31,,,,0.019,2019-12-31,5,5,5,"Demolition of the existing building and erection of a four-storey block comprising a ground floor D2 (assembly and leisure) use and 2 x 1-bed, 2 x 2-bed and 1 x 3-bed flats across all floors; associated access, cycle parking, amenity space and landscaping.. http://www.planningservices.haringey.gov.uk/portal/servlets/ApplicationSearchServlet?",Haringey Council,http://opendatacommunities.org/id/london-borough-council/haringey,not owned by a public authority,2018-07-27,full planning permission,,permissioned,"46 Tottenham Lane,,N8 7ED",HGY/2018/0210,http://www.planningservices.haringey.gov.uk/portal/servlets/ApplicationSearchServlet,,,
yes,,2019-12-31,,,,0.009,2019-12-31,1,1,1,Single storey house with room in the attic. http://www.planningservices.haringey.gov.uk/portal/servlets/ApplicationSearchServlet?,Haringey Council,http://opendatacommunities.org/id/london-borough-council/haringey,not owned by a public authority,2018-03-22,full planning permission,,permissioned,"Land Rear Of 81- 83 Nightingale Lane,,N8 7QY",HGY/2018/0376,http://www.planningservices.haringey.gov.uk/portal/servlets/ApplicationSearchServlet,,,
yes,,2019-12-31,,,,0.012,2019-12-31,1,1,1,"Demolition of existing garage and garden store, and erection of new three bedroom house on a currently vacant site. The house will be at the end of the terrace on Westbury Avenue and attached to 228 Westbury Avenue.. http://www.planningservices.haringey.gov.uk/portal/servlets/ApplicationSearchServlet?",Haringey Council,http://opendatacommunities.org/id/london-borough-council/haringey,not owned by a public authority,2018-07-18,full planning permission,,permissioned,"228 Westbury Avenue,,N22 6RU",HGY/2018/0876,http://www.planningservices.haringey.gov.uk/portal/servlets/ApplicationSearchServlet,,,
yes,,2019-12-31,,,,0.08,2019-12-31,0,0,0,The demolition of existing buildings and the erection of a single detached dwelling. http://www.planningservices.haringey.gov.uk/portal/servlets/ApplicationSearchServlet?,Haringey Council,http://opendatacommunities.org/id/london-borough-council/haringey,not owned by a public authority,2018-05-10,full planning permission,,permissioned,"6 Stormont Road,,N6 4NL",HGY/2018/0929,http://www.planningservices.haringey.gov.uk/portal/servlets/ApplicationSearchServlet,,,
yes,,2019-12-31,,,,0.031,2019-12-31,1,1,1,Demolition of existing garage to be replaced with a new three bedroom three storey house comprising of a basement level and associated private amenity space.. http://www.planningservices.haringey.gov.uk/portal/servlets/ApplicationSearchServlet?,Haringey Council,http://opendatacommunities.org/id/london-borough-council/haringey,not owned by a public authority,2018-07-26,full planning permission,,permissioned,"81 Ridge Road,,N8 9NP",HGY/2018/1385,http://www.planningservices.haringey.gov.uk/portal/servlets/ApplicationSearchServlet,,,
yes,,2019-12-31,,,,0.031,2019-12-31,1,1,1,Demolition of existing lock-up garages and erection of 3 bed chalet bungalow. http://www.planningservices.haringey.gov.uk/portal/servlets/ApplicationSearchServlet?,Haringey Council,http://opendatacommunities.org/id/london-borough-council/haringey,not owned by a public authority,2018-06-15,full planning permission,,permissioned,"10 Eldon Road,,N22 5DT",HGY/2018/1576,http://www.planningservices.haringey.gov.uk/portal/servlets/ApplicationSearchServlet,,,
yes,,2019-12-31,,,,0.053,2019-12-31,4,4,4,"Demolition of existing garages and erection of 4 x 3 bedroom family dwellings with associated car parking, landscaping and associated works. http://www.planningservices.haringey.gov.uk/portal/servlets/ApplicationSearchServlet?",Haringey Council,http://opendatacommunities.org/id/london-borough-council/haringey,not owned by a public authority,2018-08-24,full planning permission,,permissioned,"Site Adjacent To Philip Court Hornsey Lane Gardens Philip Court,,N6 5LN",HGY/2018/1660,http://www.planningservices.haringey.gov.uk/portal/servlets/ApplicationSearchServlet,,,
yes,,2019-12-31,,,,0.03,2019-12-31,1,1,1,"Erection of a 2 bedroom, single storey dwelling house with cycle storage and refuse & recycling facilities together with associated landscaping on the land adjacent to 131 St. Loys Road.. http://www.planningservices.haringey.gov.uk/portal/servlets/ApplicationSearchServlet?",Haringey Council,http://opendatacommunities.org/id/london-borough-council/haringey,not owned by a public authority,2018-12-04,full planning permission,,permissioned,"131 St Loys Road,,N17 6UE",HGY/2018/2061,http://www.planningservices.haringey.gov.uk/portal/servlets/ApplicationSearchServlet,,,
yes,,2019-12-31,,,,0.026,2019-12-31,1,1,1,Erection of new build 3 bedroom detached house with associated amenity space and cycle parking.. http://www.planningservices.haringey.gov.uk/portal/servlets/ApplicationSearchServlet?,Haringey Council,http://opendatacommunities.org/id/london-borough-council/haringey,not owned by a public authority,2018-12-14,full planning permission,,permissioned,"83 Priory Road,,N8 8LY",HGY/2018/2062,http://www.planningservices.haringey.gov.uk/portal/servlets/ApplicationSearchServlet,,,
yes,,2019-12-31,,,,0.008,2019-12-31,1,1,1,Demolition of existing garage/studio and the construction of a one bedroom detached bungalow with garden and patio bin and cycle storage. http://www.planningservices.haringey.gov.uk/portal/servlets/ApplicationSearchServlet?,Haringey Council,http://opendatacommunities.org/id/london-borough-council/haringey,not owned by a public authority,2018-08-28,full planning permission,,permissioned,"37b Palmerston Road,,N22 8QH",HGY/2018/2176,http://www.planningservices.haringey.gov.uk/portal/servlets/ApplicationSearchServlet,,,
yes,,2019-12-31,,,,2.4,2019-12-31,,,,"Demolition works and clearance of existing site to provide a mixed-use development comprising 6 buildings up to 38 storeys in height, which together with pavilion and basement accommodation will provide up to 104,053m² of floorspace (GIA), comprising residential (Use Class C3) (up to 1,036 units), retail (Use Class A1-A4), health centre (Use Class D1), office (Use Class B1), leisure (Use Class D2) parking and servicing areas, hard and soft landscaping (including the provision of a new public square), highways works, creation of new vehicular accesses and the realignment of Station Road, decentralised energy network works and other associated works.. http://www.planningservices.haringey.gov.uk/portal/servlets/ApplicationSearchServlet?",Haringey Council,http://opendatacommunities.org/id/london-borough-council/haringey,mixed ownership,2019-03-27,full planning permission,,permissioned,"Strategic Development Partnership (Sdp) Sites Welbourne, Nor Station Road,,N17",HGY/2018/2223,http://www.planningservices.haringey.gov.uk/portal/servlets/ApplicationSearchServlet,,,
yes,,2019-12-31,,,,0.09,2019-12-31,5,5,5,Clearance of existing derelict site and construction of 5 x new build town houses with ancillary car parking and amenity space. (Renewal of Planning Permission granted 08.05.2015 under planning reference HGY/2014/2453).. http://www.planningservices.haringey.gov.uk/portal/servlets/ApplicationSearchServlet?,Haringey Council,http://opendatacommunities.org/id/london-borough-council/haringey,not owned by a public authority,2018-11-30,full planning permission,,permissioned,"Land Rear Of 705-707 High Road,,N17 8AD",HGY/2018/2278,http://www.planningservices.haringey.gov.uk/portal/servlets/ApplicationSearchServlet,,,
yes,,2019-12-31,,,,0.052,2019-12-31,1,1,1,A new one bedroom dwelling along the rear boundary at 8 Williams Grove.. http://www.planningservices.haringey.gov.uk/portal/servlets/ApplicationSearchServlet?,Haringey Council,http://opendatacommunities.org/id/london-borough-council/haringey,not owned by a public authority,2018-10-23,full planning permission,,permissioned,"8 Williams Grove,,N22 5NR",HGY/2018/2531,http://www.planningservices.haringey.gov.uk/portal/servlets/ApplicationSearchServlet,,,
yes,,2019-12-31,,,,0.022,2019-12-31,1,1,1,Construction of a two storey dwellinghouse at ground and lower ground floor. http://www.planningservices.haringey.gov.uk/portal/servlets/ApplicationSearchServlet?,Haringey Council,http://opendatacommunities.org/id/london-borough-council/haringey,not owned by a public authority,2018-10-19,full planning permission,,permissioned,"Cornerways Ellington Road,,N10 3DD",HGY/2018/2596,http://www.planningservices.haringey.gov.uk/portal/servlets/ApplicationSearchServlet,,,
yes,,2019-12-31,,,,0.027,2019-12-31,1,1,1,"Erection of a two-storey, three double bedroom mews house with basement and associated private garden; the removal of an existing single-storey rear extension to No. 8 Weston Park and replacement with a new single-storey rear extension and associated private garden for the use of the dental practice. http://www.planningservices.haringey.gov.uk/portal/servlets/ApplicationSearchServlet?",Haringey Council,http://opendatacommunities.org/id/london-borough-council/haringey,not owned by a public authority,2018-11-06,full planning permission,,permissioned,"8 Weston Park,,N8 9TJ",HGY/2018/2598,http://www.planningservices.haringey.gov.uk/portal/servlets/ApplicationSearchServlet,,,
yes,,2019-12-31,,,,0.01,2019-12-31,1,1,1,Demolition of existing garages and construction of new self-contained residential unit. http://www.planningservices.haringey.gov.uk/portal/servlets/ApplicationSearchServlet?,Haringey Council,http://opendatacommunities.org/id/london-borough-council/haringey,not owned by a public authority,2018-10-22,full planning permission,,permissioned,"Garages Rear Of 269 Archway Road,,N6 5BT",HGY/2018/2764,http://www.planningservices.haringey.gov.uk/portal/servlets/ApplicationSearchServlet,,,
yes,,2019-12-31,,,,0.018,2019-12-31,1,1,1,"Three-storey, mixed-use development comprising a ground floor commercial unit with a 2-bed, 3-person self-contained residential unit on the two floors above.. http://www.planningservices.haringey.gov.uk/portal/servlets/ApplicationSearchServlet?",Haringey Council,http://opendatacommunities.org/id/london-borough-council/haringey,not owned by a public authority,2019-04-16,full planning permission,,permissioned,"20 Crescent Road,,N22 7RS",HGY/2018/3155,http://www.planningservices.haringey.gov.uk/portal/servlets/ApplicationSearchServlet,,,
