Deliverable,EndDate,FirstAddedDate,GeoX,GeoY,HazardousSubstances,Hectares,LastUpdatedDate,MinNetDwellings,NetDwellingsRangeFrom,NetDwellingsRangeTo,Notes,OrganisationLabel,OrganisationURI,OwnershipStatus,PermissionDate,PermissionType,PlanningHistory,PlanningStatus,SiteNameAddress,SiteReference,SiteplanURL,entity,point,brownfield-land
yes,,2017-12-01,-2.911731,53.502805,,0.4,2019-12-18,,15,15,Haulage Depot. Completions expected on site within 5 years.,,http://opendatacommunities.org/id/district-council/staffordshire-moorlands,not owned by a public authority,,,,not permissioned,"Haulage Depot, St Thomas's Road",UT019,https://www.staffsmoorlands.gov.uk/media/4698/Brownfield-Register/pdf/SMDC_Brownfield_Land_Register_2019_Maps.pdf?m=1576509255197,,,
yes,,2017-12-01,-2.644112,53.471271,,1.1,2019-12-18,,11,11,Has outline planning permission for 11 dwellings granted at appeal 5/11/2014. Completions expected on site within 5 years,,http://opendatacommunities.org/id/district-council/staffordshire-moorlands,not owned by a public authority,2018-03-15,outline planning permission,,permissioned,"Former reservoirs off, Land at Bridge End, Macclesfield Road",LE071A,https://www.staffsmoorlands.gov.uk/media/4698/Brownfield-Register/pdf/SMDC_Brownfield_Land_Register_2019_Maps.pdf?m=1576509255197,,,
,,2017-12-01,-2.610367,50.257668,,3.5,2019-12-18,,50,50,Care home in wooded grounds,,http://opendatacommunities.org/id/district-council/staffordshire-moorlands,owned by a public authority,,,,not permissioned,"Kniveden Hall and Springhill, Mount Road",LE066,https://www.staffsmoorlands.gov.uk/media/4698/Brownfield-Register/pdf/SMDC_Brownfield_Land_Register_2019_Maps.pdf?m=1576509255197,,,
yes,,2017-12-01,-2.654697,53.485559,,0.46,2019-12-18,,49,49,Demolition of Mill and creation of 49 retirement apartments - under construction,,http://opendatacommunities.org/id/district-council/staffordshire-moorlands,not owned by a public authority,2017-08-30,full planning permission,,permissioned,"Portland Mill, Portland Street",LE073,https://www.staffsmoorlands.gov.uk/media/4698/Brownfield-Register/pdf/SMDC_Brownfield_Land_Register_2019_Maps.pdf?m=1576509255197,,,
yes,,2017-12-01,-2.64859,53.387526,,0.66,2019-12-18,,20,20,Former school now derelict. Completions expected on site within 5 years,,http://opendatacommunities.org/id/district-council/staffordshire-moorlands,owned by a public authority,,,,not permissioned,"Site of former, Meadows School, Tunstall Road",BD055,https://www.staffsmoorlands.gov.uk/media/4698/Brownfield-Register/pdf/SMDC_Brownfield_Land_Register_2019_Maps.pdf?m=1576509255197,,,
yes,,2017-12-01,-2.633648,53.390788,,0.28,2019-12-18,,42,42,Underused retail & employment site. Completions expected on site within 5 years,,http://opendatacommunities.org/id/district-council/staffordshire-moorlands,not owned by a public authority,,,,not permissioned,"Minster Mill, Walley Street",BD102,https://www.staffsmoorlands.gov.uk/media/4698/Brownfield-Register/pdf/SMDC_Brownfield_Land_Register_2019_Maps.pdf?m=1576509255197,,,
yes,2019-02-26,2017-12-01,-2.859362,53.500963,,0.95,2019-12-18,,42,42,Now complete - all social rented.,,http://opendatacommunities.org/id/district-council/staffordshire-moorlands,not owned by a public authority,2015-02-27,full planning permission,,permissioned,"Hurst Yard, Meadow Drive / Bank Street",CH014,https://www.staffsmoorlands.gov.uk/media/4698/Brownfield-Register/pdf/SMDC_Brownfield_Land_Register_2019_Maps.pdf?m=1576509255197,,,
yes,,2017-12-01,-2.850974,53.502929,,0.8,2019-12-18,,32,32,Coach Depot and Oil Depot Yard. Completions expected on site within 5 years,,http://opendatacommunities.org/id/district-council/staffordshire-moorlands,not owned by a public authority,,,,not permissioned,"Stoddards Depot, Leek Road",CH015,https://www.staffsmoorlands.gov.uk/media/4698/Brownfield-Register/pdf/SMDC_Brownfield_Land_Register_2019_Maps.pdf?m=1576509255197,,,
yes,,2017-12-01,-2.860924,53.490957,,1.2,2019-12-18,,42,42,Mixed Use Site. Completions expected on site within 5 years,,http://opendatacommunities.org/id/district-council/staffordshire-moorlands,not owned by a public authority,,,,not permissioned,"Land north of, The Green",CH020,https://www.staffsmoorlands.gov.uk/media/4698/Brownfield-Register/pdf/SMDC_Brownfield_Land_Register_2019_Maps.pdf?m=1576509255197,,,
yes,,2017-12-01,-2.660489,53.481042,,0.36,2019-12-18,,57,57,Planning permission for apartments age 55+ with care,,http://opendatacommunities.org/id/district-council/staffordshire-moorlands,not owned by a public authority,2017-11-19,full planning permission,,permissioned,"Compton Mill, Compton Street",LE151,https://www.staffsmoorlands.gov.uk/media/4698/Brownfield-Register/pdf/SMDC_Brownfield_Land_Register_2019_Maps.pdf?m=1576509255197,,,
,,2017-12-01,-2.65374,53.476279,,0.63,2019-12-18,,44,44,"Shade and Davenport Mill now converted, Big Mill part not started",,http://opendatacommunities.org/id/district-council/staffordshire-moorlands,not owned by a public authority,2004-08-08,full planning permission,,permissioned,"Big Mill, Mill Street",LE088,https://www.staffsmoorlands.gov.uk/media/4698/Brownfield-Register/pdf/SMDC_Brownfield_Land_Register_2019_Maps.pdf?m=1576509255197,,,
yes,,2017-12-01,-2.659272,53.481265,,0.37,2019-12-18,,93,93,"Demolition of mill and re-build of 93 apartments (33 sheltered, 40 retirement & 20 apartments). Completions expected on site within 5 years",,http://opendatacommunities.org/id/district-council/staffordshire-moorlands,not owned by a public authority,2016-05-20,outline planning permission,,permissioned,London Mill Leek,LE079,https://www.staffsmoorlands.gov.uk/media/4698/Brownfield-Register/pdf/SMDC_Brownfield_Land_Register_2019_Maps.pdf?m=1576509255197,,,
yes,,2017-12-01,-2.675524,53.475133,,6.59,2019-12-18,,175,175,"Resi up to 175 dwellings, open space, play area, live work units, marina (inc LE261). Completions expected on site within 5 years",,http://opendatacommunities.org/id/district-council/staffordshire-moorlands,not owned by a public authority,2015-08-17,outline planning permission,,permissioned,Hughes concrete Leek,LE260,https://www.staffsmoorlands.gov.uk/media/4698/Brownfield-Register/pdf/SMDC_Brownfield_Land_Register_2019_Maps.pdf?m=1576509255197,,,
yes,,2017-12-01,-2.720103,53.428707,,1.46,2019-12-18,,10,10,"Operating Equestrian business including indoor arena, ancillary buildings, manege, and landscaping. Completions expected on site within 5 years",,http://opendatacommunities.org/id/district-council/staffordshire-moorlands,not owned by a public authority,2015-05-12,outline planning permission,,permissioned,"Land and Buildings at, Endon Riding School, Stanley Moss Road",EN135,https://www.staffsmoorlands.gov.uk/media/4698/Brownfield-Register/pdf/SMDC_Brownfield_Land_Register_2019_Maps.pdf?m=1576509255197,,,
yes,,2017-12-01,-2.869511,53.444369,,4.2,2019-12-18,,7,7,Change of Use & new build now complete,,http://opendatacommunities.org/id/district-council/staffordshire-moorlands,not owned by a public authority,2016-11-18,full planning permission,,permissioned,"Land at, Caverswall Park Farm, Caverswall Lane",OC067,https://www.staffsmoorlands.gov.uk/media/4698/Brownfield-Register/pdf/SMDC_Brownfield_Land_Register_2019_Maps.pdf?m=1576509255197,,,
yes,,2017-12-01,-2.902034,53.509089,,0.73,2019-12-18,,6,6,Redevelopment to provide 6 new dwellings. Completions expected on site within 5 years,,http://opendatacommunities.org/id/district-council/staffordshire-moorlands,not owned by a public authority,2018-02-23,full planning permission,,permissioned,coregreenyard scrapyard tenford lane,OC076,https://www.staffsmoorlands.gov.uk/media/4698/Brownfield-Register/pdf/SMDC_Brownfield_Land_Register_2019_Maps.pdf?m=1576509255197,,,
yes,,2018-12-13,-2.639515,53.411998,,0.37,2019-12-18,,6,6,Conversion of disused boarding kennels to bungalows. Completions expected on site within 5 years,,http://opendatacommunities.org/id/district-council/staffordshire-moorlands,not owned by a public authority,2017-10-03,outline planning permission,,permissioned,"Trent Head Farm, Barrage Road",OC115,https://www.staffsmoorlands.gov.uk/media/4698/Brownfield-Register/pdf/SMDC_Brownfield_Land_Register_2019_Maps.pdf?m=1576509255197,,,
yes,,2018-12-13,-2.660974,53.479296,,0.08,2019-12-18,,7,7,Garage. Completions expected on site within 5 years,,http://opendatacommunities.org/id/district-council/staffordshire-moorlands,not owned by a public authority,2016-06-14,full planning permission,,permissioned,"Garage, Broad Street, Leek",LE149,https://www.staffsmoorlands.gov.uk/media/4698/Brownfield-Register/pdf/SMDC_Brownfield_Land_Register_2019_Maps.pdf?m=1576509255197,,,
yes,,2018-12-13,-2.655845,53.482811,,0.1,2019-12-18,,5,5,Car Park. Completions expected on site within 5 years,,http://opendatacommunities.org/id/district-council/staffordshire-moorlands,not owned by a public authority,2016-05-13,full planning permission,,permissioned,"Car Park, Bath Street",LE290,https://www.staffsmoorlands.gov.uk/media/4698/Brownfield-Register/pdf/SMDC_Brownfield_Land_Register_2019_Maps.pdf?m=1576509255197,,,
yes,,2018-12-13,-2.6582,53.481181,,0.06,2019-12-18,,5,5,Night Club & Offices. Completions expected on site within 5 years,,http://opendatacommunities.org/id/district-council/staffordshire-moorlands,not owned by a public authority,2016-09-09,outline planning permission,,permissioned,14-18 Russell Street,LE293,https://www.staffsmoorlands.gov.uk/media/4698/Brownfield-Register/pdf/SMDC_Brownfield_Land_Register_2019_Maps.pdf?m=1576509255197,,,
yes,,2018-12-13,-2.669376,53.477981,,0.15,2019-12-18,,7,7,Public House. Completions expected on site within 5 years,,http://opendatacommunities.org/id/district-council/staffordshire-moorlands,not owned by a public authority,2017-03-20,outline planning permission,,permissioned,Pride of the Moorlands,LE298,https://www.staffsmoorlands.gov.uk/media/4698/Brownfield-Register/pdf/SMDC_Brownfield_Land_Register_2019_Maps.pdf?m=1576509255197,,,
yes,,2018-12-13,-2.881451,53.500335,,0.2,2019-12-18,,5,5,Public House. Completions expected on site within 5 years,,http://opendatacommunities.org/id/district-council/staffordshire-moorlands,not owned by a public authority,2016-10-11,outline planning permission,,permissioned,"The Crown Inn, Tean Road",CH193,https://www.staffsmoorlands.gov.uk/media/4698/Brownfield-Register/pdf/SMDC_Brownfield_Land_Register_2019_Maps.pdf?m=1576509255197,,,
yes,,2019-12-10,-2.657585,53.485247,,0.08,2019-12-18,,14,14,Conversion of former Mill. Completions expected on site within 5 years,,http://opendatacommunities.org/id/district-council/staffordshire-moorlands,not owned by a public authority,2018-06-13,full planning permission,,permissioned,"Well Street Mill, Well Street, Leek",LE308,https://www.staffsmoorlands.gov.uk/media/4698/Brownfield-Register/pdf/SMDC_Brownfield_Land_Register_2019_Maps.pdf?m=1576509255197,,,
yes,,2019-12-10,-2.920594,53.540984,,0.43,2019-12-18,,9,9,Former Quarry,,http://opendatacommunities.org/id/district-council/staffordshire-moorlands,not owned by a public authority,2018-11-09,full planning permission,,permissioned,"Tearne Quarry, Main Road, Hollington",OC154,https://www.staffsmoorlands.gov.uk/media/4698/Brownfield-Register/pdf/SMDC_Brownfield_Land_Register_2019_Maps.pdf?m=1576509255197,,,
yes,2019-03-31,2019-12-10,-2.794402,53.43007,,0.7,2019-12-18,,8,8,Annex to Nursing Home. Completed.,,http://opendatacommunities.org/id/district-council/staffordshire-moorlands,not owned by a public authority,2018-12-06,full planning permission,,permissioned,"Annex to Ash Hall Nursing Home, Ash Bank Road, Werrington",WE088,https://www.staffsmoorlands.gov.uk/media/4698/Brownfield-Register/pdf/SMDC_Brownfield_Land_Register_2019_Maps.pdf?m=1576509255197,,,
