Deliverable,EndDate,FirstAddedDate,GeoX,GeoY,HazardousSubstances,Hectares,LastUpdatedDate,MinNetDwellings,NetDwellingsRangeFrom,NetDwellingsRangeTo,Notes,OrganisationLabel,OrganisationURI,OwnershipStatus,PermissionDate,PermissionType,PlanningHistory,PlanningStatus,point,SiteNameAddress,SiteplanURL,SiteReference
yes,2019-11-21,2018-12-07,-2.617184,53.650221,,0.24,2018-12-07,,12,12,Erection of 12no. Affordable dwellings following the demolition of the former St James Bowling Club (10 Houses and 2 apartments). Planning Ref: 17/00044/FULMAJ (2017-04-11). complete,,http://opendatacommunities.org/id/district-council/chorley,not owned by a public authority,2017-04-11,full planning permission,,permissioned,,"St James Bowling Club, Eaves Lane",,3304
yes,2019-11-21,2019-01-30,-2.750656,53.635139,,0.8,2019-01-30,,5,5,Demolition of buildings and erection of 4 dwellings and erection of replacement dwelling. Planning Ref: 16/01061/FUL (2017-03-08); 17/00770/FUL (2017-11-03). 2 dwellings under construction at 1 April 2019.,,http://opendatacommunities.org/id/district-council/chorley,not owned by a public authority,2017-03-08,full planning permission,,permissioned,,"Lynric Farm, Blue Stone Lane",,3222
yes,2018-12-31,2017-10-12,-2.642388,53.689176,,0.24,2017-10-12,,13,13,"Mixed development consisting of 10 new starter industrial units and 13 dwellings. 13 dwellings left to be built at April 2017, all of which were under construction. It is predicted that all of these dwellings will be completed in the first year of the five year period.",,http://opendatacommunities.org/id/district-council/chorley,not owned by a public authority,2012-11-22,full planning permission,,permissioned,,"W M Lawrence and Sons, Lyons Lane Mill, Townley Street, Chorley",,2879
yes,2018-12-31,2017-10-12,-2.61963,53.662448,,0.6,2017-10-12,,21,21,"Erection of 21 new dwellings with associated garages, parking areas, private amenity space and hard and soft landscaping. 21 dwellings left to be built at April 2017, all of which were under construction. It is predicted that all of these dwellings will be completed in the first year of the five year period.",,http://opendatacommunities.org/id/district-council/chorley,not owned by a public authority,2016-04-25,full planning permission,,permissioned,,"Parcel N & Parcel WF, Buckshaw Village, Chorley",,1799
,2018-12-31,2017-10-12,-2.63256,53.66203,,0.32,2017-10-12,,22,22,Demolition of public house and erection of 12 dwellings and 10 flats.,,http://opendatacommunities.org/id/district-council/chorley,not owned by a public authority,2016-02-10,full planning permission,,permissioned,,"Gillibrand Arms, Collingwood Road, Chorley",,3138
,2019-11-22,2017-10-12,-2.63089,53.692823,,0.53,2017-10-12,,8,8,Demolition of mill and erection of 8 dwellings. Complete,,http://opendatacommunities.org/id/district-council/chorley,not owned by a public authority,2014-04-22,full planning permission,,permissioned,,"Kem Mill, Kem Mill Lane, Whittle-le-Woods",,3005
,2018-12-31,2017-10-12,-2.62957,53.65108,,0.11,2017-10-12,,9,9,"Proposed demolition of the former Windmill Hotel to facilitate the development of 9No. apartments, associated car parking and access. Complete",,http://opendatacommunities.org/id/district-council/chorley,not owned by a public authority,2015-06-01,full planning permission,,permissioned,,"The Windmill Hotel, The Green, Ecclestone",,3089
,2019-11-22,2019-01-10,-2.679949,53.658552,,0.75,2019-11-22,,8,8,"Erection of 8 self build dwellings. Planning Ref: 15/00162/OUTMAJ, 18/01150/REM, 18/01193/REM. One dwelling under construction at 1st April 2019",,http://opendatacommunities.org/id/district-council/chorley,not owned by a public authority,2019-03-04,reserved matters approval,,permissioned,,"Euxton Mill, Dawbers Lane, Euxton PR7 6EB",,3440
